"FID_","address","bitly","created_at","id","issue_id","lat","lng","minutes_si","page","rating","request_ty","slug","status","summary","updated_at","updated__1","user_id","vote_count","FID_2","STATEFP","PLACEFP","PLACENS","PLCIDFP","NAME","NAMELSAD","LSAD","CLASSFP","CPI","PCICBSA","PCINECTA","MTFCC","UR","FUNCSTAT","FID_3","OBJECTID","NPU","NAME_1","OLD_NAME","FID_TXT","SHAPE_AREA","SHAPE_LEN","FID_4","GIST_ID","FIPSSTCO","TRT2000","STFID","TRACTID"
,"189-197 Daniel Drive Stockbridge, GA 30281, USA","http://bit.ly/J04Ppa","12/07/2013 - 01:56pm",846880.000000,846880.000000,33.554069,-84.263908,41.000000,1.000000,1.000000,0.000000,"846880-sign","Open","Sign","12/07/2013 - 01:56pm","2013-12-07T13:56:14-05:00",135598.000000,0.000000,0," "," "," "," "," "," "," "," "," "," "," "," "," "," ",0,0.000000," "," "," "," ",0.000000,0.000000,0,0," "," "," "," "
,"Redbud Lane And Country Club Drive In Windsong Subdivision Stocbridge, Ga","http://bit.ly/1f6h4Lu","12/07/2013 - 09:09am",846718.000000,846718.000000,32.157435,-82.907123,327.000000,1.000000,1.000000,0.000000,"846718-sign-knocked-down-and-missing","Open","Sign knocked down and missing","12/07/2013 - 09:09am","2013-12-07T09:09:44-05:00",0.000000,0.000000,0," "," "," "," "," "," "," "," "," "," "," "," "," "," ",0,0.000000," "," "," "," ",0.000000,0.000000,0,0," "," "," "," "
,"190 Boone Road Newnan, Georgia","http://bit.ly/1cqymTq","12/06/2013 - 12:41pm",846130.000000,846130.000000,33.430605,-84.901715,1556.000000,1.000000,2.000000,0.000000,"846130-exposed-telephone-line","Open","Exposed Telephone Line","12/06/2013 - 02:09pm","2013-12-06T14:09:42-05:00",0.000000,1.000000,0," "," "," "," "," "," "," "," "," "," "," "," "," "," ",0,0.000000," "," "," "," ",0.000000,0.000000,0,0," "," "," "," "
,"2120 Johnson Ferry Rd Ne Brookhaven, GA","http://bit.ly/1dUoPY0","12/06/2013 - 07:42am",845856.000000,845856.000000,33.892950,-84.326717,1854.000000,1.000000,4.000000,2607.000000,"845856-new-pothole-east-of-previous-potholes","Open","new pothole, east of previous potholes","12/06/2013 - 08:43am","2013-12-06T08:43:07-05:00",135739.000000,3.000000,0," "," "," "," "," "," "," "," "," "," "," "," "," "," ",0,0.000000," "," "," "," ",0.000000,0.000000,0,0," "," "," "," "
,"2816 Chamblee Tucker Road Chamblee, GA 30341, USA","http://bit.ly/1cd7y5p","12/05/2013 - 12:18pm",844494.000000,844494.000000,33.880286,-84.274681,3018.000000,1.000000,1.000000,0.000000,"844494-new-qt-and-traffic-leading-to-substantial-evening-delays","Open","New qt and traffic leading to substantial evening delays","12/05/2013 - 12:18pm","2013-12-05T12:18:46-05:00",0.000000,0.000000,0," "," "," "," "," "," "," "," "," "," "," "," "," "," ",0,0.000000," "," "," "," ",0.000000,0.000000,0,0," "," "," "," "
,"3898 Lehigh Laural Court Decatur, GA 30034, USA","http://bit.ly/1cZrQAY","12/05/2013 - 09:30am",844219.000000,844219.000000,33.667171,-84.211090,3186.000000,1.000000,1.000000,0.000000,"844219-pot-hole","Open","pot hole","12/05/2013 - 09:30am","2013-12-05T09:30:55-05:00",355843.000000,0.000000,0," "," "," "," "," "," "," "," "," "," "," "," "," "," ",0,0.000000," "," "," "," ",0.000000,0.000000,0,0," "," "," "," "
,"481 Grayson Way Alpharetta, GA 30004, USA","http://bit.ly/1cYOPfv","12/04/2013 - 09:47pm",843435.000000,843435.000000,34.129855,-84.245478,3889.000000,1.000000,1.000000,0.000000,"843435-street-light-out","Open","Street Light Out","12/04/2013 - 09:47pm","2013-12-04T21:47:58-05:00",0.000000,0.000000,0," "," "," "," "," "," "," "," "," "," "," "," "," "," ",0,0.000000," "," "," "," ",0.000000,0.000000,0,0," "," "," "," "
,"1500 Cumberland Pkwy Se smyrna, GA","http://bit.ly/1g6tCFG","12/04/2013 - 10:26am",842905.000000,842905.000000,33.847937,-84.496113,4570.000000,1.000000,1.000000,0.000000,"842905-pothole-that-was-repaired-is-falling-apart","Open","Pothole that was repaired is falling apart","12/04/2013 - 10:26am","2013-12-04T10:26:59-05:00",0.000000,0.000000,0," "," "," "," "," "," "," "," "," "," "," "," "," "," ",0,0.000000," "," "," "," ",0.000000,0.000000,0,0," "," "," "," "
,"3962-3998 Parkcrest Drive Northeast Atlanta, Georgia","http://bit.ly/1k6EWPq","12/03/2013 - 11:29am",841169.000000,841169.000000,33.907865,-84.332997,5947.000000,1.000000,4.000000,2604.000000,"841169-no-signage","Open","No signage","12/03/2013 - 02:02pm","2013-12-03T14:02:50-05:00",0.000000,2.000000,0," "," "," "," "," "," "," "," "," "," "," "," "," "," ",0,0.000000," "," "," "," ",0.000000,0.000000,0,0," "," "," "," "
,"Henderson Mill And Evans Road.  Dekalb, Georgia","http://bit.ly/WBckD0","12/02/2013 - 10:17pm",840456.000000,840456.000000,33.871844,-84.250805,6739.000000,1.000000,1.000000,0.000000,"840456-pothole-in-road","Open","Pothole in road","12/02/2013 - 10:17pm","2013-12-02T22:17:36-05:00",0.000000,0.000000,0," "," "," "," "," "," "," "," "," "," "," "," "," "," ",0,0.000000," "," "," "," ",0.000000,0.000000,0,0," "," "," "," "
,"4470 Thurgood Estates Dr. ELLENWOOD, Georgia","http://bit.ly/1dLqMG3","12/02/2013 - 11:06am",839901.000000,839901.000000,33.651304,-84.207742,7411.000000,1.000000,1.000000,0.000000,"839901-cracks","Open","Cracks","12/02/2013 - 11:06am","2013-12-02T11:06:20-05:00",358293.000000,0.000000,0," "," "," "," "," "," "," "," "," "," "," "," "," "," ",0,0.000000," "," "," "," ",0.000000,0.000000,0,0," "," "," "," "
,"2523 Andover Drive Doraville, GA 30360, USA","http://bit.ly/1eGVoFF","11/29/2013 - 02:38pm",837687.000000,837687.000000,33.933162,-84.284263,11518.000000,1.000000,3.000000,4315.000000,"837687-utility-problem","Acknowledged","Utility Problem","12/02/2013 - 09:31am","2013-12-02T09:31:44-05:00",135734.000000,1.000000,0," "," "," "," "," "," "," "," "," "," "," "," "," "," ",0,0.000000," "," "," "," ",0.000000,0.000000,0,0," "," "," "," "
,"1640-1652 Lower Fayetteville Road Newnan, GA 30265, USA","http://bit.ly/1buUTjj","11/29/2013 - 11:35am",837607.000000,837607.000000,33.379888,-84.738110,11702.000000,1.000000,1.000000,0.000000,"837607-traffic-light-will-not-change","Open","Traffic light will not change","11/29/2013 - 11:35am","2013-11-29T11:35:07-05:00",111884.000000,0.000000,0," "," "," "," "," "," "," "," "," "," "," "," "," "," ",0,0.000000," "," "," "," ",0.000000,0.000000,0,0," "," "," "," "
,"4301-4399 Brookwood Drive Southwest Austell, GA 30106, USA","http://bit.ly/1eAZaAo","11/27/2013 - 04:33pm",836373.000000,836373.000000,33.848602,-84.592953,14283.000000,1.000000,1.000000,0.000000,"836373-evicted-tenants","Open","Evicted tenants","11/27/2013 - 04:33pm","2013-11-27T16:33:39-05:00",95930.000000,0.000000,0," "," "," "," "," "," "," "," "," "," "," "," "," "," ",0,0.000000," "," "," "," ",0.000000,0.000000,0,0," "," "," "," "
,"1500 Cumberland Parkway Smyrna, GA","http://bit.ly/1eA3VKq","11/27/2013 - 09:48am",835658.000000,835658.000000,33.847937,-84.496113,14689.000000,1.000000,1.000000,0.000000,"835658-huge-pothole","Open","Huge pothole","11/27/2013 - 09:48am","2013-11-27T09:48:12-05:00",0.000000,0.000000,0," "," "," "," "," "," "," "," "," "," "," "," "," "," ",0,0.000000," "," "," "," ",0.000000,0.000000,0,0," "," "," "," "
,"Johnson Ferry Rd @ Donaldson Dr Brookhaven, GA 30319, USA","http://bit.ly/1aYuEvr","11/24/2013 - 06:56am",833331.000000,833331.000000,33.892288,-84.326072,19180.000000,1.000000,7.000000,2788.000000,"833331-code-compliance-issue","Open","Code Compliance Issue","11/29/2013 - 10:26am","2013-11-29T10:26:16-05:00",0.000000,4.000000,0," "," "," "," "," "," "," "," "," "," "," "," "," "," ",0,0.000000," "," "," "," ",0.000000,0.000000,0,0," "," "," "," "
,"West Panola Road Ellenwood, Georgia","http://bit.ly/Imxnb2","11/24/2013 - 02:17am",833266.000000,833266.000000,33.616057,-84.252061,19459.000000,1.000000,1.000000,0.000000,"833266-narrow-1-lane-road","Open","Narrow 1 lane road","11/24/2013 - 02:17am","2013-11-24T02:17:34-05:00",0.000000,0.000000,0," "," "," "," "," "," "," "," "," "," "," "," "," "," ",0,0.000000," "," "," "," ",0.000000,0.000000,0,0," "," "," "," "
,"Forest Parkway Ellenwood, Georgia","http://bit.ly/Imx93Y","11/24/2013 - 02:14am",833264.000000,833264.000000,33.612975,-84.305770,19462.000000,1.000000,1.000000,0.000000,"833264-uneven-pavement","Open","Uneven pavement","11/24/2013 - 02:14am","2013-11-24T02:14:35-05:00",0.000000,0.000000,0," "," "," "," "," "," "," "," "," "," "," "," "," "," ",0,0.000000," "," "," "," ",0.000000,0.000000,0,0," "," "," "," "
,"The Perimeter Atlanta, Georgia","http://bit.ly/18T1y0C","11/21/2013 - 10:54am",830533.000000,830533.000000,33.916697,-84.342181,23263.000000,1.000000,3.000000,2350.000000,"830533-backup-on-i-285-west-backs-up-peachtree-industrial-which-backs-up-tilly-mill-road","Acknowledged","Backup on I-285 West backs up Peachtree Industrial which backs up Tilly Mill Road","11/23/2013 - 04:07am","2013-11-23T04:07:54-05:00",210030.000000,0.000000,0," "," "," "," "," "," "," "," "," "," "," "," "," "," ",0,0.000000," "," "," "," ",0.000000,0.000000,0,0," "," "," "," "
,"3819-3829 Ashford Dunwoody Road Northeast Atlanta, Georgia","http://bit.ly/1bEVedQ","11/21/2013 - 06:59am",829317.000000,829317.000000,33.903889,-84.331375,23497.000000,1.000000,7.000000,2795.000000,"829317-debris-in-bicycle-lane","Open","Debris in Bicycle Lane","11/21/2013 - 02:50pm","2013-11-21T14:50:03-05:00",8994.000000,5.000000,0," "," "," "," "," "," "," "," "," "," "," "," "," "," ",0,0.000000," "," "," "," ",0.000000,0.000000,0,0," "," "," "," "
,"4301-4411 Candler Lake East Ne Atlanta, GA 30319, USA","http://bit.ly/1hY8AL1","11/20/2013 - 05:47pm",828661.000000,828661.000000,33.914463,-84.324616,24290.000000,1.000000,4.000000,2605.000000,"828661-tree-issue","Open","Tree Issue","11/21/2013 - 02:47pm","2013-11-21T14:47:52-05:00",122596.000000,1.000000,0," "," "," "," "," "," "," "," "," "," "," "," "," "," ",0,0.000000," "," "," "," ",0.000000,0.000000,0,0," "," "," "," "
,"1486 Maplewood Drive Macon, Georgia","http://bit.ly/17H1iH1","11/18/2013 - 08:07pm",826194.000000,826194.000000,32.895784,-83.712209,27030.000000,1.000000,1.000000,1896.000000,"826194-street-light-in-front-of-my-house-has-burned-out","Open","Street light in front of my house has burned out.","11/18/2013 - 08:07pm","2013-11-18T20:07:02-05:00",355947.000000,0.000000,0," "," "," "," "," "," "," "," "," "," "," "," "," "," ",0,0.000000," "," "," "," ",0.000000,0.000000,0,0," "," "," "," "
,"3898 Lehigh Laural Court Decatur, GA 30034, USA","http://bit.ly/1gYzvoM","11/18/2013 - 01:13pm",825837.000000,825837.000000,33.667217,-84.210857,27443.000000,1.000000,1.000000,0.000000,"825837-street-repair-pothole","Open","street repair  pothole","11/18/2013 - 01:13pm","2013-11-18T13:13:34-05:00",355843.000000,0.000000,0," "," "," "," "," "," "," "," "," "," "," "," "," "," ",0,0.000000," "," "," "," ",0.000000,0.000000,0,0," "," "," "," "
,"4046 Ashford Dunwoody Road Northeast Atlanta, GA 30319, USA","http://bit.ly/1byuYBQ","11/18/2013 - 10:44am",825577.000000,825577.000000,33.911214,-84.333398,27593.000000,1.000000,4.000000,2790.000000,"825577-sidewalk-problem","Acknowledged","Sidewalk Problem","12/04/2013 - 10:21pm","2013-12-04T22:21:18-05:00",102992.000000,1.000000,0," "," "," "," "," "," "," "," "," "," "," "," "," "," ",0,0.000000," "," "," "," ",0.000000,0.000000,0,0," "," "," "," "
,"Nancy Creek Trail Atlanta, GA 30319, USA","http://bit.ly/HY9kQo","11/17/2013 - 03:32pm",824798.000000,824798.000000,33.894718,-84.325271,28744.000000,1.000000,1.000000,2605.000000,"824798-tree-issue","Open","Tree Issue","11/17/2013 - 03:32pm","2013-11-17T15:32:54-05:00",0.000000,0.000000,0," "," "," "," "," "," "," "," "," "," "," "," "," "," ",0,0.000000," "," "," "," ",0.000000,0.000000,0,0," "," "," "," "
,"1444 Ashwoody Court Northeast Atlanta, GA 30319, USA","http://bit.ly/VaLgOB","11/16/2013 - 04:30pm",824228.000000,824228.000000,33.916706,-84.329833,30126.000000,1.000000,7.000000,2607.000000,"824228-pavement-problem","Open","Pavement Problem","11/19/2013 - 02:43pm","2013-11-19T14:43:46-05:00",0.000000,5.000000,0," "," "," "," "," "," "," "," "," "," "," "," "," "," ",0,0.000000," "," "," "," ",0.000000,0.000000,0,0," "," "," "," "
,"3794 Ashford Dunwoody Road Northeast Atlanta, GA 30319, USA","http://bit.ly/17blAGi","11/16/2013 - 02:36pm",824180.000000,824180.000000,33.900367,-84.336517,30240.000000,1.000000,3.000000,2607.000000,"824180-pavement-problem","Acknowledged","Pavement Problem","11/19/2013 - 04:07pm","2013-11-19T16:07:05-05:00",0.000000,1.000000,0," "," "," "," "," "," "," "," "," "," "," "," "," "," ",0,0.000000," "," "," "," ",0.000000,0.000000,0,0," "," "," "," "
,"3790 Ashford Dunwoody Road Northeast Brookhaven, Georgia","http://bit.ly/1buTMuJ","11/16/2013 - 02:14pm",824165.000000,824165.000000,33.902925,-84.331261,30262.000000,1.000000,5.000000,2607.000000,"824165-ashford-dunwoody-and-harts-mill","Acknowledged","Ashford Dunwoody and Harts Mill","11/19/2013 - 04:15pm","2013-11-19T16:15:09-05:00",0.000000,3.000000,0," "," "," "," "," "," "," "," "," "," "," "," "," "," ",0,0.000000," "," "," "," ",0.000000,0.000000,0,0," "," "," "," "
,"3933 Ballground Hwy canton, ga","http://bit.ly/HX20EL","11/15/2013 - 07:42am",822223.000000,822223.000000,34.284059,-84.438084,32094.000000,1.000000,1.000000,0.000000,"822223-dark-area","Open","dark area","11/15/2013 - 07:42am","2013-11-15T07:42:46-05:00",0.000000,0.000000,0," "," "," "," "," "," "," "," "," "," "," "," "," "," ",0,0.000000," "," "," "," ",0.000000,0.000000,0,0," "," "," "," "
,"1101 Byrnwyck Rd Atlanta Ga","http://bit.ly/1eMqrCH","11/13/2013 - 12:12pm",820044.000000,820044.000000,33.904930,-84.346099,34705.000000,1.000000,6.000000,2601.000000,"820044-storm-water-problem","Open","Storm Water Problem","11/18/2013 - 11:08am","2013-11-18T11:08:26-05:00",0.000000,2.000000,0," "," "," "," "," "," "," "," "," "," "," "," "," "," ",0,0.000000," "," "," "," ",0.000000,0.000000,0,0," "," "," "," "
,"1171-1179 Byrnwyck Road Northeast Atlanta, GA 30319, USA","http://bit.ly/1eMpU3C","11/13/2013 - 12:09pm",820042.000000,820042.000000,33.904930,-84.346099,34707.000000,1.000000,3.000000,2607.000000,"820042-pavement-problem","Open","Pavement Problem","11/13/2013 - 07:24pm","2013-11-13T19:24:13-05:00",0.000000,1.000000,0," "," "," "," "," "," "," "," "," "," "," "," "," "," ",0,0.000000," "," "," "," ",0.000000,0.000000,0,0," "," "," "," "
,"101 Covington Drive Macon, GA 31210, USA","http://bit.ly/15QeDZy","11/13/2013 - 08:33am",819706.000000,819706.000000,32.877716,-83.721725,34924.000000,1.000000,2.000000,0.000000,"819706-dead-animal-in-road","Closed","Dead animal in road","12/05/2013 - 07:03pm","2013-12-05T19:03:12-05:00",125501.000000,0.000000,0," "," "," "," "," "," "," "," "," "," "," "," "," "," ",0,0.000000," "," "," "," ",0.000000,0.000000,0,0," "," "," "," "
,"Intersection Hwy 87/Riverside Dr And Wesleyan Drive North Macon, GA","http://bit.ly/HPUVpJ","11/11/2013 - 10:02am",817507.000000,817507.000000,32.944276,-83.722714,37715.000000,1.000000,1.000000,0.000000,"817507-street-light-out","Open","Street light out","11/11/2013 - 10:02am","2013-11-11T10:02:29-05:00",0.000000,0.000000,0," "," "," "," "," "," "," "," "," "," "," "," "," "," ",0,0.000000," "," "," "," ",0.000000,0.000000,0,0," "," "," "," "
,"Blackburn Park Brookhaven, GA","http://bit.ly/HPUMT2","11/11/2013 - 10:00am",817505.000000,817505.000000,33.896972,-84.328566,37716.000000,1.000000,5.000000,2789.000000,"817505-fence-down-along-path-in-blackburn","Open","Fence Down along Path in Blackburn","11/13/2013 - 04:16pm","2013-11-13T16:16:12-05:00",354433.000000,3.000000,0," "," "," "," "," "," "," "," "," "," "," "," "," "," ",0,0.000000," "," "," "," ",0.000000,0.000000,0,0," "," "," "," "
,"3174-3482 Pete Shaw Road Marietta, Georgia","http://bit.ly/YAdphG","11/08/2013 - 02:14pm",815500.000000,815500.000000,34.046175,-84.463393,41782.000000,1.000000,1.000000,0.000000,"815500-pothole-in-east-bound-lane","Open","Pothole in east bound lane","11/08/2013 - 02:14pm","2013-11-08T14:14:52-05:00",0.000000,0.000000,0," "," "," "," "," "," "," "," "," "," "," "," "," "," ",0,0.000000," "," "," "," ",0.000000,0.000000,0,0," "," "," "," "
,"3530-3598 Walt Stephens Road Stockbridge, GA 30281, USA","http://bit.ly/1aJlEAf","11/08/2013 - 11:29am",815309.000000,815309.000000,33.528167,-84.274314,41948.000000,1.000000,1.000000,0.000000,"815309-sign","Open","Sign","11/08/2013 - 11:29am","2013-11-08T11:29:16-05:00",0.000000,0.000000,0," "," "," "," "," "," "," "," "," "," "," "," "," "," ",0,0.000000," "," "," "," ",0.000000,0.000000,0,0," "," "," "," "
,"1937 Vance Drive Northeast Atlanta, Georgia","http://bit.ly/1baug0U","11/07/2013 - 02:34pm",814391.000000,814391.000000,33.847854,-84.309834,43203.000000,1.000000,1.000000,0.000000,"814391-brookhaven-rezoning-signs","Open","Brookhaven Rezoning Signs","11/07/2013 - 02:34pm","2013-11-07T14:34:28-05:00",0.000000,0.000000,0," "," "," "," "," "," "," "," "," "," "," "," "," "," ",0,0.000000," "," "," "," ",0.000000,0.000000,0,0," "," "," "," "
,"Eagles Landing Parkway & Interstate 75 Stockbridge, GA 30281, USA","http://bit.ly/1bacVVQ","11/07/2013 - 01:03pm",814314.000000,814314.000000,33.506175,-84.229675,43294.000000,1.000000,1.000000,0.000000,"814314-illega-sign","Open","Illega sign","11/07/2013 - 01:03pm","2013-11-07T13:03:10-05:00",135598.000000,0.000000,0," "," "," "," "," "," "," "," "," "," "," "," "," "," ",0,0.000000," "," "," "," ",0.000000,0.000000,0,0," "," "," "," "
,"1915 Knipe Dr Marietta/Cobb, GA","http://bit.ly/1bacgUy","11/07/2013 - 12:59pm",814312.000000,814312.000000,33.918880,-84.610590,43297.000000,1.000000,1.000000,0.000000,"814312-pot-hole-fixed","Open","Pot Hole fixed","11/07/2013 - 12:59pm","2013-11-07T12:59:52-05:00",0.000000,0.000000,0," "," "," "," "," "," "," "," "," "," "," "," "," "," ",0,0.000000," "," "," "," ",0.000000,0.000000,0,0," "," "," "," "
,"1025 Parkwest Lane Stone Mountain, Georgia","http://bit.ly/187YpK1","11/06/2013 - 04:42pm",813204.000000,813204.000000,33.764469,-84.186838,44514.000000,1.000000,1.000000,0.000000,"813204-pothole","Open","Pothole","11/06/2013 - 04:42pm","2013-11-06T16:42:41-05:00",353636.000000,0.000000,0," "," "," "," "," "," "," "," "," "," "," "," "," "," ",0,0.000000," "," "," "," ",0.000000,0.000000,0,0," "," "," "," "
,"3898 Lehigh Laural Ct Decatur , Georgia","http://bit.ly/187EmeH","11/06/2013 - 01:00pm",812999.000000,812999.000000,33.667181,-84.210989,44736.000000,1.000000,1.000000,0.000000,"812999-pot-hole-in-cul-de-sac","Open","pot hole in cul de sac","11/06/2013 - 01:00pm","2013-11-06T13:00:40-05:00",353580.000000,0.000000,0," "," "," "," "," "," "," "," "," "," "," "," "," "," ",0,0.000000," "," "," "," ",0.000000,0.000000,0,0," "," "," "," "
,"3650 Ashford Dunwoody Road Northeast Atlanta, Georgia","http://bit.ly/17ESSAt","11/06/2013 - 11:28am",812871.000000,812871.000000,33.897369,-84.330295,44828.000000,1.000000,2.000000,2788.000000,"812871-real-estate-signs","Open","Real Estate Signs","11/06/2013 - 12:05pm","2013-11-06T12:05:28-05:00",0.000000,1.000000,0," "," "," "," "," "," "," "," "," "," "," "," "," "," ",0,0.000000," "," "," "," ",0.000000,0.000000,0,0," "," "," "," "
,"2530 Cherry Hill Lane Atlanta, GA 30360, USA","http://bit.ly/17EGBvT","11/06/2013 - 08:45am",812642.000000,812642.000000,33.936923,-84.284149,44991.000000,1.000000,1.000000,314.000000,"812642-storm-water-problem","Acknowledged","Storm Water Problem","11/06/2013 - 08:52am","2013-11-06T08:52:04-05:00",102634.000000,0.000000,0," "," "," "," "," "," "," "," "," "," "," "," "," "," ",0,0.000000," "," "," "," ",0.000000,0.000000,0,0," "," "," "," "
,"1850 Preserve Way Atlanta, Georgia","http://bit.ly/1fjltL7","11/06/2013 - 08:39am",812634.000000,812634.000000,33.913980,-84.312431,44997.000000,1.000000,2.000000,2795.000000,"812634-support-lines-on-at-t-power-pole-down","Acknowledged","Support lines on AT&T Power Pole Down","11/06/2013 - 10:54am","2013-11-06T10:54:12-05:00",0.000000,0.000000,0," "," "," "," "," "," "," "," "," "," "," "," "," "," ",0,0.000000," "," "," "," ",0.000000,0.000000,0,0," "," "," "," "
,"2921 Winterhaven Court Atlanta, GA 30360, USA","http://bit.ly/1fjiUbW","11/06/2013 - 08:14am",812616.000000,812616.000000,33.936161,-84.268058,45023.000000,1.000000,1.000000,312.000000,"812616-pavement-problem","Acknowledged","Pavement Problem","11/06/2013 - 08:21am","2013-11-06T08:21:01-05:00",102634.000000,0.000000,0," "," "," "," "," "," "," "," "," "," "," "," "," "," ",0,0.000000," "," "," "," ",0.000000,0.000000,0,0," "," "," "," "
,"2221 Johnson Ferry Road Northeast Brookhaven, Georgia","http://bit.ly/18WpG1E","11/05/2013 - 02:42pm",811868.000000,811868.000000,33.890685,-84.321805,46075.000000,1.000000,3.000000,2607.000000,"811868-pothole-on-johnson-ferry-rd","Open","Pothole on Johnson Ferry Rd","11/05/2013 - 04:54pm","2013-11-05T16:54:20-05:00",0.000000,1.000000,0," "," "," "," "," "," "," "," "," "," "," "," "," "," ",0,0.000000," "," "," "," ",0.000000,0.000000,0,0," "," "," "," "
,"Flippen Road stockbridge, ga","http://bit.ly/YzpiET","11/02/2013 - 07:24am",808121.000000,808121.000000,33.508462,-84.245071,50893.000000,1.000000,1.000000,0.000000,"808121-white-paint","Open","White paint","11/02/2013 - 07:24am","2013-11-02T07:24:36-04:00",0.000000,0.000000,0," "," "," "," "," "," "," "," "," "," "," "," "," "," ",0,0.000000," "," "," "," ",0.000000,0.000000,0,0," "," "," "," "
,"West Nancy Creek Drive/West Ashdun Court Dekalb, GA","http://bit.ly/1f8HYlG","11/01/2013 - 03:23pm",807581.000000,807581.000000,33.795644,-84.227879,51853.000000,1.000000,1.000000,0.000000,"807581-pot-hole","Open","Pot Hole","11/01/2013 - 03:23pm","2013-11-01T15:23:56-04:00",0.000000,0.000000,0," "," "," "," "," "," "," "," "," "," "," "," "," "," ",0,0.000000," "," "," "," ",0.000000,0.000000,0,0," "," "," "," "
,"Riverside Causeway Decatur, GA","http://bit.ly/HwVPGi","10/31/2013 - 01:34pm",806038.000000,806038.000000,33.672266,-84.256034,53403.000000,1.000000,1.000000,0.000000,"806038-graffiti","Open","graffiti","10/31/2013 - 01:34pm","2013-10-31T13:34:10-04:00",0.000000,0.000000,0," "," "," "," "," "," "," "," "," "," "," "," "," "," ",0,0.000000," "," "," "," ",0.000000,0.000000,0,0," "," "," "," "
,"Riverside Causeway Decatur, GA","http://bit.ly/HwVd3y","10/31/2013 - 01:28pm",806021.000000,806021.000000,33.672266,-84.256034,53409.000000,1.000000,1.000000,0.000000,"806021-graffiti","Open","graffiti","10/31/2013 - 01:28pm","2013-10-31T13:28:03-04:00",0.000000,0.000000,0," "," "," "," "," "," "," "," "," "," "," "," "," "," ",0,0.000000," "," "," "," ",0.000000,0.000000,0,0," "," "," "," "
,"4521 Cobble Creek Ln (Vacant Lot Next To Resident) Raleigh, North Carolina","http://bit.ly/19aNVx9","10/30/2013 - 11:08am",804490.000000,804490.000000,34.884625,-83.472954,54988.000000,1.000000,2.000000,0.000000,"804490-empty-lot-used-for-dumping","Open","Empty lot used for dumping","10/30/2013 - 11:10am","2013-10-30T11:10:42-04:00",0.000000,0.000000,0," "," "," "," "," "," "," "," "," "," "," "," "," "," ",0,0.000000," "," "," "," ",0.000000,0.000000,0,0," "," "," "," "
,"4184 Dunwoody Terrace Atlanta, Georgia","http://bit.ly/19Qgake","10/29/2013 - 03:42pm",803757.000000,803757.000000,33.917183,-84.318112,56155.000000,1.000000,2.000000,2607.000000,"803757-pot-hole","Open","Pot Hole","10/31/2013 - 12:22pm","2013-10-31T12:22:59-04:00",0.000000,0.000000,0," "," "," "," "," "," "," "," "," "," "," "," "," "," ",0,0.000000," "," "," "," ",0.000000,0.000000,0,0," "," "," "," "
,"3220 Rockview Drive Lithonia/Dekalb, GA","http://bit.ly/1g2K3mn","10/26/2013 - 10:21am",800498.000000,800498.000000,33.688798,-84.126728,60796.000000,1.000000,2.000000,0.000000,"800498-rockview-potholes","Open","Rockview Potholes","11/26/2013 - 08:21am","2013-11-26T08:21:42-05:00",0.000000,1.000000,0," "," "," "," "," "," "," "," "," "," "," "," "," "," ",0,0.000000," "," "," "," ",0.000000,0.000000,0,0," "," "," "," "
,"1300 Pin Oak Court McDonough, GA 30252, USA","http://bit.ly/1acd9NL","10/25/2013 - 09:42am",799474.000000,799474.000000,33.539636,-84.077602,62274.000000,1.000000,2.000000,0.000000,"799474-pothole","Open","Pothole","11/06/2013 - 07:23am","2013-11-06T07:23:02-05:00",351051.000000,1.000000,0," "," "," "," "," "," "," "," "," "," "," "," "," "," ",0,0.000000," "," "," "," ",0.000000,0.000000,0,0," "," "," "," "
,"1244 Perimeter Summit Parkway Atlanta, Georgia","http://bit.ly/H4gd1F","10/24/2013 - 09:14am",797907.000000,797907.000000,33.913664,-84.335788,63742.000000,1.000000,7.000000,2795.000000,"797907-traffic-backed-up-perimeter-summit-pkwy-at-parkside-and-ashford-dunwoody","Open","Traffic Backed Up Perimeter Summit Pkwy at Parkside AND Ashford Dunwoody","11/25/2013 - 12:32pm","2013-11-25T12:32:11-05:00",132785.000000,3.000000,0," "," "," "," "," "," "," "," "," "," "," "," "," "," ",0,0.000000," "," "," "," ",0.000000,0.000000,0,0," "," "," "," "
,"201 East Lake Road McDonough, GA 30252, USA","http://bit.ly/19xoTaG","10/23/2013 - 09:14pm",797361.000000,797361.000000,33.507545,-84.131354,64463.000000,1.000000,1.000000,0.000000,"797361-heavy-traffic-and-young-drivers","Open","Heavy traffic and young drivers","10/23/2013 - 09:14pm","2013-10-23T21:14:04-04:00",0.000000,0.000000,0," "," "," "," "," "," "," "," "," "," "," "," "," "," ",0,0.000000," "," "," "," ",0.000000,0.000000,0,0," "," "," "," "
,"1466 Fulford Rd Monticello, Jefferson Co., Florida","http://bit.ly/18KJvNp","10/23/2013 - 11:08am",796730.000000,796730.000000,30.669471,-83.852113,65069.000000,1.000000,1.000000,0.000000,"796730-construction-hay","Open","Construction Hay","10/23/2013 - 11:08am","2013-10-23T11:08:14-04:00",0.000000,0.000000,0," "," "," "," "," "," "," "," "," "," "," "," "," "," ",0,0.000000," "," "," "," ",0.000000,0.000000,0,0," "," "," "," "
,"4228-4238 Britt Road Tucker, Georgia","http://bit.ly/H29qpl","10/23/2013 - 10:42am",796714.000000,796714.000000,33.883141,-84.215287,65095.000000,1.000000,1.000000,0.000000,"796714-gang-graffiti","Open","Gang Graffiti","10/23/2013 - 10:42am","2013-10-23T10:42:10-04:00",0.000000,0.000000,0," "," "," "," "," "," "," "," "," "," "," "," "," "," ",0,0.000000," "," "," "," ",0.000000,0.000000,0,0," "," "," "," "
,"Homeplace Drive And Speer Road Stockbridge Henry, Ga","http://bit.ly/18uuCOS","10/18/2013 - 10:06pm",790965.000000,790965.000000,33.531127,-84.274827,71610.000000,1.000000,4.000000,3963.000000,"790965-missing-street-sign","Acknowledged","Missing Street sign","10/22/2013 - 10:20am","2013-10-22T10:20:00-04:00",0.000000,0.000000,0," "," "," "," "," "," "," "," "," "," "," "," "," "," ",0,0.000000," "," "," "," ",0.000000,0.000000,0,0," "," "," "," "
,"3121 Robinwood Trail Decatur/Dekalb, GA","http://bit.ly/WZpiy3","10/17/2013 - 08:30am",788325.000000,788325.000000,33.693499,-84.216484,73866.000000,1.000000,1.000000,0.000000,"788325-pot-hole","Open","Pot hole","10/17/2013 - 08:30am","2013-10-17T08:30:54-04:00",0.000000,0.000000,0," "," "," "," "," "," "," "," "," "," "," "," "," "," ",0,0.000000," "," "," "," ",0.000000,0.000000,0,0," "," "," "," "
,"Pecan Drve And Butterworth Rd Canton, Georgia","http://bit.ly/1fF3Fws","10/17/2013 - 07:45am",788247.000000,788247.000000,34.228737,-84.582607,73912.000000,1.000000,8.000000,0.000000,"788247-no-street-light","Open","no street light","10/19/2013 - 11:49am","2013-10-19T11:49:13-04:00",0.000000,9.000000,0," "," "," "," "," "," "," "," "," "," "," "," "," "," ",0,0.000000," "," "," "," ",0.000000,0.000000,0,0," "," "," "," "
,"2426 Hiram Acworth Highway Dallas, Georgia","http://bit.ly/17M5HlJ","10/16/2013 - 11:41pm",787929.000000,787929.000000,33.941028,-84.738154,74396.000000,1.000000,1.000000,0.000000,"787929-huge-pothole","Open","huge pothole","10/16/2013 - 11:41pm","2013-10-16T23:41:31-04:00",0.000000,0.000000,0," "," "," "," "," "," "," "," "," "," "," "," "," "," ",0,0.000000," "," "," "," ",0.000000,0.000000,0,0," "," "," "," "
,"236-292 Shoal Creek Road Canton, GA 30114, USA","http://bit.ly/16LUZ2N","10/16/2013 - 03:42am",786397.000000,786397.000000,34.250876,-84.499687,75595.000000,1.000000,3.000000,0.000000,"786397-lines-extremely-need-repainted","Open","lines extremely need repainted","12/05/2013 - 03:27am","2013-12-05T03:27:31-05:00",113014.000000,3.000000,0," "," "," "," "," "," "," "," "," "," "," "," "," "," ",0,0.000000," "," "," "," ",0.000000,0.000000,0,0," "," "," "," "
,"108 Clifford Ct canton, ga","http://bit.ly/19G6NlM","10/15/2013 - 07:17pm",785995.000000,785995.000000,34.141757,-84.425178,76100.000000,1.000000,1.000000,0.000000,"785995-street-light","Open","street light","10/15/2013 - 07:17pm","2013-10-15T19:17:28-04:00",0.000000,0.000000,0," "," "," "," "," "," "," "," "," "," "," "," "," "," ",0,0.000000," "," "," "," ",0.000000,0.000000,0,0," "," "," "," "
,"2221 Johnson Ferry Road Northeast Sandy Springs, GA 30342, USA","http://bit.ly/17EaC84","10/14/2013 - 06:41pm",785215.000000,785215.000000,33.890909,-84.322431,77575.000000,1.000000,3.000000,2607.000000,"785215-pavement-problem","Open","Pavement Problem","10/15/2013 - 01:54am","2013-10-15T01:54:00-04:00",109197.000000,2.000000,0," "," "," "," "," "," "," "," "," "," "," "," "," "," ",0,0.000000," "," "," "," ",0.000000,0.000000,0,0," "," "," "," "
,"2351-2399 Meadowvale Drive Northeast Atlanta, GA 30345, USA","http://bit.ly/GY21I7","10/14/2013 - 05:34pm",785179.000000,785179.000000,33.850334,-84.292898,77642.000000,1.000000,2.000000,0.000000,"785179-drainage-cover-broken","Open","Drainage cover broken","11/15/2013 - 03:36pm","2013-11-15T15:36:01-05:00",2168.000000,0.000000,0," "," "," "," "," "," "," "," "," "," "," "," "," "," ",0,0.000000," "," "," "," ",0.000000,0.000000,0,0," "," "," "," "
,"613 Snapping Shoals Road McDonough, GA 30252, USA","http://bit.ly/1hRxjva","10/14/2013 - 02:23pm",784846.000000,784846.000000,33.456081,-84.020195,77834.000000,1.000000,1.000000,0.000000,"784846-dead-cat-in-road","Open","Dead cat in road","10/14/2013 - 02:23pm","2013-10-14T14:23:25-04:00",0.000000,0.000000,0," "," "," "," "," "," "," "," "," "," "," "," "," "," ",0,0.000000," "," "," "," ",0.000000,0.000000,0,0," "," "," "," "
,"5634-5650 North Henry Boulevard Stockbridge, GA 30281, USA","http://bit.ly/1656aVO","10/14/2013 - 01:20pm",784781.000000,784781.000000,33.555030,-84.259498,77897.000000,1.000000,1.000000,0.000000,"784781-water-main-break","Open","Water main break","10/14/2013 - 01:20pm","2013-10-14T13:20:45-04:00",135598.000000,0.000000,0," "," "," "," "," "," "," "," "," "," "," "," "," "," ",0,0.000000," "," "," "," ",0.000000,0.000000,0,0," "," "," "," "
,"1699 Colebrook Circle Decatur, GA","http://bit.ly/1652LWM","10/14/2013 - 12:57pm",784766.000000,784766.000000,33.831711,-84.283868,77920.000000,1.000000,1.000000,0.000000,"784766-storm-drain-sinkhole","Open","Storm Drain Sinkhole","10/14/2013 - 12:57pm","2013-10-14T12:57:07-04:00",0.000000,0.000000,0," "," "," "," "," "," "," "," "," "," "," "," "," "," ",0,0.000000," "," "," "," ",0.000000,0.000000,0,0," "," "," "," "
,"1125 Byrnwyck Road Northeast Atlanta, GA 30319, USA","http://bit.ly/1cKX9TP","10/13/2013 - 12:20pm",784313.000000,784313.000000,33.906785,-84.346562,79397.000000,1.000000,3.000000,2607.000000,"784313-pavement-problem","Open","Pavement Problem","11/05/2013 - 11:06am","2013-11-05T11:06:34-05:00",0.000000,1.000000,0," "," "," "," "," "," "," "," "," "," "," "," "," "," ",0,0.000000," "," "," "," ",0.000000,0.000000,0,0," "," "," "," "
,"Stockbridge GA 30281, USA","http://bit.ly/188cavx","10/12/2013 - 11:44am",783942.000000,783942.000000,33.523678,-84.236165,80873.000000,1.000000,2.000000,0.000000,"783942-trash","Open","trash","10/12/2013 - 11:49am","2013-10-12T11:49:02-04:00",348227.000000,1.000000,0," "," "," "," "," "," "," "," "," "," "," "," "," "," ",0,0.000000," "," "," "," ",0.000000,0.000000,0,0," "," "," "," "
,"5000 Winters Chapel Road Atlanta, Georgia","http://bit.ly/1gxF2kp","10/11/2013 - 07:22pm",783274.000000,783274.000000,33.941573,-84.271189,81855.000000,1.000000,1.000000,2987.000000,"783274-no-crosswalk","Acknowledged","No crosswalk","10/11/2013 - 07:31pm","2013-10-11T19:31:14-04:00",343604.000000,0.000000,0," "," "," "," "," "," "," "," "," "," "," "," "," "," ",0,0.000000," "," "," "," ",0.000000,0.000000,0,0," "," "," "," "
,"1158-1182 W Nancy Creek Drive Northeast Atlanta, GA 30319, USA","http://bit.ly/19CY7QX","10/10/2013 - 01:27pm",781595.000000,781595.000000,33.902160,-84.341201,83650.000000,1.000000,1.000000,2788.000000,"781595-code-compliance-issue","Open","Code Compliance Issue","10/10/2013 - 01:27pm","2013-10-10T13:27:25-04:00",0.000000,0.000000,0," "," "," "," "," "," "," "," "," "," "," "," "," "," ",0,0.000000," "," "," "," ",0.000000,0.000000,0,0," "," "," "," "
,"1343-1351 Old Johnson Ferry Road Northeast Atlanta, GA 30319, USA","http://bit.ly/19CXUND","10/10/2013 - 01:26pm",781593.000000,781593.000000,33.902442,-84.342155,83651.000000,1.000000,1.000000,2788.000000,"781593-code-compliance-issue","Open","Code Compliance Issue","10/10/2013 - 01:26pm","2013-10-10T13:26:07-04:00",0.000000,0.000000,0," "," "," "," "," "," "," "," "," "," "," "," "," "," ",0,0.000000," "," "," "," ",0.000000,0.000000,0,0," "," "," "," "
,"1388 Bubbling Creek Road Northeast Atlanta, GA 30319, USA","http://bit.ly/19CXE0X","10/10/2013 - 01:23pm",781591.000000,781591.000000,33.901714,-84.329895,83653.000000,1.000000,3.000000,2600.000000,"781591-right-of-way-maintenance-issue","Open","Right-of-Way Maintenance Issue","10/11/2013 - 11:43am","2013-10-11T11:43:57-04:00",0.000000,0.000000,0," "," "," "," "," "," "," "," "," "," "," "," "," "," ",0,0.000000," "," "," "," ",0.000000,0.000000,0,0," "," "," "," "
,"3242 Connie Way  Winston , GA","http://bit.ly/156iArR","10/10/2013 - 04:54am",780432.000000,780432.000000,33.718012,-84.787349,84403.000000,1.000000,1.000000,0.000000,"780432-road-never-been-paved-in-40-years","Open","Road never been paved in 40 years","10/10/2013 - 04:54am","2013-10-10T04:54:30Z",0.000000,0.000000,0," "," "," "," "," "," "," "," "," "," "," "," "," "," ",0,0.000000," "," "," "," ",0.000000,0.000000,0,0," "," "," "," "
,"Austell Road Cobb county, Georgia","http://bit.ly/156iBvY","10/10/2013 - 03:33am",780415.000000,780415.000000,33.839912,-84.610816,84484.000000,1.000000,1.000000,0.000000,"780415-bad-potholes-on-austell-road","Open","Bad potholes on Austell road","10/10/2013 - 03:33am","2013-10-10T03:33:45Z",0.000000,0.000000,0," "," "," "," "," "," "," "," "," "," "," "," "," "," ",0,0.000000," "," "," "," ",0.000000,0.000000,0,0," "," "," "," "
,"Austell Road Cobb county, Georgia","http://bit.ly/1hDySNd","10/10/2013 - 03:33am",780414.000000,780414.000000,33.839912,-84.610816,84484.000000,1.000000,1.000000,0.000000,"780414-bad-potholes-on-austell-road","Open","Bad potholes on Austell road","10/10/2013 - 03:33am","2013-10-10T03:33:34Z",0.000000,0.000000,0," "," "," "," "," "," "," "," "," "," "," "," "," "," ",0,0.000000," "," "," "," ",0.000000,0.000000,0,0," "," "," "," "
,"Austell Road Cobb county, Georgia","http://bit.ly/156iBvS","10/10/2013 - 03:33am",780413.000000,780413.000000,33.839912,-84.610816,84484.000000,1.000000,1.000000,0.000000,"780413-bad-potholes-on-austell-road","Open","Bad potholes on Austell road","10/10/2013 - 03:33am","2013-10-10T03:33:29Z",0.000000,0.000000,0," "," "," "," "," "," "," "," "," "," "," "," "," "," ",0,0.000000," "," "," "," ",0.000000,0.000000,0,0," "," "," "," "
,"1593-1597 Rock Quarry Road Stockbridge, GA 30281, USA","http://bit.ly/18Pn8p1","10/09/2013 - 05:04pm",779896.000000,779896.000000,33.507789,-84.228141,85113.000000,1.000000,1.000000,0.000000,"779896-sign","Open","Sign","10/09/2013 - 05:04pm","2013-10-09T17:04:12Z",0.000000,0.000000,0," "," "," "," "," "," "," "," "," "," "," "," "," "," ",0,0.000000," "," "," "," ",0.000000,0.000000,0,0," "," "," "," "
,"Peeler Rd Dunwoody, GA","http://bit.ly/1bG2GeJ","10/09/2013 - 01:48am",779277.000000,779277.000000,33.934691,-84.169605,86029.000000,1.000000,2.000000,0.000000,"779277-brook-run-soon-over-run-with-bamboo","Open","Brook Run soon over-run with bamboo","10/09/2013 - 01:51am","2013-10-09T01:51:39Z",347348.000000,1.000000,0," "," "," "," "," "," "," "," "," "," "," "," "," "," ",0,0.000000," "," "," "," ",0.000000,0.000000,0,0," "," "," "," "
,"Johnson Ferry Rd Brookhaven, GA","http://bit.ly/1bFZX54","10/09/2013 - 01:18am",779261.000000,779261.000000,33.893234,-84.333757,86059.000000,1.000000,4.000000,2607.000000,"779261-multiple-pot-holes","Open","Multiple pot holes","10/11/2013 - 04:34pm","2013-10-11T16:34:22Z",112736.000000,3.000000,0," "," "," "," "," "," "," "," "," "," "," "," "," "," ",0,0.000000," "," "," "," ",0.000000,0.000000,0,0," "," "," "," "
,"3701 Walt Stephens Road Stockbridge, GA 30281, USA","http://bit.ly/1b8p0Jz","10/08/2013 - 07:09pm",779012.000000,779012.000000,33.528141,-84.273948,86428.000000,1.000000,1.000000,0.000000,"779012-sign-picked-up","Open","Sign picked up","10/08/2013 - 07:09pm","2013-10-08T19:09:46Z",135598.000000,0.000000,0," "," "," "," "," "," "," "," "," "," "," "," "," "," ",0,0.000000," "," "," "," ",0.000000,0.000000,0,0," "," "," "," "
,"4357-4383 Burns Road Northwest Lilburn, Georgia","http://bit.ly/17jXbdf","10/08/2013 - 04:50pm",778882.000000,778882.000000,33.911703,-84.134105,86567.000000,1.000000,1.000000,0.000000,"778882-potholes","Open","Potholes","10/08/2013 - 04:50pm","2013-10-08T16:50:32Z",0.000000,0.000000,0," "," "," "," "," "," "," "," "," "," "," "," "," "," ",0,0.000000," "," "," "," ",0.000000,0.000000,0,0," "," "," "," "
,"560 Kenilworth Circle Stone Mountain, GA","http://bit.ly/15kgbvv","10/08/2013 - 03:06pm",778793.000000,778793.000000,33.793537,-84.188751,86671.000000,1.000000,1.000000,0.000000,"778793-storm-drain-removed-and-never-replace-giant-hole","Open","Storm Drain Removed and Never Replace - Giant Hole","10/08/2013 - 03:06pm","2013-10-08T15:06:08Z",0.000000,0.000000,0," "," "," "," "," "," "," "," "," "," "," "," "," "," ",0,0.000000," "," "," "," ",0.000000,0.000000,0,0," "," "," "," "
,"4284 Magnolia Path Decatur / Dekalb, GA","http://bit.ly/18KFbwx","10/07/2013 - 03:42pm",777768.000000,777768.000000,33.681143,-84.213538,87835.000000,1.000000,1.000000,0.000000,"777768-street-light-out","Open","Street Light Out","10/07/2013 - 03:42pm","2013-10-07T15:42:15-04:00",0.000000,0.000000,0," "," "," "," "," "," "," "," "," "," "," "," "," "," ",0,0.000000," "," "," "," ",0.000000,0.000000,0,0," "," "," "," "
,"6405 The Trail Stone Mountain, GA","http://bit.ly/16JV610","10/04/2013 - 02:37pm",774241.000000,774241.000000,33.770487,-84.126614,92459.000000,1.000000,2.000000,0.000000,"774241-pothole","Open","Pothole","11/04/2013 - 05:39pm","2013-11-04T17:39:53Z",148634.000000,0.000000,0," "," "," "," "," "," "," "," "," "," "," "," "," "," ",0,0.000000," "," "," "," ",0.000000,0.000000,0,0," "," "," "," "
,"685-701 Flippen Road Stockbridge, GA 30281, USA","http://bit.ly/15KPp1Y","10/03/2013 - 12:06pm",772587.000000,772587.000000,33.529089,-84.245808,93810.000000,1.000000,1.000000,0.000000,"772587-sign-violation","Open","Sign violation","10/03/2013 - 12:06pm","2013-10-03T12:06:59-04:00",345897.000000,0.000000,0," "," "," "," "," "," "," "," "," "," "," "," "," "," ",0,0.000000," "," "," "," ",0.000000,0.000000,0,0," "," "," "," "
,"1577 Koppers Road Conley, Georgia","http://bit.ly/18xcHGn","10/03/2013 - 09:34am",772398.000000,772398.000000,33.663313,-84.327616,93962.000000,1.000000,1.000000,0.000000,"772398-pot-hole-at-intersection-of-bonsal-and-koppers-rd","Open","Pot hole at intersection of Bonsal and Koppers Rd.","10/03/2013 - 09:34am","2013-10-03T09:34:50-04:00",301504.000000,0.000000,0," "," "," "," "," "," "," "," "," "," "," "," "," "," ",0,0.000000," "," "," "," ",0.000000,0.000000,0,0," "," "," "," "
,"Bridges Rd Catoosa, GA","http://bit.ly/GzR6Eb","10/02/2013 - 05:31pm",771837.000000,771837.000000,34.963745,-85.063312,94925.000000,1.000000,1.000000,0.000000,"771837-major-potholes-in-road","Open","Major potholes in road","10/02/2013 - 05:31pm","2013-10-02T17:31:51-04:00",0.000000,0.000000,0," "," "," "," "," "," "," "," "," "," "," "," "," "," ",0,0.000000," "," "," "," ",0.000000,0.000000,0,0," "," "," "," "
,"695 Red Oak Road Stockbridge, GA 30281, USA","http://bit.ly/GzScQw","10/02/2013 - 02:20pm",771596.000000,771596.000000,33.528105,-84.228025,95116.000000,1.000000,1.000000,0.000000,"771596-sign-violation","Open","Sign violation","10/02/2013 - 02:20pm","2013-10-02T14:20:52-04:00",345897.000000,0.000000,0," "," "," "," "," "," "," "," "," "," "," "," "," "," ",0,0.000000," "," "," "," ",0.000000,0.000000,0,0," "," "," "," "
,"1359-1399 Old Johnson Ferry Road Northeast Atlanta, Georgia","http://bit.ly/1c4kKi3","10/02/2013 - 09:16am",771276.000000,771276.000000,33.902048,-84.341635,95420.000000,1.000000,3.000000,2607.000000,"771276-large-pothole","Open","Large pothole","10/10/2013 - 02:06pm","2013-10-10T14:06:37-04:00",345832.000000,2.000000,0," "," "," "," "," "," "," "," "," "," "," "," "," "," ",0,0.000000," "," "," "," ",0.000000,0.000000,0,0," "," "," "," "
,"Mcdonough GA 30253, USA","http://bit.ly/18LGgmp","10/01/2013 - 03:48pm",770851.000000,770851.000000,33.507648,-84.143592,96469.000000,1.000000,1.000000,0.000000,"770851-water-leak-comes-up-from-crack-in-asphalt","Open","Water leak comes up from crack in asphalt","10/01/2013 - 03:48pm","2013-10-01T15:48:02-04:00",345674.000000,0.000000,0," "," "," "," "," "," "," "," "," "," "," "," "," "," ",0,0.000000," "," "," "," ",0.000000,0.000000,0,0," "," "," "," "
,"1900-1964 East Lake Road McDonough, GA 30252, USA","http://bit.ly/18LFJ45","10/01/2013 - 03:45pm",770843.000000,770843.000000,33.501284,-84.078512,96472.000000,1.000000,2.000000,0.000000,"770843-needs-traffic-light","Open","Needs traffic light","10/23/2013 - 08:53pm","2013-10-23T20:53:18-04:00",345674.000000,1.000000,0," "," "," "," "," "," "," "," "," "," "," "," "," "," ",0,0.000000," "," "," "," ",0.000000,0.000000,0,0," "," "," "," "
,"174 Tye Street Stockbridge, GA 30281, USA","http://bit.ly/18LD7TN","10/01/2013 - 03:32pm",770832.000000,770832.000000,33.528619,-84.235705,96484.000000,1.000000,1.000000,0.000000,"770832-signs-in-right-of-way","Open","signs in right of way","10/01/2013 - 03:32pm","2013-10-01T15:32:58-04:00",345035.000000,0.000000,0," "," "," "," "," "," "," "," "," "," "," "," "," "," ",0,0.000000," "," "," "," ",0.000000,0.000000,0,0," "," "," "," "
,"4460 Walt Stephens Road Stockbridge, GA 30281, USA","http://bit.ly/18LpDJA","10/01/2013 - 03:20pm",770818.000000,770818.000000,33.528814,-84.247005,96497.000000,1.000000,1.000000,0.000000,"770818-in-right-of-way-blocking-view","Open","in right of way..blocking view","10/01/2013 - 03:20pm","2013-10-01T15:20:48-04:00",345035.000000,0.000000,0," "," "," "," "," "," "," "," "," "," "," "," "," "," ",0,0.000000," "," "," "," ",0.000000,0.000000,0,0," "," "," "," "
,"870 Bridgewater Court Stone Mountain, GA","http://bit.ly/16DEAj3","09/30/2013 - 06:17pm",769112.000000,769112.000000,33.769428,-84.185356,97760.000000,1.000000,1.000000,0.000000,"769112-no-street-lights","Open","No street lights","09/30/2013 - 06:17pm","2013-09-30T18:17:13-04:00",345414.000000,0.000000,0," "," "," "," "," "," "," "," "," "," "," "," "," "," ",0,0.000000," "," "," "," ",0.000000,0.000000,0,0," "," "," "," "
,"1712 Council Bluff Drive Northeast Atlanta, Georgia","http://bit.ly/15EKIGK","09/30/2013 - 11:50am",768656.000000,768656.000000,33.829728,-84.305673,98147.000000,1.000000,2.000000,0.000000,"768656-water-leak-sagamore","Open","Water leak - Sagamore","09/30/2013 - 03:32pm","2013-09-30T15:32:35-04:00",0.000000,1.000000,0," "," "," "," "," "," "," "," "," "," "," "," "," "," ",0,0.000000," "," "," "," ",0.000000,0.000000,0,0," "," "," "," "
,"3057 Kenville Lane Decatur, Georgia","http://bit.ly/15EDti0","09/30/2013 - 10:40am",768495.000000,768495.000000,33.672394,-84.264224,98217.000000,1.000000,1.000000,0.000000,"768495-multiple-pothole-on-street","Open","multiple pothole on street","09/30/2013 - 10:40am","2013-09-30T10:40:40-04:00",0.000000,0.000000,0," "," "," "," "," "," "," "," "," "," "," "," "," "," ",0,0.000000," "," "," "," ",0.000000,0.000000,0,0," "," "," "," "
,"4230 Regency Park Court Atlanta, GA 30341, USA","http://bit.ly/199KyYY","09/29/2013 - 04:35pm",768086.000000,768086.000000,33.916752,-84.316184,99302.000000,1.000000,3.000000,2795.000000,"768086-major-electrical-equipment-on-ground","Open","Major electricAl equipment on ground","10/01/2013 - 04:48pm","2013-10-01T16:48:42-04:00",107710.000000,1.000000,0," "," "," "," "," "," "," "," "," "," "," "," "," "," ",0,0.000000," "," "," "," ",0.000000,0.000000,0,0," "," "," "," "
,"1741-1759 East Nancy Creek Atlanta, GA 30341, USA","http://bit.ly/199KfNF","09/29/2013 - 04:32pm",768085.000000,768085.000000,33.916332,-84.317329,99305.000000,1.000000,1.000000,2605.000000,"768085-tree-issue","Open","Tree Issue","09/29/2013 - 04:32pm","2013-09-29T16:32:02-04:00",107710.000000,0.000000,0," "," "," "," "," "," "," "," "," "," "," "," "," "," ",0,0.000000," "," "," "," ",0.000000,0.000000,0,0," "," "," "," "
,"4058 Candler Lake West Brookhaven/Dekalb, GA","http://bit.ly/16Mp0uu","09/29/2013 - 03:57pm",768077.000000,768077.000000,33.912256,-84.327648,99340.000000,1.000000,3.000000,2795.000000,"768077-street-light-missing","Open","Street light missing","12/03/2013 - 10:59pm","2013-12-03T22:59:07-05:00",345138.000000,0.000000,0," "," "," "," "," "," "," "," "," "," "," "," "," "," ",0,0.000000," "," "," "," ",0.000000,0.000000,0,0," "," "," "," "
,"4190 Dunwoody Terrace Chamblee, GA 30341, USA","http://bit.ly/16MeUKd","09/29/2013 - 02:49pm",768056.000000,768056.000000,33.917517,-84.318201,99408.000000,1.000000,1.000000,2607.000000,"768056-pavement-problem","Open","Pavement Problem","09/29/2013 - 02:49pm","2013-09-29T14:49:48-04:00",107710.000000,0.000000,0," "," "," "," "," "," "," "," "," "," "," "," "," "," ",0,0.000000," "," "," "," ",0.000000,0.000000,0,0," "," "," "," "
,"358 River Point Drive McDonough, GA 30252, USA","http://bit.ly/16L9hMe","09/29/2013 - 06:50am",767808.000000,767808.000000,33.538076,-84.074329,99887.000000,1.000000,1.000000,0.000000,"767808-filled-potholes-with-red-clay-no-asphalt-on-top","Open","Filled potholes with red clay, no asphalt on top","09/29/2013 - 06:50am","2013-09-29T06:50:05-04:00",0.000000,0.000000,0," "," "," "," "," "," "," "," "," "," "," "," "," "," ",0,0.000000," "," "," "," ",0.000000,0.000000,0,0," "," "," "," "
,"4460 Walt Stephens Road Stockbridge, GA 30281, USA","http://bit.ly/16A32S9","09/28/2013 - 07:36pm",767583.000000,767583.000000,33.528838,-84.246958,100561.000000,1.000000,1.000000,0.000000,"767583-in-the-right-of-way","Open","in the right of way","09/28/2013 - 07:36pm","2013-09-28T19:36:21-04:00",345035.000000,0.000000,0," "," "," "," "," "," "," "," "," "," "," "," "," "," ",0,0.000000," "," "," "," ",0.000000,0.000000,0,0," "," "," "," "
,"1500-1660 East Nancy Creek Atlanta, GA 30319, USA","http://bit.ly/YEmmDh","09/28/2013 - 01:35pm",767400.000000,767400.000000,33.915579,-84.325319,100922.000000,1.000000,4.000000,2789.000000,"767400-parks-problem","Open","Parks Problem","10/01/2013 - 10:32am","2013-10-01T10:32:15-04:00",344950.000000,3.000000,0," "," "," "," "," "," "," "," "," "," "," "," "," "," ",0,0.000000," "," "," "," ",0.000000,0.000000,0,0," "," "," "," "
,"2967 Ashford Dunwoody Road Northeast Atlanta, GA 30319, USA","http://bit.ly/YEm9A2","09/28/2013 - 12:06pm",767362.000000,767362.000000,33.875355,-84.327902,101011.000000,1.000000,3.000000,2788.000000,"767362-code-compliance-issue","Open","Code Compliance Issue","09/29/2013 - 06:46pm","2013-09-29T18:46:35-04:00",0.000000,2.000000,0," "," "," "," "," "," "," "," "," "," "," "," "," "," ",0,0.000000," "," "," "," ",0.000000,0.000000,0,0," "," "," "," "
,"1500-1660 East Nancy Creek Atlanta, GA 30319, USA","http://bit.ly/YElnTN","09/28/2013 - 10:01am",767240.000000,767240.000000,33.915331,-84.324956,101136.000000,1.000000,3.000000,2789.000000,"767240-parks-problem","Open","Parks Problem","09/30/2013 - 07:51pm","2013-09-30T19:51:17-04:00",344950.000000,2.000000,0," "," "," "," "," "," "," "," "," "," "," "," "," "," ",0,0.000000," "," "," "," ",0.000000,0.000000,0,0," "," "," "," "
,"630 Lewis Road Canton, GA","http://bit.ly/16MNTXV","09/26/2013 - 06:17pm",764100.000000,764100.000000,34.219623,-84.484295,103520.000000,1.000000,1.000000,0.000000,"764100-no-water","Open","No water","09/26/2013 - 06:17pm","2013-09-26T18:17:07-04:00",0.000000,0.000000,0," "," "," "," "," "," "," "," "," "," "," "," "," "," ",0,0.000000," "," "," "," ",0.000000,0.000000,0,0," "," "," "," "
,"Lake Forest And Northwood Dr Sandy spring, Georgia","http://bit.ly/1bG8R1n","09/25/2013 - 01:28pm",762208.000000,762208.000000,32.157435,-82.907123,105249.000000,1.000000,1.000000,0.000000,"762208-damage-tree","Open","Damage tree","09/25/2013 - 01:28pm","2013-09-25T13:28:42-04:00",0.000000,0.000000,0," "," "," "," "," "," "," "," "," "," "," "," "," "," ",0,0.000000," "," "," "," ",0.000000,0.000000,0,0," "," "," "," "
,"Vista Way Macon, GA","http://bit.ly/1bG5yYh","09/25/2013 - 01:03pm",762169.000000,762169.000000,32.885540,-83.568785,105274.000000,1.000000,1.000000,0.000000,"762169-cut-right-of-way","Open","Cut Right-Of-Way","09/25/2013 - 01:03pm","2013-09-25T13:03:12-04:00",34550.000000,0.000000,0," "," "," "," "," "," "," "," "," "," "," "," "," "," ",0,0.000000," "," "," "," ",0.000000,0.000000,0,0," "," "," "," "
,"North Hairston Stone Mountain, GA","http://bit.ly/19xYwzK","09/24/2013 - 11:32pm",760871.000000,760871.000000,33.804778,-84.193606,106085.000000,1.000000,1.000000,0.000000,"760871-pothole","Open","Pothole","09/24/2013 - 11:32pm","2013-09-24T23:32:28-04:00",0.000000,0.000000,0," "," "," "," "," "," "," "," "," "," "," "," "," "," ",0,0.000000," "," "," "," ",0.000000,0.000000,0,0," "," "," "," "
,"Rockland Rd Lithonia/DeKalb, GA","http://bit.ly/16oUn50","09/24/2013 - 04:52pm",760477.000000,760477.000000,33.676119,-84.116500,106485.000000,1.000000,1.000000,0.000000,"760477-potholes","Open","Potholes","09/24/2013 - 04:52pm","2013-09-24T16:52:49-04:00",0.000000,0.000000,0," "," "," "," "," "," "," "," "," "," "," "," "," "," ",0,0.000000," "," "," "," ",0.000000,0.000000,0,0," "," "," "," "
,"Wesley Chapel Rd Decatur/DeKalb, GA","http://bit.ly/16oT3PM","09/24/2013 - 04:38pm",760468.000000,760468.000000,33.707720,-84.218461,106499.000000,1.000000,1.000000,0.000000,"760468-deep-pothole","Open","Deep Pothole","09/24/2013 - 04:38pm","2013-09-24T16:38:40-04:00",0.000000,0.000000,0," "," "," "," "," "," "," "," "," "," "," "," "," "," ",0,0.000000," "," "," "," ",0.000000,0.000000,0,0," "," "," "," "
,"Klondike Rd Lithonia/DeKalb, GA","http://bit.ly/16oSPbc","09/24/2013 - 04:36pm",760464.000000,760464.000000,33.669733,-84.118188,106501.000000,1.000000,1.000000,0.000000,"760464-potholes","Open","Potholes","09/24/2013 - 04:36pm","2013-09-24T16:36:21-04:00",0.000000,0.000000,0," "," "," "," "," "," "," "," "," "," "," "," "," "," ",0,0.000000," "," "," "," ",0.000000,0.000000,0,0," "," "," "," "
,"Central Ave /New Peachtre Rd  doraville, Georgia","http://bit.ly/1b3aung","09/24/2013 - 03:51pm",760430.000000,760430.000000,33.816807,-84.223937,106546.000000,1.000000,1.000000,0.000000,"760430-big-pothole","Open","big pothole","09/24/2013 - 03:51pm","2013-09-24T15:51:39-04:00",0.000000,0.000000,0," "," "," "," "," "," "," "," "," "," "," "," "," "," ",0,0.000000," "," "," "," ",0.000000,0.000000,0,0," "," "," "," "
,"139 Tobee Dr Bibb County, GA","http://bit.ly/1b2y9E4","09/24/2013 - 11:57am",760016.000000,760016.000000,32.797129,-83.777895,106780.000000,1.000000,2.000000,0.000000,"760016-overgrown-lots","Open","Overgrown lots","10/28/2013 - 03:12pm","2013-10-28T15:12:31-04:00",0.000000,0.000000,0," "," "," "," "," "," "," "," "," "," "," "," "," "," ",0,0.000000," "," "," "," ",0.000000,0.000000,0,0," "," "," "," "
,"Murphey Candler Park Atlanta, Georgia","http://bit.ly/18kY61u","09/23/2013 - 11:03am",758028.000000,758028.000000,33.908907,-84.323029,108274.000000,1.000000,12.000000,2789.000000,"758028-pet-waste-bags","Acknowledged","Pet waste bags","09/29/2013 - 11:16am","2013-09-29T11:16:54-04:00",0.000000,8.000000,0," "," "," "," "," "," "," "," "," "," "," "," "," "," ",0,0.000000," "," "," "," ",0.000000,0.000000,0,0," "," "," "," "
,"2609-2663 Peeler Road Dunwoody, Georgia","http://bit.ly/18kkZQM","09/22/2013 - 10:46pm",757264.000000,757264.000000,33.936748,-84.287754,109010.000000,1.000000,2.000000,312.000000,"757264-pothole-on-peeler-rd-just-east-of-tilly-mill-rd","Acknowledged","Pothole on Peeler Rd just east of Tilly Mill Rd.","09/23/2013 - 01:12pm","2013-09-23T13:12:49-04:00",343604.000000,0.000000,0," "," "," "," "," "," "," "," "," "," "," "," "," "," ",0,0.000000," "," "," "," ",0.000000,0.000000,0,0," "," "," "," "
,"5000 Winters Chapel Road Dunwoody, Georgia","http://bit.ly/14xOuiD","09/22/2013 - 10:02pm",757253.000000,757253.000000,33.941608,-84.271360,109055.000000,1.000000,2.000000,2987.000000,"757253-missing-crosswalk-at-peeler-road-and-winters-chapel-road","Acknowledged","Missing crosswalk at Peeler Road and Winters Chapel Road","09/23/2013 - 12:16pm","2013-09-23T12:16:10-04:00",343604.000000,0.000000,0," "," "," "," "," "," "," "," "," "," "," "," "," "," ",0,0.000000," "," "," "," ",0.000000,0.000000,0,0," "," "," "," "
,"162 South Bethany Road McDonough, GA 30252, USA","http://bit.ly/1f7z1N0","09/22/2013 - 12:22pm",756930.000000,756930.000000,33.424198,-84.090705,109635.000000,1.000000,2.000000,0.000000,"756930-road-hazard","Open","Road hazard","09/24/2013 - 05:20pm","2013-09-24T17:20:15-04:00",343536.000000,1.000000,0," "," "," "," "," "," "," "," "," "," "," "," "," "," ",0,0.000000," "," "," "," ",0.000000,0.000000,0,0," "," "," "," "
,"Murphey Candler Park Brookhaven, GA","http://bit.ly/17RQUZQ","09/21/2013 - 12:36pm",755899.000000,755899.000000,33.908907,-84.323029,111061.000000,1.000000,5.000000,2605.000000,"755899-dead-tree-near-playing-field","Open","Dead tree near playing field","10/31/2013 - 12:14pm","2013-10-31T12:14:00-04:00",0.000000,1.000000,0," "," "," "," "," "," "," "," "," "," "," "," "," "," ",0,0.000000," "," "," "," ",0.000000,0.000000,0,0," "," "," "," "
,"824 Donaldson Road Chattanooga, Tennessee","http://bit.ly/11L7GK0","09/20/2013 - 03:21pm",754157.000000,754157.000000,35.009776,-85.259386,112336.000000,1.000000,1.000000,0.000000,"754157-sinkhole","Open","Sinkhole","09/20/2013 - 03:21pm","2013-09-20T15:21:26-04:00",93903.000000,0.000000,0," "," "," "," "," "," "," "," "," "," "," "," "," "," ",0,0.000000," "," "," "," ",0.000000,0.000000,0,0," "," "," "," "
,"818 Poindexter Ave East Ridge, TN","http://bit.ly/1fiPOKC","09/20/2013 - 03:17pm",754154.000000,754154.000000,35.008878,-85.261497,112340.000000,1.000000,1.000000,0.000000,"754154-sinkhole","Open","Sinkhole","09/20/2013 - 03:17pm","2013-09-20T15:17:52-04:00",93903.000000,0.000000,0," "," "," "," "," "," "," "," "," "," "," "," "," "," ",0,0.000000," "," "," "," ",0.000000,0.000000,0,0," "," "," "," "
,"1-155 Francis Lane Stockbridge, Georgia","http://bit.ly/16nCPjT","09/18/2013 - 10:23pm",750831.000000,750831.000000,33.542557,-84.194133,115034.000000,1.000000,2.000000,0.000000,"750831-pothole","Open","Pothole","09/18/2013 - 10:29pm","2013-09-18T22:29:03Z",0.000000,1.000000,0," "," "," "," "," "," "," "," "," "," "," "," "," "," ",0,0.000000," "," "," "," ",0.000000,0.000000,0,0," "," "," "," "
,"Parkside Place Atlanta, GA 30319, USA","http://bit.ly/1f8nIBy","09/18/2013 - 09:20pm",750783.000000,750783.000000,33.912898,-84.339049,115097.000000,1.000000,3.000000,2606.000000,"750783-signal-problem","Open","Signal Problem","09/25/2013 - 04:44pm","2013-09-25T16:44:05Z",0.000000,2.000000,0," "," "," "," "," "," "," "," "," "," "," "," "," "," ",0,0.000000," "," "," "," ",0.000000,0.000000,0,0," "," "," "," "
,"3197-3201 Ashford Dunwoody Road Northeast Atlanta, Georgia","http://bit.ly/1gyFFY4","09/18/2013 - 03:16pm",750294.000000,750294.000000,33.883773,-84.327044,115461.000000,1.000000,2.000000,2606.000000,"750294-traffic-signal","Open","traffic signal","09/19/2013 - 12:07pm","2013-09-19T12:07:56Z",0.000000,1.000000,0," "," "," "," "," "," "," "," "," "," "," "," "," "," ",0,0.000000," "," "," "," ",0.000000,0.000000,0,0," "," "," "," "
,"1936-2040 Harts Mill Road Northeast Chamblee, GA 30341, USA","http://bit.ly/150l0fL","09/17/2013 - 09:22pm",748857.000000,748857.000000,33.901297,-84.308245,116535.000000,1.000000,1.000000,0.000000,"748857-light-out","Open","Light out","09/17/2013 - 09:22pm","2013-09-17T21:22:38Z",70083.000000,0.000000,0," "," "," "," "," "," "," "," "," "," "," "," "," "," ",0,0.000000," "," "," "," ",0.000000,0.000000,0,0," "," "," "," "
,"Speer Rd Stockbridge, GA","http://bit.ly/152W41H","09/17/2013 - 01:47pm",747468.000000,747468.000000,33.537784,-84.276536,116990.000000,1.000000,2.000000,0.000000,"747468-illegal-dumping","Open","Illegal Dumping","10/04/2013 - 09:29pm","2013-10-04T21:29:17Z",0.000000,1.000000,0," "," "," "," "," "," "," "," "," "," "," "," "," "," ",0,0.000000," "," "," "," ",0.000000,0.000000,0,0," "," "," "," "
,"5752 Ridgeview Ct Norcross, GA","http://bit.ly/Yu5kb8","09/16/2013 - 10:47am",746273.000000,746273.000000,33.909158,-84.189798,118370.000000,1.000000,2.000000,0.000000,"746273-street-light-is-out","Open","Street light is out","10/01/2013 - 10:11am","2013-10-01T10:11:12-04:00",0.000000,0.000000,0," "," "," "," "," "," "," "," "," "," "," "," "," "," ",0,0.000000," "," "," "," ",0.000000,0.000000,0,0," "," "," "," "
,"3360 Embry Circle Chamblee, Georgia","http://bit.ly/1blJBxf","09/15/2013 - 07:49pm",745608.000000,745608.000000,33.877986,-84.257865,119268.000000,1.000000,2.000000,0.000000,"745608-dip-in-road","Open","Dip in road","09/26/2013 - 10:05pm","2013-09-26T22:05:41-04:00",341773.000000,1.000000,0," "," "," "," "," "," "," "," "," "," "," "," "," "," ",0,0.000000," "," "," "," ",0.000000,0.000000,0,0," "," "," "," "
,"148 Ashton Drive Macon, GA 31220, USA","http://bit.ly/X4zu6m","09/14/2013 - 06:03pm",744855.000000,744855.000000,32.857119,-83.762217,120814.000000,1.000000,3.000000,1900.000000,"744855-pothole","Acknowledged","Pothole","11/21/2013 - 10:23pm","2013-11-21T22:23:14-05:00",341179.000000,1.000000,0," "," "," "," "," "," "," "," "," "," "," "," "," "," ",0,0.000000," "," "," "," ",0.000000,0.000000,0,0," "," "," "," "
,"4507-4513 Sudbury Road Atlanta, GA 30360, USA","http://bit.ly/166XN6h","09/14/2013 - 04:24pm",744811.000000,744811.000000,33.928474,-84.277122,120912.000000,1.000000,1.000000,313.000000,"744811-sign-problem","Acknowledged","Sign Problem","09/14/2013 - 04:31pm","2013-09-14T16:31:17-04:00",341620.000000,0.000000,0," "," "," "," "," "," "," "," "," "," "," "," "," "," ",0,0.000000," "," "," "," ",0.000000,0.000000,0,0," "," "," "," "
,"4502 Sudbury Road Doraville, GA 30360, USA","http://bit.ly/166W9BH","09/14/2013 - 04:16pm",744809.000000,744809.000000,33.927993,-84.277198,120921.000000,1.000000,1.000000,313.000000,"744809-sign-problem","Acknowledged","Sign Problem","09/14/2013 - 04:21pm","2013-09-14T16:21:24-04:00",341620.000000,0.000000,0," "," "," "," "," "," "," "," "," "," "," "," "," "," ",0,0.000000," "," "," "," ",0.000000,0.000000,0,0," "," "," "," "
,"4497 Sudbury Road Doraville, GA 30360, USA","http://bit.ly/X4zenW","09/14/2013 - 03:52pm",744799.000000,744799.000000,33.927837,-84.276741,120945.000000,1.000000,1.000000,313.000000,"744799-sign-problem","Acknowledged","Sign Problem","09/14/2013 - 04:01pm","2013-09-14T16:01:33-04:00",341620.000000,0.000000,0," "," "," "," "," "," "," "," "," "," "," "," "," "," ",0,0.000000," "," "," "," ",0.000000,0.000000,0,0," "," "," "," "
,"2696 Laurelwood Road Atlanta, GA 30360, USA","http://bit.ly/166Ps2D","09/14/2013 - 03:45pm",744727.000000,744727.000000,33.931941,-84.278358,120952.000000,1.000000,1.000000,313.000000,"744727-sign-problem","Acknowledged","Sign Problem","11/28/2013 - 09:53am","2013-11-28T09:53:25-05:00",0.000000,0.000000,0," "," "," "," "," "," "," "," "," "," "," "," "," "," ",0,0.000000," "," "," "," ",0.000000,0.000000,0,0," "," "," "," "
,"3716-3766 Ashford Dunwoody Road Northeast Atlanta, GA 30319, USA","http://bit.ly/163lITo","09/13/2013 - 07:12pm",743134.000000,743134.000000,33.900909,-84.331886,122185.000000,1.000000,6.000000,2795.000000,"743134-grafitti","Open","Grafitti","09/14/2013 - 12:08pm","2013-09-14T12:08:25-04:00",107219.000000,5.000000,0," "," "," "," "," "," "," "," "," "," "," "," "," "," ",0,0.000000," "," "," "," ",0.000000,0.000000,0,0," "," "," "," "
,"4624 Bishop Rd MACON/BIBB, GA","http://bit.ly/1b5GmtM","09/11/2013 - 12:13pm",738195.000000,738195.000000,32.819750,-83.717151,125484.000000,1.000000,1.000000,0.000000,"738195-bad-property-mr-cullin","Open","BAD PROPERTY---Mr Cullin","09/11/2013 - 12:13pm","2013-09-11T12:13:10-04:00",0.000000,0.000000,0," "," "," "," "," "," "," "," "," "," "," "," "," "," ",0,0.000000," "," "," "," ",0.000000,0.000000,0,0," "," "," "," "
,"2931 Old Norcross Tucker Road Tucker, GA","http://bit.ly/17M5p1W","09/09/2013 - 04:58pm",734590.000000,734590.000000,33.882313,-84.203056,128079.000000,1.000000,1.000000,0.000000,"734590-potholes-are-back-near-entrance-to-nesbitt-elementary-school","Open","Potholes Are BACK near Entrance to Nesbitt Elementary School","09/09/2013 - 04:58pm","2013-09-09T16:58:47-04:00",103963.000000,0.000000,0," "," "," "," "," "," "," "," "," "," "," "," "," "," ",0,0.000000," "," "," "," ",0.000000,0.000000,0,0," "," "," "," "
,"Glaze Drive At Peeler Road  Dunwoody /Dekalb, georgia","http://bit.ly/1akfAuU","09/09/2013 - 10:32am",734040.000000,734040.000000,33.945175,-84.270080,128465.000000,1.000000,1.000000,0.000000,"734040-visibility","Open","Visibility","09/09/2013 - 10:32am","2013-09-09T10:32:27-04:00",0.000000,0.000000,0," "," "," "," "," "," "," "," "," "," "," "," "," "," ",0,0.000000," "," "," "," ",0.000000,0.000000,0,0," "," "," "," "
,"Centennial Olympic Parkway Conyers, Georgia","http://bit.ly/13vi8Ey","09/08/2013 - 11:51am",733046.000000,733046.000000,33.689242,-83.961907,130066.000000,1.000000,1.000000,0.000000,"733046-traffic-light","Open","traffic light","09/08/2013 - 11:51am","2013-09-08T11:51:14Z",0.000000,0.000000,0," "," "," "," "," "," "," "," "," "," "," "," "," "," ",0,0.000000," "," "," "," ",0.000000,0.000000,0,0," "," "," "," "
,"191 Baker Rd. Newnan, GA 30263","http://bit.ly/1dQJAlW","09/07/2013 - 06:45pm",732524.000000,732524.000000,33.411513,-84.704875,131092.000000,1.000000,2.000000,0.000000,"732524-mailbox","Open","Mailbox","09/13/2013 - 12:29pm","2013-09-13T12:29:41Z",0.000000,1.000000,0," "," "," "," "," "," "," "," "," "," "," "," "," "," ",0,0.000000," "," "," "," ",0.000000,0.000000,0,0," "," "," "," "
,"165 Anderson Rd J.C / Carter, Tn","http://bit.ly/Y7lAOm","09/06/2013 - 02:52pm",730693.000000,730693.000000,34.454831,-82.827932,132765.000000,1.000000,1.000000,0.000000,"730693-depressions-sinks-in-i-26","Open","Depressions/Sinks in I-26","09/06/2013 - 02:52pm","2013-09-06T14:52:51Z",0.000000,0.000000,0," "," "," "," "," "," "," "," "," "," "," "," "," "," ",0,0.000000," "," "," "," ",0.000000,0.000000,0,0," "," "," "," "
,"Harts Mill Road And Ashford Dunwood Road Ne Brookhaven, GA","http://bit.ly/Y7gBND","09/05/2013 - 10:56pm",729053.000000,729053.000000,33.902604,-84.331223,133721.000000,1.000000,1.000000,2606.000000,"729053-signal-timing","Open","Signal timing","09/05/2013 - 10:56pm","2013-09-05T22:56:53Z",0.000000,0.000000,0," "," "," "," "," "," "," "," "," "," "," "," "," "," ",0,0.000000," "," "," "," ",0.000000,0.000000,0,0," "," "," "," "
,"Briarcliff Rd Ne And Henderson Mill Road Dekalb, GA","http://bit.ly/Y7gBNx","09/05/2013 - 10:54pm",729052.000000,729052.000000,33.849108,-84.257407,133723.000000,1.000000,2.000000,0.000000,"729052-traffic-signal-henderson-mill-road","Open","traffic signal - Henderson Mill Road","09/07/2013 - 07:10pm","2013-09-07T19:10:34Z",0.000000,1.000000,0," "," "," "," "," "," "," "," "," "," "," "," "," "," ",0,0.000000," "," "," "," ",0.000000,0.000000,0,0," "," "," "," "
,"6768-6778 Best Friend Road Norcross, Georgia","http://bit.ly/14nvAgh","09/05/2013 - 06:44pm",728832.000000,728832.000000,33.914281,-84.235892,133973.000000,1.000000,1.000000,0.000000,"728832-on-bf-road","Open","#% on BF Road","09/05/2013 - 06:44pm","2013-09-05T18:44:13Z",0.000000,0.000000,0," "," "," "," "," "," "," "," "," "," "," "," "," "," ",0,0.000000," "," "," "," ",0.000000,0.000000,0,0," "," "," "," "
,"6987-7025 Best Friend Road Atlanta, Georgia","http://bit.ly/14nvpBF","09/05/2013 - 06:42pm",728827.000000,728827.000000,33.909303,-84.242061,133975.000000,1.000000,1.000000,0.000000,"728827-4-on-bf-road","Open","#4 on BF Road","09/05/2013 - 06:42pm","2013-09-05T18:42:25Z",0.000000,0.000000,0," "," "," "," "," "," "," "," "," "," "," "," "," "," ",0,0.000000," "," "," "," ",0.000000,0.000000,0,0," "," "," "," "
,"7004 Best Friend Road Atlanta, Georgia","http://bit.ly/14nvoxG","09/05/2013 - 06:41pm",728826.000000,728826.000000,33.908110,-84.243552,133976.000000,1.000000,1.000000,0.000000,"728826-3-on-bf-road","Open","#3 on BF Road","09/05/2013 - 06:41pm","2013-09-05T18:41:47Z",0.000000,0.000000,0," "," "," "," "," "," "," "," "," "," "," "," "," "," ",0,0.000000," "," "," "," ",0.000000,0.000000,0,0," "," "," "," "
,"7077-7099 Best Friend Road Atlanta, Georgia","http://bit.ly/14nuRMn","09/05/2013 - 06:39pm",728818.000000,728818.000000,33.908075,-84.243696,133978.000000,1.000000,2.000000,0.000000,"728818-2-on-best-friend-road","Open","#2 on Best Friend Road","10/23/2013 - 06:39pm","2013-10-23T18:39:53Z",0.000000,1.000000,0," "," "," "," "," "," "," "," "," "," "," "," "," "," ",0,0.000000," "," "," "," ",0.000000,0.000000,0,0," "," "," "," "
,"3597-3599 Best Friend Road Atlanta, Georgia","http://bit.ly/14uEwvh","09/05/2013 - 06:33pm",728807.000000,728807.000000,33.907090,-84.244926,133984.000000,1.000000,2.000000,0.000000,"728807-pot-holes-and-rough-railroad","Open","Pot Holes and Rough Railroad","09/05/2013 - 06:46pm","2013-09-05T18:46:55Z",0.000000,1.000000,0," "," "," "," "," "," "," "," "," "," "," "," "," "," ",0,0.000000," "," "," "," ",0.000000,0.000000,0,0," "," "," "," "
,"4900-4944 Highpoint Drive Marietta, GA 30066, USA","http://bit.ly/15ZYVvM","09/04/2013 - 07:02pm",726148.000000,726148.000000,34.070380,-84.486041,135155.000000,1.000000,1.000000,0.000000,"726148-abandoned-vehicle-on-public-rd","Open","abandoned vehicle on public rd","09/04/2013 - 07:02pm","2013-09-04T19:02:37-04:00",338962.000000,0.000000,0," "," "," "," "," "," "," "," "," "," "," "," "," "," ",0,0.000000," "," "," "," ",0.000000,0.000000,0,0," "," "," "," "
,"4800 Tremont Court Northeast Marietta, GA 30066, USA","http://bit.ly/15ZYuBu","09/04/2013 - 06:59pm",726144.000000,726144.000000,34.068202,-84.488655,135158.000000,1.000000,1.000000,0.000000,"726144-stop-sign-down","Open","stop sign down","09/04/2013 - 07:00pm","2013-09-04T19:00:00-04:00",338962.000000,0.000000,0," "," "," "," "," "," "," "," "," "," "," "," "," "," ",0,0.000000," "," "," "," ",0.000000,0.000000,0,0," "," "," "," "
,"156-172 Georgia 138 Stockbridge, GA 30281, USA","http://bit.ly/14WeJzz","09/03/2013 - 06:12pm",722439.000000,722439.000000,33.540203,-84.198422,136645.000000,1.000000,2.000000,0.000000,"722439-remove-the-4-burnt-down-or-boarded-up-houses-on-138-between-138-42-intersection-and-138-155-intersection","Open","Remove the 4 burnt down or boarded up houses on 138 between 138/42 intersection and 138/155 intersection.","12/03/2013 - 08:59am","2013-12-03T08:59:13-05:00",338623.000000,1.000000,0," "," "," "," "," "," "," "," "," "," "," "," "," "," ",0,0.000000," "," "," "," ",0.000000,0.000000,0,0," "," "," "," "
,"1500-1660 East Nancy Creek Atlanta, GA 30319, USA","http://bit.ly/18ydswb","09/02/2013 - 05:09pm",721096.000000,721096.000000,33.915519,-84.325195,138148.000000,1.000000,5.000000,2601.000000,"721096-storm-water-problem","Acknowledged","Storm Water Problem","09/17/2013 - 08:26am","2013-09-17T08:26:04-04:00",122596.000000,3.000000,0," "," "," "," "," "," "," "," "," "," "," "," "," "," ",0,0.000000," "," "," "," ",0.000000,0.000000,0,0," "," "," "," "
,"Ashwoody Ct And Shawnee Ln Brookhaven, GA","http://bit.ly/15tDpuV","08/31/2013 - 03:32pm",718752.000000,718752.000000,33.916713,-84.330138,141125.000000,1.000000,14.000000,2607.000000,"718752-large-pothole-on-ashwoody-ct","Acknowledged","Large pothole on Ashwoody Ct","12/03/2013 - 02:07pm","2013-12-03T14:07:19-05:00",337576.000000,10.000000,0," "," "," "," "," "," "," "," "," "," "," "," "," "," ",0,0.000000," "," "," "," ",0.000000,0.000000,0,0," "," "," "," "
,"320 Farmbrook Pass Canton, GA","http://bit.ly/12VUJvN","08/31/2013 - 12:57am",717639.000000,717639.000000,34.225665,-84.341958,142000.000000,1.000000,1.000000,0.000000,"717639-streetlight-out","Open","Streetlight out","08/31/2013 - 12:57am","2013-08-31T00:57:46-04:00",0.000000,0.000000,0," "," "," "," "," "," "," "," "," "," "," "," "," "," ",0,0.000000," "," "," "," ",0.000000,0.000000,0,0," "," "," "," "
,"1922 Oak Grove Rd Ne Atlanta/DeKalb, GA","http://bit.ly/15mzAyr","08/30/2013 - 04:18pm",717065.000000,717065.000000,33.838323,-84.290323,142519.000000,1.000000,1.000000,0.000000,"717065-flashing-school-zone-light-not-working","Open","flashing school zone light not working","08/30/2013 - 04:18pm","2013-08-30T16:18:31-04:00",0.000000,0.000000,0," "," "," "," "," "," "," "," "," "," "," "," "," "," ",0,0.000000," "," "," "," ",0.000000,0.000000,0,0," "," "," "," "
,"106 Neal Ave. Stockbridge, GA","http://bit.ly/14dWulq","08/30/2013 - 10:04am",716488.000000,716488.000000,33.544996,-84.220164,142893.000000,1.000000,1.000000,0.000000,"716488-health-dept-code-violation","Open","health dept. code violation","08/30/2013 - 10:04am","2013-08-30T10:04:26-04:00",0.000000,0.000000,0," "," "," "," "," "," "," "," "," "," "," "," "," "," ",0,0.000000," "," "," "," ",0.000000,0.000000,0,0," "," "," "," "
,"1373 W Nancy Creek Drive Northeast Atlanta, Georgia","http://bit.ly/19R3EAH","08/29/2013 - 06:40pm",714982.000000,714982.000000,33.905347,-84.332741,143817.000000,1.000000,29.000000,2606.000000,"714982-west-nancy-creek-at-ash-dun","Open","West Nancy Creek at Ash-Dun","12/02/2013 - 09:54am","2013-12-02T09:54:05-05:00",0.000000,25.000000,0," "," "," "," "," "," "," "," "," "," "," "," "," "," ",0,0.000000," "," "," "," ",0.000000,0.000000,0,0," "," "," "," "
,"116 Neal Boulevard Stockbridge, Georgia","http://bit.ly/143sGxh","08/29/2013 - 05:24pm",714942.000000,714942.000000,33.546594,-84.220212,143893.000000,1.000000,1.000000,0.000000,"714942-water-pipe-gushing","Open","water pipe gushing","08/29/2013 - 05:24pm","2013-08-29T17:24:39-04:00",0.000000,0.000000,0," "," "," "," "," "," "," "," "," "," "," "," "," "," ",0,0.000000," "," "," "," ",0.000000,0.000000,0,0," "," "," "," "
,"2331 Allen Road Macon, GA 31216, USA","http://bit.ly/185rPsS","08/28/2013 - 07:28pm",712734.000000,712734.000000,32.742128,-83.656450,145209.000000,1.000000,1.000000,0.000000,"712734-other","Open","Other","08/29/2013 - 11:29pm","2013-08-29T23:29:37-04:00",337281.000000,0.000000,0," "," "," "," "," "," "," "," "," "," "," "," "," "," ",0,0.000000," "," "," "," ",0.000000,0.000000,0,0," "," "," "," "
,"Napier Ave From Park St To Forsyth Rd macon, ga","http://bit.ly/154ma4i","08/28/2013 - 02:40pm",712423.000000,712423.000000,32.886042,-83.736629,145497.000000,1.000000,2.000000,0.000000,"712423-major-clean-up-needed-and-fix-issues","Open","major clean up needed and fix issues","09/30/2013 - 02:53pm","2013-09-30T14:53:17-04:00",0.000000,0.000000,0," "," "," "," "," "," "," "," "," "," "," "," "," "," ",0,0.000000," "," "," "," ",0.000000,0.000000,0,0," "," "," "," "
,"Stephenson Road/N. Deshong Road Lithonia, Georgia","http://bit.ly/1dLHbYm","08/27/2013 - 10:18am",709578.000000,709578.000000,33.769636,-84.102891,147199.000000,1.000000,1.000000,0.000000,"709578-overgrow-grass","Open","Overgrow Grass","08/27/2013 - 10:18am","2013-08-27T10:18:57-04:00",0.000000,0.000000,0," "," "," "," "," "," "," "," "," "," "," "," "," "," ",0,0.000000," "," "," "," ",0.000000,0.000000,0,0," "," "," "," "
,"2860-2998 Promenade Place Buford, Georgia","http://bit.ly/14zezxV","08/26/2013 - 08:50pm",708588.000000,708588.000000,34.104056,-83.962105,148007.000000,1.000000,1.000000,0.000000,"708588-pot-hole","Open","Pot hole","08/26/2013 - 08:50pm","2013-08-26T20:50:36-04:00",0.000000,0.000000,0," "," "," "," "," "," "," "," "," "," "," "," "," "," ",0,0.000000," "," "," "," ",0.000000,0.000000,0,0," "," "," "," "
,"3790 Ashford Dunwoody Road Northeast Brookhaven, Georgia","http://bit.ly/17hxcVT","08/26/2013 - 03:40pm",708298.000000,708298.000000,33.902890,-84.331196,148317.000000,1.000000,5.000000,2604.000000,"708298-partially-hidden-sign","Acknowledged","Partially Hidden Sign","08/30/2013 - 12:28am","2013-08-30T00:28:06-04:00",0.000000,3.000000,0," "," "," "," "," "," "," "," "," "," "," "," "," "," ",0,0.000000," "," "," "," ",0.000000,0.000000,0,0," "," "," "," "
,"4692-4736 Ayers Road Macon, GA 31210, USA","http://bit.ly/19Unb6E","08/26/2013 - 09:17am",707547.000000,707547.000000,32.858579,-83.708085,148701.000000,1.000000,2.000000,1900.000000,"707547-pothole","Acknowledged","Pothole","08/26/2013 - 10:24am","2013-08-26T10:24:47-04:00",57036.000000,0.000000,0," "," "," "," "," "," "," "," "," "," "," "," "," "," ",0,0.000000," "," "," "," ",0.000000,0.000000,0,0," "," "," "," "
,"Parkside Place Atlanta, GA 30319, USA","http://bit.ly/176YD6A","08/22/2013 - 05:13pm",703006.000000,703006.000000,33.913093,-84.339195,153984.000000,1.000000,4.000000,2606.000000,"703006-signal-problem","Acknowledged","Signal Problem","08/30/2013 - 01:53am","2013-08-30T01:53:21-04:00",70083.000000,1.000000,0," "," "," "," "," "," "," "," "," "," "," "," "," "," ",0,0.000000," "," "," "," ",0.000000,0.000000,0,0," "," "," "," "
,"4176 Candler Lake West Ne Atlanta, GA 30319, USA","http://bit.ly/153dLDY","08/22/2013 - 02:37pm",702855.000000,702855.000000,33.916404,-84.328407,154140.000000,1.000000,3.000000,2605.000000,"702855-tree-issue","Acknowledged","Tree Issue","08/27/2013 - 08:53am","2013-08-27T08:53:51-04:00",105803.000000,0.000000,0," "," "," "," "," "," "," "," "," "," "," "," "," "," ",0,0.000000," "," "," "," ",0.000000,0.000000,0,0," "," "," "," "
,"550 And 560 Chinaberry Lane Havana/Gadsden, FL","http://bit.ly/1741E7C","08/21/2013 - 10:43am",700841.000000,700841.000000,30.659802,-84.383360,155814.000000,1.000000,1.000000,2572.000000,"700841-chinaberry-lane","Open","Chinaberry Lane","08/21/2013 - 10:43am","2013-08-21T10:43:21-04:00",0.000000,0.000000,0," "," "," "," "," "," "," "," "," "," "," "," "," "," ",0,0.000000," "," "," "," ",0.000000,0.000000,0,0," "," "," "," "
,"3571-3621 Ashford Dunwoody Road Northeast Atlanta, Georgia","http://bit.ly/1bNI7tl","08/19/2013 - 06:24pm",696074.000000,696074.000000,33.894283,-84.328331,158233.000000,1.000000,20.000000,2600.000000,"696074-left-turns-block-traffic-5-00-7-00-pm","Acknowledged","Left turns block traffic 5:00-7:00 pm","11/26/2013 - 04:59pm","2013-11-26T16:59:15-05:00",0.000000,14.000000,0," "," "," "," "," "," "," "," "," "," "," "," "," "," ",0,0.000000," "," "," "," ",0.000000,0.000000,0,0," "," "," "," "
,"3716-3766 Ashford Dunwoody Road Northeast Atlanta, GA 30319, USA","http://bit.ly/XqRN2Z","08/18/2013 - 08:42pm",694906.000000,694906.000000,33.900344,-84.331893,159535.000000,1.000000,6.000000,2600.000000,"694906-right-of-way-maintenance-issue","Acknowledged","Right-of-Way Maintenance Issue","11/18/2013 - 04:03pm","2013-11-18T16:03:56-05:00",117239.000000,3.000000,0," "," "," "," "," "," "," "," "," "," "," "," "," "," ",0,0.000000," "," "," "," ",0.000000,0.000000,0,0," "," "," "," "
,"3566-3582 Ashford Dunwoody Road Northeast Atlanta, GA 30319, USA","http://bit.ly/XqRMwf","08/18/2013 - 08:36pm",694904.000000,694904.000000,33.895196,-84.329085,159541.000000,1.000000,4.000000,2600.000000,"694904-right-of-way-maintenance-issue","Acknowledged","Right-of-Way Maintenance Issue","11/11/2013 - 10:13am","2013-11-11T10:13:08-05:00",117239.000000,2.000000,0," "," "," "," "," "," "," "," "," "," "," "," "," "," ",0,0.000000," "," "," "," ",0.000000,0.000000,0,0," "," "," "," "
,"2163 Johnson Ferry Road Northeast Atlanta, GA 30319, USA","http://bit.ly/16nBgES","08/18/2013 - 08:30pm",694898.000000,694898.000000,33.891941,-84.325637,159548.000000,1.000000,7.000000,2788.000000,"694898-right-of-way-maintenance-issue","Acknowledged","Right-of-Way Maintenance Issue","10/18/2013 - 12:08am","2013-10-18T00:08:22-04:00",117239.000000,3.000000,0," "," "," "," "," "," "," "," "," "," "," "," "," "," ",0,0.000000," "," "," "," ",0.000000,0.000000,0,0," "," "," "," "
,"2422 Lithonia Industrial Boulevard Lithonia, Georgia","http://bit.ly/16TvtWz","08/18/2013 - 01:07am",694012.000000,694012.000000,33.714187,-84.124484,160710.000000,1.000000,2.000000,0.000000,"694012-turning-light-needed","Open","Turning Light Needed","09/17/2013 - 07:49pm","2013-09-17T19:49:46-04:00",0.000000,0.000000,0," "," "," "," "," "," "," "," "," "," "," "," "," "," ",0,0.000000," "," "," "," ",0.000000,0.000000,0,0," "," "," "," "
,"6105 Rockbridge Road stone MTN/ Dekalb , GA","http://bit.ly/16X05bu","08/17/2013 - 08:41pm",693968.000000,693968.000000,33.788047,-84.146114,160976.000000,1.000000,2.000000,0.000000,"693968-thank-you","Open","Thank You!!!!!","08/18/2013 - 09:07pm","2013-08-18T21:07:52-04:00",0.000000,0.000000,0," "," "," "," "," "," "," "," "," "," "," "," "," "," ",0,0.000000," "," "," "," ",0.000000,0.000000,0,0," "," "," "," "
,"3625-3685 East Liddell Road Duluth, GA 30096, USA","http://bit.ly/1eSEkuj","08/17/2013 - 03:29pm",693858.000000,693858.000000,33.950946,-84.130531,161288.000000,1.000000,2.000000,0.000000,"693858-green-light-but-unable-to-go-at-all","Open","Green light but unable to go at all","08/30/2013 - 04:22am","2013-08-30T04:22:23-04:00",70083.000000,0.000000,0," "," "," "," "," "," "," "," "," "," "," "," "," "," ",0,0.000000," "," "," "," ",0.000000,0.000000,0,0," "," "," "," "
,"Interstate 75 Stockbridge, GA 30281, USA","http://www.seeclickfix.com/issues/692328-illegal-sign-in-right-of-way","08/16/2013 - 02:12pm",692328.000000,692328.000000,33.505744,-84.229438,162805.000000,1.000000,1.000000,0.000000,"692328-illegal-sign-in-right-of-way","Open","Illegal sign in right-of-way","08/30/2013 - 04:53am","2013-08-30T04:53:15-04:00",134328.000000,0.000000,0," "," "," "," "," "," "," "," "," "," "," "," "," "," ",0,0.000000," "," "," "," ",0.000000,0.000000,0,0," "," "," "," "
,"3879-3915 Ashford Dunwoody Road Brookhaven, Georgia","http://bit.ly/14CT1fj","08/15/2013 - 03:49pm",690601.000000,690601.000000,33.905098,-84.331819,164149.000000,1.000000,3.000000,2604.000000,"690601-hidden-park-sign","Acknowledged","Hidden Park Sign","08/30/2013 - 05:13am","2013-08-30T05:13:47-04:00",0.000000,1.000000,0," "," "," "," "," "," "," "," "," "," "," "," "," "," ",0,0.000000," "," "," "," ",0.000000,0.000000,0,0," "," "," "," "
,"1925 Marietta Highway Canton, Georgia","http://bit.ly/13BlVwW","08/15/2013 - 02:05am",688745.000000,688745.000000,34.221733,-84.506340,165212.000000,1.000000,1.000000,0.000000,"688745-huge-pothole","Open","huge pothole","08/15/2013 - 02:05am","2013-08-15T02:05:48Z",0.000000,0.000000,0," "," "," "," "," "," "," "," "," "," "," "," "," "," ",0,0.000000," "," "," "," ",0.000000,0.000000,0,0," "," "," "," "
,"5025 Winters Chapel Road Atlanta, GA 30360","http://bit.ly/16KNSVq","08/14/2013 - 01:44pm",687757.000000,687757.000000,33.941980,-84.270983,165953.000000,1.000000,1.000000,312.000000,"687757-raised-concrete-in-the-right-of-way","Acknowledged","Raised Concrete in the right-of-way","08/30/2013 - 10:07am","2013-08-30T10:07:25Z",0.000000,0.000000,0," "," "," "," "," "," "," "," "," "," "," "," "," "," ",0,0.000000," "," "," "," ",0.000000,0.000000,0,0," "," "," "," "
,"116 Neal Blvd stcokbridge/ henry, georgia","http://www.seeclickfix.com/issues/686584-water-leak","08/13/2013 - 10:55pm",686584.000000,686584.000000,33.546394,-84.220116,166842.000000,1.000000,1.000000,0.000000,"686584-water-leak","Open","water leak","08/13/2013 - 10:55pm","2013-08-13T22:55:58Z",0.000000,0.000000,0," "," "," "," "," "," "," "," "," "," "," "," "," "," ",0,0.000000," "," "," "," ",0.000000,0.000000,0,0," "," "," "," "
,"3820 Briarcliff Rd N Dekalb County, GA","http://bit.ly/1cuTZnD","08/12/2013 - 05:32pm",683949.000000,683949.000000,33.846551,-84.284958,168366.000000,1.000000,1.000000,0.000000,"683949-sidewalk-needs-major-repair","Open","sidewalk needs major repair","08/12/2013 - 05:32pm","2013-08-12T17:32:02-04:00",0.000000,0.000000,0," "," "," "," "," "," "," "," "," "," "," "," "," "," ",0,0.000000," "," "," "," ",0.000000,0.000000,0,0," "," "," "," "
,"2092 Heritage Dr Ne Dekalb County, GA","http://bit.ly/1cuTtGh","08/12/2013 - 05:29pm",683948.000000,683948.000000,33.844749,-84.288847,168368.000000,1.000000,1.000000,0.000000,"683948-pothole","Open","pothole","08/12/2013 - 05:29pm","2013-08-12T17:29:07-04:00",0.000000,0.000000,0," "," "," "," "," "," "," "," "," "," "," "," "," "," ",0,0.000000," "," "," "," ",0.000000,0.000000,0,0," "," "," "," "
,"2516 Flemington Rd Ne Dekalb County, GA","http://bit.ly/1cuSMN8","08/12/2013 - 05:25pm",683932.000000,683932.000000,33.846227,-84.288375,168372.000000,1.000000,1.000000,0.000000,"683932-pothole-needs-repair","Open","pothole needs repair","08/12/2013 - 05:25pm","2013-08-12T17:25:22-04:00",0.000000,0.000000,0," "," "," "," "," "," "," "," "," "," "," "," "," "," ",0,0.000000," "," "," "," ",0.000000,0.000000,0,0," "," "," "," "
,"2516 Woodwardia Rd Ne Dekalb County, GA","http://bit.ly/1cuSw0F","08/12/2013 - 05:23pm",683930.000000,683930.000000,33.847208,-84.288197,168374.000000,1.000000,1.000000,0.000000,"683930-pothole-needs-repair","Open","pothole needs repair","08/12/2013 - 05:23pm","2013-08-12T17:23:59-04:00",0.000000,0.000000,0," "," "," "," "," "," "," "," "," "," "," "," "," "," ",0,0.000000," "," "," "," ",0.000000,0.000000,0,0," "," "," "," "
,"3660 Ashford Dunwoody Road Brookhaven, GA","http://bit.ly/13uCURx","08/12/2013 - 08:05am",683031.000000,683031.000000,33.897630,-84.330456,168932.000000,1.000000,12.000000,2600.000000,"683031-overgrown-grass-and-weeds-along-blackburn-park","Acknowledged","overgrown grass and weeds along Blackburn Park","09/16/2013 - 12:15pm","2013-09-16T12:15:57-04:00",135739.000000,11.000000,0," "," "," "," "," "," "," "," "," "," "," "," "," "," ",0,0.000000," "," "," "," ",0.000000,0.000000,0,0," "," "," "," "
,"100-130 Bass Road Macon, Georgia","http://bit.ly/1cFPGFg","08/11/2013 - 07:55pm",682580.000000,682580.000000,32.879831,-83.745933,169662.000000,1.000000,4.000000,0.000000,"682580-illegal-signs","Open","Illegal Signs","10/05/2013 - 06:17pm","2013-10-05T18:17:27-04:00",47116.000000,2.000000,0," "," "," "," "," "," "," "," "," "," "," "," "," "," ",0,0.000000," "," "," "," ",0.000000,0.000000,0,0," "," "," "," "
,"6675 Peachtree Industrial Boulevard Doraville, Georgia","http://bit.ly/1cjovRu","08/09/2013 - 09:21am",679269.000000,679269.000000,33.927135,-84.272708,173176.000000,1.000000,1.000000,0.000000,"679269-storm-water-intake-and-gutter-debris","Open","Storm Water Intake and Gutter Debris","08/09/2013 - 09:21am","2013-08-09T09:21:12-04:00",140678.000000,0.000000,0," "," "," "," "," "," "," "," "," "," "," "," "," "," ",0,0.000000," "," "," "," ",0.000000,0.000000,0,0," "," "," "," "
,"6675 Peachtree Industrial Boulevard Doraville, Georgia","http://bit.ly/1cjoahz","08/09/2013 - 09:19am",679266.000000,679266.000000,33.927064,-84.272751,173179.000000,1.000000,1.000000,0.000000,"679266-gutter-and-storm-water-intake-debris","Open","Gutter and Storm Water Intake Debris","08/09/2013 - 09:19am","2013-08-09T09:19:06-04:00",140678.000000,0.000000,0," "," "," "," "," "," "," "," "," "," "," "," "," "," ",0,0.000000," "," "," "," ",0.000000,0.000000,0,0," "," "," "," "
,"949 Stoneybrook Ct Macon, GA","http://bit.ly/1cjm8hB","08/09/2013 - 09:09am",679164.000000,679164.000000,32.894174,-83.677058,173188.000000,1.000000,1.000000,0.000000,"679164-garbage-cart","Open","Garbage Cart","08/09/2013 - 09:09am","2013-08-09T09:09:07-04:00",0.000000,0.000000,0," "," "," "," "," "," "," "," "," "," "," "," "," "," ",0,0.000000," "," "," "," ",0.000000,0.000000,0,0," "," "," "," "
,"4100-4104 Ashford Dunwoody Road Northeast Atlanta, Georgia","http://bit.ly/14pcMee","08/08/2013 - 03:29pm",677606.000000,677606.000000,33.913422,-84.335703,174248.000000,1.000000,12.000000,2606.000000,"677606-heavy-traffic-backup","Acknowledged","Heavy Traffic Backup","09/07/2013 - 08:16am","2013-09-07T08:16:38-04:00",65566.000000,8.000000,0," "," "," "," "," "," "," "," "," "," "," "," "," "," ",0,0.000000," "," "," "," ",0.000000,0.000000,0,0," "," "," "," "
,"1430 Brawley Circle Atlanta/DeKalb, Georgia","http://bit.ly/14oZgHy","08/08/2013 - 02:28pm",677530.000000,677530.000000,33.919690,-84.305366,174309.000000,1.000000,1.000000,0.000000,"677530-intersection-cleanup","Open","intersection cleanup","08/08/2013 - 02:28pm","2013-08-08T14:28:21-04:00",0.000000,0.000000,0," "," "," "," "," "," "," "," "," "," "," "," "," "," ",0,0.000000," "," "," "," ",0.000000,0.000000,0,0," "," "," "," "
,"Forest Parkway Just North Of Hwy 85  Forest Park, Georgia","http://bit.ly/14oAyad","08/08/2013 - 12:37pm",677253.000000,677253.000000,33.615121,-84.403424,174420.000000,1.000000,2.000000,0.000000,"677253-several-large-potholes-left-hand-lane","Open","several large potholes left hand lane","10/08/2013 - 01:51pm","2013-10-08T13:51:35-04:00",0.000000,0.000000,0," "," "," "," "," "," "," "," "," "," "," "," "," "," ",0,0.000000," "," "," "," ",0.000000,0.000000,0,0," "," "," "," "
,"2644-2646 Wesley Chapel Road Decatur, Georgia","http://bit.ly/16z6MR1","08/07/2013 - 07:16am",674413.000000,674413.000000,33.710767,-84.217406,176181.000000,1.000000,1.000000,0.000000,"674413-lights-out-of-sync","Open","Lights out of sync","08/07/2013 - 07:16am","2013-08-07T07:16:37-04:00",0.000000,0.000000,0," "," "," "," "," "," "," "," "," "," "," "," "," "," ",0,0.000000," "," "," "," ",0.000000,0.000000,0,0," "," "," "," "
,"4163-4199 Ocmulgee East Boulevard Macon, GA 31217, USA","http://bit.ly/191v6uU","08/06/2013 - 04:47pm",673302.000000,673302.000000,32.813237,-83.568893,177050.000000,1.000000,2.000000,0.000000,"673302-other","Open","Other","08/09/2013 - 06:27am","2013-08-09T06:27:03-04:00",137535.000000,1.000000,0," "," "," "," "," "," "," "," "," "," "," "," "," "," ",0,0.000000," "," "," "," ",0.000000,0.000000,0,0," "," "," "," "
,"171 Waters Edge Drive  Lizella , GA","http://bit.ly/14wEIzO","08/06/2013 - 03:32pm",673201.000000,673201.000000,32.822474,-83.778426,177125.000000,1.000000,1.000000,0.000000,"673201-property-maintenance","Open","Property Maintenance","08/06/2013 - 03:32pm","2013-08-06T15:32:13-04:00",0.000000,0.000000,0," "," "," "," "," "," "," "," "," "," "," "," "," "," ",0,0.000000," "," "," "," ",0.000000,0.000000,0,0," "," "," "," "
,"1017 Ashley Hall Road Bibb County, GA","http://bit.ly/XbtsAb","08/06/2013 - 10:03am",672733.000000,672733.000000,32.866774,-83.738135,177454.000000,1.000000,1.000000,0.000000,"672733-debris-needs-picked-up-at-curb","Open","Debris needs picked up at curb","08/06/2013 - 10:03am","2013-08-06T10:03:19-04:00",0.000000,0.000000,0," "," "," "," "," "," "," "," "," "," "," "," "," "," ",0,0.000000," "," "," "," ",0.000000,0.000000,0,0," "," "," "," "
,"6429 Rockbridge Rd Stone MTN/ Dekalb , GA","http://bit.ly/1cEmT2h","08/05/2013 - 07:01pm",671070.000000,671070.000000,33.784230,-84.133763,178356.000000,1.000000,1.000000,0.000000,"671070-last-years-repair-ready-to-give-way","Open","last years repair ready to give way","08/05/2013 - 07:01pm","2013-08-05T19:01:20-04:00",0.000000,0.000000,0," "," "," "," "," "," "," "," "," "," "," "," "," "," ",0,0.000000," "," "," "," ",0.000000,0.000000,0,0," "," "," "," "
,"6105-Rockbridge Road Stone Mountain, Georgia","http://bit.ly/1cElYz0","08/05/2013 - 06:54pm",671063.000000,671063.000000,33.788984,-84.185563,178363.000000,1.000000,1.000000,0.000000,"671063-dangerous-shoulder-collapse-past-white-line","Open","Dangerous shoulder collapse past white line","08/30/2013 - 12:17pm","2013-08-30T12:17:24-04:00",0.000000,0.000000,0," "," "," "," "," "," "," "," "," "," "," "," "," "," ",0,0.000000," "," "," "," ",0.000000,0.000000,0,0," "," "," "," "
,"3863 Windsor Trail Gainesville, GA","http://bit.ly/1cElSY2","08/05/2013 - 06:53pm",671062.000000,671062.000000,34.321040,-83.957242,178364.000000,1.000000,1.000000,0.000000,"671062-street-light-not-working-at-night","Open","street light not working  at night","08/05/2013 - 06:53pm","2013-08-05T18:53:32-04:00",0.000000,0.000000,0," "," "," "," "," "," "," "," "," "," "," "," "," "," ",0,0.000000," "," "," "," ",0.000000,0.000000,0,0," "," "," "," "
,"1419 Chedworth Place Stone Mountain, GA","http://bit.ly/VzbTse","08/05/2013 - 10:35am",670374.000000,670374.000000,33.751347,-84.221635,178862.000000,1.000000,1.000000,0.000000,"670374-pot-hole-repair-second-request","Open","pot hole repair  second request","08/05/2013 - 10:35am","2013-08-05T10:35:18-04:00",0.000000,0.000000,0," "," "," "," "," "," "," "," "," "," "," "," "," "," ",0,0.000000," "," "," "," ",0.000000,0.000000,0,0," "," "," "," "
,"5170-5176 Mccarter Station Stone Mountain, GA 30088, USA","http://bit.ly/148mMID","08/03/2013 - 02:04pm",668462.000000,668462.000000,33.767251,-84.177889,181533.000000,1.000000,1.000000,0.000000,"668462-pothole","Open","pothole","08/30/2013 - 01:29pm","2013-08-30T13:29:22-04:00",108892.000000,0.000000,0," "," "," "," "," "," "," "," "," "," "," "," "," "," ",0,0.000000," "," "," "," ",0.000000,0.000000,0,0," "," "," "," "
,"4343 Ashwoody Trail Brookhaven, GA","http://bit.ly/12LXUIG","08/02/2013 - 01:20pm",666881.000000,666881.000000,33.918591,-84.334177,183017.000000,1.000000,2.000000,2601.000000,"666881-poor-drainage","Acknowledged","Poor Drainage","08/02/2013 - 05:06pm","2013-08-02T17:06:12-04:00",0.000000,0.000000,0," "," "," "," "," "," "," "," "," "," "," "," "," "," ",0,0.000000," "," "," "," ",0.000000,0.000000,0,0," "," "," "," "
,"2191 Dresden Drive Atlanta, Georgia","http://bit.ly/12LMHHR","08/02/2013 - 12:24pm",666755.000000,666755.000000,33.866136,-84.301359,183074.000000,1.000000,1.000000,0.000000,"666755-sidewalk-blocked","Open","Sidewalk blocked","08/02/2013 - 12:24pm","2013-08-02T12:24:04-04:00",0.000000,0.000000,0," "," "," "," "," "," "," "," "," "," "," "," "," "," ",0,0.000000," "," "," "," ",0.000000,0.000000,0,0," "," "," "," "
,"3360 Anvil Block Road Ellenwood, Georgia","http://bit.ly/1b03uXQ","08/01/2013 - 11:37pm",665791.000000,665791.000000,33.628484,-84.280586,183840.000000,1.000000,1.000000,0.000000,"665791-lots-of-potholes","Open","Lots of Potholes","08/01/2013 - 11:37pm","2013-08-01T23:37:25-04:00",0.000000,0.000000,0," "," "," "," "," "," "," "," "," "," "," "," "," "," ",0,0.000000," "," "," "," ",0.000000,0.000000,0,0," "," "," "," "
,"Klondike Rd Lithonia, DeKalb, GA","http://bit.ly/15yTgeU","08/01/2013 - 05:59pm",665524.000000,665524.000000,33.669733,-84.118188,184178.000000,1.000000,1.000000,0.000000,"665524-pot-holes","Open","Pot holes","08/01/2013 - 05:59pm","2013-08-01T17:59:20-04:00",0.000000,0.000000,0," "," "," "," "," "," "," "," "," "," "," "," "," "," ",0,0.000000," "," "," "," ",0.000000,0.000000,0,0," "," "," "," "
,"2855 Shallowford Rd Ne Atlanta, GA","http://bit.ly/1csyAcq","08/01/2013 - 12:11pm",664993.000000,664993.000000,33.871105,-84.290390,184526.000000,1.000000,1.000000,0.000000,"664993-code-violation-cars-parked-on-yard","Open","code violation: cars parked on yard","08/27/2013 - 08:13am","2013-08-27T08:13:01-04:00",135739.000000,0.000000,0," "," "," "," "," "," "," "," "," "," "," "," "," "," ",0,0.000000," "," "," "," ",0.000000,0.000000,0,0," "," "," "," "
,"2120 Dresden Dr Ne Atlanta, GA","http://bit.ly/1cswaKM","08/01/2013 - 11:59am",664980.000000,664980.000000,33.866478,-84.303630,184538.000000,1.000000,1.000000,0.000000,"664980-road-shoulder-and-drainage","Open","road shoulder and drainage","08/27/2013 - 08:13am","2013-08-27T08:13:16-04:00",135739.000000,0.000000,0," "," "," "," "," "," "," "," "," "," "," "," "," "," ",0,0.000000," "," "," "," ",0.000000,0.000000,0,0," "," "," "," "
,"5116 Pine Ridge Drive Macon/Bibb, Georgia","http://bit.ly/18Pe5UO","08/01/2013 - 11:01am",664872.000000,664872.000000,32.892575,-83.725032,184596.000000,1.000000,4.000000,1897.000000,"664872-creek-obstruction","Acknowledged","Creek Obstruction","08/30/2013 - 03:03pm","2013-08-30T15:03:46-04:00",0.000000,2.000000,0," "," "," "," "," "," "," "," "," "," "," "," "," "," ",0,0.000000," "," "," "," ",0.000000,0.000000,0,0," "," "," "," "
,"1915-1973 S Johnson Ferry Road Northeast Atlanta, GA 30319, USA","http://bit.ly/18P9YrN","08/01/2013 - 10:28am",664681.000000,664681.000000,33.893238,-84.333496,184629.000000,1.000000,3.000000,2790.000000,"664681-sidewalk-problem","Acknowledged","Sidewalk Problem","10/30/2013 - 12:20pm","2013-10-30T12:20:55-04:00",0.000000,1.000000,0," "," "," "," "," "," "," "," "," "," "," "," "," "," ",0,0.000000," "," "," "," ",0.000000,0.000000,0,0," "," "," "," "
,"422-432 North Stone Mountain Lithonia Road Stone Mountain, Georgia","http://bit.ly/13puNJB","08/01/2013 - 09:10am",664594.000000,664594.000000,33.790411,-84.164771,184707.000000,1.000000,2.000000,0.000000,"664594-huge-pot-hold","Open","Huge Pot Hold","08/01/2013 - 09:12am","2013-08-01T09:12:52-04:00",0.000000,0.000000,0," "," "," "," "," "," "," "," "," "," "," "," "," "," ",0,0.000000," "," "," "," ",0.000000,0.000000,0,0," "," "," "," "
,"Columns Drive east cobb county, ga","http://www.seeclickfix.com/issues/662184-a-lot-of-potholes-in-the-1st-1-2-mile-of-the-road","07/31/2013 - 01:01pm",662184.000000,662184.000000,33.931751,-84.421166,186156.000000,1.000000,2.000000,0.000000,"662184-a-lot-of-potholes-in-the-1st-1-2-mile-of-the-road","Open","A lot of potholes in the 1st 1/2 mile of the road.","09/03/2013 - 01:57pm","2013-09-03T13:57:59Z",0.000000,0.000000,0," "," "," "," "," "," "," "," "," "," "," "," "," "," ",0,0.000000," "," "," "," ",0.000000,0.000000,0,0," "," "," "," "
,"2583 Dresden Drive chamblee/dekalb, GA","http://bit.ly/19vsl85","07/30/2013 - 07:43pm",660511.000000,660511.000000,33.869574,-84.286955,187195.000000,1.000000,2.000000,0.000000,"660511-dangerous-pothole-creating-hazard-for-traffic","Open","dangerous pothole creating hazard for traffic","08/04/2013 - 11:36pm","2013-08-04T23:36:00Z",0.000000,4.000000,0," "," "," "," "," "," "," "," "," "," "," "," "," "," ",0,0.000000," "," "," "," ",0.000000,0.000000,0,0," "," "," "," "
,"Bourne Avenue Port Wentworth, GA 31407, USA","http://bit.ly/15Z9bSO","07/29/2013 - 08:27am",656890.000000,656890.000000,32.126738,-81.170161,189070.000000,1.000000,1.000000,0.000000,"656890-traffic-light-timer","Open","traffic light timer","07/29/2013 - 08:27am","2013-07-29T08:27:46-04:00",0.000000,0.000000,0," "," "," "," "," "," "," "," "," "," "," "," "," "," ",0,0.000000," "," "," "," ",0.000000,0.000000,0,0," "," "," "," "
,"1165 Vineyard Ct  Stone Mountain, GA 30083","http://bit.ly/13RQEcd","07/28/2013 - 06:57pm",656527.000000,656527.000000,33.813238,-84.203607,189880.000000,1.000000,1.000000,0.000000,"656527-pot-hole","Open","pot hole","07/28/2013 - 06:57pm","2013-07-28T18:57:50-04:00",0.000000,0.000000,0," "," "," "," "," "," "," "," "," "," "," "," "," "," ",0,0.000000," "," "," "," ",0.000000,0.000000,0,0," "," "," "," "
,"3961 Easy St Macon, GA","http://bit.ly/1bVp42z","07/26/2013 - 11:38am",653305.000000,653305.000000,32.836310,-83.710908,193199.000000,1.000000,1.000000,0.000000,"653305-pothole","Open","Pothole","07/26/2013 - 11:38am","2013-07-26T11:38:56-04:00",0.000000,0.000000,0," "," "," "," "," "," "," "," "," "," "," "," "," "," ",0,0.000000," "," "," "," ",0.000000,0.000000,0,0," "," "," "," "
,"598 Jefferson Circle Se Walthourville, GA","http://bit.ly/12O7h59","07/25/2013 - 12:55pm",651411.000000,651411.000000,31.757072,-81.630153,194562.000000,1.000000,2.000000,0.000000,"651411-pot-hole","Open","Pot hole","07/28/2013 - 12:44pm","2013-07-28T12:44:06-04:00",0.000000,1.000000,0," "," "," "," "," "," "," "," "," "," "," "," "," "," ",0,0.000000," "," "," "," ",0.000000,0.000000,0,0," "," "," "," "
,"Stone Mtn. Lithonia Rd Dekalb, GA","http://bit.ly/170EnzS","07/24/2013 - 08:27pm",649668.000000,649668.000000,33.792608,-84.165873,195550.000000,1.000000,2.000000,0.000000,"649668-sunken-section-of-road","Open","Sunken section of road","07/25/2013 - 03:13pm","2013-07-25T15:13:07-04:00",0.000000,1.000000,0," "," "," "," "," "," "," "," "," "," "," "," "," "," ",0,0.000000," "," "," "," ",0.000000,0.000000,0,0," "," "," "," "
,"2772rangewood Drive Atlanta, GA","http://bit.ly/VqEcco","07/24/2013 - 05:59pm",649568.000000,649568.000000,33.865903,-84.263769,195698.000000,1.000000,1.000000,0.000000,"649568-off-the-radar","Open","Off the radar","08/30/2013 - 07:51pm","2013-08-30T19:51:36-04:00",0.000000,0.000000,0," "," "," "," "," "," "," "," "," "," "," "," "," "," ",0,0.000000," "," "," "," ",0.000000,0.000000,0,0," "," "," "," "
,"2490 Circlewood Rd Dekalb, Georgia","http://bit.ly/13bl1py","07/24/2013 - 04:48pm",649509.000000,649509.000000,33.852677,-84.286914,195769.000000,1.000000,1.000000,0.000000,"649509-sink-hole","Open","Sink Hole","07/24/2013 - 04:48pm","2013-07-24T16:48:16-04:00",0.000000,0.000000,0," "," "," "," "," "," "," "," "," "," "," "," "," "," ",0,0.000000," "," "," "," ",0.000000,0.000000,0,0," "," "," "," "
,"2827 Flowers Road South Atlanta, GA 30341, USA","http://bit.ly/19hJu54","07/24/2013 - 08:25am",648596.000000,648596.000000,33.874316,-84.270296,196272.000000,1.000000,4.000000,0.000000,"648596-hole-in-pavement","Open","hole in pavement","07/24/2013 - 12:45pm","2013-07-24T12:45:19-04:00",135739.000000,3.000000,0," "," "," "," "," "," "," "," "," "," "," "," "," "," ",0,0.000000," "," "," "," ",0.000000,0.000000,0,0," "," "," "," "
,"Sams Crossing & East College Ave Decatur, Ga","http://bit.ly/18BdPMk","07/23/2013 - 05:17pm",646418.000000,646418.000000,33.774784,-84.279540,197180.000000,1.000000,2.000000,0.000000,"646418-needs-to-be-smoothed-to-rough","Open","Needs to be smoothed.  To rough","07/24/2013 - 01:02am","2013-07-24T01:02:22-04:00",0.000000,1.000000,0," "," "," "," "," "," "," "," "," "," "," "," "," "," ",0,0.000000," "," "," "," ",0.000000,0.000000,0,0," "," "," "," "
,"155 Little Shoals Drive Canton, GA","http://bit.ly/1dT22pN","07/23/2013 - 03:43pm",646325.000000,646325.000000,34.218711,-84.375290,197274.000000,1.000000,1.000000,0.000000,"646325-street-light-out","Open","Street Light Out","07/23/2013 - 03:43pm","2013-07-23T15:43:45-04:00",0.000000,0.000000,0," "," "," "," "," "," "," "," "," "," "," "," "," "," ",0,0.000000," "," "," "," ",0.000000,0.000000,0,0," "," "," "," "
,"2583 Dresden Drive chamblee, GA","http://bit.ly/13XrQuQ","07/23/2013 - 08:54am",645754.000000,645754.000000,33.869574,-84.286955,197683.000000,1.000000,1.000000,0.000000,"645754-growing-sink-hole","Open","Growing Sink Hole","07/23/2013 - 08:54am","2013-07-23T08:54:18-04:00",0.000000,0.000000,0," "," "," "," "," "," "," "," "," "," "," "," "," "," ",0,0.000000," "," "," "," ",0.000000,0.000000,0,0," "," "," "," "
,"3611 Chamblee Tucker Rd Chamblee, GA","http://bit.ly/13XmyzN","07/23/2013 - 08:33am",645728.000000,645728.000000,33.883694,-84.246165,197704.000000,1.000000,6.000000,0.000000,"645728-pothole-in-road","Open","pothole in road","11/22/2013 - 10:03am","2013-11-22T10:03:03-05:00",135739.000000,4.000000,0," "," "," "," "," "," "," "," "," "," "," "," "," "," ",0,0.000000," "," "," "," ",0.000000,0.000000,0,0," "," "," "," "
,"2583 Dresden Drive Atlanta, Georgia","http://bit.ly/1b9Cicw","07/22/2013 - 06:00pm",645376.000000,645376.000000,33.869863,-84.286955,198577.000000,1.000000,2.000000,0.000000,"645376-sink-hole","Open","sink hole","11/20/2013 - 12:01pm","2013-11-20T12:01:30-05:00",135517.000000,0.000000,0," "," "," "," "," "," "," "," "," "," "," "," "," "," ",0,0.000000," "," "," "," ",0.000000,0.000000,0,0," "," "," "," "
,"169 Gateway Drive Macon, GA 31210, USA","http://bit.ly/11892fG","07/21/2013 - 05:42pm",643925.000000,643925.000000,32.927570,-83.712832,200036.000000,1.000000,2.000000,0.000000,"643925-other","Open","Other","12/05/2013 - 08:51pm","2013-12-05T20:51:37-05:00",0.000000,1.000000,0," "," "," "," "," "," "," "," "," "," "," "," "," "," ",0,0.000000," "," "," "," ",0.000000,0.000000,0,0," "," "," "," "
,"889 June Dr Sw Conyers, GA","http://bit.ly/12PLM7x","07/19/2013 - 08:13pm",641345.000000,641345.000000,33.666796,-84.061123,203004.000000,1.000000,2.000000,0.000000,"641345-road-needs-resurfaced","Open","ROAD NEEDS  RESURFACED","07/20/2013 - 01:30am","2013-07-20T01:30:48Z",0.000000,1.000000,0," "," "," "," "," "," "," "," "," "," "," "," "," "," ",0,0.000000," "," "," "," ",0.000000,0.000000,0,0," "," "," "," "
,"2750 Walden Road Macon, Georgia","http://bit.ly/15raKIS","07/19/2013 - 02:38am",639451.000000,639451.000000,32.707085,-83.665381,204059.000000,1.000000,1.000000,0.000000,"639451-need-a-rolling-trash-bin","Open","Need a rolling trash bin.","07/19/2013 - 02:38am","2013-07-19T02:38:30Z",0.000000,0.000000,0," "," "," "," "," "," "," "," "," "," "," "," "," "," ",0,0.000000," "," "," "," ",0.000000,0.000000,0,0," "," "," "," "
,"Interstate 75 Macon, Georgia","http://bit.ly/1dHD9NH","07/18/2013 - 06:44pm",639030.000000,639030.000000,32.754635,-83.711726,204534.000000,1.000000,2.000000,0.000000,"639030-pole-lighting","Open","Pole Lighting","10/24/2013 - 12:08pm","2013-10-24T12:08:06Z",134843.000000,0.000000,0," "," "," "," "," "," "," "," "," "," "," "," "," "," ",0,0.000000," "," "," "," ",0.000000,0.000000,0,0," "," "," "," "
,"8 Mcpherson Hollow Rd Talking Rock, Pickens, GA","http://bit.ly/1bKS5wr","07/18/2013 - 10:25am",637747.000000,637747.000000,34.520765,-84.446083,205032.000000,1.000000,1.000000,0.000000,"637747-road-impassable","Open","road impassable","07/18/2013 - 10:25am","2013-07-18T10:25:25Z",0.000000,0.000000,0," "," "," "," "," "," "," "," "," "," "," "," "," "," ",0,0.000000," "," "," "," ",0.000000,0.000000,0,0," "," "," "," "
,"3692 Ashford Dunwoody Road Dunwoody, Georgia","http://bit.ly/11UeG7X","07/16/2013 - 02:29pm",634623.000000,634623.000000,33.899092,-84.331618,207429.000000,1.000000,6.000000,2607.000000,"634623-broken-pavement-s-bound-for-several-blocks","Acknowledged","Broken pavement, S bound for several blocks.","08/13/2013 - 08:51am","2013-08-13T08:51:02-04:00",0.000000,1.000000,0," "," "," "," "," "," "," "," "," "," "," "," "," "," ",0,0.000000," "," "," "," ",0.000000,0.000000,0,0," "," "," "," "
,"3133-3181 Ashford Dunwoody Road Northeast Atlanta, Georgia","http://bit.ly/11Ue6Hj","07/16/2013 - 02:24pm",634615.000000,634615.000000,33.881821,-84.326726,207433.000000,1.000000,5.000000,2607.000000,"634615-medium-pothole","Acknowledged","Medium pothole","09/15/2013 - 06:09pm","2013-09-15T18:09:20-04:00",0.000000,2.000000,0," "," "," "," "," "," "," "," "," "," "," "," "," "," ",0,0.000000," "," "," "," ",0.000000,0.000000,0,0," "," "," "," "
,"3133-3181 Ashford Dunwoody Road Northeast Atlanta, Georgia","http://bit.ly/11UdYaP","07/16/2013 - 02:23pm",634613.000000,634613.000000,33.881208,-84.326726,207435.000000,1.000000,5.000000,2607.000000,"634613-giant-pothole","Acknowledged","Giant pothole","09/15/2013 - 06:09pm","2013-09-15T18:09:51-04:00",0.000000,3.000000,0," "," "," "," "," "," "," "," "," "," "," "," "," "," ",0,0.000000," "," "," "," ",0.000000,0.000000,0,0," "," "," "," "
,"Centre Street Fernandina Beach, Florida","http://bit.ly/14UldgQ","07/15/2013 - 02:44pm",631842.000000,631842.000000,30.671116,-81.462098,208853.000000,1.000000,1.000000,0.000000,"631842-mail-delivery-ends","Open","Mail Delivery Ends???","07/15/2013 - 02:44pm","2013-07-15T14:44:29-04:00",0.000000,0.000000,0," "," "," "," "," "," "," "," "," "," "," "," "," "," ",0,0.000000," "," "," "," ",0.000000,0.000000,0,0," "," "," "," "
,"Lawson Drive Canton, Georgia","http://bit.ly/XN8Vk7","07/11/2013 - 06:40am",624301.000000,624301.000000,34.214170,-84.468941,215097.000000,1.000000,1.000000,0.000000,"624301-lawson-drive-needs-repaving-and-brush-clean-up-on-sides","Open","Lawson Drive needs repaving and brush clean up on sides","07/11/2013 - 06:40am","2013-07-11T06:40:36-04:00",0.000000,0.000000,0," "," "," "," "," "," "," "," "," "," "," "," "," "," ",0,0.000000," "," "," "," ",0.000000,0.000000,0,0," "," "," "," "
,"Dellwood Drive Macon, Georgia","http://bit.ly/15wSgIM","07/10/2013 - 04:12pm",623143.000000,623143.000000,32.832184,-83.712700,215965.000000,1.000000,2.000000,0.000000,"623143-overgrown-lot","Open","Overgrown lot","10/09/2013 - 07:46am","2013-10-09T07:46:52-04:00",48116.000000,0.000000,0," "," "," "," "," "," "," "," "," "," "," "," "," "," ",0,0.000000," "," "," "," ",0.000000,0.000000,0,0," "," "," "," "
,"952 Piedmont Road Marietta, Georgia","http://bit.ly/111Ur6z","07/09/2013 - 09:45am",620002.000000,620002.000000,34.020600,-84.522000,217792.000000,1.000000,1.000000,0.000000,"620002-rough-railroad-crossing-off-of-piedmont-rd","Open","Rough Railroad Crossing off of Piedmont Rd","07/09/2013 - 09:45am","2013-07-09T09:45:36-04:00",0.000000,0.000000,0," "," "," "," "," "," "," "," "," "," "," "," "," "," ",0,0.000000," "," "," "," ",0.000000,0.000000,0,0," "," "," "," "
,"4519 Bouldercrest Road Ellenwood, Georgia","http://bit.ly/1aTSi1q","07/08/2013 - 07:18pm",618720.000000,618720.000000,33.630617,-84.282812,218660.000000,1.000000,1.000000,0.000000,"618720-numerous-potholes","Open","Numerous Potholes","07/08/2013 - 07:18pm","2013-07-08T19:18:07-04:00",0.000000,0.000000,0," "," "," "," "," "," "," "," "," "," "," "," "," "," ",0,0.000000," "," "," "," ",0.000000,0.000000,0,0," "," "," "," "
,"6351 Cumming Highway Canton, GA 30115, USA","http://bit.ly/1a5Tv2G","07/08/2013 - 10:15am",617866.000000,617866.000000,34.242551,-84.383980,219202.000000,1.000000,2.000000,0.000000,"617866-road-issues-bumpy-roads","Open","Road Issues bumpy roads","10/13/2013 - 09:38am","2013-10-13T09:38:49-04:00",132690.000000,0.000000,0," "," "," "," "," "," "," "," "," "," "," "," "," "," ",0,0.000000," "," "," "," ",0.000000,0.000000,0,0," "," "," "," "
,"Cherry Street","http://bit.ly/1a5QKyv","07/08/2013 - 09:55am",617815.000000,617815.000000,31.678523,-82.083923,219223.000000,1.000000,2.000000,0.000000,"617815-broken-glass","Closed","Broken glass","12/06/2013 - 05:16pm","2013-12-06T17:16:33-05:00",45023.000000,0.000000,0," "," "," "," "," "," "," "," "," "," "," "," "," "," ",0,0.000000," "," "," "," ",0.000000,0.000000,0,0," "," "," "," "
,"Baxter Avenue Off Riverside Drive Macon, Georgia","http://bit.ly/1d6Cx3K","07/07/2013 - 01:17pm",617179.000000,617179.000000,32.890777,-83.677090,220461.000000,1.000000,2.000000,0.000000,"617179-trash-all-over-the-streets-all-the-way-to-riverside-drive","Open","Trash All Over the Streets all the way to Riverside Drive","11/05/2013 - 07:54pm","2013-11-05T19:54:57-05:00",0.000000,1.000000,0," "," "," "," "," "," "," "," "," "," "," "," "," "," ",0,0.000000," "," "," "," ",0.000000,0.000000,0,0," "," "," "," "
,"Forest Avenue Of Riverside Drive Macon, Georgia","http://bit.ly/1d6BsJr","07/07/2013 - 01:12pm",617176.000000,617176.000000,32.890777,-83.677090,220465.000000,1.000000,2.000000,0.000000,"617176-overgrown-tree-limbs-trashin-the-streets-and-overgrown-grass-on-the-sibewalks","Open","Overgrown tree limbs , trashin the streets and overgrown grass on the sibewalks","11/05/2013 - 07:53pm","2013-11-05T19:53:11-05:00",0.000000,2.000000,0," "," "," "," "," "," "," "," "," "," "," "," "," "," ",0,0.000000," "," "," "," ",0.000000,0.000000,0,0," "," "," "," "
,"3154 Briarcliff Way ATLANTA, Georgia","http://bit.ly/WXVrTz","07/05/2013 - 06:56pm",615435.000000,615435.000000,33.855100,-84.259457,223242.000000,1.000000,2.000000,0.000000,"615435-sidewalk-hazard","Open","Sidewalk hazard","08/07/2013 - 07:23pm","2013-08-07T19:23:24Z",0.000000,0.000000,0," "," "," "," "," "," "," "," "," "," "," "," "," "," ",0,0.000000," "," "," "," ",0.000000,0.000000,0,0," "," "," "," "
,"1083 Byrnwyck Rd. Atlanta, Georgia 30319","http://bit.ly/WXV6jv","07/05/2013 - 05:43pm",615345.000000,615345.000000,33.908137,-84.346260,223314.000000,1.000000,2.000000,2607.000000,"615345-pot-hole","Acknowledged","pot hole","07/09/2013 - 04:23pm","2013-07-09T16:23:54Z",0.000000,0.000000,0," "," "," "," "," "," "," "," "," "," "," "," "," "," ",0,0.000000," "," "," "," ",0.000000,0.000000,0,0," "," "," "," "
,"952 Piedmont Road Marietta, Georgia","http://bit.ly/VgBrdD","07/05/2013 - 02:24pm",615020.000000,615020.000000,34.020590,-84.522017,223513.000000,1.000000,2.000000,0.000000,"615020-really-bad-railroad-crossing-at-piedmont-rd","Open","Really Bad Railroad Crossing at Piedmont Rd","09/04/2013 - 10:04am","2013-09-04T10:04:06Z",0.000000,0.000000,0," "," "," "," "," "," "," "," "," "," "," "," "," "," ",0,0.000000," "," "," "," ",0.000000,0.000000,0,0," "," "," "," "
,"1310 Observatory Avenue North Augusta, South Carolina","http://bit.ly/12mWG0o","07/03/2013 - 08:46pm",613237.000000,613237.000000,33.505764,-81.966190,225771.000000,1.000000,3.000000,0.000000,"613237-dangerous-tree-about-to-fall-onto-clay-avenue-and-impede-fire-hydrant-access","Open","Dangerous tree about to fall onto Clay Avenue and impede fire-hydrant access.","12/02/2013 - 04:00pm","2013-12-02T16:00:49-05:00",0.000000,1.000000,0," "," "," "," "," "," "," "," "," "," "," "," "," "," ",0,0.000000," "," "," "," ",0.000000,0.000000,0,0," "," "," "," "
,"1006-1014 Big Shanty Road Northwest Kennesaw, Georgia","http://bit.ly/12mTrWZ","07/03/2013 - 08:10pm",613226.000000,613226.000000,34.029640,-84.585189,225807.000000,1.000000,2.000000,0.000000,"613226-pothole-road-issues","Open","Pothole/Road Issues","07/03/2013 - 08:11pm","2013-07-03T20:11:09-04:00",0.000000,1.000000,0," "," "," "," "," "," "," "," "," "," "," "," "," "," ",0,0.000000," "," "," "," ",0.000000,0.000000,0,0," "," "," "," "
,"3171-3371 Campus Loop Road Kennesaw, Georgia","http://bit.ly/12mSDkZ","07/03/2013 - 08:01pm",613222.000000,613222.000000,34.033728,-84.585718,225816.000000,1.000000,1.000000,0.000000,"613222-potholes","Open","POTHOLES","07/03/2013 - 08:01pm","2013-07-03T20:01:36-04:00",0.000000,0.000000,0," "," "," "," "," "," "," "," "," "," "," "," "," "," ",0,0.000000," "," "," "," ",0.000000,0.000000,0,0," "," "," "," "
,"3864-3882 Moore Road Ellenwood, Georgia","http://bit.ly/14Nw6jh","07/03/2013 - 10:04am",612507.000000,612507.000000,33.667703,-84.312485,226413.000000,1.000000,1.000000,0.000000,"612507-pot-hole-at-near-entrance-to-boulder-forest-subdivision-off-moore-rd","Open","Pot hole at/near entrance to Boulder Forest subdivision off Moore Rd.","07/03/2013 - 10:04am","2013-07-03T10:04:39-04:00",0.000000,0.000000,0," "," "," "," "," "," "," "," "," "," "," "," "," "," ",0,0.000000," "," "," "," ",0.000000,0.000000,0,0," "," "," "," "
,"3800-3898 Fox Creek Court Marietta, Georgia","http://bit.ly/11UJX8J","07/01/2013 - 01:32pm",608174.000000,608174.000000,34.056924,-84.438199,229085.000000,1.000000,1.000000,0.000000,"608174-missing-stop-sign-and-street-sign","Open","missing stop sign and street sign","07/01/2013 - 01:32pm","2013-07-01T13:32:45-04:00",0.000000,0.000000,0," "," "," "," "," "," "," "," "," "," "," "," "," "," ",0,0.000000," "," "," "," ",0.000000,0.000000,0,0," "," "," "," "
,"4206 Cedar Lake Dr conley / dekalb, Georgia","http://bit.ly/WX6t9Y","06/30/2013 - 11:27am",606633.000000,606633.000000,33.656013,-84.311104,230650.000000,1.000000,1.000000,0.000000,"606633-city-drainage-behind-property-located-at-4206-cedar-lake-dr-conley-ga-30288","Open","city drainage behind property located at 4206 cedar lake dr. conley ga 30288","06/30/2013 - 11:27am","2013-06-30T11:27:20-04:00",0.000000,0.000000,0," "," "," "," "," "," "," "," "," "," "," "," "," "," ",0,0.000000," "," "," "," ",0.000000,0.000000,0,0," "," "," "," "
,"1803 Bouldercrest Rd Se Atlanta/Dekalb, Georgia","http://bit.ly/10OTm1L","06/28/2013 - 09:00pm",604026.000000,604026.000000,33.688828,-84.315101,232957.000000,1.000000,1.000000,0.000000,"604026-grass-at-mcnair-high-school","Open","Grass at McNair High School","06/28/2013 - 09:00pm","2013-06-28T21:00:58-04:00",0.000000,0.000000,0," "," "," "," "," "," "," "," "," "," "," "," "," "," ",0,0.000000," "," "," "," ",0.000000,0.000000,0,0," "," "," "," "
,"3100 Sweetwater Road Lawrenceville, Georgia","http://bit.ly/13mrmmU","06/28/2013 - 04:48pm",603883.000000,603883.000000,33.950513,-84.107580,233209.000000,1.000000,1.000000,0.000000,"603883-road-closed","Open","Road Closed","06/28/2013 - 04:48pm","2013-06-28T16:48:53-04:00",0.000000,0.000000,0," "," "," "," "," "," "," "," "," "," "," "," "," "," ",0,0.000000," "," "," "," ",0.000000,0.000000,0,0," "," "," "," "
,"2280-2300 Abby Lane Northeast Atlanta, GA 30345, USA","http://bit.ly/17FGlvY","06/27/2013 - 03:31pm",601241.000000,601241.000000,33.850116,-84.299044,234726.000000,1.000000,2.000000,0.000000,"601241-drain-cover-hazard","Open","Drain cover hazard","10/26/2013 - 01:15pm","2013-10-26T13:15:23-04:00",2168.000000,0.000000,0," "," "," "," "," "," "," "," "," "," "," "," "," "," ",0,0.000000," "," "," "," ",0.000000,0.000000,0,0," "," "," "," "
,"Brooks Rd Macon, Georgia","http://bit.ly/11Qjupx","06/27/2013 - 02:14pm",601148.000000,601148.000000,32.352120,-84.218424,234804.000000,1.000000,1.000000,0.000000,"601148-tree-bent-leaning","Open","Tree- Bent- Leaning","06/27/2013 - 02:14pm","2013-06-27T14:14:18-04:00",0.000000,0.000000,0," "," "," "," "," "," "," "," "," "," "," "," "," "," ",0,0.000000," "," "," "," ",0.000000,0.000000,0,0," "," "," "," "
,"Shadowwood Ct Macon, Georgia","http://bit.ly/1394d9E","06/26/2013 - 06:00pm",598866.000000,598866.000000,32.829980,-83.750959,236017.000000,1.000000,3.000000,0.000000,"598866-tree-growing-in-light-pole","Open","Tree Growing in Light Pole","09/25/2013 - 09:29pm","2013-09-25T21:29:24-04:00",0.000000,0.000000,0," "," "," "," "," "," "," "," "," "," "," "," "," "," ",0,0.000000," "," "," "," ",0.000000,0.000000,0,0," "," "," "," "
,"Pine Valley And White Oak Macon, Georgia","http://bit.ly/19uGMK6","06/26/2013 - 02:22pm",598565.000000,598565.000000,32.833659,-83.713423,236235.000000,1.000000,2.000000,0.000000,"598565-overgrowth","Open","Overgrowth","10/25/2013 - 11:46am","2013-10-25T11:46:43-04:00",48116.000000,0.000000,0," "," "," "," "," "," "," "," "," "," "," "," "," "," ",0,0.000000," "," "," "," ",0.000000,0.000000,0,0," "," "," "," "
,"4079-4099 Elnora Drive Macon, Georgia","http://bit.ly/1ckOa6M","06/25/2013 - 11:26pm",596488.000000,596488.000000,32.897828,-83.693176,237132.000000,1.000000,2.000000,0.000000,"596488-asphalt","Open","asphalt","08/03/2013 - 11:45am","2013-08-03T11:45:46-04:00",0.000000,1.000000,0," "," "," "," "," "," "," "," "," "," "," "," "," "," ",0,0.000000," "," "," "," ",0.000000,0.000000,0,0," "," "," "," "
,"6170 Mcdonough Dr Norcross, Georgia","http://bit.ly/147SSDi","06/25/2013 - 02:52pm",595891.000000,595891.000000,33.909334,-84.207981,237646.000000,1.000000,7.000000,0.000000,"595891-major-pothole","Open","Major Pothole","06/25/2013 - 07:37pm","2013-06-25T19:37:30-04:00",0.000000,7.000000,0," "," "," "," "," "," "," "," "," "," "," "," "," "," ",0,0.000000," "," "," "," ",0.000000,0.000000,0,0," "," "," "," "
,"10 Inverness Avenue Newnan, Georgia","http://bit.ly/19vGfEe","06/24/2013 - 11:48am",592929.000000,592929.000000,33.390916,-84.723196,239269.000000,1.000000,1.000000,0.000000,"592929-car-constantly-parked-in-curve","Open","car constantly parked in curve","06/24/2013 - 11:48am","2013-06-24T11:48:40-04:00",0.000000,0.000000,0," "," "," "," "," "," "," "," "," "," "," "," "," "," ",0,0.000000," "," "," "," ",0.000000,0.000000,0,0," "," "," "," "
,"10 Inverness Avenue Newnan, Georgia","http://bit.ly/14SUHFo","06/24/2013 - 09:07am",592599.000000,592599.000000,33.390916,-84.723196,239431.000000,1.000000,1.000000,0.000000,"592599-car-constantly-parked-in-curve","Open","car constantly parked in curve","06/24/2013 - 09:07am","2013-06-24T09:07:01-04:00",0.000000,0.000000,0," "," "," "," "," "," "," "," "," "," "," "," "," "," ",0,0.000000," "," "," "," ",0.000000,0.000000,0,0," "," "," "," "
,"2750 Walden Road Macon, Georgia","http://bit.ly/SwM4vV","06/23/2013 - 11:12pm",592145.000000,592145.000000,32.707085,-83.665381,240026.000000,1.000000,1.000000,0.000000,"592145-missing-trash-bin","Open","Missing Trash Bin","06/23/2013 - 11:12pm","2013-06-23T23:12:08-04:00",0.000000,0.000000,0," "," "," "," "," "," "," "," "," "," "," "," "," "," ",0,0.000000," "," "," "," ",0.000000,0.000000,0,0," "," "," "," "
,"3493 Ashford Dunwoody Road Northeast Brookhaven, GA 30319, USA","http://bit.ly/1aDAA0v","06/22/2013 - 07:35pm",591195.000000,591195.000000,33.890537,-84.325080,241682.000000,1.000000,13.000000,2604.000000,"591195-sign-problem","Acknowledged","Sign Problem","09/01/2013 - 09:07am","2013-09-01T09:07:03-04:00",107219.000000,12.000000,0," "," "," "," "," "," "," "," "," "," "," "," "," "," ",0,0.000000," "," "," "," ",0.000000,0.000000,0,0," "," "," "," "
,"Clairmont Ave Macon, Georgia","http://bit.ly/1262miw","06/21/2013 - 02:17pm",589263.000000,589263.000000,32.893875,-83.675935,243440.000000,1.000000,4.000000,0.000000,"589263-stop-signs-where-clairmont-ave-crosses-clairmont-pl-nw-of-red-oak-dr","Open","Stop signs where Clairmont Ave crosses Clairmont Pl NW of Red Oak Dr","09/20/2013 - 09:00am","2013-09-20T09:00:39-04:00",0.000000,6.000000,0," "," "," "," "," "," "," "," "," "," "," "," "," "," ",0,0.000000," "," "," "," ",0.000000,0.000000,0,0," "," "," "," "
,"1130 Dickens Roard N.W. Lilburn, Georgia","http://bit.ly/13Vr0BR","06/20/2013 - 11:33pm",588055.000000,588055.000000,33.907638,-84.152579,244324.000000,1.000000,1.000000,0.000000,"588055-bad-news-report-on-lighting-rods","Open","Bad news report on lighting rods","06/20/2013 - 11:33pm","2013-06-20T23:33:50-04:00",0.000000,0.000000,0," "," "," "," "," "," "," "," "," "," "," "," "," "," ",0,0.000000," "," "," "," ",0.000000,0.000000,0,0," "," "," "," "
,"3918 Flowerland Drive Northeast Atlanta, Georgia","http://bit.ly/13W781T","06/20/2013 - 05:15pm",587815.000000,587815.000000,33.903272,-84.319650,244703.000000,1.000000,2.000000,2788.000000,"587815-debris-in-yard","Acknowledged","Debris in Yard","06/24/2013 - 09:07am","2013-06-24T09:07:28-04:00",0.000000,0.000000,0," "," "," "," "," "," "," "," "," "," "," "," "," "," ",0,0.000000," "," "," "," ",0.000000,0.000000,0,0," "," "," "," "
,"2888 Norfair Loop lithonia, Georgia","http://bit.ly/13VTI64","06/20/2013 - 03:19pm",587687.000000,587687.000000,33.698239,-84.155150,244818.000000,1.000000,1.000000,0.000000,"587687-street-ligth","Open","street ligth","06/20/2013 - 03:19pm","2013-06-20T15:19:22-04:00",0.000000,0.000000,0," "," "," "," "," "," "," "," "," "," "," "," "," "," ",0,0.000000," "," "," "," ",0.000000,0.000000,0,0," "," "," "," "
,"2600-2630 Moreland Avenue Atlanta, GA 30316, USA","http://bit.ly/12XrbjY","06/20/2013 - 08:55am",586987.000000,586987.000000,33.682750,-84.347221,245202.000000,1.000000,1.000000,0.000000,"586987-missing-manhole-cover","Open","Missing manhole cover","06/20/2013 - 08:55am","2013-06-20T08:55:53-04:00",30661.000000,0.000000,0," "," "," "," "," "," "," "," "," "," "," "," "," "," ",0,0.000000," "," "," "," ",0.000000,0.000000,0,0," "," "," "," "
,"Dogwood Rd. Sw / Webb Gin House Rd. SNELLVILLE/Gwinnett, Atlanta/Georgia","http://bit.ly/143JAXD","06/19/2013 - 05:22pm",585346.000000,585346.000000,33.885499,-84.042363,246135.000000,1.000000,1.000000,0.000000,"585346-speed-trap","Open","Speed trap","06/19/2013 - 05:22pm","2013-06-19T17:22:55-04:00",0.000000,0.000000,0," "," "," "," "," "," "," "," "," "," "," "," "," "," ",0,0.000000," "," "," "," ",0.000000,0.000000,0,0," "," "," "," "
,"1836 Concord Bainbridge Rd Havana, Florida","http://bit.ly/191sbWn","06/19/2013 - 02:32pm",585155.000000,585155.000000,30.682426,-84.375649,246305.000000,1.000000,2.000000,2657.000000,"585155-trees-need-cutting-on-shoulder","Open","Trees need cutting on shoulder","08/27/2013 - 12:18pm","2013-08-27T12:18:01-04:00",0.000000,0.000000,0," "," "," "," "," "," "," "," "," "," "," "," "," "," ",0,0.000000," "," "," "," ",0.000000,0.000000,0,0," "," "," "," "
,"1801 Hickory Flat Highway Canton, GA 30115, USA","http://bit.ly/1913PvX","06/19/2013 - 12:46pm",584893.000000,584893.000000,34.221564,-84.468307,246411.000000,1.000000,2.000000,0.000000,"584893-water-pools-on-road","Open","water pools on road.","07/23/2013 - 07:39am","2013-07-23T07:39:37-04:00",130615.000000,1.000000,0," "," "," "," "," "," "," "," "," "," "," "," "," "," ",0,0.000000," "," "," "," ",0.000000,0.000000,0,0," "," "," "," "
,"3965 Cascade Palmetto Hwy Fairburn/Fulton, Georgia","http://bit.ly/190F5Un","06/19/2013 - 11:02am",584717.000000,584717.000000,33.647653,-84.672171,246515.000000,1.000000,1.000000,0.000000,"584717-many-potholes","Open","Many Potholes","06/19/2013 - 11:02am","2013-06-19T11:02:42-04:00",0.000000,0.000000,0," "," "," "," "," "," "," "," "," "," "," "," "," "," ",0,0.000000," "," "," "," ",0.000000,0.000000,0,0," "," "," "," "
,"6204 Zebulon Rd Macon, Georgia","http://bit.ly/16gi8HV","06/19/2013 - 08:54am",584449.000000,584449.000000,32.879461,-83.764617,246644.000000,1.000000,1.000000,0.000000,"584449-trash-can","Open","Trash can","06/19/2013 - 08:54am","2013-06-19T08:54:21-04:00",0.000000,0.000000,0," "," "," "," "," "," "," "," "," "," "," "," "," "," ",0,0.000000," "," "," "," ",0.000000,0.000000,0,0," "," "," "," "
,"2225 Johnson Ferry Road Northeast Atlanta, GA 30319, USA","http://bit.ly/13SeBP8","06/18/2013 - 11:56am",582309.000000,582309.000000,33.890720,-84.324317,247902.000000,1.000000,9.000000,2788.000000,"582309-code-compliance-issue","Acknowledged","Code Compliance Issue","08/18/2013 - 02:51pm","2013-08-18T14:51:33-04:00",107219.000000,8.000000,0," "," "," "," "," "," "," "," "," "," "," "," "," "," ",0,0.000000," "," "," "," ",0.000000,0.000000,0,0," "," "," "," "
,"2700 Bart Johnson Road Buford, Georgia","http://bit.ly/18VIXpP","06/18/2013 - 08:57am",581946.000000,581946.000000,34.100276,-83.959703,248080.000000,1.000000,1.000000,0.000000,"581946-steel-plate-in-roadway","Open","Steel plate in roadway","06/18/2013 - 08:57am","2013-06-18T08:57:54-04:00",0.000000,0.000000,0," "," "," "," "," "," "," "," "," "," "," "," "," "," ",0,0.000000," "," "," "," ",0.000000,0.000000,0,0," "," "," "," "
,"1305 Autumnhill  Ln Stone Mountain, Georgia","http://bit.ly/10rA8QS","06/17/2013 - 06:12pm",580162.000000,580162.000000,33.755800,-84.209897,248965.000000,1.000000,1.000000,0.000000,"580162-big-hole-in-street-covered-we-hen-raining-damage-cars-alinement","Open","big hole in street  covered we hen raining damage cars alinement","06/17/2013 - 06:12pm","2013-06-17T18:12:47-04:00",0.000000,0.000000,0," "," "," "," "," "," "," "," "," "," "," "," "," "," ",0,0.000000," "," "," "," ",0.000000,0.000000,0,0," "," "," "," "
,"3579 Peachtree Parkway Suwanee, Georgia","http://bit.ly/U9VFs4","06/15/2013 - 03:53pm",577901.000000,577901.000000,34.073714,-84.164965,251985.000000,1.000000,2.000000,0.000000,"577901-pothole","Open","Pothole","06/15/2013 - 03:58pm","2013-06-15T15:58:36-04:00",0.000000,0.000000,0," "," "," "," "," "," "," "," "," "," "," "," "," "," ",0,0.000000," "," "," "," ",0.000000,0.000000,0,0," "," "," "," "
,"1075 Byrnwyck Road Northeast Atlanta, GA 30319, USA","http://bit.ly/U9Vv3K","06/15/2013 - 02:31pm",577845.000000,577845.000000,33.908206,-84.345985,252066.000000,1.000000,3.000000,2607.000000,"577845-pavement-problem","Acknowledged","Pavement Problem","08/27/2013 - 09:18am","2013-08-27T09:18:28-04:00",93503.000000,1.000000,0," "," "," "," "," "," "," "," "," "," "," "," "," "," ",0,0.000000," "," "," "," ",0.000000,0.000000,0,0," "," "," "," "
,"Buford Highway Doraville, Georgia","http://bit.ly/198ppLz","06/14/2013 - 11:41am",575607.000000,575607.000000,33.918290,-84.258038,253677.000000,1.000000,1.000000,0.000000,"575607-traffic-lights","Open","Traffic Lights","06/14/2013 - 11:41am","2013-06-14T11:41:14-04:00",0.000000,0.000000,0," "," "," "," "," "," "," "," "," "," "," "," "," "," ",0,0.000000," "," "," "," ",0.000000,0.000000,0,0," "," "," "," "
,"3787 Sidestreet Atlanta, Georgia","http://bit.ly/Vy0RWB","06/13/2013 - 02:49pm",573566.000000,573566.000000,33.903152,-84.315113,254928.000000,1.000000,2.000000,2604.000000,"573566-faded-sign-rusted-pole","Acknowledged","Faded Sign/Rusted pole","08/27/2013 - 09:18am","2013-08-27T09:18:29-04:00",0.000000,0.000000,0," "," "," "," "," "," "," "," "," "," "," "," "," "," ",0,0.000000," "," "," "," ",0.000000,0.000000,0,0," "," "," "," "
,"3815 Sidestreet Atlanta, Georgia","http://bit.ly/Vy0POu","06/13/2013 - 02:47pm",573557.000000,573557.000000,33.904007,-84.314384,254931.000000,1.000000,2.000000,2604.000000,"573557-unreadable-sign","Acknowledged","Unreadable Sign","08/27/2013 - 09:18am","2013-08-27T09:18:29-04:00",0.000000,0.000000,0," "," "," "," "," "," "," "," "," "," "," "," "," "," ",0,0.000000," "," "," "," ",0.000000,0.000000,0,0," "," "," "," "
,"806-1100 Arbor Hill Road Canton, Georgia","http://bit.ly/15YbWnu","06/13/2013 - 12:53am",571474.000000,571474.000000,34.208236,-84.365191,256004.000000,1.000000,1.000000,0.000000,"571474-low-branches","Open","Low Branches","06/13/2013 - 12:53am","2013-06-13T00:53:56Z",0.000000,0.000000,0," "," "," "," "," "," "," "," "," "," "," "," "," "," ",0,0.000000," "," "," "," ",0.000000,0.000000,0,0," "," "," "," "
,"6204 Zebulon Rd Macon, Georgia","http://bit.ly/11fHfa4","06/12/2013 - 06:02pm",571080.000000,571080.000000,32.879461,-83.764617,256415.000000,1.000000,1.000000,0.000000,"571080-garbage-can","Open","garbage can","06/12/2013 - 06:06pm","2013-06-12T18:06:53Z",0.000000,0.000000,0," "," "," "," "," "," "," "," "," "," "," "," "," "," ",0,0.000000," "," "," "," ",0.000000,0.000000,0,0," "," "," "," "
,"Eisenhower Parkway At Heron Street Macon, Georgia","http://bit.ly/ZB70UH","06/08/2013 - 04:59pm",565152.000000,565152.000000,32.797073,-83.864267,261999.000000,1.000000,1.000000,0.000000,"565152-drain","Open","Drain","06/08/2013 - 04:59pm","2013-06-08T16:59:16-04:00",0.000000,0.000000,0," "," "," "," "," "," "," "," "," "," "," "," "," "," ",0,0.000000," "," "," "," ",0.000000,0.000000,0,0," "," "," "," "
,"5575-5635 Peachtree Parkway Norcross, GA 30092, USA","http://bit.ly/1111uZ6","06/06/2013 - 07:35am",559971.000000,559971.000000,33.966648,-84.223072,265442.000000,1.000000,1.000000,0.000000,"559971-pot-hole","Open","Pot hole","06/06/2013 - 07:35am","2013-06-06T07:35:36-04:00",109197.000000,0.000000,0," "," "," "," "," "," "," "," "," "," "," "," "," "," ",0,0.000000," "," "," "," ",0.000000,0.000000,0,0," "," "," "," "
,"5224 Bowman Road Macon, GA 31210, USA","http://bit.ly/18XOuuU","06/05/2013 - 07:53pm",558969.000000,558969.000000,32.921283,-83.726364,266145.000000,1.000000,1.000000,0.000000,"558969-other","Open","Other","07/03/2013 - 10:38pm","2013-07-03T22:38:28-04:00",42244.000000,0.000000,0," "," "," "," "," "," "," "," "," "," "," "," "," "," ",0,0.000000," "," "," "," ",0.000000,0.000000,0,0," "," "," "," "
,"Deshong Dr   lithonia, Georgia","http://bit.ly/12slNoC","06/05/2013 - 09:26am",557836.000000,557836.000000,33.747057,-84.129051,266771.000000,1.000000,1.000000,0.000000,"557836-pothole","Open","pothole","06/05/2013 - 09:26am","2013-06-05T09:26:31-04:00",0.000000,0.000000,0," "," "," "," "," "," "," "," "," "," "," "," "," "," ",0,0.000000," "," "," "," ",0.000000,0.000000,0,0," "," "," "," "
,"2276 Seven Oaks Circle conley, Georgia","http://bit.ly/1b1GNAJ","06/04/2013 - 05:29pm",556124.000000,556124.000000,33.666054,-84.296527,267729.000000,1.000000,1.000000,0.000000,"556124-potholes","Open","potholes","06/04/2013 - 05:29pm","2013-06-04T17:29:19-04:00",0.000000,0.000000,0," "," "," "," "," "," "," "," "," "," "," "," "," "," ",0,0.000000," "," "," "," ",0.000000,0.000000,0,0," "," "," "," "
,"806-1100 Arbor Hill Road Canton, Georgia","http://bit.ly/12rsnM5","06/04/2013 - 04:35pm",556076.000000,556076.000000,34.208144,-84.365240,267782.000000,1.000000,2.000000,0.000000,"556076-low-hanging-brancher","Closed","Low Hanging Brancher","12/05/2013 - 10:35am","2013-12-05T10:35:27-05:00",0.000000,0.000000,0," "," "," "," "," "," "," "," "," "," "," "," "," "," ",0,0.000000," "," "," "," ",0.000000,0.000000,0,0," "," "," "," "
,"1300 James Burgess Road Suwanee, Georgia","http://bit.ly/1b0L2MW","06/04/2013 - 11:53am",555590.000000,555590.000000,34.110739,-84.124650,268065.000000,1.000000,3.000000,0.000000,"555590-traffic-light-required-at-the-juction-of-nicoles-rd-and-james-burgess-rd","Open","Traffic light required at the juction of Nicoles Rd and James Burgess Rd","06/04/2013 - 12:03pm","2013-06-04T12:03:53-04:00",0.000000,2.000000,0," "," "," "," "," "," "," "," "," "," "," "," "," "," ",0,0.000000," "," "," "," ",0.000000,0.000000,0,0," "," "," "," "
,"186 Northridge Drive Macon, Georgia","http://bit.ly/11QCUyN","06/03/2013 - 07:42am",553007.000000,553007.000000,32.859024,-83.759003,269755.000000,1.000000,2.000000,0.000000,"553007-parking-of-travel-trailer-rv","Open","Parking of Travel Trailer (RV)","07/12/2013 - 01:51pm","2013-07-12T13:51:57-04:00",0.000000,0.000000,0," "," "," "," "," "," "," "," "," "," "," "," "," "," ",0,0.000000," "," "," "," ",0.000000,0.000000,0,0," "," "," "," "
,"6369-6479 Peachtree Industrial Boulevard Doraville, GA 30360, USA","http://bit.ly/12X8JCK","06/01/2013 - 09:45pm",551632.000000,551632.000000,33.922679,-84.281837,271793.000000,1.000000,2.000000,0.000000,"551632-clean-this-area-up","Open","Clean this area up","07/02/2013 - 07:49am","2013-07-02T07:49:41-04:00",119265.000000,1.000000,0," "," "," "," "," "," "," "," "," "," "," "," "," "," ",0,0.000000," "," "," "," ",0.000000,0.000000,0,0," "," "," "," "
,"Buford Hwy@Mcelroy Rd Doraville, GA 30340, USA","http://bit.ly/19sA44M","05/31/2013 - 07:38am",548032.000000,548032.000000,33.908942,-84.266812,274079.000000,1.000000,1.000000,0.000000,"548032-left-turn-signal","Open","Left turn signal","05/31/2013 - 07:38am","2013-05-31T07:38:26-04:00",70083.000000,0.000000,0," "," "," "," "," "," "," "," "," "," "," "," "," "," ",0,0.000000," "," "," "," ",0.000000,0.000000,0,0," "," "," "," "
,"Charles Hardy Parkway And Macland Road Dallas, Georgia","http://bit.ly/15g2xIt","05/30/2013 - 04:52pm",547010.000000,547010.000000,33.916878,-84.770490,274965.000000,1.000000,1.000000,0.000000,"547010-can-i-get-a-turn-signal","Open","Can I get a turn signal????","05/30/2013 - 04:52pm","2013-05-30T16:52:42-04:00",0.000000,0.000000,0," "," "," "," "," "," "," "," "," "," "," "," "," "," ",0,0.000000," "," "," "," ",0.000000,0.000000,0,0," "," "," "," "
,"160 Saratoga Dr gwinnett county, Georgia","http://bit.ly/114tFFe","05/30/2013 - 08:46am",546040.000000,546040.000000,33.917089,-84.076434,275452.000000,1.000000,1.000000,0.000000,"546040-sink-hole-forming","Open","sink hole forming","05/30/2013 - 08:46am","2013-05-30T08:46:08-04:00",0.000000,0.000000,0," "," "," "," "," "," "," "," "," "," "," "," "," "," ",0,0.000000," "," "," "," ",0.000000,0.000000,0,0," "," "," "," "
,"2267-2319 Johnson Ferry Road Northeast Atlanta, GA 30319, USA","http://bit.ly/Y9yn98","05/30/2013 - 07:31am",545678.000000,545678.000000,33.890060,-84.320114,275527.000000,1.000000,2.000000,2607.000000,"545678-pavement-problem","Acknowledged","Pavement Problem","05/30/2013 - 04:45pm","2013-05-30T16:45:45-04:00",109197.000000,0.000000,0," "," "," "," "," "," "," "," "," "," "," "," "," "," ",0,0.000000," "," "," "," ",0.000000,0.000000,0,0," "," "," "," "
,"3554 Windsor Circle Macon, Georgia","http://bit.ly/15iGLTG","05/29/2013 - 11:04am",544348.000000,544348.000000,32.847530,-83.555023,276753.000000,1.000000,2.000000,0.000000,"544348-vacant-lot-used-for-dumping","Open","Vacant lot used for dumping","06/17/2013 - 04:51pm","2013-06-17T16:51:28-04:00",0.000000,1.000000,0," "," "," "," "," "," "," "," "," "," "," "," "," "," ",0,0.000000," "," "," "," ",0.000000,0.000000,0,0," "," "," "," "
,"8485 Holcomb Bridge Road Fulton County, Georgia","http://bit.ly/1527iVH","05/28/2013 - 07:43am",541534.000000,541534.000000,33.988864,-84.273095,278395.000000,1.000000,1.000000,0.000000,"541534-jagged-pothole-in-front-of-tire-store","Open","Jagged Pothole in Front of Tire Store","05/28/2013 - 07:43am","2013-05-28T07:43:21-04:00",103963.000000,0.000000,0," "," "," "," "," "," "," "," "," "," "," "," "," "," ",0,0.000000," "," "," "," ",0.000000,0.000000,0,0," "," "," "," "
,"2146 Meadowcliff Drive Northeast Atlanta, GA 30345, USA","http://bit.ly/12YWuan","05/27/2013 - 03:35pm",541145.000000,541145.000000,33.846392,-84.299273,279362.000000,1.000000,2.000000,0.000000,"541145-pothole-hazard","Open","Pothole hazard","09/25/2013 - 10:36am","2013-09-25T10:36:53-04:00",2168.000000,0.000000,0," "," "," "," "," "," "," "," "," "," "," "," "," "," ",0,0.000000," "," "," "," ",0.000000,0.000000,0,0," "," "," "," "
,"112 Northridge Drive Macon, GA 31220, USA","http://bit.ly/19ctteM","05/25/2013 - 09:37am",539289.000000,539289.000000,32.854000,-83.759742,282600.000000,1.000000,2.000000,1900.000000,"539289-pothole","Acknowledged","Pothole","05/29/2013 - 07:08am","2013-05-29T07:08:03-04:00",51183.000000,0.000000,0," "," "," "," "," "," "," "," "," "," "," "," "," "," ",0,0.000000," "," "," "," ",0.000000,0.000000,0,0," "," "," "," "
,"2590 Weatherstone Circle Conyers, Georgia","http://bit.ly/10mQkxn","05/22/2013 - 02:19pm",534433.000000,534433.000000,33.624460,-84.026299,286638.000000,1.000000,1.000000,0.000000,"534433-pothole","Open","Pothole","05/22/2013 - 02:19pm","2013-05-22T14:19:51-04:00",0.000000,0.000000,0," "," "," "," "," "," "," "," "," "," "," "," "," "," ",0,0.000000," "," "," "," ",0.000000,0.000000,0,0," "," "," "," "
,"117 Heathwood Drive Macon, Georgia","http://bit.ly/1607UiE","05/19/2013 - 09:27pm",528818.000000,528818.000000,32.831085,-83.747214,290531.000000,1.000000,2.000000,1899.000000,"528818-dead-deer-creating-bad-odor","Acknowledged","Dead Deer Creating Bad Odor","05/20/2013 - 07:36am","2013-05-20T07:36:08-04:00",0.000000,0.000000,0," "," "," "," "," "," "," "," "," "," "," "," "," "," ",0,0.000000," "," "," "," ",0.000000,0.000000,0,0," "," "," "," "
,"Forest Parkway And Hwy 85 Atlanta, Georgia","http://bit.ly/1098OVF","05/17/2013 - 10:59am",526590.000000,526590.000000,33.615326,-84.402683,294038.000000,1.000000,2.000000,0.000000,"526590-bumpy-lumpy-road","Open","Bumpy lumpy road","09/15/2013 - 11:36am","2013-09-15T11:36:51-04:00",0.000000,0.000000,0," "," "," "," "," "," "," "," "," "," "," "," "," "," ",0,0.000000," "," "," "," ",0.000000,0.000000,0,0," "," "," "," "
,"3050 Windy Hill Road Southeast Atlanta, Georgia","http://bit.ly/16BYj0T","05/16/2013 - 10:56am",524776.000000,524776.000000,33.905774,-84.463747,295482.000000,1.000000,1.000000,0.000000,"524776-pothole","Open","Pothole","05/16/2013 - 10:56am","2013-05-16T10:56:26-04:00",0.000000,0.000000,0," "," "," "," "," "," "," "," "," "," "," "," "," "," ",0,0.000000," "," "," "," ",0.000000,0.000000,0,0," "," "," "," "
,"Hall Rd Macon, Georgia","http://bit.ly/10WOK4f","05/14/2013 - 10:59pm",521574.000000,521574.000000,32.906441,-83.707452,297639.000000,1.000000,2.000000,1900.000000,"521574-pot-hole","Acknowledged","Pot Hole","05/15/2013 - 07:26am","2013-05-15T07:26:03-04:00",0.000000,0.000000,0," "," "," "," "," "," "," "," "," "," "," "," "," "," ",0,0.000000," "," "," "," ",0.000000,0.000000,0,0," "," "," "," "
,"6045 Skipperton Road Macon, GA 31216, USA","http://bit.ly/14fVgas","05/12/2013 - 05:34pm",517770.000000,517770.000000,32.743978,-83.704928,300843.000000,1.000000,1.000000,0.000000,"517770-other","Open","Other","07/03/2013 - 10:37pm","2013-07-03T22:37:43-04:00",57036.000000,0.000000,0," "," "," "," "," "," "," "," "," "," "," "," "," "," ",0,0.000000," "," "," "," ",0.000000,0.000000,0,0," "," "," "," "
,"4368-4398 Berkford Circle Northeast Atlanta, GA 30341, USA","http://bit.ly/139jdO6","05/11/2013 - 10:34pm",517021.000000,517021.000000,33.916271,-84.319167,301983.000000,1.000000,4.000000,2790.000000,"517021-pavement-problem","Acknowledged","Pavement Problem","09/29/2013 - 04:32pm","2013-09-29T16:32:26-04:00",107710.000000,2.000000,0," "," "," "," "," "," "," "," "," "," "," "," "," "," ",0,0.000000," "," "," "," ",0.000000,0.000000,0,0," "," "," "," "
,"3130 Tolbert Drive Decatur, GA 30033, USA","http://bit.ly/13oYFVz","05/11/2013 - 04:43pm",516862.000000,516862.000000,33.825783,-84.261227,302335.000000,1.000000,3.000000,0.000000,"516862-drugs-trash-kids-playground","Open","Drugs & trash @ kids' playground","06/17/2013 - 07:34pm","2013-06-17T19:34:06-04:00",61081.000000,1.000000,0," "," "," "," "," "," "," "," "," "," "," "," "," "," ",0,0.000000," "," "," "," ",0.000000,0.000000,0,0," "," "," "," "
,"261-289 Forest Road Newnan, Georgia","http://bit.ly/18ymCMr","05/10/2013 - 08:45am",514709.000000,514709.000000,33.382086,-84.737558,304253.000000,1.000000,1.000000,0.000000,"514709-missing-manhole-cover","Open","Missing manhole cover","05/10/2013 - 08:45am","2013-05-10T08:45:06-04:00",0.000000,0.000000,0," "," "," "," "," "," "," "," "," "," "," "," "," "," ",0,0.000000," "," "," "," ",0.000000,0.000000,0,0," "," "," "," "
,"4343 Ashwoody Trail Brookhaven, Georgia","http://bit.ly/13m9k2P","05/09/2013 - 02:08pm",513596.000000,513596.000000,33.918591,-84.334177,305370.000000,1.000000,2.000000,2601.000000,"513596-improper-drainage","Acknowledged","improper drainage","05/21/2013 - 10:48am","2013-05-21T10:48:02-04:00",0.000000,0.000000,0," "," "," "," "," "," "," "," "," "," "," "," "," "," ",0,0.000000," "," "," "," ",0.000000,0.000000,0,0," "," "," "," "
,"5192 Winding Glen Drive Lithonia Ga 30038 Dekalb, Georgia","http://bit.ly/15JM42p","05/08/2013 - 11:46pm",512385.000000,512385.000000,33.695836,-84.178310,306472.000000,1.000000,1.000000,0.000000,"512385-street-cracked-and-sinking","Open","Street cracked and sinking","05/08/2013 - 11:46pm","2013-05-08T23:46:27Z",0.000000,0.000000,0," "," "," "," "," "," "," "," "," "," "," "," "," "," ",0,0.000000," "," "," "," ",0.000000,0.000000,0,0," "," "," "," "
,"1401 Brawley Circle Atlanta, Georgia","http://bit.ly/18YtlfN","05/08/2013 - 03:57pm",511746.000000,511746.000000,33.919320,-84.323584,306940.000000,1.000000,2.000000,2607.000000,"511746-sinking-pavement","Acknowledged","sinking pavement","05/21/2013 - 02:46pm","2013-05-21T14:46:00Z",0.000000,0.000000,0," "," "," "," "," "," "," "," "," "," "," "," "," "," ",0,0.000000," "," "," "," ",0.000000,0.000000,0,0," "," "," "," "
,"Macon Ga. Harrison Road","http://bit.ly/Ytm0Uc","05/08/2013 - 03:40am",510289.000000,510289.000000,32.812550,-83.723837,307677.000000,1.000000,3.000000,0.000000,"510289-other","Open","Other","09/20/2013 - 02:43am","2013-09-20T02:43:06Z",116153.000000,3.000000,0," "," "," "," "," "," "," "," "," "," "," "," "," "," ",0,0.000000," "," "," "," ",0.000000,0.000000,0,0," "," "," "," "
,"3902 Northside Drive Macon, Georgia","http://bit.ly/15BROLy","05/07/2013 - 11:15pm",509651.000000,509651.000000,32.898271,-83.697134,307942.000000,1.000000,1.000000,0.000000,"509651-pedestrian-safety","Open","Pedestrian safety","05/07/2013 - 11:15pm","2013-05-07T23:15:37Z",0.000000,0.000000,0," "," "," "," "," "," "," "," "," "," "," "," "," "," ",0,0.000000," "," "," "," ",0.000000,0.000000,0,0," "," "," "," "
,"3902 Northside Drive Macon, Georgia","http://bit.ly/15BRKLS","05/07/2013 - 11:15pm",509650.000000,509650.000000,32.898271,-83.697134,307943.000000,1.000000,1.000000,0.000000,"509650-pedestrian-safety","Open","Pedestrian safety","05/07/2013 - 11:15pm","2013-05-07T23:15:24Z",0.000000,0.000000,0," "," "," "," "," "," "," "," "," "," "," "," "," "," ",0,0.000000," "," "," "," ",0.000000,0.000000,0,0," "," "," "," "
,"3902 Northside Drive Macon, Georgia","http://bit.ly/15BRrRm","05/07/2013 - 11:15pm",509649.000000,509649.000000,32.898271,-83.697134,307943.000000,1.000000,1.000000,0.000000,"509649-pedestrian-safety","Open","Pedestrian safety","05/07/2013 - 11:15pm","2013-05-07T23:15:08Z",0.000000,0.000000,0," "," "," "," "," "," "," "," "," "," "," "," "," "," ",0,0.000000," "," "," "," ",0.000000,0.000000,0,0," "," "," "," "
,"Wrights Mill Road Canton, Georgia","http://bit.ly/15Bu5vb","05/07/2013 - 10:02pm",509593.000000,509593.000000,34.216376,-84.302717,308015.000000,1.000000,2.000000,0.000000,"509593-huge-potholes-cracks-in-road-uneven-pavement-and-low-hanging-trees-wrights-mill-road-between-hwy-372-and-bobo-lane","Open","huge potholes, cracks in road, uneven pavement and low hanging trees - Wrights Mill Road (between Hwy 372 and Bobo Lane)","08/11/2013 - 11:49pm","2013-08-11T23:49:55Z",0.000000,0.000000,0," "," "," "," "," "," "," "," "," "," "," "," "," "," ",0,0.000000," "," "," "," ",0.000000,0.000000,0,0," "," "," "," "
,"Lilburn-Stone Mountain Highway Stone Mountain, Dekalb, Georgia","http://bit.ly/16e3eVs","05/07/2013 - 01:49pm",509088.000000,509088.000000,33.828750,-84.178326,308508.000000,1.000000,2.000000,0.000000,"509088-huge-pothole","Open","HUGE POTHOLE","07/07/2013 - 06:33pm","2013-07-07T18:33:22Z",0.000000,0.000000,0," "," "," "," "," "," "," "," "," "," "," "," "," "," ",0,0.000000," "," "," "," ",0.000000,0.000000,0,0," "," "," "," "
,"2150-2186 Dresden Drive Atlanta, Georgia","http://bit.ly/U8xb18","05/06/2013 - 02:34pm",508113.000000,508113.000000,33.866564,-84.301337,309663.000000,1.000000,1.000000,0.000000,"508113-litter-blocking-sidewalk","Open","Litter blocking sidewalk","05/06/2013 - 02:34pm","2013-05-06T14:34:54-04:00",0.000000,0.000000,0," "," "," "," "," "," "," "," "," "," "," "," "," "," ",0,0.000000," "," "," "," ",0.000000,0.000000,0,0," "," "," "," "
,"2495 Creel Rd. atlanta, ga.","http://bit.ly/18o80iz","05/05/2013 - 04:17pm",506947.000000,506947.000000,33.573689,-84.463918,311001.000000,1.000000,1.000000,0.000000,"506947-it-does-not-know-me","Open","it does not know me","05/05/2013 - 04:17pm","2013-05-05T16:17:21-04:00",0.000000,0.000000,0," "," "," "," "," "," "," "," "," "," "," "," "," "," ",0,0.000000," "," "," "," ",0.000000,0.000000,0,0," "," "," "," "
,"4051 Candler Lake West Ne Atlanta, GA 30319, USA","http://bit.ly/Ytn24O","05/03/2013 - 10:06pm",504594.000000,504594.000000,33.912437,-84.323799,313772.000000,1.000000,2.000000,2601.000000,"504594-storm-water-problem","Acknowledged","Storm Water Problem","05/07/2013 - 03:59pm","2013-05-07T15:59:09Z",122596.000000,0.000000,0," "," "," "," "," "," "," "," "," "," "," "," "," "," ",0,0.000000," "," "," "," ",0.000000,0.000000,0,0," "," "," "," "
,"456 Front Street North Augusta, South Carolina","http://bit.ly/YhgGmA","05/02/2013 - 11:37am",502348.000000,502348.000000,33.486045,-81.981838,315601.000000,1.000000,1.000000,0.000000,"502348-street-light","Open","street light","05/02/2013 - 11:37am","2013-05-02T11:37:11-04:00",0.000000,0.000000,0," "," "," "," "," "," "," "," "," "," "," "," "," "," ",0,0.000000," "," "," "," ",0.000000,0.000000,0,0," "," "," "," "
,"225 James Daniel Rd Rockmart, Georgia","http://bit.ly/U4YcCA","05/02/2013 - 09:14am",501991.000000,501991.000000,33.915722,-85.124431,315743.000000,1.000000,1.000000,0.000000,"501991-james-daniel-road","Open","James Daniel road","05/02/2013 - 09:14am","2013-05-02T09:14:58-04:00",0.000000,0.000000,0," "," "," "," "," "," "," "," "," "," "," "," "," "," ",0,0.000000," "," "," "," ",0.000000,0.000000,0,0," "," "," "," "
,"505 Silver Springs Ct Macon, Georgia","http://bit.ly/12RcvP9","04/30/2013 - 08:42pm",498152.000000,498152.000000,32.725252,-83.692110,318176.000000,1.000000,1.000000,0.000000,"498152-speed-sign","Open","speed sign","04/30/2013 - 08:42pm","2013-04-30T20:42:24Z",0.000000,0.000000,0," "," "," "," "," "," "," "," "," "," "," "," "," "," ",0,0.000000," "," "," "," ",0.000000,0.000000,0,0," "," "," "," "
,"6528-6620 Brannon Hill Road Clarkston, GA 30021, USA","http://bit.ly/12XiGlD","04/30/2013 - 12:54pm",497370.000000,497370.000000,33.796475,-84.227822,318643.000000,1.000000,3.000000,0.000000,"497370-the-entire-neighborhood-had-potholes-that-need-fixing-now-than-500-family-live-here","Open","The entire neighborhood had potholes that need fixing now than 500 family live here","05/03/2013 - 03:30pm","2013-05-03T15:30:03Z",123867.000000,0.000000,0," "," "," "," "," "," "," "," "," "," "," "," "," "," ",0,0.000000," "," "," "," ",0.000000,0.000000,0,0," "," "," "," "
,"4386 Chamblee Dunwoody Road Atlanta, GA 30341, USA","http://bit.ly/185m0xy","04/28/2013 - 11:08am",494158.000000,494158.000000,33.918408,-84.315948,321630.000000,1.000000,4.000000,2795.000000,"494158-major-electrical-equipment-on-road","Acknowledged","Major electrical equipment on road","07/28/2013 - 01:56am","2013-07-28T01:56:19Z",107710.000000,1.000000,0," "," "," "," "," "," "," "," "," "," "," "," "," "," ",0,0.000000," "," "," "," ",0.000000,0.000000,0,0," "," "," "," "
,"5064 Memorial Drive Stone Mountain, Georgia","http://bit.ly/17pkvsz","04/27/2013 - 08:00pm",493636.000000,493636.000000,33.795056,-84.228949,322538.000000,1.000000,3.000000,0.000000,"493636-dcss-shuttle-bus-stop","Open","DCSS Shuttle Bus Stop","05/01/2013 - 12:59am","2013-05-01T00:59:10Z",0.000000,1.000000,0," "," "," "," "," "," "," "," "," "," "," "," "," "," ",0,0.000000," "," "," "," ",0.000000,0.000000,0,0," "," "," "," "
,"3645 Donaldson Drive Brookhaven, Georgia","http://bit.ly/13Amica","04/26/2013 - 10:01pm",492314.000000,492314.000000,33.895458,-84.331944,323857.000000,1.000000,6.000000,2600.000000,"492314-blocked-sidewalk","Acknowledged","blocked sidewalk","07/09/2013 - 04:21pm","2013-07-09T16:21:42Z",0.000000,2.000000,0," "," "," "," "," "," "," "," "," "," "," "," "," "," ",0,0.000000," "," "," "," ",0.000000,0.000000,0,0," "," "," "," "
,"1385 Mcfarland Parkway Alpharetta, Georgia","http://bit.ly/ZROnZo","04/26/2013 - 11:16am",491879.000000,491879.000000,34.115179,-84.223022,324262.000000,1.000000,1.000000,0.000000,"491879-pothole","Open","pothole","04/26/2013 - 11:16am","2013-04-26T11:16:28-04:00",0.000000,0.000000,0," "," "," "," "," "," "," "," "," "," "," "," "," "," ",0,0.000000," "," "," "," ",0.000000,0.000000,0,0," "," "," "," "
,"915-997 North Mcdonough Road Griffin, Georgia","http://bit.ly/11HReGi","04/25/2013 - 04:42pm",489598.000000,489598.000000,33.271972,-84.190061,325375.000000,1.000000,1.000000,0.000000,"489598-patching-nightmare","Open","Patching Nightmare","04/25/2013 - 04:42pm","2013-04-25T16:42:47-04:00",0.000000,0.000000,0," "," "," "," "," "," "," "," "," "," "," "," "," "," ",0,0.000000," "," "," "," ",0.000000,0.000000,0,0," "," "," "," "
,"Corner Of East Ponce De Leon And Harriston Road Stone Mountain, Georgia","http://bit.ly/13x6mr2","04/25/2013 - 09:24am",489065.000000,489065.000000,33.825857,-84.195799,325813.000000,1.000000,1.000000,0.000000,"489065-traffic-light-staying-red-for-a-long-time","Open","Traffic Light staying red for a long time.","04/25/2013 - 09:24am","2013-04-25T09:24:41-04:00",0.000000,0.000000,0," "," "," "," "," "," "," "," "," "," "," "," "," "," ",0,0.000000," "," "," "," ",0.000000,0.000000,0,0," "," "," "," "
,"I-285 N And I -285 S Atlanta, Georgia","http://bit.ly/13x4MFA","04/25/2013 - 09:14am",489059.000000,489059.000000,33.882285,-84.249669,325823.000000,1.000000,1.000000,0.000000,"489059-pot-holes","Open","Pot Holes","04/25/2013 - 09:14am","2013-04-25T09:14:44-04:00",0.000000,0.000000,0," "," "," "," "," "," "," "," "," "," "," "," "," "," ",0,0.000000," "," "," "," ",0.000000,0.000000,0,0," "," "," "," "
,"2049 Dresden Rd Atlanta, Georgia","http://bit.ly/10dfHAh","04/24/2013 - 09:01am",487071.000000,487071.000000,33.866458,-84.303450,327276.000000,1.000000,1.000000,0.000000,"487071-hole-in-shoulder-of-road","Open","hole in shoulder of road","07/24/2013 - 08:18am","2013-07-24T08:18:38-04:00",135739.000000,0.000000,0," "," "," "," "," "," "," "," "," "," "," "," "," "," ",0,0.000000," "," "," "," ",0.000000,0.000000,0,0," "," "," "," "
,"3645 Chamblee Tucker Road Chamblee, Georgia","http://bit.ly/10deBUY","04/24/2013 - 08:58am",487069.000000,487069.000000,33.883162,-84.244986,327280.000000,1.000000,2.000000,0.000000,"487069-pot-hole-in-road","Open","pot hole in road","07/24/2013 - 08:18am","2013-07-24T08:18:46-04:00",135739.000000,1.000000,0," "," "," "," "," "," "," "," "," "," "," "," "," "," ",0,0.000000," "," "," "," ",0.000000,0.000000,0,0," "," "," "," "
,"5915-5953 Peachtree Boulevard Atlanta, GA 30341, USA","http://bit.ly/XUMrBZ","04/23/2013 - 05:51pm",485501.000000,485501.000000,33.909495,-84.290516,328187.000000,1.000000,1.000000,0.000000,"485501-idea-for-traffic-improvement","Open","Idea for traffic improvement","04/23/2013 - 05:51pm","2013-04-23T17:51:06-04:00",119265.000000,0.000000,0," "," "," "," "," "," "," "," "," "," "," "," "," "," ",0,0.000000," "," "," "," ",0.000000,0.000000,0,0," "," "," "," "
,"Buford Hwy And Pleasantdale  Atlanta, GA","http://bit.ly/ZL9TOx","04/22/2013 - 07:54pm",483097.000000,483097.000000,33.924722,-84.249607,329504.000000,1.000000,1.000000,0.000000,"483097-traffic-light-timing","Open","Traffic Light Timing","04/22/2013 - 07:54pm","2013-04-22T19:54:18-04:00",70083.000000,0.000000,0," "," "," "," "," "," "," "," "," "," "," "," "," "," ",0,0.000000," "," "," "," ",0.000000,0.000000,0,0," "," "," "," "
,"2335 Heath Road Macon, GA","http://bit.ly/17GtZOl","04/21/2013 - 09:32pm",481640.000000,481640.000000,32.830357,-83.745735,330846.000000,1.000000,1.000000,0.000000,"481640-street-light-out","Open","Street light out","04/21/2013 - 09:32pm","2013-04-21T21:32:04-04:00",0.000000,0.000000,0," "," "," "," "," "," "," "," "," "," "," "," "," "," ",0,0.000000," "," "," "," ",0.000000,0.000000,0,0," "," "," "," "
,"2205-2265 Johnson Ferry Road Northeast Atlanta, GA","http://bit.ly/10mJ36u","04/19/2013 - 06:27am",477922.000000,477922.000000,33.890386,-84.321798,334631.000000,1.000000,3.000000,2607.000000,"477922-deteriorating-pavement-johnson-ferry-rd-at-durden","Acknowledged","Deteriorating pavement Johnson Ferry Rd at Durden","10/02/2013 - 12:40pm","2013-10-02T12:40:37-04:00",0.000000,1.000000,0," "," "," "," "," "," "," "," "," "," "," "," "," "," ",0,0.000000," "," "," "," ",0.000000,0.000000,0,0," "," "," "," "
,"4402 Candler Lake East Ne Atlanta, GA 30319, USA","http://bit.ly/VnkEpX","04/18/2013 - 06:35pm",477806.000000,477806.000000,33.913616,-84.323356,335343.000000,1.000000,2.000000,2605.000000,"477806-tree-issue","Acknowledged","Tree Issue","04/19/2013 - 08:17am","2013-04-19T08:17:42-04:00",122596.000000,0.000000,0," "," "," "," "," "," "," "," "," "," "," "," "," "," ",0,0.000000," "," "," "," ",0.000000,0.000000,0,0," "," "," "," "
,"Bouldercrest Rd At 285w Atlanta, GA","http://bit.ly/VnkCOJ","04/18/2013 - 06:15pm",477795.000000,477795.000000,33.684317,-84.310305,335363.000000,1.000000,2.000000,0.000000,"477795-pothole","Open","Pothole","07/18/2013 - 06:49am","2013-07-18T06:49:41-04:00",0.000000,0.000000,0," "," "," "," "," "," "," "," "," "," "," "," "," "," ",0,0.000000," "," "," "," ",0.000000,0.000000,0,0," "," "," "," "
,"1495-1499 Lake Hearn Drive Northeast Atlanta, GA 30319, USA","http://bit.ly/115Z7od","04/18/2013 - 05:22pm",477778.000000,477778.000000,33.916031,-84.337545,335415.000000,1.000000,2.000000,2607.000000,"477778-pavement-problem","Acknowledged","Pavement Problem","04/22/2013 - 04:07pm","2013-04-22T16:07:05-04:00",70083.000000,0.000000,0," "," "," "," "," "," "," "," "," "," "," "," "," "," ",0,0.000000," "," "," "," ",0.000000,0.000000,0,0," "," "," "," "
,"Parkside Place Atlanta, GA 30319, USA","http://bit.ly/115YgE7","04/18/2013 - 05:13pm",477774.000000,477774.000000,33.916716,-84.339819,335424.000000,1.000000,2.000000,2604.000000,"477774-sign-problem","Acknowledged","Sign Problem","04/22/2013 - 04:07pm","2013-04-22T16:07:05-04:00",70083.000000,0.000000,0," "," "," "," "," "," "," "," "," "," "," "," "," "," ",0,0.000000," "," "," "," ",0.000000,0.000000,0,0," "," "," "," "
,"2557 River Forest Court ELlenwood, GA","http://bit.ly/101TRj8","04/18/2013 - 10:17am",477254.000000,477254.000000,33.673632,-84.284868,335840.000000,1.000000,1.000000,0.000000,"477254-pothole","Open","Pothole","04/18/2013 - 10:17am","2013-04-18T10:17:41-04:00",0.000000,0.000000,0," "," "," "," "," "," "," "," "," "," "," "," "," "," ",0,0.000000," "," "," "," ",0.000000,0.000000,0,0," "," "," "," "
,"100-162 Heard Drive Canton, GA","http://bit.ly/XSZW7b","04/18/2013 - 08:20am",477072.000000,477072.000000,34.298885,-84.447803,335958.000000,1.000000,1.000000,0.000000,"477072-pavement-markings","Open","Pavement Markings","04/18/2013 - 08:20am","2013-04-18T08:20:20-04:00",0.000000,0.000000,0," "," "," "," "," "," "," "," "," "," "," "," "," "," ",0,0.000000," "," "," "," ",0.000000,0.000000,0,0," "," "," "," "
,"3904-3998 Fate Conn Road Canton, GA","http://bit.ly/XSZENN","04/18/2013 - 08:17am",477069.000000,477069.000000,34.276405,-84.449863,335961.000000,1.000000,1.000000,0.000000,"477069-pavement-markings-signage","Open","Pavement markings & signage","04/18/2013 - 08:17am","2013-04-18T08:17:28-04:00",0.000000,0.000000,0," "," "," "," "," "," "," "," "," "," "," "," "," "," ",0,0.000000," "," "," "," ",0.000000,0.000000,0,0," "," "," "," "
,"151 Barrington Hall Drive Macon, GA 31220, USA","http://bit.ly/12giuOf","04/15/2013 - 04:33pm",463876.000000,463876.000000,32.887738,-83.802529,339785.000000,1.000000,1.000000,0.000000,"463876-other","Open","Other","07/03/2013 - 10:36pm","2013-07-03T22:36:33-04:00",112143.000000,0.000000,0," "," "," "," "," "," "," "," "," "," "," "," "," "," ",0,0.000000," "," "," "," ",0.000000,0.000000,0,0," "," "," "," "
,"2701 Ashbury Point Lane Marietta, GA","http://bit.ly/156zp8p","04/13/2013 - 04:15pm",462804.000000,462804.000000,34.016866,-84.497249,342683.000000,1.000000,1.000000,0.000000,"462804-street-sign-fell","Open","Street sign fell","04/13/2013 - 04:15pm","2013-04-13T16:15:19-04:00",0.000000,0.000000,0," "," "," "," "," "," "," "," "," "," "," "," "," "," ",0,0.000000," "," "," "," ",0.000000,0.000000,0,0," "," "," "," "
,"2146 Johnson Ferry Road Northeast Atlanta, GA","http://bit.ly/170nmpW","04/12/2013 - 10:01am",462174.000000,462174.000000,33.892150,-84.325693,344496.000000,1.000000,16.000000,2788.000000,"462174-multiple-code-violations","Acknowledged","Multiple Code Violations","10/02/2013 - 10:27am","2013-10-02T10:27:44-04:00",0.000000,10.000000,0," "," "," "," "," "," "," "," "," "," "," "," "," "," ",0,0.000000," "," "," "," ",0.000000,0.000000,0,0," "," "," "," "
,"7465-7499 Rockland Road Lithonia, GA","http://bit.ly/ZH6K99","04/10/2013 - 06:22pm",461202.000000,461202.000000,33.675120,-84.084734,346876.000000,1.000000,2.000000,0.000000,"461202-big-pothole","Open","Big Pothole","09/20/2013 - 03:42pm","2013-09-20T15:42:22-04:00",70183.000000,5.000000,0," "," "," "," "," "," "," "," "," "," "," "," "," "," ",0,0.000000," "," "," "," ",0.000000,0.000000,0,0," "," "," "," "
,"2554 E. Wesley Chapel Way Decatur, GA","http://bit.ly/11PTWLK","04/09/2013 - 04:36pm",460308.000000,460308.000000,33.712672,-84.215098,348422.000000,1.000000,1.000000,0.000000,"460308-potholes-several","Open","Potholes - Several","04/09/2013 - 04:36pm","2013-04-09T16:36:28-04:00",0.000000,0.000000,0," "," "," "," "," "," "," "," "," "," "," "," "," "," ",0,0.000000," "," "," "," ",0.000000,0.000000,0,0," "," "," "," "
,"Fischer Rd Sharpsburg/ Coweta, GA","http://bit.ly/ZzVUSq","04/09/2013 - 09:09am",458721.000000,458721.000000,33.422421,-84.638487,348868.000000,1.000000,1.000000,0.000000,"458721-semi-truck-traffic","Open","Semi Truck Traffic","04/09/2013 - 09:09am","2013-04-09T09:09:46-04:00",0.000000,0.000000,0," "," "," "," "," "," "," "," "," "," "," "," "," "," ",0,0.000000," "," "," "," ",0.000000,0.000000,0,0," "," "," "," "
,"Emery Highway  Macon, GA","http://bit.ly/ZH5vGv","04/08/2013 - 03:21pm",458324.000000,458324.000000,32.847295,-83.598078,349937.000000,1.000000,1.000000,0.000000,"458324-dead-animal-pickup","Open","Dead Animal Pickup","04/08/2013 - 03:21pm","2013-04-08T15:21:20-04:00",0.000000,0.000000,0," "," "," "," "," "," "," "," "," "," "," "," "," "," ",0,0.000000," "," "," "," ",0.000000,0.000000,0,0," "," "," "," "
,"398 Ochlockonee River Road Havana, FL","http://bit.ly/10LtOA6","04/08/2013 - 11:31am",458077.000000,458077.000000,30.670567,-84.319914,350167.000000,1.000000,2.000000,2828.000000,"458077-mosquitoes","Acknowledged","Mosquitoes","04/16/2013 - 07:15am","2013-04-16T07:15:35-04:00",0.000000,0.000000,0," "," "," "," "," "," "," "," "," "," "," "," "," "," ",0,0.000000," "," "," "," ",0.000000,0.000000,0,0," "," "," "," "
,"1006 Travitine Trail Loganville, GA","http://bit.ly/11Dzj5h","04/06/2013 - 09:59pm",457250.000000,457250.000000,33.753828,-83.877093,352418.000000,1.000000,1.000000,0.000000,"457250-street-light","Open","Street light","04/06/2013 - 09:59pm","2013-04-06T21:59:40-04:00",0.000000,0.000000,0," "," "," "," "," "," "," "," "," "," "," "," "," "," ",0,0.000000," "," "," "," ",0.000000,0.000000,0,0," "," "," "," "
,"1433 Ashwoody Ct Atlanta, GA","http://bit.ly/Y5h7gH","04/06/2013 - 07:21pm",457216.000000,457216.000000,33.916593,-84.330637,352576.000000,1.000000,3.000000,2607.000000,"457216-pothole-at-corner-of-ashwoody-ct-and-shawnee-lane","Acknowledged","Pothole at corner of Ashwoody Ct and Shawnee Lane","09/17/2013 - 08:10am","2013-09-17T08:10:21-04:00",0.000000,1.000000,0," "," "," "," "," "," "," "," "," "," "," "," "," "," ",0,0.000000," "," "," "," ",0.000000,0.000000,0,0," "," "," "," "
,"3852 Flowerland Atlanta, GA","http://bit.ly/Xgp9pO","04/04/2013 - 05:22pm",456093.000000,456093.000000,33.905539,-84.320306,355576.000000,1.000000,2.000000,2605.000000,"456093-leaning-tree","Acknowledged","Leaning Tree","04/08/2013 - 04:21pm","2013-04-08T16:21:30-04:00",0.000000,0.000000,0," "," "," "," "," "," "," "," "," "," "," "," "," "," ",0,0.000000," "," "," "," ",0.000000,0.000000,0,0," "," "," "," "
,"560 Chinaberry Lane Havana, FL","http://bit.ly/XghqrL","04/04/2013 - 04:02pm",456035.000000,456035.000000,30.659802,-84.383360,355656.000000,1.000000,2.000000,2655.000000,"456035-eroding-entry","Acknowledged","eroding entry","05/16/2013 - 09:31am","2013-05-16T09:31:02-04:00",0.000000,0.000000,0," "," "," "," "," "," "," "," "," "," "," "," "," "," ",0,0.000000," "," "," "," ",0.000000,0.000000,0,0," "," "," "," "
,"2987-3037 Ashford Dunwoody Road Northeast Atlanta, GA","http://bit.ly/13Urufj","04/04/2013 - 11:18am",455828.000000,455828.000000,33.877057,-84.327666,355940.000000,1.000000,5.000000,2604.000000,"455828-speed-limit-sign","Acknowledged","Speed Limit Sign","04/21/2013 - 04:41pm","2013-04-21T16:41:38-04:00",0.000000,2.000000,0," "," "," "," "," "," "," "," "," "," "," "," "," "," ",0,0.000000," "," "," "," ",0.000000,0.000000,0,0," "," "," "," "
,"1195 Dogwood Drive Havana/Gadsden, FL","http://bit.ly/13Un3Ry","04/04/2013 - 10:51am",455799.000000,455799.000000,30.650561,-84.403407,355967.000000,1.000000,2.000000,2828.000000,"455799-culvert-too-small","Acknowledged","Culvert too small","04/16/2013 - 07:16am","2013-04-16T07:16:39-04:00",0.000000,0.000000,0," "," "," "," "," "," "," "," "," "," "," "," "," "," ",0,0.000000," "," "," "," ",0.000000,0.000000,0,0," "," "," "," "
,"S. Deshon Rd  stone mountain, GA","http://bit.ly/10d2ACr","04/04/2013 - 06:57am",455666.000000,455666.000000,33.779414,-84.103494,356201.000000,1.000000,1.000000,0.000000,"455666-large-pot-hole-on-the-right-side","Open","large pot hole on the right side","04/04/2013 - 06:57am","2013-04-04T06:57:06-04:00",0.000000,0.000000,0," "," "," "," "," "," "," "," "," "," "," "," "," "," ",0,0.000000," "," "," "," ",0.000000,0.000000,0,0," "," "," "," "
,"S. Deshon Rd  stone mountain, GA","http://bit.ly/10d25bD","04/04/2013 - 06:55am",455665.000000,455665.000000,33.779414,-84.103494,356202.000000,1.000000,1.000000,0.000000,"455665-large-pot-hole-on-the-right-side","Open","large pot hole on the right side","04/04/2013 - 06:55am","2013-04-04T06:55:40-04:00",0.000000,0.000000,0," "," "," "," "," "," "," "," "," "," "," "," "," "," ",0,0.000000," "," "," "," ",0.000000,0.000000,0,0," "," "," "," "
,"S. Deshon Rd  stone mountain, GA","http://bit.ly/10d1AOO","04/04/2013 - 06:53am",455664.000000,455664.000000,33.779414,-84.103494,356205.000000,1.000000,1.000000,0.000000,"455664-large-pot-hole-on-the-right-side","Open","large pot hole on the right side","04/04/2013 - 06:53am","2013-04-04T06:53:10-04:00",0.000000,0.000000,0," "," "," "," "," "," "," "," "," "," "," "," "," "," ",0,0.000000," "," "," "," ",0.000000,0.000000,0,0," "," "," "," "
,"108 Embassy Ct. Macon, GA","http://bit.ly/YTb6Xw","04/03/2013 - 02:14pm",455269.000000,455269.000000,32.886465,-83.738563,357203.000000,1.000000,1.000000,0.000000,"455269-orange-and-white-barrel","Open","orange and white barrel","05/04/2013 - 06:34am","2013-05-04T06:34:49-04:00",0.000000,0.000000,0," "," "," "," "," "," "," "," "," "," "," "," "," "," ",0,0.000000," "," "," "," ",0.000000,0.000000,0,0," "," "," "," "
,"6684 Vinson Drive Macon, GA 31216","http://bit.ly/YT6gtu","04/03/2013 - 01:33pm",455225.000000,455225.000000,32.726818,-83.689130,357245.000000,1.000000,2.000000,1900.000000,"455225-pothole","Acknowledged","Pothole","04/03/2013 - 02:59pm","2013-04-03T14:59:47-04:00",0.000000,0.000000,0," "," "," "," "," "," "," "," "," "," "," "," "," "," ",0,0.000000," "," "," "," ",0.000000,0.000000,0,0," "," "," "," "
,"E. Conley Rd  Conley Clayton , GA","http://bit.ly/14BYMyT","04/02/2013 - 09:06am",454182.000000,454182.000000,33.647501,-84.323549,358951.000000,1.000000,1.000000,0.000000,"454182-2-ugly-huge-hole","Open","2 ugly huge hole","04/02/2013 - 09:06am","2013-04-02T09:06:55-04:00",0.000000,0.000000,0," "," "," "," "," "," "," "," "," "," "," "," "," "," ",0,0.000000," "," "," "," ",0.000000,0.000000,0,0," "," "," "," "
,"3650 Chelsea Crescent Northeast Atlanta, GA","http://bit.ly/U3z6DG","03/27/2013 - 08:43am",451148.000000,451148.000000,33.898554,-84.342466,367614.000000,1.000000,3.000000,2601.000000,"451148-poor-water-drainage","Acknowledged","Poor Water Drainage","07/24/2013 - 01:41pm","2013-07-24T13:41:34-04:00",0.000000,1.000000,0," "," "," "," "," "," "," "," "," "," "," "," "," "," ",0,0.000000," "," "," "," ",0.000000,0.000000,0,0," "," "," "," "
,"3925 Mcelroy Road Doraville, GA 30340, USA","http://bit.ly/UmGKdD","03/24/2013 - 05:20pm",448158.000000,448158.000000,33.908664,-84.266548,371418.000000,1.000000,2.000000,0.000000,"448158-turn-signal-at-mcelroy-is-very-short","Open","Turn signal at McElroy is very short","03/24/2013 - 05:20pm","2013-03-24T17:20:53-04:00",0.000000,1.000000,0," "," "," "," "," "," "," "," "," "," "," "," "," "," ",0,0.000000," "," "," "," ",0.000000,0.000000,0,0," "," "," "," "
,"4151 Canby Lane Decatur, GA","http://bit.ly/YjfH7V","03/23/2013 - 04:51am",446261.000000,446261.000000,33.708347,-84.210205,373847.000000,1.000000,2.000000,0.000000,"446261-road-is-too-dangerous-to-drive-out-to-wesley-chapel-rd","Open","Road is too dangerous to drive out to Wesley Chapel Rd.","11/18/2013 - 05:12pm","2013-11-18T17:12:33Z",0.000000,1.000000,0," "," "," "," "," "," "," "," "," "," "," "," "," "," ",0,0.000000," "," "," "," ",0.000000,0.000000,0,0," "," "," "," "
,"Larry Mcdonald Memorial Highway Kennesaw, GA 30144, USA","http://bit.ly/16O6g13","03/22/2013 - 10:33pm",446003.000000,446003.000000,34.030139,-84.576353,374225.000000,1.000000,1.000000,0.000000,"446003-three-inch-plus-3-holes-at-exact-location-where-both-front-tires-pass-over-rr-tracks","Open","Three-inch plus (3+) holes at exact location where both front tires pass over RR tracks","03/22/2013 - 10:33pm","2013-03-22T22:33:33Z",0.000000,0.000000,0," "," "," "," "," "," "," "," "," "," "," "," "," "," ",0,0.000000," "," "," "," ",0.000000,0.000000,0,0," "," "," "," "
,"3806 Fulton Mill Road Georgia, USA","http://bit.ly/11pXZN9","03/22/2013 - 05:17pm",445779.000000,445779.000000,32.799098,-83.752937,374541.000000,1.000000,1.000000,0.000000,"445779-other","Open","Other","07/04/2013 - 02:35am","2013-07-04T02:35:40Z",116153.000000,0.000000,0," "," "," "," "," "," "," "," "," "," "," "," "," "," ",0,0.000000," "," "," "," ",0.000000,0.000000,0,0," "," "," "," "
,"1353-1377 Oconee Pass Northeast Atlanta, GA 30319, USA","http://bit.ly/104SYrM","03/22/2013 - 12:39pm",445447.000000,445447.000000,33.910760,-84.333046,374819.000000,1.000000,2.000000,2607.000000,"445447-pavement-problem","Acknowledged","Pavement Problem","03/27/2013 - 07:30pm","2013-03-27T19:30:01Z",117239.000000,0.000000,0," "," "," "," "," "," "," "," "," "," "," "," "," "," ",0,0.000000," "," "," "," ",0.000000,0.000000,0,0," "," "," "," "
,"3113 Roswell Road At Old Canton To Roswell Rd/Indian Hills Marietta, GA","http://bit.ly/ReQHKt","03/19/2013 - 08:44pm",443784.000000,443784.000000,33.979594,-84.461008,378413.000000,1.000000,1.000000,0.000000,"443784-pavement-with-bad-potholes","Open","Pavement with bad potholes","03/19/2013 - 08:44pm","2013-03-19T20:44:55-04:00",0.000000,0.000000,0," "," "," "," "," "," "," "," "," "," "," "," "," "," ",0,0.000000," "," "," "," ",0.000000,0.000000,0,0," "," "," "," "
,"2651 Cobb Parkway Southeast Smyrna, GA 30080, USA","http://bit.ly/WLDcot","03/19/2013 - 05:26pm",443619.000000,443619.000000,33.888484,-84.473373,378612.000000,1.000000,1.000000,0.000000,"443619-poorly-timed-lights","Open","Poorly timed lights","03/19/2013 - 05:26pm","2013-03-19T17:26:36-04:00",55052.000000,0.000000,0," "," "," "," "," "," "," "," "," "," "," "," "," "," ",0,0.000000," "," "," "," ",0.000000,0.000000,0,0," "," "," "," "
,"608 Sullivan Road Newnan, GA","http://bit.ly/ReQjLL","03/19/2013 - 04:23pm",443571.000000,443571.000000,33.391770,-84.713249,378675.000000,1.000000,2.000000,0.000000,"443571-sullivan-road-worked","Open","Sullivan road worked","06/19/2013 - 08:02pm","2013-06-19T20:02:47-04:00",0.000000,0.000000,0," "," "," "," "," "," "," "," "," "," "," "," "," "," ",0,0.000000," "," "," "," ",0.000000,0.000000,0,0," "," "," "," "
,"1201-1299 Riverloch Way Northeast Lawrenceville, GA","http://bit.ly/ReQ8Aa","03/19/2013 - 02:32pm",443494.000000,443494.000000,33.994239,-83.991834,378786.000000,1.000000,1.000000,0.000000,"443494-deep-road-surface-depression","Open","Deep road surface depression","03/19/2013 - 02:32pm","2013-03-19T14:32:11-04:00",0.000000,0.000000,0," "," "," "," "," "," "," "," "," "," "," "," "," "," ",0,0.000000," "," "," "," ",0.000000,0.000000,0,0," "," "," "," "
,"398 Lebeaux Court  kennesaw, GA","http://bit.ly/145qEuW","03/19/2013 - 09:20am",443270.000000,443270.000000,34.055544,-84.562703,379098.000000,1.000000,1.000000,0.000000,"443270-hail","Open","Hail","03/19/2013 - 09:20am","2013-03-19T09:20:00-04:00",0.000000,0.000000,0," "," "," "," "," "," "," "," "," "," "," "," "," "," ",0,0.000000," "," "," "," ",0.000000,0.000000,0,0," "," "," "," "
,"4715 Hartley Bridge Road Macon, GA","http://www.seeclickfix.com/issues/439154-dangerous-intersection","03/12/2013 - 02:29pm",439154.000000,439154.000000,32.744131,-83.727067,388869.000000,1.000000,1.000000,0.000000,"439154-dangerous-intersection","Open","dangerous intersection","03/12/2013 - 02:29pm","2013-03-12T14:29:08-04:00",0.000000,0.000000,0," "," "," "," "," "," "," "," "," "," "," "," "," "," ",0,0.000000," "," "," "," ",0.000000,0.000000,0,0," "," "," "," "
,"Waldrop Rd decatur, GA","http://www.seeclickfix.com/issues/438551-pot-holes","03/11/2013 - 03:49pm",438551.000000,438551.000000,33.680154,-84.254029,390228.000000,1.000000,1.000000,0.000000,"438551-pot-holes","Open","Pot holes","03/11/2013 - 03:49pm","2013-03-11T15:49:57-04:00",0.000000,0.000000,0," "," "," "," "," "," "," "," "," "," "," "," "," "," ",0,0.000000," "," "," "," ",0.000000,0.000000,0,0," "," "," "," "
,"Moore Macon, GA","http://www.seeclickfix.com/issues/438388-garbage-cart-needed","03/11/2013 - 01:25pm",438388.000000,438388.000000,32.919067,-83.865805,390373.000000,1.000000,1.000000,0.000000,"438388-garbage-cart-needed","Open","Garbage Cart Needed","03/11/2013 - 01:25pm","2013-03-11T13:25:05-04:00",38669.000000,0.000000,0," "," "," "," "," "," "," "," "," "," "," "," "," "," ",0,0.000000," "," "," "," ",0.000000,0.000000,0,0," "," "," "," "
,"4650 Flat Shoals Parkway Decatur, GA","http://bit.ly/YlkhMi","03/10/2013 - 10:26am",437776.000000,437776.000000,33.678264,-84.229623,391991.000000,1.000000,1.000000,0.000000,"437776-pipe-projecting-up-out-of-road-on-flat-shoals-pkwy-who-s-paying-for-my-2-flat-tires","Open","Pipe projecting up out of road on Flat Shoals Pkwy!!! Who's paying for my 2 flat  tires?","03/10/2013 - 10:26am","2013-03-10T10:26:55-04:00",0.000000,0.000000,0," "," "," "," "," "," "," "," "," "," "," "," "," "," ",0,0.000000," "," "," "," ",0.000000,0.000000,0,0," "," "," "," "
,"19 Millard Farmer Industrial Boulevard Newnan, GA 30263, USA","http://bit.ly/Yuk1jq","03/10/2013 - 08:48am",437761.000000,437761.000000,33.400077,-84.806945,392089.000000,1.000000,4.000000,0.000000,"437761-need-sign","Open","Need Sign","09/07/2013 - 08:08am","2013-09-07T08:08:37-04:00",109541.000000,2.000000,0," "," "," "," "," "," "," "," "," "," "," "," "," "," ",0,0.000000," "," "," "," ",0.000000,0.000000,0,0," "," "," "," "
,"4146 Bill Arp Road Douglasville, GA","http://www.seeclickfix.com/issues/435882-shoulder-sink-hole","03/06/2013 - 04:53pm",435882.000000,435882.000000,33.691388,-84.797480,397304.000000,1.000000,1.000000,0.000000,"435882-shoulder-sink-hole","Open","shoulder sink hole","03/06/2013 - 04:53pm","2013-03-06T16:53:55-05:00",0.000000,0.000000,0," "," "," "," "," "," "," "," "," "," "," "," "," "," ",0,0.000000," "," "," "," ",0.000000,0.000000,0,0," "," "," "," "
,"3900-3938 Rockbridge Road Stone Mountain, GA","http://www.seeclickfix.com/issues/435121-traffic-light-timing","03/05/2013 - 12:39pm",435121.000000,435121.000000,33.786701,-84.232942,398999.000000,1.000000,1.000000,0.000000,"435121-traffic-light-timing","Open","traffic light timing","03/05/2013 - 12:39pm","2013-03-05T12:39:40-05:00",0.000000,0.000000,0," "," "," "," "," "," "," "," "," "," "," "," "," "," ",0,0.000000," "," "," "," ",0.000000,0.000000,0,0," "," "," "," "
,"3572-3588 Donaldson Drive Northeast Atlanta, GA 30319, USA","http://www.seeclickfix.com/issues/434440-signal-problem","03/04/2013 - 10:49am",434440.000000,434440.000000,33.893489,-84.325828,400549.000000,1.000000,10.000000,2606.000000,"434440-signal-problem","Acknowledged","Signal Problem","11/29/2013 - 10:28am","2013-11-29T10:28:20-05:00",110864.000000,9.000000,0," "," "," "," "," "," "," "," "," "," "," "," "," "," ",0,0.000000," "," "," "," ",0.000000,0.000000,0,0," "," "," "," "
,"Sydney Pond Circle Lawrenceville, GA","http://bit.ly/1622FfD","03/03/2013 - 08:55pm",434228.000000,434228.000000,33.950139,-84.037365,401383.000000,1.000000,1.000000,0.000000,"434228-deep-wide-pothole","Open","deep, wide pothole","03/03/2013 - 08:55pm","2013-03-03T20:55:45-05:00",0.000000,0.000000,0," "," "," "," "," "," "," "," "," "," "," "," "," "," ",0,0.000000," "," "," "," ",0.000000,0.000000,0,0," "," "," "," "
,"101-251 Steel Bridge Road Canton, GA","http://bit.ly/Wpiuv6","03/03/2013 - 12:41pm",434005.000000,434005.000000,34.174211,-84.566163,401877.000000,1.000000,1.000000,0.000000,"434005-rough-road","Open","rough road","03/03/2013 - 12:41pm","2013-03-03T12:41:01-05:00",0.000000,0.000000,0," "," "," "," "," "," "," "," "," "," "," "," "," "," ",0,0.000000," "," "," "," ",0.000000,0.000000,0,0," "," "," "," "
,"Snapfinger Woods Dr Decatur, GA","http://bit.ly/XMxFcR","03/01/2013 - 11:44pm",433471.000000,433471.000000,33.711317,-84.196136,404094.000000,1.000000,3.000000,0.000000,"433471-pothole-bonanza","Open","Pothole Bonanza","10/02/2013 - 08:59am","2013-10-02T08:59:45-04:00",0.000000,1.000000,0," "," "," "," "," "," "," "," "," "," "," "," "," "," ",0,0.000000," "," "," "," ",0.000000,0.000000,0,0," "," "," "," "
,"153-173 Mcdonough Road Fayetteville, GA 30214, USA","http://www.seeclickfix.com/issues/432394-tree-bushes-fallen-into-sideqalk","02/28/2013 - 01:08pm",432394.000000,432394.000000,33.455646,-84.417251,406169.000000,1.000000,1.000000,0.000000,"432394-tree-bushes-fallen-into-sideqalk","Open","Tree/bushes fallen into sideqalk","02/28/2013 - 01:08pm","2013-02-28T13:08:50-05:00",9747.000000,0.000000,0," "," "," "," "," "," "," "," "," "," "," "," "," "," ",0,0.000000," "," "," "," ",0.000000,0.000000,0,0," "," "," "," "
,"Jones Rd Macon, GA","http://bit.ly/YJmd56","02/28/2013 - 10:23am",432162.000000,432162.000000,32.732219,-83.692045,406334.000000,1.000000,1.000000,0.000000,"432162-tree-limbs-blocking-the-visability-of-the-street-have-to-pull-far-out-to-see","Open","TREE LIMBS BLOCKING THE VISABILITY OF THE STREET. HAVE TO PULL FAR OUT TO SEE.","02/28/2013 - 10:23am","2013-02-28T10:23:47-05:00",0.000000,0.000000,0," "," "," "," "," "," "," "," "," "," "," "," "," "," ",0,0.000000," "," "," "," ",0.000000,0.000000,0,0," "," "," "," "
,"Hwy 211/Hwy124 Braselton  gwinnett, GA","http://bit.ly/15jSr8Y","02/27/2013 - 09:16pm",430913.000000,430913.000000,34.095518,-83.810804,407122.000000,1.000000,1.000000,0.000000,"430913-rough-road","Open","Rough road","02/27/2013 - 09:16pm","2013-02-27T21:16:20-05:00",0.000000,0.000000,0," "," "," "," "," "," "," "," "," "," "," "," "," "," ",0,0.000000," "," "," "," ",0.000000,0.000000,0,0," "," "," "," "
,"Hwy 211/Hwy124 Braselton  gwinnett, GA","http://bit.ly/15jSkKK","02/27/2013 - 09:14pm",430912.000000,430912.000000,34.095518,-83.810804,407123.000000,1.000000,1.000000,0.000000,"430912-rough-road","Open","Rough road","02/27/2013 - 09:14pm","2013-02-27T21:14:56-05:00",0.000000,0.000000,0," "," "," "," "," "," "," "," "," "," "," "," "," "," ",0,0.000000," "," "," "," ",0.000000,0.000000,0,0," "," "," "," "
,"Hwy 211/Hwy124 Braselton  gwinnett, GA","http://bit.ly/15jRZHM","02/27/2013 - 09:11pm",430910.000000,430910.000000,34.095518,-83.810804,407127.000000,1.000000,1.000000,0.000000,"430910-rough-road","Open","Rough road","02/27/2013 - 09:11pm","2013-02-27T21:11:10-05:00",0.000000,0.000000,0," "," "," "," "," "," "," "," "," "," "," "," "," "," ",0,0.000000," "," "," "," ",0.000000,0.000000,0,0," "," "," "," "
,"Hwy 211/Hwy124 Braselton  gwinnett, GA","http://bit.ly/15jRRbf","02/27/2013 - 09:10pm",430909.000000,430909.000000,34.095518,-83.810804,407128.000000,1.000000,1.000000,0.000000,"430909-rough-road","Open","Rough road","02/27/2013 - 09:10pm","2013-02-27T21:10:18-05:00",0.000000,0.000000,0," "," "," "," "," "," "," "," "," "," "," "," "," "," ",0,0.000000," "," "," "," ",0.000000,0.000000,0,0," "," "," "," "
,"4106 Rue St Germain Stone Mountain, GA","http://www.seeclickfix.com/issues/430371-pothole","02/27/2013 - 03:12pm",430371.000000,430371.000000,33.783568,-84.219001,407485.000000,1.000000,1.000000,0.000000,"430371-pothole","Open","Pothole","02/27/2013 - 03:12pm","2013-02-27T15:12:55-05:00",0.000000,0.000000,0," "," "," "," "," "," "," "," "," "," "," "," "," "," ",0,0.000000," "," "," "," ",0.000000,0.000000,0,0," "," "," "," "
,"944 Stoney Brook Ct Macon, GA","http://www.seeclickfix.com/issues/430365-billing-issues","02/27/2013 - 03:10pm",430365.000000,430365.000000,32.893877,-83.676817,407488.000000,1.000000,1.000000,0.000000,"430365-billing-issues","Open","BILLING ISSUES","02/27/2013 - 03:10pm","2013-02-27T15:10:07-05:00",37214.000000,0.000000,0," "," "," "," "," "," "," "," "," "," "," "," "," "," ",0,0.000000," "," "," "," ",0.000000,0.000000,0,0," "," "," "," "
,"815-825 Rays Road Stone Mountain, GA","http://bit.ly/V9VIGb","02/27/2013 - 12:56pm",430208.000000,430208.000000,33.802116,-84.220054,407622.000000,1.000000,1.000000,0.000000,"430208-patch-sinking","Open","patch sinking","02/27/2013 - 12:56pm","2013-02-27T12:56:34-05:00",0.000000,0.000000,0," "," "," "," "," "," "," "," "," "," "," "," "," "," ",0,0.000000," "," "," "," ",0.000000,0.000000,0,0," "," "," "," "
,"3760 Flat Shoals Parkway Decatur , GA","http://bit.ly/13Wkfhl","02/27/2013 - 08:52am",429913.000000,429913.000000,33.698163,-84.265243,407866.000000,1.000000,2.000000,0.000000,"429913-wellington-court-apartments-huge-potholes","Open","Wellington Court Apartments Huge Potholes","03/30/2013 - 08:19am","2013-03-30T08:19:22-04:00",0.000000,0.000000,0," "," "," "," "," "," "," "," "," "," "," "," "," "," ",0,0.000000," "," "," "," ",0.000000,0.000000,0,0," "," "," "," "
,"Harts Mill And Flowerland Atlanta, GA","http://bit.ly/XEDr03","02/26/2013 - 06:46pm",428505.000000,428505.000000,33.901715,-84.320074,408712.000000,1.000000,5.000000,2795.000000,"428505-temp-cross-walk-harts-mill-rd-and-flowerland","Acknowledged","Temp Cross Walk / Harts Mill Rd. and Flowerland","06/15/2013 - 10:24am","2013-06-15T10:24:57-04:00",0.000000,2.000000,0," "," "," "," "," "," "," "," "," "," "," "," "," "," ",0,0.000000," "," "," "," ",0.000000,0.000000,0,0," "," "," "," "
,"2565 Ashley Downs Lane  atlanta, GA","http://bit.ly/XAKXME","02/26/2013 - 06:31pm",428500.000000,428500.000000,33.565697,-84.475292,408726.000000,1.000000,1.000000,0.000000,"428500-pothole-manhols-rise-8in-out-ground","Open","pothole & Manhols rise 8in out ground","02/26/2013 - 06:31pm","2013-02-26T18:31:54-05:00",0.000000,0.000000,0," "," "," "," "," "," "," "," "," "," "," "," "," "," ",0,0.000000," "," "," "," ",0.000000,0.000000,0,0," "," "," "," "
,"4135 Old Mcdonough Road Conley, GA","http://www.seeclickfix.com/issues/425962-large-pothole","02/25/2013 - 11:04am",425962.000000,425962.000000,33.659809,-84.341246,410614.000000,1.000000,1.000000,0.000000,"425962-large-pothole","Open","Large pothole","02/25/2013 - 11:04am","2013-02-25T11:04:07-05:00",0.000000,0.000000,0," "," "," "," "," "," "," "," "," "," "," "," "," "," ",0,0.000000," "," "," "," ",0.000000,0.000000,0,0," "," "," "," "
,"4053-4099 Bowman Boulevard Macon, GA","http://www.seeclickfix.com/issues/425916-deep-potholes","02/25/2013 - 10:35am",425916.000000,425916.000000,32.916767,-83.712289,410643.000000,1.000000,3.000000,1900.000000,"425916-deep-potholes","Acknowledged","Deep potholes!","02/25/2013 - 11:33am","2013-02-25T11:33:17-05:00",0.000000,1.000000,0," "," "," "," "," "," "," "," "," "," "," "," "," "," ",0,0.000000," "," "," "," ",0.000000,0.000000,0,0," "," "," "," "
,"Harmony Drive Canton, GA","http://bit.ly/W2eiBL","02/24/2013 - 06:45am",424948.000000,424948.000000,34.260022,-84.409027,412313.000000,1.000000,1.000000,0.000000,"424948-rough-road","Open","Rough road","02/24/2013 - 06:45am","2013-02-24T06:45:16-05:00",0.000000,0.000000,0," "," "," "," "," "," "," "," "," "," "," "," "," "," ",0,0.000000," "," "," "," ",0.000000,0.000000,0,0," "," "," "," "
,"1000 Preston Glen Cir. Canton, GA","http://bit.ly/TAyohb","02/23/2013 - 11:48pm",424699.000000,424699.000000,34.190455,-84.539157,412730.000000,1.000000,1.000000,0.000000,"424699-divider-lines-reflectors","Open","Divider Lines ,Reflectors","02/23/2013 - 11:48pm","2013-02-23T23:48:31-05:00",0.000000,0.000000,0," "," "," "," "," "," "," "," "," "," "," "," "," "," ",0,0.000000," "," "," "," ",0.000000,0.000000,0,0," "," "," "," "
,"Ga-400 Southbound Exit 7 Holcomb Bridge Road Roswell, GA","http://bit.ly/158TPes","02/22/2013 - 07:57am",422523.000000,422523.000000,33.973186,-84.262462,415121.000000,1.000000,3.000000,0.000000,"422523-dangerous-interchange","Open","Dangerous interchange","03/25/2013 - 06:05am","2013-03-25T06:05:12-04:00",9887.000000,2.000000,0," "," "," "," "," "," "," "," "," "," "," "," "," "," ",0,0.000000," "," "," "," ",0.000000,0.000000,0,0," "," "," "," "
,"2245 Dresden Drive Chamblee, GA","http://bit.ly/X0i1Om","02/21/2013 - 11:59pm",421513.000000,421513.000000,33.867938,-84.298853,415598.000000,1.000000,2.000000,0.000000,"421513-large-pothole-on-dresden-drive","Open","Large Pothole on Dresden Drive","02/22/2013 - 09:17am","2013-02-22T09:17:13-05:00",0.000000,1.000000,0," "," "," "," "," "," "," "," "," "," "," "," "," "," ",0,0.000000," "," "," "," ",0.000000,0.000000,0,0," "," "," "," "
,"6353 Pawleys Isle Lithonia, GA","http://bit.ly/UOkE5L","02/21/2013 - 09:19pm",421049.000000,421049.000000,33.745499,-84.128561,415759.000000,1.000000,1.000000,0.000000,"421049-street-light-is-out","Open","Street Light Is Out","02/21/2013 - 09:19pm","2013-02-21T21:19:10-05:00",0.000000,0.000000,0," "," "," "," "," "," "," "," "," "," "," "," "," "," ",0,0.000000," "," "," "," ",0.000000,0.000000,0,0," "," "," "," "
,"1297 Little Road Canton, GA","http://www.seeclickfix.com/issues/420936-little-road-needs-repair","02/21/2013 - 05:47pm",420936.000000,420936.000000,34.161932,-84.432919,415970.000000,1.000000,1.000000,0.000000,"420936-little-road-needs-repair","Open","Little Road needs repair!","02/21/2013 - 05:47pm","2013-02-21T17:47:56-05:00",0.000000,0.000000,0," "," "," "," "," "," "," "," "," "," "," "," "," "," ",0,0.000000," "," "," "," ",0.000000,0.000000,0,0," "," "," "," "
,"4197 Brookdale Ave Macon, GA","http://www.seeclickfix.com/issues/420554-billing-issue","02/21/2013 - 10:39am",420554.000000,420554.000000,32.853368,-83.693624,416398.000000,1.000000,1.000000,0.000000,"420554-billing-issue","Open","BILLING ISSUE","02/21/2013 - 10:39am","2013-02-21T10:39:57-05:00",37214.000000,0.000000,0," "," "," "," "," "," "," "," "," "," "," "," "," "," ",0,0.000000," "," "," "," ",0.000000,0.000000,0,0," "," "," "," "
,"3972 Lavista Road Tucker, GA","http://www.seeclickfix.com/issues/419072-traffic-conditions-northlake","02/20/2013 - 11:40pm",419072.000000,419072.000000,33.845483,-84.255767,417058.000000,1.000000,3.000000,0.000000,"419072-traffic-conditions-northlake","Open","Traffic Conditions-Northlake","05/27/2013 - 08:33pm","2013-05-27T20:33:10-04:00",0.000000,2.000000,0," "," "," "," "," "," "," "," "," "," "," "," "," "," ",0,0.000000," "," "," "," ",0.000000,0.000000,0,0," "," "," "," "
,"391 Apple Blossom Way Macon, GA","http://www.seeclickfix.com/issues/418566-yard-debris","02/20/2013 - 02:53pm",418566.000000,418566.000000,32.814293,-83.539269,417585.000000,1.000000,1.000000,0.000000,"418566-yard-debris","Open","YARD DEBRIS","02/20/2013 - 02:53pm","2013-02-20T14:53:40-05:00",0.000000,0.000000,0," "," "," "," "," "," "," "," "," "," "," "," "," "," ",0,0.000000," "," "," "," ",0.000000,0.000000,0,0," "," "," "," "
,"4200-4398 Atlanta Road Smyrna, GA","http://www.seeclickfix.com/issues/418137-traffic-jam-atlanta-rd-i285n","02/20/2013 - 09:12am",418137.000000,418137.000000,33.846242,-84.491824,417926.000000,1.000000,1.000000,0.000000,"418137-traffic-jam-atlanta-rd-i285n","Open","Traffic Jam Atlanta Rd&I285N","02/20/2013 - 09:12am","2013-02-20T09:12:47-05:00",0.000000,0.000000,0," "," "," "," "," "," "," "," "," "," "," "," "," "," ",0,0.000000," "," "," "," ",0.000000,0.000000,0,0," "," "," "," "
,"6611 Zebulon Road Macon, GA 31220, USA","http://bit.ly/Y6lA3q","02/19/2013 - 11:16am",416000.000000,416000.000000,32.883257,-83.779016,419241.000000,1.000000,1.000000,0.000000,"416000-other","Open","Other","07/03/2013 - 10:34pm","2013-07-03T22:34:54-04:00",112143.000000,0.000000,0," "," "," "," "," "," "," "," "," "," "," "," "," "," ",0,0.000000," "," "," "," ",0.000000,0.000000,0,0," "," "," "," "
,"Mission Rd/Rr 3 South Cartersville, GA","http://bit.ly/YC6IIP","02/18/2013 - 03:08pm",414367.000000,414367.000000,34.165611,-84.856082,420450.000000,1.000000,1.000000,0.000000,"414367-potholes","Open","Potholes","02/18/2013 - 03:08pm","2013-02-18T15:08:01-05:00",0.000000,0.000000,0," "," "," "," "," "," "," "," "," "," "," "," "," "," ",0,0.000000," "," "," "," ",0.000000,0.000000,0,0," "," "," "," "
,"6204 Zebulon Rd Macon, GA","http://bit.ly/12y7Ila","02/18/2013 - 11:52am",414216.000000,414216.000000,32.879461,-83.764617,420646.000000,1.000000,1.000000,0.000000,"414216-abandoned-trash-cans","Open","Abandoned trash cans","03/21/2013 - 06:01am","2013-03-21T06:01:31-04:00",0.000000,0.000000,0," "," "," "," "," "," "," "," "," "," "," "," "," "," ",0,0.000000," "," "," "," ",0.000000,0.000000,0,0," "," "," "," "
,"Amberwood Pte Woodstock, GA","http://bit.ly/XXtqxT","02/18/2013 - 10:16am",414145.000000,414145.000000,34.145391,-84.568308,420742.000000,1.000000,1.000000,0.000000,"414145-pot-hole","Open","Pot hole","02/18/2013 - 10:16am","2013-02-18T10:16:42-05:00",0.000000,0.000000,0," "," "," "," "," "," "," "," "," "," "," "," "," "," ",0,0.000000," "," "," "," ",0.000000,0.000000,0,0," "," "," "," "
,"Victory  Drive Acworth, GA","http://bit.ly/W5ybC4","02/18/2013 - 09:18am",414073.000000,414073.000000,34.108878,-84.593876,420800.000000,1.000000,1.000000,0.000000,"414073-pot-holes","Open","pot holes","02/18/2013 - 09:18am","2013-02-18T09:18:09-05:00",0.000000,0.000000,0," "," "," "," "," "," "," "," "," "," "," "," "," "," ",0,0.000000," "," "," "," ",0.000000,0.000000,0,0," "," "," "," "
,"Plantation Centre Dr N And Zebulon Rd Macon, GA","http://bit.ly/W5myva","02/18/2013 - 07:51am",413958.000000,413958.000000,32.879861,-83.758747,420887.000000,1.000000,1.000000,0.000000,"413958-trash-in-medium","Open","Trash in medium","05/01/2013 - 09:43am","2013-05-01T09:43:32-04:00",0.000000,0.000000,0," "," "," "," "," "," "," "," "," "," "," "," "," "," ",0,0.000000," "," "," "," ",0.000000,0.000000,0,0," "," "," "," "
,"Plantation Centre Dr. N And Zebulon Rd Macon, GA","http://bit.ly/W5lFCM","02/18/2013 - 07:44am",413956.000000,413956.000000,32.879861,-83.758747,420894.000000,1.000000,1.000000,0.000000,"413956-debris","Open","Debris","05/20/2013 - 08:20am","2013-05-20T08:20:48-04:00",0.000000,0.000000,0," "," "," "," "," "," "," "," "," "," "," "," "," "," ",0,0.000000," "," "," "," ",0.000000,0.000000,0,0," "," "," "," "
,"Plantation Centre Dr. N And Zebulon Rd Macon, GA","http://bit.ly/W5lkQw","02/18/2013 - 07:40am",413954.000000,413954.000000,32.879861,-83.758747,420898.000000,1.000000,1.000000,0.000000,"413954-debris","Open","Debris","05/01/2013 - 09:42am","2013-05-01T09:42:50-04:00",0.000000,0.000000,0," "," "," "," "," "," "," "," "," "," "," "," "," "," ",0,0.000000," "," "," "," ",0.000000,0.000000,0,0," "," "," "," "
,"39 Walker Road Cartersville, GA","http://bit.ly/XeZiy7","02/17/2013 - 09:52pm",413689.000000,413689.000000,34.239320,-84.837128,421486.000000,1.000000,1.000000,0.000000,"413689-pothole-in-middle-of-walker-road","Open","Pothole in Middle of Walker Road","02/17/2013 - 09:52pm","2013-02-17T21:52:01-05:00",0.000000,0.000000,0," "," "," "," "," "," "," "," "," "," "," "," "," "," ",0,0.000000," "," "," "," ",0.000000,0.000000,0,0," "," "," "," "
,"Old Alabama Rd Cartersville, GA","http://bit.ly/UvfgEo","02/17/2013 - 12:43pm",413457.000000,413457.000000,34.115665,-84.841302,422035.000000,1.000000,1.000000,0.000000,"413457-woodland-hs","Open","Woodland HS","02/17/2013 - 12:43pm","2013-02-17T12:43:07-05:00",0.000000,0.000000,0," "," "," "," "," "," "," "," "," "," "," "," "," "," ",0,0.000000," "," "," "," ",0.000000,0.000000,0,0," "," "," "," "
,"Redan Rd@Redan Sta Georgia 30088, USA","http://bit.ly/UuR6tM","02/17/2013 - 10:26am",413347.000000,413347.000000,33.759853,-84.170601,422172.000000,1.000000,3.000000,0.000000,"413347-pothole-and-uneven-pavement","Open","pothole and uneven pavement","12/05/2013 - 01:56pm","2013-12-05T13:56:57-05:00",108892.000000,1.000000,0," "," "," "," "," "," "," "," "," "," "," "," "," "," ",0,0.000000," "," "," "," ",0.000000,0.000000,0,0," "," "," "," "
,"Walker Road Cartersville, GA","http://bit.ly/Utn3CC","02/17/2013 - 12:36am",413024.000000,413024.000000,34.239627,-84.837081,422762.000000,1.000000,1.000000,0.000000,"413024-pothole","Open","Pothole","02/17/2013 - 12:36am","2013-02-17T00:36:47-05:00",0.000000,0.000000,0," "," "," "," "," "," "," "," "," "," "," "," "," "," ",0,0.000000," "," "," "," ",0.000000,0.000000,0,0," "," "," "," "
,"1550-1556 Lawrenceville Highway Lawrenceville, GA","http://bit.ly/Yo9mmq","02/16/2013 - 05:43pm",412835.000000,412835.000000,33.937830,-84.034661,423174.000000,1.000000,1.000000,0.000000,"412835-deep-pothole","Open","Deep Pothole","02/16/2013 - 05:43pm","2013-02-16T17:43:53-05:00",0.000000,0.000000,0," "," "," "," "," "," "," "," "," "," "," "," "," "," ",0,0.000000," "," "," "," ",0.000000,0.000000,0,0," "," "," "," "
,"3210 Tucker Norcross Road Tucker, GA 30084","http://bit.ly/ZiBuwd","02/16/2013 - 12:50pm",412675.000000,412675.000000,33.883764,-84.220796,423467.000000,1.000000,1.000000,0.000000,"412675-pothole-under-traffic-lights-at-pleasantdale-tucker-norcross","Open","Pothole Under Traffic Lights at Pleasantdale & Tucker-Norcross","02/16/2013 - 12:50pm","2013-02-16T12:50:51-05:00",103963.000000,0.000000,0," "," "," "," "," "," "," "," "," "," "," "," "," "," ",0,0.000000," "," "," "," ",0.000000,0.000000,0,0," "," "," "," "
,"3772 Ashford Trail Northeast Atlanta, GA 30319, USA","http://www.seeclickfix.com/issues/408176-pavement-problem","02/15/2013 - 09:28am",408176.000000,408176.000000,33.902571,-84.323225,425110.000000,1.000000,4.000000,2607.000000,"408176-pavement-problem","Acknowledged","Pavement Problem","10/19/2013 - 12:44pm","2013-10-19T12:44:26-04:00",111043.000000,1.000000,0," "," "," "," "," "," "," "," "," "," "," "," "," "," ",0,0.000000," "," "," "," ",0.000000,0.000000,0,0," "," "," "," "
,"4787 Elam Road Stone Mountain, GA 30083, USA","http://www.seeclickfix.com/issues/401765-pothole","02/13/2013 - 04:58pm",401765.000000,401765.000000,33.776074,-84.197933,427540.000000,1.000000,1.000000,0.000000,"401765-pothole","Open","pothole","02/13/2013 - 04:58pm","2013-02-13T16:58:31-05:00",108892.000000,0.000000,0," "," "," "," "," "," "," "," "," "," "," "," "," "," ",0,0.000000," "," "," "," ",0.000000,0.000000,0,0," "," "," "," "
,"2446 Dresden Drive Chamblee, GA 30341, USA","http://www.seeclickfix.com/issues/401764-pothole","02/13/2013 - 04:56pm",401764.000000,401764.000000,33.870295,-84.292198,427541.000000,1.000000,1.000000,0.000000,"401764-pothole","Open","pothole","02/13/2013 - 04:56pm","2013-02-13T16:56:52-05:00",108892.000000,0.000000,0," "," "," "," "," "," "," "," "," "," "," "," "," "," ",0,0.000000," "," "," "," ",0.000000,0.000000,0,0," "," "," "," "
,"Dekalb Medical Parkway lithonia, GA","http://www.seeclickfix.com/issues/401619-pot-holes","02/13/2013 - 02:14pm",401619.000000,401619.000000,33.712679,-84.146631,427703.000000,1.000000,1.000000,0.000000,"401619-pot-holes","Open","Pot Holes","02/13/2013 - 02:14pm","2013-02-13T14:14:52-05:00",0.000000,0.000000,0," "," "," "," "," "," "," "," "," "," "," "," "," "," ",0,0.000000," "," "," "," ",0.000000,0.000000,0,0," "," "," "," "
,"Jones Rd Macon, GA","http://www.seeclickfix.com/issues/399644-tree-limbs-blocking-visability","02/12/2013 - 04:46pm",399644.000000,399644.000000,32.731587,-83.702774,428992.000000,1.000000,1.000000,0.000000,"399644-tree-limbs-blocking-visability","Open","TREE LIMBS BLOCKING VISABILITY","02/12/2013 - 04:46pm","2013-02-12T16:46:13-05:00",0.000000,0.000000,0," "," "," "," "," "," "," "," "," "," "," "," "," "," ",0,0.000000," "," "," "," ",0.000000,0.000000,0,0," "," "," "," "
,"4211 Oak Forest Drive Northeast Atlanta, GA 30319, USA","http://bit.ly/VdmImP","02/12/2013 - 09:14am",399054.000000,399054.000000,33.917663,-84.332275,429444.000000,1.000000,5.000000,2795.000000,"399054-left-turn-arrow-request-into-oak-forest-hills","Acknowledged","Left Turn Arrow Request into Oak Forest Hills","04/04/2013 - 12:29pm","2013-04-04T12:29:41-04:00",107513.000000,3.000000,0," "," "," "," "," "," "," "," "," "," "," "," "," "," ",0,0.000000," "," "," "," ",0.000000,0.000000,0,0," "," "," "," "
,"1-91 Raymond Hill Newnan, GA 30265, USA","http://bit.ly/Y3zHWJ","02/10/2013 - 02:21pm",395744.000000,395744.000000,33.441256,-84.691988,432017.000000,1.000000,1.000000,0.000000,"395744-one-green-light-out","Open","One green light out","02/10/2013 - 02:21pm","2013-02-10T14:21:25-05:00",109823.000000,0.000000,0," "," "," "," "," "," "," "," "," "," "," "," "," "," ",0,0.000000," "," "," "," ",0.000000,0.000000,0,0," "," "," "," "
,"2235 Cobb Parkway Marietta, GA","http://bit.ly/XXoV4o","02/08/2013 - 03:20pm",393008.000000,393008.000000,33.902336,-84.476623,434838.000000,1.000000,1.000000,0.000000,"393008-construction-company-cut-the-side-road","Open","Construction Company cut the side road","02/08/2013 - 03:20pm","2013-02-08T15:20:06-05:00",0.000000,0.000000,0," "," "," "," "," "," "," "," "," "," "," "," "," "," ",0,0.000000," "," "," "," ",0.000000,0.000000,0,0," "," "," "," "
,"1330 Silver Hill Road Stone Mountain, GA","http://bit.ly/11VfPLi","02/08/2013 - 02:32pm",392991.000000,392991.000000,33.820345,-84.164513,434886.000000,1.000000,1.000000,0.000000,"392991-streetlight-malfunction","Open","Streetlight malfunction","02/08/2013 - 02:32pm","2013-02-08T14:32:20-05:00",0.000000,0.000000,0," "," "," "," "," "," "," "," "," "," "," "," "," "," ",0,0.000000," "," "," "," ",0.000000,0.000000,0,0," "," "," "," "
,"5233 Mccarter Station Stone Mountain, GA","http://www.seeclickfix.com/issues/391284-pothole-in-road","02/07/2013 - 03:26pm",391284.000000,391284.000000,33.766896,-84.175022,436272.000000,1.000000,1.000000,0.000000,"391284-pothole-in-road","Open","Pothole In Road","02/07/2013 - 03:26pm","2013-02-07T15:26:15-05:00",0.000000,0.000000,0," "," "," "," "," "," "," "," "," "," "," "," "," "," ",0,0.000000," "," "," "," ",0.000000,0.000000,0,0," "," "," "," "
,"Zebulon Rd And Plantation Centre Dr N Macon, GA","http://bit.ly/XqrLgx","02/07/2013 - 09:07am",390886.000000,390886.000000,32.879861,-83.758747,436651.000000,1.000000,1.000000,0.000000,"390886-removal-of-trash","Open","Removal of trash","05/01/2013 - 09:45am","2013-05-01T09:45:17-04:00",0.000000,0.000000,0," "," "," "," "," "," "," "," "," "," "," "," "," "," ",0,0.000000," "," "," "," ",0.000000,0.000000,0,0," "," "," "," "
,"101-265 Mullinax Road Alpharetta, GA","http://bit.ly/VHjWIQ","02/05/2013 - 06:19pm",387986.000000,387986.000000,34.154993,-84.231119,438978.000000,1.000000,1.000000,0.000000,"387986-green-light-timing-extension","Open","Green light timing extension","02/05/2013 - 06:19pm","2013-02-05T18:19:52-05:00",0.000000,0.000000,0," "," "," "," "," "," "," "," "," "," "," "," "," "," ",0,0.000000," "," "," "," ",0.000000,0.000000,0,0," "," "," "," "
,"295-307 Shoal Creek Road Canton, GA","http://www.seeclickfix.com/issues/385351-pothole","02/03/2013 - 03:12pm",385351.000000,385351.000000,34.250620,-84.498808,442046.000000,1.000000,5.000000,0.000000,"385351-pothole","Open","Pothole","02/05/2013 - 09:38am","2013-02-05T09:38:55-05:00",0.000000,4.000000,0," "," "," "," "," "," "," "," "," "," "," "," "," "," ",0,0.000000," "," "," "," ",0.000000,0.000000,0,0," "," "," "," "
,"3765 Watkins Place Northeast Atlanta, GA","http://bit.ly/XcrH4m","02/02/2013 - 11:50am",384449.000000,384449.000000,33.902783,-84.321197,443688.000000,1.000000,4.000000,2795.000000,"384449-cross-walk","Acknowledged","cross walk","06/04/2013 - 10:41pm","2013-06-04T22:41:40-04:00",0.000000,1.000000,0," "," "," "," "," "," "," "," "," "," "," "," "," "," ",0,0.000000," "," "," "," ",0.000000,0.000000,0,0," "," "," "," "
,"1497 Harts Mill Road Northeast Atlanta, GA","http://bit.ly/XcrIFo","02/02/2013 - 11:46am",384448.000000,384448.000000,33.901429,-84.328493,443692.000000,1.000000,3.000000,2795.000000,"384448-street-lights","Acknowledged","street lights","02/09/2013 - 12:27pm","2013-02-09T12:27:58-05:00",0.000000,0.000000,0," "," "," "," "," "," "," "," "," "," "," "," "," "," ",0,0.000000," "," "," "," ",0.000000,0.000000,0,0," "," "," "," "
,"3841 Northside Dr Macon, GA","http://www.seeclickfix.com/issues/383144-illegal-signs-on-the-right-of-ways","02/01/2013 - 03:33pm",383144.000000,383144.000000,32.897819,-83.694392,444905.000000,1.000000,1.000000,0.000000,"383144-illegal-signs-on-the-right-of-ways","Open","Illegal signs on the right of ways","05/03/2013 - 06:32am","2013-05-03T06:32:18-04:00",0.000000,0.000000,0," "," "," "," "," "," "," "," "," "," "," "," "," "," ",0,0.000000," "," "," "," ",0.000000,0.000000,0,0," "," "," "," "
,"3841 Northside Dr Macon, GA","http://www.seeclickfix.com/issues/383143-illegal-signs-on-the-right-of-ways","02/01/2013 - 03:32pm",383143.000000,383143.000000,32.897819,-83.694392,444906.000000,1.000000,1.000000,0.000000,"383143-illegal-signs-on-the-right-of-ways","Open","Illegal signs on the right of ways","05/01/2013 - 09:46am","2013-05-01T09:46:17-04:00",0.000000,0.000000,0," "," "," "," "," "," "," "," "," "," "," "," "," "," ",0,0.000000," "," "," "," ",0.000000,0.000000,0,0," "," "," "," "
,"Northside Dr And Forest Hill Rd Macon, GA","http://bit.ly/UC4ypR","02/01/2013 - 10:27am",382829.000000,382829.000000,32.899165,-83.703180,445210.000000,1.000000,1.000000,0.000000,"382829-illegal-signs-on-the-right-of-ways","Open","Illegal signs on the right of ways","06/02/2013 - 06:24am","2013-06-02T06:24:13-04:00",0.000000,0.000000,0," "," "," "," "," "," "," "," "," "," "," "," "," "," ",0,0.000000," "," "," "," ",0.000000,0.000000,0,0," "," "," "," "
,"Josiphine Run Drive Suwanee, GA","http://bit.ly/WXPvKl","02/01/2013 - 06:59am",382501.000000,382501.000000,34.070623,-84.028221,445419.000000,1.000000,2.000000,0.000000,"382501-pothole-in-neighborhood","Open","Pothole in neighborhood","04/03/2013 - 06:22am","2013-04-03T06:22:02-04:00",0.000000,1.000000,0," "," "," "," "," "," "," "," "," "," "," "," "," "," ",0,0.000000," "," "," "," ",0.000000,0.000000,0,0," "," "," "," "
,"149 Spivey Glen Drive Jonesboro, GA","http://bit.ly/WFuB4D","02/01/2013 - 12:49am",381690.000000,381690.000000,33.538225,-84.284623,445789.000000,1.000000,1.000000,0.000000,"381690-street-light-out","Open","Street Light OUt","02/01/2013 - 12:49am","2013-02-01T00:49:16-05:00",0.000000,0.000000,0," "," "," "," "," "," "," "," "," "," "," "," "," "," ",0,0.000000," "," "," "," ",0.000000,0.000000,0,0," "," "," "," "
,"2788 Lavista Road Ne Decatur, GA","http://www.seeclickfix.com/issues/381242-deep-pothole-in-road","01/31/2013 - 05:49pm",381242.000000,381242.000000,33.825144,-84.292453,446209.000000,1.000000,1.000000,0.000000,"381242-deep-pothole-in-road","Open","deep pothole in road","07/24/2013 - 08:19am","2013-07-24T08:19:07-04:00",135739.000000,0.000000,0," "," "," "," "," "," "," "," "," "," "," "," "," "," ",0,0.000000," "," "," "," ",0.000000,0.000000,0,0," "," "," "," "
,"2788 Lavista Road Decatur/Dekalb, GA","http://bit.ly/XoFNRk","01/31/2013 - 02:27pm",381096.000000,381096.000000,33.825144,-84.292453,446411.000000,1.000000,3.000000,0.000000,"381096-pot-hole","Open","Pot Hole","04/27/2013 - 09:53pm","2013-04-27T21:53:39-04:00",0.000000,2.000000,0," "," "," "," "," "," "," "," "," "," "," "," "," "," ",0,0.000000," "," "," "," ",0.000000,0.000000,0,0," "," "," "," "
,"231-857 West Seminole Drive Byron, GA","http://www.seeclickfix.com/issues/378804-holes-in-road","01/30/2013 - 02:11pm",378804.000000,378804.000000,32.675750,-83.739754,447866.000000,1.000000,1.000000,0.000000,"378804-holes-in-road","Open","holes in road","01/30/2013 - 02:11pm","2013-01-30T14:11:54-05:00",0.000000,0.000000,0," "," "," "," "," "," "," "," "," "," "," "," "," "," ",0,0.000000," "," "," "," ",0.000000,0.000000,0,0," "," "," "," "
,"3995 Ashford Dunwoody Rd Ne Brookhaven, GA","http://bit.ly/VvEwMh","01/30/2013 - 09:33am",378407.000000,378407.000000,33.909274,-84.331521,448145.000000,1.000000,22.000000,2795.000000,"378407-children-cannot-safely-corss-the-street-to-montgomery","Acknowledged","Children Cannot Safely Corss the Street to Montgomery","11/21/2013 - 10:26am","2013-11-21T10:26:32-05:00",0.000000,18.000000,0," "," "," "," "," "," "," "," "," "," "," "," "," "," ",0,0.000000," "," "," "," ",0.000000,0.000000,0,0," "," "," "," "
,"4300 Pleasantdale Road Doraville, GA  30340, GA","http://www.seeclickfix.com/issues/374172-broken-pavement-multiple-potholes","01/28/2013 - 01:59pm",374172.000000,374172.000000,33.908771,-84.248591,450759.000000,1.000000,10.000000,0.000000,"374172-broken-pavement-multiple-potholes","Open","Broken Pavement, Multiple Potholes","11/27/2013 - 09:19pm","2013-11-27T21:19:56-05:00",0.000000,7.000000,0," "," "," "," "," "," "," "," "," "," "," "," "," "," ",0,0.000000," "," "," "," ",0.000000,0.000000,0,0," "," "," "," "
,"37 Hardwood Court Newnan, GA 30265, USA","http://bit.ly/X0iRpP","01/26/2013 - 10:50am",372801.000000,372801.000000,33.400035,-84.688529,453828.000000,1.000000,1.000000,0.000000,"372801-street-light-out","Open","Street light out","01/26/2013 - 10:50am","2013-01-26T10:50:08-05:00",10799.000000,0.000000,0," "," "," "," "," "," "," "," "," "," "," "," "," "," ",0,0.000000," "," "," "," ",0.000000,0.000000,0,0," "," "," "," "
,"6377 Polar Fox Court RIVERDALE, GA 30296","http://bit.ly/WlYMxL","01/25/2013 - 07:06pm",371845.000000,371845.000000,33.579368,-84.462574,454772.000000,1.000000,1.000000,0.000000,"371845-fulton-county-need-to-place-the-final-asphalt-topping-at-fox-subdivions","Open","FULTON COUNTY NEED TO PLACE THE FINAL ASPHALT TOPPING AT FOX SUBDIVIONS","01/25/2013 - 07:06pm","2013-01-25T19:06:36-05:00",0.000000,0.000000,0," "," "," "," "," "," "," "," "," "," "," "," "," "," ",0,0.000000," "," "," "," ",0.000000,0.000000,0,0," "," "," "," "
,"Kirkland Dr. Ne Atlanta, GA","http://bit.ly/10WGN5u","01/25/2013 - 01:48pm",371740.000000,371740.000000,33.837658,-84.289763,455090.000000,1.000000,4.000000,0.000000,"371740-tree-branches-growing-into-road","Open","tree branches growing into road","07/25/2013 - 03:59pm","2013-07-25T15:59:36-04:00",0.000000,2.000000,0," "," "," "," "," "," "," "," "," "," "," "," "," "," ",0,0.000000," "," "," "," ",0.000000,0.000000,0,0," "," "," "," "
,"Harts Mill Road Ne @ Watkins Atlanta, GA","http://www.seeclickfix.com/issues/371608-cross-walk-needed","01/25/2013 - 10:30am",371608.000000,371608.000000,33.902006,-84.321568,455288.000000,1.000000,4.000000,2795.000000,"371608-cross-walk-needed","Acknowledged","Cross walk Needed","01/28/2013 - 09:44pm","2013-01-28T21:44:38-05:00",0.000000,3.000000,0," "," "," "," "," "," "," "," "," "," "," "," "," "," ",0,0.000000," "," "," "," ",0.000000,0.000000,0,0," "," "," "," "
,"3063 Oakvale Heights decatur/dekalb, GA","http://www.seeclickfix.com/issues/370226-pothole","01/24/2013 - 06:10pm",370226.000000,370226.000000,33.678620,-84.264964,456268.000000,1.000000,1.000000,0.000000,"370226-pothole","Open","pothole","01/24/2013 - 06:10pm","2013-01-24T18:10:00-05:00",0.000000,0.000000,0," "," "," "," "," "," "," "," "," "," "," "," "," "," ",0,0.000000," "," "," "," ",0.000000,0.000000,0,0," "," "," "," "
,"Bass Rd And Rivoli Rd Macon, GA","http://bit.ly/W1ry6o","01/24/2013 - 09:35am",369846.000000,369846.000000,32.907733,-83.745569,456783.000000,1.000000,1.000000,0.000000,"369846-illegal-sign","Open","Illegal sign","05/01/2013 - 09:47am","2013-05-01T09:47:26-04:00",0.000000,0.000000,0," "," "," "," "," "," "," "," "," "," "," "," "," "," ",0,0.000000," "," "," "," ",0.000000,0.000000,0,0," "," "," "," "
,"4300 Pleasantdale Rd. Chamblee, GA","http://bit.ly/YoA7f2","01/23/2013 - 07:40pm",368635.000000,368635.000000,33.907268,-84.246512,457617.000000,1.000000,3.000000,0.000000,"368635-potholes-railroad-tracks","Open","Potholes/Railroad tracks","03/29/2013 - 07:15pm","2013-03-29T19:15:21-04:00",0.000000,1.000000,0," "," "," "," "," "," "," "," "," "," "," "," "," "," ",0,0.000000," "," "," "," ",0.000000,0.000000,0,0," "," "," "," "
,"Plantation Centre Dr N And Zebulon Rd Macon, GA","http://www.seeclickfix.com/issues/366642-debris-at-intersection","01/22/2013 - 01:41pm",366642.000000,366642.000000,32.879861,-83.758747,459417.000000,1.000000,1.000000,0.000000,"366642-debris-at-intersection","Open","Debris at intersection","05/01/2013 - 09:42am","2013-05-01T09:42:27-04:00",0.000000,0.000000,0," "," "," "," "," "," "," "," "," "," "," "," "," "," ",0,0.000000," "," "," "," ",0.000000,0.000000,0,0," "," "," "," "
,"3660-3668 Ashford Dunwoody Road Northeast Atlanta, GA","http://www.seeclickfix.com/issues/366473-chains-protruding-from-catch-basin-lid","01/22/2013 - 10:48am",366473.000000,366473.000000,33.897654,-84.330596,459590.000000,1.000000,3.000000,2790.000000,"366473-chains-protruding-from-catch-basin-lid","Acknowledged","Chains Protruding from Catch Basin Lid","03/02/2013 - 12:32pm","2013-03-02T12:32:48-05:00",0.000000,1.000000,0," "," "," "," "," "," "," "," "," "," "," "," "," "," ",0,0.000000," "," "," "," ",0.000000,0.000000,0,0," "," "," "," "
,"3692 Ashford Dunwoody Road Northeast Atlanta, GA","http://www.seeclickfix.com/issues/366464-crosswalk-at-the-ymca","01/22/2013 - 10:42am",366464.000000,366464.000000,33.899043,-84.331454,459596.000000,1.000000,8.000000,2604.000000,"366464-crosswalk-at-the-ymca","Acknowledged","Crosswalk at the YMCA","09/15/2013 - 06:08pm","2013-09-15T18:08:37-04:00",0.000000,5.000000,0," "," "," "," "," "," "," "," "," "," "," "," "," "," ",0,0.000000," "," "," "," ",0.000000,0.000000,0,0," "," "," "," "
,"3536-3564 Ashford Dunwoody Road Northeast Atlanta, GA","http://www.seeclickfix.com/issues/366455-crosswalks-at-cambridge-square","01/22/2013 - 10:37am",366455.000000,366455.000000,33.894519,-84.328750,459601.000000,1.000000,7.000000,2604.000000,"366455-crosswalks-at-cambridge-square","Acknowledged","Crosswalks at Cambridge Square","09/15/2013 - 06:05pm","2013-09-15T18:05:45-04:00",0.000000,6.000000,0," "," "," "," "," "," "," "," "," "," "," "," "," "," ",0,0.000000," "," "," "," ",0.000000,0.000000,0,0," "," "," "," "
,"Us 78 West At I-285 South Stone Mountain, GA","http://bit.ly/Xtf04W","01/21/2013 - 12:55pm",365711.000000,365711.000000,33.818353,-84.247677,460903.000000,1.000000,2.000000,0.000000,"365711-huge-pothole-in-middle-of-on-ramp","Open","Huge pothole in middle of on ramp","02/22/2013 - 07:49pm","2013-02-22T19:49:54-05:00",0.000000,1.000000,0," "," "," "," "," "," "," "," "," "," "," "," "," "," ",0,0.000000," "," "," "," ",0.000000,0.000000,0,0," "," "," "," "
,"Morris Stevens Rd Gray/JONES, GA","http://bit.ly/T72Ymf","01/20/2013 - 07:30pm",365185.000000,365185.000000,32.930704,-83.447071,461948.000000,1.000000,1.000000,0.000000,"365185-report-road-issues","Open","Report road issues.","01/20/2013 - 07:30pm","2013-01-20T19:30:05-05:00",0.000000,0.000000,0," "," "," "," "," "," "," "," "," "," "," "," "," "," ",0,0.000000," "," "," "," ",0.000000,0.000000,0,0," "," "," "," "
,"King Road Riverdale, GA","http://bit.ly/XKNJNv","01/19/2013 - 12:19am",363520.000000,363520.000000,33.581167,-84.429180,464539.000000,1.000000,1.000000,0.000000,"363520-too-many-potholes-to-count","Open","Too many potholes to count","01/19/2013 - 12:19am","2013-01-19T00:19:14-05:00",0.000000,0.000000,0," "," "," "," "," "," "," "," "," "," "," "," "," "," ",0,0.000000," "," "," "," ",0.000000,0.000000,0,0," "," "," "," "
,"465 Chartley Dr Stone Mountain, GA","http://www.seeclickfix.com/issues/361132-street-light-out","01/17/2013 - 01:52pm",361132.000000,361132.000000,33.783610,-84.205782,466606.000000,1.000000,2.000000,0.000000,"361132-street-light-out","Open","Street Light out","01/17/2013 - 01:52pm","2013-01-17T13:52:38-05:00",0.000000,1.000000,0," "," "," "," "," "," "," "," "," "," "," "," "," "," ",0,0.000000," "," "," "," ",0.000000,0.000000,0,0," "," "," "," "
,"Us 41 Near Creastveiw Gas Station Warner Robins, GA","http://bit.ly/10g7wJ0","01/17/2013 - 07:21am",360733.000000,360733.000000,32.596969,-83.717963,466997.000000,1.000000,1.000000,0.000000,"360733-report-road-issues","Open","Report road issues.","01/17/2013 - 07:21am","2013-01-17T07:21:32-05:00",0.000000,0.000000,0," "," "," "," "," "," "," "," "," "," "," "," "," "," ",0,0.000000," "," "," "," ",0.000000,0.000000,0,0," "," "," "," "
,"3795-3797 Clairmont Road Atlanta, GA 30341, USA","http://www.seeclickfix.com/issues/357468-incomplete-handicap-ramp","01/15/2013 - 11:56am",357468.000000,357468.000000,33.872467,-84.309150,469602.000000,1.000000,1.000000,0.000000,"357468-incomplete-handicap-ramp","Open","Incomplete handicap ramp","01/15/2013 - 11:56am","2013-01-15T11:56:09-05:00",99646.000000,0.000000,0," "," "," "," "," "," "," "," "," "," "," "," "," "," ",0,0.000000," "," "," "," ",0.000000,0.000000,0,0," "," "," "," "
,"Maplewood Dr Macon, GA","http://www.seeclickfix.com/issues/355446-sink-holes","01/14/2013 - 10:53am",355446.000000,355446.000000,32.894848,-83.711820,471105.000000,1.000000,2.000000,1900.000000,"355446-sink-holes","Acknowledged","sink holes","08/01/2013 - 09:18am","2013-08-01T09:18:05-04:00",0.000000,0.000000,0," "," "," "," "," "," "," "," "," "," "," "," "," "," ",0,0.000000," "," "," "," ",0.000000,0.000000,0,0," "," "," "," "
,"5633 Wells Circle Stone Mountain, Dekalb, GA","http://bit.ly/13oDwKA","01/12/2013 - 10:14am",353952.000000,353952.000000,33.780799,-84.158818,474024.000000,1.000000,1.000000,0.000000,"353952-pot-hole","Open","Pot Hole","01/12/2013 - 10:14am","2013-01-12T10:14:50-05:00",0.000000,0.000000,0," "," "," "," "," "," "," "," "," "," "," "," "," "," ",0,0.000000," "," "," "," ",0.000000,0.000000,0,0," "," "," "," "
,"Broad Avenue Valley, AL","http://bit.ly/VvfmeU","01/11/2013 - 06:57pm",352389.000000,352389.000000,32.847561,-85.184988,474941.000000,1.000000,1.000000,0.000000,"352389-left-turn-signal-from-hwy-29-sb-to-i-85-nb-has-been-out-for-years","Open","Left turn signal from Hwy 29 SB to I-85 NB has been out for years","01/11/2013 - 06:57pm","2013-01-11T18:57:51-05:00",0.000000,0.000000,0," "," "," "," "," "," "," "," "," "," "," "," "," "," ",0,0.000000," "," "," "," ",0.000000,0.000000,0,0," "," "," "," "
,"3461 Chamblee Tucker Road Atlanta, GA","http://www.seeclickfix.com/issues/350103-pothole-in-road","01/10/2013 - 10:14am",350103.000000,350103.000000,33.885464,-84.250690,476904.000000,1.000000,2.000000,0.000000,"350103-pothole-in-road","Open","pothole in road","07/24/2013 - 08:19am","2013-07-24T08:19:43-04:00",135739.000000,1.000000,0," "," "," "," "," "," "," "," "," "," "," "," "," "," ",0,0.000000," "," "," "," ",0.000000,0.000000,0,0," "," "," "," "
,"4240 Pleasantdale Road Atlanta, GA","http://bit.ly/TLGRja","01/09/2013 - 05:48pm",348666.000000,348666.000000,33.907394,-84.246683,477890.000000,1.000000,2.000000,0.000000,"348666-potholes-and-bumpy-railroad-crossing","Open","Potholes and BUMPY railroad crossing","01/29/2013 - 08:20am","2013-01-29T08:20:23-05:00",0.000000,1.000000,0," "," "," "," "," "," "," "," "," "," "," "," "," "," ",0,0.000000," "," "," "," ",0.000000,0.000000,0,0," "," "," "," "
,"Graham Rd. Macon, GA","http://bit.ly/TLAtIz","01/09/2013 - 04:45pm",348637.000000,348637.000000,32.894805,-83.607498,477953.000000,1.000000,1.000000,0.000000,"348637-litter-clean-r-w","Open","Litter Clean R / W","01/09/2013 - 04:45pm","2013-01-09T16:45:31-05:00",38470.000000,0.000000,0," "," "," "," "," "," "," "," "," "," "," "," "," "," ",0,0.000000," "," "," "," ",0.000000,0.000000,0,0," "," "," "," "
,"Plantation Centre Dr N Macon, GA","http://bit.ly/WvPWt3","01/08/2013 - 07:29pm",346724.000000,346724.000000,32.884061,-83.758632,479228.000000,1.000000,1.000000,0.000000,"346724-clean-up","Open","Clean up","05/01/2013 - 09:45am","2013-05-01T09:45:47-04:00",0.000000,0.000000,0," "," "," "," "," "," "," "," "," "," "," "," "," "," ",0,0.000000," "," "," "," ",0.000000,0.000000,0,0," "," "," "," "
,"619 Roberson Road Rockmart/Paulding, GA","http://www.seeclickfix.com/issues/346485-paulding-will-not-keep-this-road-graded","01/08/2013 - 01:31pm",346485.000000,346485.000000,33.915895,-85.039045,479587.000000,1.000000,2.000000,0.000000,"346485-paulding-will-not-keep-this-road-graded","Open","Paulding will not keep this road graded","02/08/2013 - 09:57pm","2013-02-08T21:57:13-05:00",0.000000,0.000000,0," "," "," "," "," "," "," "," "," "," "," "," "," "," ",0,0.000000," "," "," "," ",0.000000,0.000000,0,0," "," "," "," "
,"285 Sux Cobb, GA","http://www.seeclickfix.com/issues/344664-when-will-they-ever-fix-285","01/07/2013 - 04:38pm",344664.000000,344664.000000,33.901338,-84.443743,480840.000000,1.000000,2.000000,0.000000,"344664-when-will-they-ever-fix-285","Closed","When will they EVER FIX 285?","12/04/2013 - 09:20am","2013-12-04T09:20:08-05:00",0.000000,0.000000,0," "," "," "," "," "," "," "," "," "," "," "," "," "," ",0,0.000000," "," "," "," ",0.000000,0.000000,0,0," "," "," "," "
,"3698 Dunlin Shore Court Norcross, GA","http://bit.ly/Xe2mc2","01/07/2013 - 06:25am",344155.000000,344155.000000,33.970878,-84.198815,481453.000000,1.000000,1.000000,0.000000,"344155-street-light-is-out","Open","Street light is out.","01/07/2013 - 06:25am","2013-01-07T06:25:22-05:00",0.000000,0.000000,0," "," "," "," "," "," "," "," "," "," "," "," "," "," ",0,0.000000," "," "," "," ",0.000000,0.000000,0,0," "," "," "," "
,"5831-5855 Zebulon Road Macon, GA","http://bit.ly/WlLVHv","01/06/2013 - 10:29pm",343975.000000,343975.000000,32.880054,-83.756722,481929.000000,1.000000,1.000000,0.000000,"343975-dead-pine-trees","Open","Dead Pine Trees","01/06/2013 - 10:29pm","2013-01-06T22:29:19-05:00",0.000000,0.000000,0," "," "," "," "," "," "," "," "," "," "," "," "," "," ",0,0.000000," "," "," "," ",0.000000,0.000000,0,0," "," "," "," "
,"4398 Allenhurst Drive Norcross, GA 30092, USA","http://www.seeclickfix.com/issues/340036-8-x-8-pot-hole-road-hazard","01/03/2013 - 11:28am",340036.000000,340036.000000,33.980453,-84.229988,486910.000000,1.000000,1.000000,0.000000,"340036-8-x-8-pot-hole-road-hazard","Open","8' x 8' pot hole/road hazard","01/03/2013 - 11:28am","2013-01-03T11:28:32-05:00",97340.000000,0.000000,0," "," "," "," "," "," "," "," "," "," "," "," "," "," ",0,0.000000," "," "," "," ",0.000000,0.000000,0,0," "," "," "," "
,"4398 Allenhurst Drive Norcross, GA 30092, USA","http://www.seeclickfix.com/issues/340035-8-x-8-pot-hole-road-hazard","01/03/2013 - 11:28am",340035.000000,340035.000000,33.980453,-84.229988,486910.000000,1.000000,1.000000,0.000000,"340035-8-x-8-pot-hole-road-hazard","Open","8' x 8' pot hole/road hazard","01/03/2013 - 11:28am","2013-01-03T11:28:31-05:00",97340.000000,0.000000,0," "," "," "," "," "," "," "," "," "," "," "," "," "," ",0,0.000000," "," "," "," ",0.000000,0.000000,0,0," "," "," "," "
,"4398 Allenhurst Drive Norcross, GA 30092, USA","http://www.seeclickfix.com/issues/340034-8-x-8-pot-hole-road-hazard","01/03/2013 - 11:28am",340034.000000,340034.000000,33.980453,-84.229988,486910.000000,1.000000,1.000000,0.000000,"340034-8-x-8-pot-hole-road-hazard","Open","8' x 8' pot hole/road hazard","01/03/2013 - 11:28am","2013-01-03T11:28:29-05:00",97340.000000,0.000000,0," "," "," "," "," "," "," "," "," "," "," "," "," "," ",0,0.000000," "," "," "," ",0.000000,0.000000,0,0," "," "," "," "
,"4398 Allenhurst Drive Norcross, GA 30092, USA","http://www.seeclickfix.com/issues/340033-8-x-8-pot-hole-road-hazard","01/03/2013 - 11:27am",340033.000000,340033.000000,33.980453,-84.229988,486910.000000,1.000000,1.000000,0.000000,"340033-8-x-8-pot-hole-road-hazard","Open","8' x 8' pot hole/road hazard","01/03/2013 - 11:27am","2013-01-03T11:27:59-05:00",97340.000000,0.000000,0," "," "," "," "," "," "," "," "," "," "," "," "," "," ",0,0.000000," "," "," "," ",0.000000,0.000000,0,0," "," "," "," "
,"4398 Allenhurst Drive Norcross, GA 30092, USA","http://bit.ly/ZXacfr","01/03/2013 - 10:24am",339953.000000,339953.000000,33.980453,-84.229988,486974.000000,1.000000,1.000000,0.000000,"339953-8-x-8-pot-hole-road-hazard","Open","8' x 8' pot hole/road hazard","01/03/2013 - 10:24am","2013-01-03T10:24:53-05:00",97340.000000,0.000000,0," "," "," "," "," "," "," "," "," "," "," "," "," "," ",0,0.000000," "," "," "," ",0.000000,0.000000,0,0," "," "," "," "
,"5576 Colbert Trail Norcross, GA","http://bit.ly/WlRWVf","01/02/2013 - 08:45pm",338837.000000,338837.000000,33.980978,-84.232417,487793.000000,1.000000,1.000000,0.000000,"338837-large-and-getting-deeper-8-x8-pothole-on-colbert-trail","Open","Large and getting deeper 8'x8' pothole on Colbert Trail","01/02/2013 - 08:45pm","2013-01-02T20:45:45-05:00",0.000000,0.000000,0," "," "," "," "," "," "," "," "," "," "," "," "," "," ",0,0.000000," "," "," "," ",0.000000,0.000000,0,0," "," "," "," "
,"101 Embassy Ct. Macon, GA","http://bit.ly/Vkp8Mz","01/02/2013 - 07:55am",338297.000000,338297.000000,32.885819,-83.738291,488563.000000,1.000000,1.000000,0.000000,"338297-mattress-etc-by-the-street","Open","mattress, etc. by the street","05/01/2013 - 09:46am","2013-05-01T09:46:51-04:00",0.000000,0.000000,0," "," "," "," "," "," "," "," "," "," "," "," "," "," ",0,0.000000," "," "," "," ",0.000000,0.000000,0,0," "," "," "," "
,"5300-5500 Blocks Of Zebulon Road Macon, GA","http://bit.ly/UG7K8g","12/29/2012 - 05:42pm",335950.000000,335950.000000,32.879669,-83.739074,493736.000000,1.000000,2.000000,0.000000,"335950-dead-pine-trees","Open","Dead Pine Trees","03/03/2013 - 02:18pm","2013-03-03T14:18:52-05:00",0.000000,0.000000,0," "," "," "," "," "," "," "," "," "," "," "," "," "," ",0,0.000000," "," "," "," ",0.000000,0.000000,0,0," "," "," "," "
,"364  Marsh View Drive Richmond Hill, GA 31324, USA","http://bit.ly/Vk4KyG","12/27/2012 - 11:00am",333155.000000,333155.000000,31.832384,-81.319545,497018.000000,1.000000,1.000000,0.000000,"333155-missing-sidewalk","Open","Missing Sidewalk","12/27/2012 - 11:00am","2012-12-27T11:00:56-05:00",0.000000,0.000000,0," "," "," "," "," "," "," "," "," "," "," "," "," "," ",0,0.000000," "," "," "," ",0.000000,0.000000,0,0," "," "," "," "
,"4081-4123 Chamblee Dunwoody Road Atlanta, GA","http://bit.ly/WHDCXB","12/22/2012 - 11:05pm",329948.000000,329948.000000,33.912155,-84.310982,503493.000000,1.000000,3.000000,0.000000,"329948-potholes-in-road","Open","potholes in road","11/22/2013 - 10:09am","2013-11-22T10:09:18-05:00",135739.000000,1.000000,0," "," "," "," "," "," "," "," "," "," "," "," "," "," ",0,0.000000," "," "," "," ",0.000000,0.000000,0,0," "," "," "," "
,"52 County Road 161a Quincy, FL 32352, USA","http://bit.ly/WxxPoZ","12/22/2012 - 12:01pm",329672.000000,329672.000000,30.654956,-84.484107,504157.000000,1.000000,2.000000,0.000000,"329672-potholes-dogtown-road","Open","Potholes - Dogtown Road","02/01/2013 - 08:20am","2013-02-01T08:20:01-05:00",0.000000,0.000000,0," "," "," "," "," "," "," "," "," "," "," "," "," "," ",0,0.000000," "," "," "," ",0.000000,0.000000,0,0," "," "," "," "
,"Moore Conley, GA 30288","http://www.seeclickfix.com/issues/327067-pot-hole-on-moore-rd","12/20/2012 - 11:42am",327067.000000,327067.000000,33.666680,-84.314489,507056.000000,1.000000,1.000000,0.000000,"327067-pot-hole-on-moore-rd","Open","Pot Hole on Moore Rd.","12/20/2012 - 11:42am","2012-12-20T11:42:06-05:00",0.000000,0.000000,0," "," "," "," "," "," "," "," "," "," "," "," "," "," ",0,0.000000," "," "," "," ",0.000000,0.000000,0,0," "," "," "," "
,"3465 Lockmed Drive Norcross, GA","http://bit.ly/T7zKkQ","12/19/2012 - 09:31am",325541.000000,325541.000000,33.974038,-84.209067,508627.000000,1.000000,1.000000,0.000000,"325541-street-light-out","Open","Street Light Out","12/19/2012 - 09:31am","2012-12-19T09:31:52-05:00",0.000000,0.000000,0," "," "," "," "," "," "," "," "," "," "," "," "," "," ",0,0.000000," "," "," "," ",0.000000,0.000000,0,0," "," "," "," "
,"Bolton Rd@285on Accessrdto285 atlantae, GA","http://bit.ly/XGCunN","12/18/2012 - 07:04pm",324278.000000,324278.000000,32.157435,-82.907123,509494.000000,1.000000,2.000000,0.000000,"324278-part-of-road-bad-going-to-285","Open","part of road bad going to 285","03/13/2013 - 12:19am","2013-03-13T00:19:23-04:00",0.000000,0.000000,0," "," "," "," "," "," "," "," "," "," "," "," "," "," ",0,0.000000," "," "," "," ",0.000000,0.000000,0,0," "," "," "," "
,"2125 Waters Run Decatur, GA 30035, USA","http://bit.ly/WhRHQK","12/17/2012 - 08:08am",322248.000000,322248.000000,33.727459,-84.195777,511590.000000,1.000000,1.000000,0.000000,"322248-stop-sign-obstruction","Open","Stop Sign Obstruction","02/18/2013 - 10:45am","2013-02-18T10:45:03-05:00",89132.000000,0.000000,0," "," "," "," "," "," "," "," "," "," "," "," "," "," ",0,0.000000," "," "," "," ",0.000000,0.000000,0,0," "," "," "," "
,"533 Owl Creek Dr powder springs, GA","http://bit.ly/VKD0zt","12/16/2012 - 08:24pm",321968.000000,321968.000000,33.966317,-84.715442,512294.000000,1.000000,1.000000,0.000000,"321968-safety-issue-with-damaged-sidewalk","Open","Safety issue with damaged sidewalk","12/16/2012 - 08:24pm","2012-12-16T20:24:03-05:00",0.000000,0.000000,0," "," "," "," "," "," "," "," "," "," "," "," "," "," ",0,0.000000," "," "," "," ",0.000000,0.000000,0,0," "," "," "," "
,"1950 Barrett Lakes Blvd Nw Kennesaw, GA home center dr is the cross intersection","http://bit.ly/VG3vq9","12/13/2012 - 11:43pm",318821.000000,318821.000000,34.000702,-84.572936,516415.000000,1.000000,2.000000,0.000000,"318821-accidents-on-barrett-lakes","Open","ACCIDENTS ON BARRETT LAKES","12/14/2012 - 04:04pm","2012-12-14T16:04:22-05:00",0.000000,1.000000,0," "," "," "," "," "," "," "," "," "," "," "," "," "," ",0,0.000000," "," "," "," ",0.000000,0.000000,0,0," "," "," "," "
," Webb Drive   Tucker , GA","http://bit.ly/XgGLhu","12/13/2012 - 09:13am",318273.000000,318273.000000,33.903911,-84.217508,517285.000000,1.000000,1.000000,0.000000,"318273-metal-plates-on-road","Open","metal plates on road","12/13/2012 - 09:13am","2012-12-13T09:13:40-05:00",0.000000,0.000000,0," "," "," "," "," "," "," "," "," "," "," "," "," "," ",0,0.000000," "," "," "," ",0.000000,0.000000,0,0," "," "," "," "
,"800 Mccall Rd Macon, GA 31217, USA","http://bit.ly/TPtTxM","12/12/2012 - 03:31pm",317141.000000,317141.000000,32.847782,-83.579002,518347.000000,1.000000,1.000000,0.000000,"317141-other","Open","Other","07/03/2013 - 10:31pm","2013-07-03T22:31:44-04:00",0.000000,0.000000,0," "," "," "," "," "," "," "," "," "," "," "," "," "," ",0,0.000000," "," "," "," ",0.000000,0.000000,0,0," "," "," "," "
,"1901 Lower Fayetteville Road Newnan, GA","http://bit.ly/VVtVKf","12/12/2012 - 10:07am",316859.000000,316859.000000,33.376557,-84.727561,518671.000000,1.000000,5.000000,0.000000,"316859-mobile-park-that-looks-like-a-junkyard","Open","Mobile Park that looks like a junkyard","08/30/2013 - 09:36pm","2013-08-30T21:36:25-04:00",91870.000000,6.000000,0," "," "," "," "," "," "," "," "," "," "," "," "," "," ",0,0.000000," "," "," "," ",0.000000,0.000000,0,0," "," "," "," "
,"5111 Fairforest Dr. Stone Mountain/ dekalb, GA","http://bit.ly/Vxyx3j","12/11/2012 - 10:19am",315241.000000,315241.000000,33.778854,-84.189168,520099.000000,1.000000,1.000000,0.000000,"315241-pothold-backdriveway-coner-of-fairforest-hearon-dr","Open","pothold & backdriveway /coner of fairforest & hearon dr.","12/11/2012 - 10:19am","2012-12-11T10:19:30-05:00",0.000000,0.000000,0," "," "," "," "," "," "," "," "," "," "," "," "," "," ",0,0.000000," "," "," "," ",0.000000,0.000000,0,0," "," "," "," "
,"4711-4763 Redbranch Dr Decatur, GA 30035, USA","http://bit.ly/QQYIWT","12/03/2012 - 08:50am",304748.000000,304748.000000,33.727502,-84.195989,531708.000000,1.000000,4.000000,0.000000,"304748-obstruction-of-view","Open","Obstruction of view","03/26/2013 - 01:52pm","2013-03-26T13:52:57-04:00",89132.000000,1.000000,0," "," "," "," "," "," "," "," "," "," "," "," "," "," ",0,0.000000," "," "," "," ",0.000000,0.000000,0,0," "," "," "," "
,"5321 Zebulon Rd Macon, GA","http://bit.ly/XO8RFi","11/16/2012 - 09:56pm",286785.000000,286785.000000,32.879879,-83.740291,555402.000000,1.000000,1.000000,0.000000,"286785-dead-trees","Open","dead trees","11/16/2012 - 09:56pm","2012-11-16T21:56:41-05:00",0.000000,0.000000,0," "," "," "," "," "," "," "," "," "," "," "," "," "," ",0,0.000000," "," "," "," ",0.000000,0.000000,0,0," "," "," "," "
,"Cumberland Blvd At Cobb Pkwy Atlanta, GA","http://bit.ly/WaypYg","11/15/2012 - 11:39pm",285407.000000,285407.000000,33.876519,-84.456092,556739.000000,1.000000,1.000000,0.000000,"285407-steep-drop-off-no-guard-rails","Open","steep drop off, no guard rails","11/15/2012 - 11:39pm","2012-11-15T23:39:22-05:00",0.000000,0.000000,0," "," "," "," "," "," "," "," "," "," "," "," "," "," ",0,0.000000," "," "," "," ",0.000000,0.000000,0,0," "," "," "," "
,"I75 South/285 East  Exit 238a forest park, clayton, GA","http://bit.ly/PXkMxl","11/15/2012 - 06:55pm",285140.000000,285140.000000,33.631291,-84.402673,557023.000000,1.000000,2.000000,0.000000,"285140-cracks-potholes","Open","cracks/potholes","11/15/2012 - 07:05pm","2012-11-15T19:05:54-05:00",0.000000,1.000000,0," "," "," "," "," "," "," "," "," "," "," "," "," "," ",0,0.000000," "," "," "," ",0.000000,0.000000,0,0," "," "," "," "
,"1921 Lilburn-Stone Mountain Rd Stone Mountain, GA","http://www.seeclickfix.com/issues/283365-drop-off-gully-instead-of-shoulder","11/14/2012 - 04:58pm",283365.000000,283365.000000,33.838643,-84.150037,558580.000000,1.000000,2.000000,0.000000,"283365-drop-off-gully-instead-of-shoulder","Open","Drop off, gully instead of shoulder","07/14/2013 - 01:23am","2013-07-14T01:23:12-04:00",0.000000,0.000000,0," "," "," "," "," "," "," "," "," "," "," "," "," "," ",0,0.000000," "," "," "," ",0.000000,0.000000,0,0," "," "," "," "
,"Waldrop Rd Dekalb, GA","http://www.seeclickfix.com/issues/283357-horrible-condition","11/14/2012 - 04:43pm",283357.000000,283357.000000,33.680154,-84.254029,558595.000000,1.000000,2.000000,0.000000,"283357-horrible-condition","Open","Horrible Condition","11/11/2013 - 05:52am","2013-11-11T05:52:26-05:00",0.000000,0.000000,0," "," "," "," "," "," "," "," "," "," "," "," "," "," ",0,0.000000," "," "," "," ",0.000000,0.000000,0,0," "," "," "," "
,"108 Embassy Ct Macon, GA","http://www.seeclickfix.com/issues/282992-garbage-can-in-front-yard","11/14/2012 - 10:41am",282992.000000,282992.000000,32.886465,-83.738563,558957.000000,1.000000,2.000000,0.000000,"282992-garbage-can-in-front-yard","Open","Garbage can in front yard","10/05/2013 - 02:54pm","2013-10-05T14:54:56-04:00",0.000000,0.000000,0," "," "," "," "," "," "," "," "," "," "," "," "," "," ",0,0.000000," "," "," "," ",0.000000,0.000000,0,0," "," "," "," "
,"Zebulon Rd Macon, GA","http://www.seeclickfix.com/issues/282966-illegal-signs-on-the-right-of-ways","11/14/2012 - 10:15am",282966.000000,282966.000000,32.885317,-83.793485,558983.000000,1.000000,2.000000,0.000000,"282966-illegal-signs-on-the-right-of-ways","Open","Illegal signs on the right of ways","05/01/2013 - 09:44am","2013-05-01T09:44:14-04:00",0.000000,1.000000,0," "," "," "," "," "," "," "," "," "," "," "," "," "," ",0,0.000000," "," "," "," ",0.000000,0.000000,0,0," "," "," "," "
,"Jones Rd South Fulton county, GA","http://bit.ly/Safrzk","11/10/2012 - 11:28pm",278887.000000,278887.000000,33.619254,-84.620767,563950.000000,1.000000,1.000000,0.000000,"278887-jones-rd","Open","Jones Rd.","11/10/2012 - 11:28pm","2012-11-10T23:28:23-05:00",0.000000,0.000000,0," "," "," "," "," "," "," "," "," "," "," "," "," "," ",0,0.000000," "," "," "," ",0.000000,0.000000,0,0," "," "," "," "
,"1325 Silver Hill Rd Stone Mountain, GA","http://bit.ly/UeMGS8","11/09/2012 - 10:56pm",277658.000000,277658.000000,33.819867,-84.164195,565422.000000,1.000000,3.000000,0.000000,"277658-streetlight-out","Open","Streetlight out","02/08/2013 - 02:30pm","2013-02-08T14:30:52-05:00",0.000000,0.000000,0," "," "," "," "," "," "," "," "," "," "," "," "," "," ",0,0.000000," "," "," "," ",0.000000,0.000000,0,0," "," "," "," "
,"184 Adrian Dr Stockbridge, GA","http://www.seeclickfix.com/issues/277479-new-pavement-un-even-and-more","11/09/2012 - 04:54pm",277479.000000,277479.000000,33.557775,-84.257755,565784.000000,1.000000,1.000000,0.000000,"277479-new-pavement-un-even-and-more","Open","New Pavement Un-even and more!","11/09/2012 - 04:54pm","2012-11-09T16:54:36-05:00",0.000000,0.000000,0," "," "," "," "," "," "," "," "," "," "," "," "," "," ",0,0.000000," "," "," "," ",0.000000,0.000000,0,0," "," "," "," "
,"1000 Block Main St Macon, GA","http://www.seeclickfix.com/issues/275768-street-asphalt","11/08/2012 - 02:05pm",275768.000000,275768.000000,32.847011,-83.607418,567393.000000,1.000000,1.000000,0.000000,"275768-street-asphalt","Open","Street / Asphalt","11/08/2012 - 02:05pm","2012-11-08T14:05:50-05:00",0.000000,0.000000,0," "," "," "," "," "," "," "," "," "," "," "," "," "," ",0,0.000000," "," "," "," ",0.000000,0.000000,0,0," "," "," "," "
,"1604 Norris Landing Dr. Snellville/Dekalb, GA","http://bit.ly/VVaLij","11/08/2012 - 09:55am",275423.000000,275423.000000,33.750278,-84.045429,567644.000000,1.000000,1.000000,0.000000,"275423-pot-holes","Open","Pot Holes","11/08/2012 - 09:55am","2012-11-08T09:55:03-05:00",0.000000,0.000000,0," "," "," "," "," "," "," "," "," "," "," "," "," "," ",0,0.000000," "," "," "," ",0.000000,0.000000,0,0," "," "," "," "
,"Around Piedmont Point Drive But On Pleasent Hill Road.","http://bit.ly/QpMlQZ","11/07/2012 - 10:55pm",274393.000000,274393.000000,33.710632,-84.050903,568303.000000,1.000000,2.000000,0.000000,"274393-pot-holes-coming-over-outter-side-white-line-on-the-dekalb-county-side-of-pleasent-hill-road-n-piedmont-pnt-dr","Open","pot holes coming over outter side white line On the Dekalb County side of Pleasent Hill road n piedmont pnt dr","12/08/2012 - 06:30am","2012-12-08T06:30:24-05:00",0.000000,0.000000,0," "," "," "," "," "," "," "," "," "," "," "," "," "," ",0,0.000000," "," "," "," ",0.000000,0.000000,0,0," "," "," "," "
,"Old Concord Road Se smyrna, GA","http://www.seeclickfix.com/issues/273807-incomplete-sidewalk","11/07/2012 - 08:59am",273807.000000,273807.000000,33.873480,-84.537741,569139.000000,1.000000,6.000000,0.000000,"273807-incomplete-sidewalk","Open","incomplete sidewalk","05/07/2013 - 08:56am","2013-05-07T08:56:06-04:00",0.000000,5.000000,0," "," "," "," "," "," "," "," "," "," "," "," "," "," ",0,0.000000," "," "," "," ",0.000000,0.000000,0,0," "," "," "," "
,"313 Church Rd Sw Smyrna, GA","http://www.seeclickfix.com/issues/273800-incomplete-sidewalk","11/07/2012 - 08:54am",273800.000000,273800.000000,33.877114,-84.545803,569144.000000,1.000000,4.000000,0.000000,"273800-incomplete-sidewalk","Open","Incomplete sidewalk","12/03/2013 - 08:48am","2013-12-03T08:48:07-05:00",0.000000,1.000000,0," "," "," "," "," "," "," "," "," "," "," "," "," "," ",0,0.000000," "," "," "," ",0.000000,0.000000,0,0," "," "," "," "
,"165 Castlegate Rd Macon, GA 31210, USA","http://bit.ly/U5nAoF","11/05/2012 - 08:17pm",271211.000000,271211.000000,32.882453,-83.739662,571341.000000,1.000000,1.000000,0.000000,"271211-other","Open","Other","07/03/2013 - 10:30pm","2013-07-03T22:30:26-04:00",0.000000,0.000000,0," "," "," "," "," "," "," "," "," "," "," "," "," "," ",0,0.000000," "," "," "," ",0.000000,0.000000,0,0," "," "," "," "
,"Millerfield Road Macon, GA","http://bit.ly/TFpwIi","11/05/2012 - 08:36am",270741.000000,270741.000000,32.881729,-83.545715,572042.000000,1.000000,1.000000,0.000000,"270741-street-asphalt","Open","Street Asphalt","11/05/2012 - 08:36am","2012-11-05T08:36:48-05:00",0.000000,0.000000,0," "," "," "," "," "," "," "," "," "," "," "," "," "," ",0,0.000000," "," "," "," ",0.000000,0.000000,0,0," "," "," "," "
,"2432-2438 S Hairston Rd Decatur, GA","http://www.seeclickfix.com/issues/268229-harry-we-need-a-traffic-light-very-badly","11/02/2012 - 04:50pm",268229.000000,268229.000000,33.719361,-84.207891,575929.000000,1.000000,1.000000,0.000000,"268229-harry-we-need-a-traffic-light-very-badly","Open","Harry we need a Traffic light very  BADLY","11/02/2012 - 04:50pm","2012-11-02T16:50:03-04:00",0.000000,0.000000,0," "," "," "," "," "," "," "," "," "," "," "," "," "," ",0,0.000000," "," "," "," ",0.000000,0.000000,0,0," "," "," "," "
,"2947 Mercer University Drive Ne Atlanta, GA","http://bit.ly/X54VQe","11/02/2012 - 12:55am",267100.000000,267100.000000,33.877223,-84.267800,576884.000000,1.000000,1.000000,0.000000,"267100-pothole-in-road","Open","pothole in road","07/24/2013 - 08:27am","2013-07-24T08:27:06-04:00",135739.000000,0.000000,0," "," "," "," "," "," "," "," "," "," "," "," "," "," ",0,0.000000," "," "," "," ",0.000000,0.000000,0,0," "," "," "," "
,"Highway 138 riverdale, GA","http://www.seeclickfix.com/issues/266717-clusters-bad-patches-and-pot-holes","11/01/2012 - 04:14pm",266717.000000,266717.000000,33.551079,-84.468942,577404.000000,1.000000,1.000000,0.000000,"266717-clusters-bad-patches-and-pot-holes","Open","clusters bad patches and pot holes","11/01/2012 - 04:14pm","2012-11-01T16:14:49-04:00",0.000000,0.000000,0," "," "," "," "," "," "," "," "," "," "," "," "," "," ",0,0.000000," "," "," "," ",0.000000,0.000000,0,0," "," "," "," "
,"1680 Old Covington Hwy Sw Conyers, GA","http://bit.ly/VFW02A","11/01/2012 - 11:40am",266390.000000,266390.000000,33.674091,-84.042813,577679.000000,1.000000,1.000000,0.000000,"266390-dangerous-tire-popping-pothole","Open","dangerous tire popping pothole","11/01/2012 - 11:40am","2012-11-01T11:40:03-04:00",0.000000,0.000000,0," "," "," "," "," "," "," "," "," "," "," "," "," "," ",0,0.000000," "," "," "," ",0.000000,0.000000,0,0," "," "," "," "
,"1680 Old Covington Hwy Sw Conyers, GA","http://bit.ly/VFV2U8","11/01/2012 - 11:32am",266388.000000,266388.000000,33.674094,-84.043089,577686.000000,1.000000,2.000000,0.000000,"266388-dangerous-tire-popping-pothole","Open","dangerous tire popping pothole","11/01/2012 - 11:37am","2012-11-01T11:37:33-04:00",0.000000,1.000000,0," "," "," "," "," "," "," "," "," "," "," "," "," "," ",0,0.000000," "," "," "," ",0.000000,0.000000,0,0," "," "," "," "
,"1680 Old Covington Hwy Sw Conyers, GA","http://bit.ly/VFUvS9","11/01/2012 - 11:27am",266386.000000,266386.000000,33.674096,-84.042872,577691.000000,1.000000,1.000000,0.000000,"266386-deadly-tire-popping-pothole","Open","deadly tire popping pothole","11/01/2012 - 11:27am","2012-11-01T11:27:40-04:00",0.000000,0.000000,0," "," "," "," "," "," "," "," "," "," "," "," "," "," ",0,0.000000," "," "," "," ",0.000000,0.000000,0,0," "," "," "," "
,"Brockett Rd Clarkston, GA","http://bit.ly/UjiZQ5","10/31/2012 - 11:48pm",265216.000000,265216.000000,33.820429,-84.233954,578391.000000,1.000000,1.000000,0.000000,"265216-multiple-potholes","Open","Multiple potholes","10/31/2012 - 11:51pm","2012-10-31T23:51:42-04:00",0.000000,0.000000,0," "," "," "," "," "," "," "," "," "," "," "," "," "," ",0,0.000000," "," "," "," ",0.000000,0.000000,0,0," "," "," "," "
,"4793 Baker Dr Acworth, GA","http://bit.ly/RmjuYL","10/30/2012 - 09:24am",262520.000000,262520.000000,34.069921,-84.628750,580695.000000,1.000000,1.000000,0.000000,"262520-street-light-out","Open","Street light out","10/30/2012 - 09:24am","2012-10-30T09:24:01-04:00",0.000000,0.000000,0," "," "," "," "," "," "," "," "," "," "," "," "," "," ",0,0.000000," "," "," "," ",0.000000,0.000000,0,0," "," "," "," "
,"158 Laney Dr Locust Grove, GA","http://bit.ly/QLQueW","10/27/2012 - 08:37am",259421.000000,259421.000000,33.404879,-84.084028,585061.000000,1.000000,3.000000,0.000000,"259421-heavy-traveled-unpaved-road","Open","heavy traveled unpaved road","11/22/2013 - 08:01am","2013-11-22T08:01:54-05:00",0.000000,1.000000,0," "," "," "," "," "," "," "," "," "," "," "," "," "," ",0,0.000000," "," "," "," ",0.000000,0.000000,0,0," "," "," "," "
,"Virginia Ave And 47th Street Chattanooga, TN","http://bit.ly/ScBw3N","10/26/2012 - 08:52am",257769.000000,257769.000000,34.996275,-85.328745,586486.000000,1.000000,2.000000,0.000000,"257769-potholes","Open","Potholes","10/26/2012 - 09:08am","2012-10-26T09:08:54-04:00",0.000000,0.000000,0," "," "," "," "," "," "," "," "," "," "," "," "," "," ",0,0.000000," "," "," "," ",0.000000,0.000000,0,0," "," "," "," "
,"5240 Panola Industrial Blvd Decatur, GA","http://www.seeclickfix.com/issues/256530-trees-preventing-a-clear-view-of-intersection","10/25/2012 - 06:10pm",256530.000000,256530.000000,33.706450,-84.175022,587368.000000,1.000000,2.000000,0.000000,"256530-trees-preventing-a-clear-view-of-intersection","Open","Trees preventing a clear view of intersection","03/26/2013 - 01:52pm","2013-03-26T13:52:36-04:00",0.000000,1.000000,0," "," "," "," "," "," "," "," "," "," "," "," "," "," ",0,0.000000," "," "," "," ",0.000000,0.000000,0,0," "," "," "," "
,"Lavista Road Decatur, GA","http://bit.ly/PT43vZ","10/25/2012 - 05:16pm",256502.000000,256502.000000,33.828767,-84.280662,587422.000000,1.000000,1.000000,0.000000,"256502-huge-pot-hole","Open","Huge pot hole","10/25/2012 - 05:16pm","2012-10-25T17:16:50-04:00",0.000000,0.000000,0," "," "," "," "," "," "," "," "," "," "," "," "," "," ",0,0.000000," "," "," "," ",0.000000,0.000000,0,0," "," "," "," "
,"3265 Northeast Expressway Ne Chamblee, GA","http://www.seeclickfix.com/issues/254176-potholes-in-access-road","10/24/2012 - 01:28pm",254176.000000,254176.000000,33.870962,-84.276794,589091.000000,1.000000,12.000000,0.000000,"254176-potholes-in-access-road","Open","potholes in access road","07/24/2013 - 08:26am","2013-07-24T08:26:22-04:00",135739.000000,11.000000,0," "," "," "," "," "," "," "," "," "," "," "," "," "," ",0,0.000000," "," "," "," ",0.000000,0.000000,0,0," "," "," "," "
,"3376 Flowers Rd S atlanta, GA","http://bit.ly/Pr4ePt","10/24/2012 - 01:19pm",254171.000000,254171.000000,33.874813,-84.256154,589099.000000,1.000000,14.000000,0.000000,"254171-potholes-along-seam-of-pavement","Open","potholes along seam of pavement","11/22/2013 - 10:05am","2013-11-22T10:05:01-05:00",135739.000000,12.000000,0," "," "," "," "," "," "," "," "," "," "," "," "," "," ",0,0.000000," "," "," "," ",0.000000,0.000000,0,0," "," "," "," "
,"Lakeloch Drive Lizella, GA","http://www.seeclickfix.com/issues/253940-stree-light-out","10/23/2012 - 09:59pm",253940.000000,253940.000000,32.820672,-83.814717,590020.000000,1.000000,1.000000,0.000000,"253940-stree-light-out","Open","Stree light out","10/23/2012 - 09:59pm","2012-10-23T21:59:02-04:00",77734.000000,0.000000,0," "," "," "," "," "," "," "," "," "," "," "," "," "," ",0,0.000000," "," "," "," ",0.000000,0.000000,0,0," "," "," "," "
,"119 Lakeloch Drive Lizella, GA","http://www.seeclickfix.com/issues/253938-street-light-out-area-very-dark","10/23/2012 - 09:54pm",253938.000000,253938.000000,32.821975,-83.811145,590024.000000,1.000000,1.000000,0.000000,"253938-street-light-out-area-very-dark","Open","Street light out area very dark","10/23/2012 - 09:54pm","2012-10-23T21:54:49-04:00",77734.000000,0.000000,0," "," "," "," "," "," "," "," "," "," "," "," "," "," ",0,0.000000," "," "," "," ",0.000000,0.000000,0,0," "," "," "," "
,"4100 Mcginnis Ferry Rd Alpharetta, GA 30005, USA","http://bit.ly/Xa4Xok","10/23/2012 - 02:58pm",248839.000000,248839.000000,34.101360,-84.235522,590440.000000,1.000000,1.000000,0.000000,"248839-traffic-light","Open","Traffic light","10/23/2012 - 02:58pm","2012-10-23T14:58:11-04:00",0.000000,0.000000,0," "," "," "," "," "," "," "," "," "," "," "," "," "," ",0,0.000000," "," "," "," ",0.000000,0.000000,0,0," "," "," "," "
,"Ronald Reagan Blvd Alpharetta, GA 30005, USA","http://bit.ly/Xa2Wsx","10/23/2012 - 02:52pm",248834.000000,248834.000000,34.110955,-84.221274,590446.000000,1.000000,2.000000,0.000000,"248834-traffic-light","Open","Traffic light","12/29/2012 - 02:39pm","2012-12-29T14:39:17-05:00",0.000000,1.000000,0," "," "," "," "," "," "," "," "," "," "," "," "," "," ",0,0.000000," "," "," "," ",0.000000,0.000000,0,0," "," "," "," "
,"119 Lakeloch Drive Lizella, GA","http://www.seeclickfix.com/issues/248641-street-light-out","10/23/2012 - 10:03am",248641.000000,248641.000000,32.822796,-83.810093,590735.000000,1.000000,1.000000,0.000000,"248641-street-light-out","Open","Street light out","10/24/2012 - 07:35pm","2012-10-24T19:35:36-04:00",77734.000000,0.000000,0," "," "," "," "," "," "," "," "," "," "," "," "," "," ",0,0.000000," "," "," "," ",0.000000,0.000000,0,0," "," "," "," "
,"119 Lakeloch Drive Macon, GA","http://www.seeclickfix.com/issues/248582-street-light-out","10/23/2012 - 08:46am",248582.000000,248582.000000,32.821124,-83.812579,590812.000000,1.000000,1.000000,0.000000,"248582-street-light-out","Open","street light out","10/24/2012 - 07:35pm","2012-10-24T19:35:39-04:00",77734.000000,0.000000,0," "," "," "," "," "," "," "," "," "," "," "," "," "," ",0,0.000000," "," "," "," ",0.000000,0.000000,0,0," "," "," "," "
,"2300 Mcintosh Dr Locust Grove, GA","http://bit.ly/OOJaRj","10/19/2012 - 01:00pm",247398.000000,247398.000000,33.346931,-84.178919,596318.000000,1.000000,1.000000,0.000000,"247398-delete","Open","delete","12/27/2012 - 07:20pm","2012-12-27T19:20:55-05:00",0.000000,0.000000,0," "," "," "," "," "," "," "," "," "," "," "," "," "," ",0,0.000000," "," "," "," ",0.000000,0.000000,0,0," "," "," "," "
,"Conyers Street lithonia, GA","http://bit.ly/RIvELY","10/18/2012 - 05:57pm",247185.000000,247185.000000,33.706542,-84.098636,597461.000000,1.000000,1.000000,0.000000,"247185-riding-a-rollercoaster","Open","riding a rollercoaster","10/18/2012 - 05:57pm","2012-10-18T17:57:36-04:00",0.000000,0.000000,0," "," "," "," "," "," "," "," "," "," "," "," "," "," ",0,0.000000," "," "," "," ",0.000000,0.000000,0,0," "," "," "," "
,"1760 Ebenezer Road Sw Conyers, GA","http://bit.ly/PBSbOX","10/17/2012 - 09:27am",246511.000000,246511.000000,33.642882,-84.042220,599411.000000,1.000000,3.000000,0.000000,"246511-traffic-light-unneccessary-turn-light-delay","Open","Traffic Light unneccessary turn light delay","01/16/2013 - 06:04am","2013-01-16T06:04:04-05:00",0.000000,2.000000,0," "," "," "," "," "," "," "," "," "," "," "," "," "," ",0,0.000000," "," "," "," ",0.000000,0.000000,0,0," "," "," "," "
,"Cresthill Ave Savannah, GA","http://www.seeclickfix.com/issues/245697-pot-holes","10/15/2012 - 02:51pm",245697.000000,245697.000000,31.991544,-81.095926,602213.000000,1.000000,1.000000,0.000000,"245697-pot-holes","Open","Pot holes","10/18/2012 - 05:35am","2012-10-18T05:35:24Z",0.000000,0.000000,0," "," "," "," "," "," "," "," "," "," "," "," "," "," ",0,0.000000," "," "," "," ",0.000000,0.000000,0,0," "," "," "," "
,"2302 Plaster Rd Ne Atlanta, GA","http://bit.ly/T87M4c","10/11/2012 - 12:02pm",244453.000000,244453.000000,33.863470,-84.294784,608141.000000,1.000000,2.000000,0.000000,"244453-hole-in-road","Closed","hole in road","12/06/2013 - 12:35pm","2013-12-06T12:35:04Z",135739.000000,0.000000,0," "," "," "," "," "," "," "," "," "," "," "," "," "," ",0,0.000000," "," "," "," ",0.000000,0.000000,0,0," "," "," "," "
,"4973-5037 Harrison Rd Macon, GA","http://bit.ly/W3hFES","10/10/2012 - 10:33pm",244341.000000,244341.000000,32.813776,-83.726069,608951.000000,1.000000,1.000000,0.000000,"244341-tall-grass-along-road","Open","tall grass along road","10/10/2012 - 10:33pm","2012-10-10T22:33:10Z",0.000000,0.000000,0," "," "," "," "," "," "," "," "," "," "," "," "," "," ",0,0.000000," "," "," "," ",0.000000,0.000000,0,0," "," "," "," "
,"Diamond Ridge Ave Canton, GA","http://www.seeclickfix.com/issues/244191-we-need-stop-signs-and-or-speed-bumps","10/10/2012 - 05:49pm",244191.000000,244191.000000,34.184672,-84.532563,609235.000000,1.000000,11.000000,0.000000,"244191-we-need-stop-signs-and-or-speed-bumps","Open","We need stop signs and/or speed bumps","10/11/2012 - 02:29pm","2012-10-11T14:29:40Z",0.000000,8.000000,0," "," "," "," "," "," "," "," "," "," "," "," "," "," ",0,0.000000," "," "," "," ",0.000000,0.000000,0,0," "," "," "," "
,"Atlanta Hwy/Falcon Pkwy Flowery Branch, GA","http://bit.ly/SO6d0M","10/10/2012 - 03:33am",243948.000000,243948.000000,34.204784,-83.885353,610090.000000,1.000000,2.000000,0.000000,"243948-loud-speeding-vehicles","Open","Loud, speeding vehicles","08/14/2013 - 08:49am","2013-08-14T08:49:51Z",0.000000,2.000000,0," "," "," "," "," "," "," "," "," "," "," "," "," "," ",0,0.000000," "," "," "," ",0.000000,0.000000,0,0," "," "," "," "
,"675 Old Peachtree Rd Nw Suwanee, GA","http://www.seeclickfix.com/issues/243674-small-swimming-pool","10/09/2012 - 05:05pm",243674.000000,243674.000000,34.008190,-84.060935,610719.000000,1.000000,1.000000,0.000000,"243674-small-swimming-pool","Open","Small swimming pool","05/08/2013 - 11:10am","2013-05-08T11:10:24Z",0.000000,0.000000,0," "," "," "," "," "," "," "," "," "," "," "," "," "," ",0,0.000000," "," "," "," ",0.000000,0.000000,0,0," "," "," "," "
,"6000 Harrison Rd Macon, GA 31206, USA","http://bit.ly/VdLJ1Y","10/02/2012 - 08:58pm",241487.000000,241487.000000,32.810942,-83.722316,620325.000000,1.000000,4.000000,0.000000,"241487-area-has-been-unkempt-for-years-it-is-not-a-welcoming-site-for-visitors-or-a-source-of-pride-for-the-citizenry","Open","Area has been unkempt for years.  It is not a welcoming site for visitors or a source of pride for the citizenry.","07/30/2013 - 10:43am","2013-07-30T10:43:28-04:00",68577.000000,2.000000,0," "," "," "," "," "," "," "," "," "," "," "," "," "," ",0,0.000000," "," "," "," ",0.000000,0.000000,0,0," "," "," "," "
,"6149 Old National Hwy Atlanta, GA 30349, USA","http://bit.ly/PsiC3Q","10/02/2012 - 01:31pm",241263.000000,241263.000000,33.587460,-84.471367,620772.000000,1.000000,2.000000,0.000000,"241263-trashbags-need-2-be-pickup-on-the-corner-of-creel-old-national-hwy-at-the-light","Open","trashbags need 2 be pickup on the corner of Creel & old national Hwy at the light","09/28/2013 - 09:32am","2013-09-28T09:32:50-04:00",40555.000000,0.000000,0," "," "," "," "," "," "," "," "," "," "," "," "," "," ",0,0.000000," "," "," "," ",0.000000,0.000000,0,0," "," "," "," "
,"4917 Mercer University Macon, GA","http://bit.ly/SXhyG6","09/30/2012 - 07:44pm",240461.000000,240461.000000,32.830190,-83.722938,623279.000000,1.000000,4.000000,0.000000,"240461-illegal-estate-sale-banner-sign","Open","Illegal estate sale banner/sign","04/30/2013 - 06:59am","2013-04-30T06:59:29-04:00",68234.000000,2.000000,0," "," "," "," "," "," "," "," "," "," "," "," "," "," ",0,0.000000," "," "," "," ",0.000000,0.000000,0,0," "," "," "," "
,"Mountain View Circle bremen, haralson, GA","http://www.seeclickfix.com/issues/239118-bad-road","09/26/2012 - 02:46pm",239118.000000,239118.000000,33.715204,-85.067250,629578.000000,1.000000,2.000000,0.000000,"239118-bad-road","Open","bad road","11/27/2012 - 05:23pm","2012-11-27T17:23:58Z",0.000000,0.000000,0," "," "," "," "," "," "," "," "," "," "," "," "," "," ",0,0.000000," "," "," "," ",0.000000,0.000000,0,0," "," "," "," "
,"6361 Peachtree Industrial Blvd Atlanta, GA","http://bit.ly/UHLdc7","09/26/2012 - 12:45pm",239036.000000,239036.000000,33.921782,-84.283075,629699.000000,1.000000,2.000000,0.000000,"239036-merging-madness","Open","Merging Madness","11/04/2013 - 08:05pm","2013-11-04T20:05:17Z",0.000000,1.000000,0," "," "," "," "," "," "," "," "," "," "," "," "," "," ",0,0.000000," "," "," "," ",0.000000,0.000000,0,0," "," "," "," "
,"3643 Chamblee Tucker Rd Tucker, GA","http://bit.ly/PTFqdm","09/22/2012 - 11:49am",237480.000000,237480.000000,33.883144,-84.244902,635275.000000,1.000000,14.000000,0.000000,"237480-pothole-in-road","Open","pothole in road","07/24/2013 - 08:32am","2013-07-24T08:32:11-04:00",135739.000000,12.000000,0," "," "," "," "," "," "," "," "," "," "," "," "," "," ",0,0.000000," "," "," "," ",0.000000,0.000000,0,0," "," "," "," "
,"3211 Chamblee Tucker Road  Atlanta, GA","http://bit.ly/PTCuO0","09/22/2012 - 11:35am",237468.000000,237468.000000,33.882922,-84.260503,635289.000000,1.000000,13.000000,0.000000,"237468-pothole-in-road","Open","pothole in road","07/24/2013 - 08:29am","2013-07-24T08:29:13-04:00",135739.000000,11.000000,0," "," "," "," "," "," "," "," "," "," "," "," "," "," ",0,0.000000," "," "," "," ",0.000000,0.000000,0,0," "," "," "," "
,"Deshong Drive lithonia/dekalb, GA","http://bit.ly/S3vqn7","09/18/2012 - 05:41pm",235913.000000,235913.000000,33.747062,-84.128697,640683.000000,1.000000,1.000000,0.000000,"235913-pothole","Open","pothole","09/18/2012 - 05:41pm","2012-09-18T17:41:02-04:00",0.000000,0.000000,0," "," "," "," "," "," "," "," "," "," "," "," "," "," ",0,0.000000," "," "," "," ",0.000000,0.000000,0,0," "," "," "," "
,"2931 Five Forks Trickum Road Lawrenceville , GA","http://bit.ly/QzGC6H","09/18/2012 - 03:05pm",235821.000000,235821.000000,33.893334,-84.055879,640839.000000,1.000000,1.000000,0.000000,"235821-don","Open","Don","09/18/2012 - 03:05pm","2012-09-18T15:05:00-04:00",0.000000,0.000000,0," "," "," "," "," "," "," "," "," "," "," "," "," "," ",0,0.000000," "," "," "," ",0.000000,0.000000,0,0," "," "," "," "
,"5102 Carlton Ridge Cir Valdosta, GA","http://bit.ly/QltJzw","09/18/2012 - 01:54pm",235769.000000,235769.000000,30.927215,-83.360057,640910.000000,1.000000,1.000000,0.000000,"235769-street-light-out","Open","Street light out","09/18/2012 - 01:54pm","2012-09-18T13:54:13-04:00",0.000000,0.000000,0," "," "," "," "," "," "," "," "," "," "," "," "," "," ",0,0.000000," "," "," "," ",0.000000,0.000000,0,0," "," "," "," "
,"5220 Carys Brook Dr Hahira, GA","http://bit.ly/QgSVEx","09/17/2012 - 05:42pm",235341.000000,235341.000000,30.927536,-83.359090,642121.000000,1.000000,1.000000,0.000000,"235341-street-light-is-burned-out","Open","Street light is burned out","09/17/2012 - 05:42pm","2012-09-17T17:42:39-04:00",0.000000,0.000000,0," "," "," "," "," "," "," "," "," "," "," "," "," "," ",0,0.000000," "," "," "," ",0.000000,0.000000,0,0," "," "," "," "
,"9245 Cumming Hwy Canton, GA","http://www.seeclickfix.com/issues/233956-hole-in-road","09/13/2012 - 06:33pm",233956.000000,233956.000000,34.238387,-84.299023,648070.000000,1.000000,1.000000,0.000000,"233956-hole-in-road","Open","hole in road","09/13/2012 - 06:33pm","2012-09-13T18:33:55Z",0.000000,0.000000,0," "," "," "," "," "," "," "," "," "," "," "," "," "," ",0,0.000000," "," "," "," ",0.000000,0.000000,0,0," "," "," "," "
,"Josiphine Run SUWANEE, GA","http://bit.ly/RxmBlc","09/10/2012 - 02:31pm",230747.000000,230747.000000,34.070623,-84.028221,652632.000000,1.000000,1.000000,0.000000,"230747-pothole-in-neighborhood-road","Open","POTHOLE IN NEIGHBORHOOD ROAD","09/10/2012 - 02:31pm","2012-09-10T14:31:37Z",0.000000,0.000000,0," "," "," "," "," "," "," "," "," "," "," "," "," "," ",0,0.000000," "," "," "," ",0.000000,0.000000,0,0," "," "," "," "
,"6380 Skipper Rd Macon, GA","http://bit.ly/NWgwIR","09/06/2012 - 05:30pm",229628.000000,229628.000000,32.735236,-83.720604,657974.000000,1.000000,4.000000,1900.000000,"229628-pothole","Acknowledged","pothole","10/31/2013 - 03:55pm","2013-10-31T15:55:32-04:00",63047.000000,2.000000,0," "," "," "," "," "," "," "," "," "," "," "," "," "," ",0,0.000000," "," "," "," ",0.000000,0.000000,0,0," "," "," "," "
,"3060 Premiere Parkway duluth, GA","http://bit.ly/NezAWY","09/06/2012 - 11:38am",229393.000000,229393.000000,33.999145,-84.098484,658325.000000,1.000000,1.000000,0.000000,"229393-large-pothole-in-front-of-our-business","Open","Large Pothole in front of our business.","09/06/2012 - 11:38am","2012-09-06T11:38:53-04:00",0.000000,0.000000,0," "," "," "," "," "," "," "," "," "," "," "," "," "," ",0,0.000000," "," "," "," ",0.000000,0.000000,0,0," "," "," "," "
,"20 Posey Ridge Court Newnan, GA","http://www.seeclickfix.com/issues/229120-street-light-out","09/05/2012 - 05:12pm",229120.000000,229120.000000,33.413727,-84.695357,659432.000000,1.000000,1.000000,0.000000,"229120-street-light-out","Open","Street light out","01/04/2013 - 07:01am","2013-01-04T07:01:06-05:00",0.000000,0.000000,0," "," "," "," "," "," "," "," "," "," "," "," "," "," ",0,0.000000," "," "," "," ",0.000000,0.000000,0,0," "," "," "," "
,"6090 Suwanee Dam Rd SUGAR HILL , GA","http://www.seeclickfix.com/issues/228598-s-dam-road-sucks","09/04/2012 - 06:08pm",228598.000000,228598.000000,34.126931,-84.075169,660816.000000,1.000000,1.000000,0.000000,"228598-s-dam-road-sucks","Open","S. DAM ROAD SUCKS","09/04/2012 - 06:08pm","2012-09-04T18:08:06-04:00",0.000000,0.000000,0," "," "," "," "," "," "," "," "," "," "," "," "," "," ",0,0.000000," "," "," "," ",0.000000,0.000000,0,0," "," "," "," "
,"1371 Greentree Parkway Macon, GA","http://www.seeclickfix.com/issues/228597-trash-can","09/04/2012 - 06:07pm",228597.000000,228597.000000,32.873923,-83.780456,660816.000000,1.000000,1.000000,0.000000,"228597-trash-can","Open","Trash can","09/04/2012 - 06:07pm","2012-09-04T18:07:36-04:00",0.000000,0.000000,0," "," "," "," "," "," "," "," "," "," "," "," "," "," ",0,0.000000," "," "," "," ",0.000000,0.000000,0,0," "," "," "," "
,"25 Morning Dove Ln Newnan, GA","http://bit.ly/RBBnlv","09/02/2012 - 06:56pm",227901.000000,227901.000000,33.388900,-84.710775,663647.000000,1.000000,1.000000,0.000000,"227901-street-light-out","Open","Street light out","09/02/2012 - 06:56pm","2012-09-02T18:56:43-04:00",0.000000,0.000000,0," "," "," "," "," "," "," "," "," "," "," "," "," "," ",0,0.000000," "," "," "," ",0.000000,0.000000,0,0," "," "," "," "
,"5925 Old National Hwy Atlanta, GA","http://bit.ly/Oy4RSC","08/31/2012 - 09:58am",227418.000000,227418.000000,33.594430,-84.468480,667066.000000,1.000000,1.000000,0.000000,"227418-hole-national","Open","""Hole National""","07/03/2013 - 10:28pm","2013-07-03T22:28:29-04:00",0.000000,0.000000,0," "," "," "," "," "," "," "," "," "," "," "," "," "," ",0,0.000000," "," "," "," ",0.000000,0.000000,0,0," "," "," "," "
,"Factory Shoals Rd Austell, GA","http://bit.ly/OtXlbs","08/30/2012 - 07:44am",226945.000000,226945.000000,33.742612,-84.580993,668640.000000,1.000000,3.000000,0.000000,"226945-multiple-potholes-and-bad-instant-patches","Open","multiple potholes and bad instant patches","10/30/2012 - 07:19am","2012-10-30T07:19:20-04:00",0.000000,1.000000,0," "," "," "," "," "," "," "," "," "," "," "," "," "," ",0,0.000000," "," "," "," ",0.000000,0.000000,0,0," "," "," "," "
,"Cedar Grove & South Fulton Pkwy Fairburn, GA","http://bit.ly/OoVQLL","08/28/2012 - 11:38pm",226399.000000,226399.000000,33.632915,-84.638671,670566.000000,1.000000,2.000000,0.000000,"226399-pothole","Open","Pothole","07/03/2013 - 10:28pm","2013-07-03T22:28:25-04:00",0.000000,0.000000,0," "," "," "," "," "," "," "," "," "," "," "," "," "," ",0,0.000000," "," "," "," ",0.000000,0.000000,0,0," "," "," "," "
,"Willow Lake Cir Chattanooga, TN","http://bit.ly/Oue4NO","08/28/2012 - 04:50pm",226283.000000,226283.000000,35.035935,-85.362317,670973.000000,1.000000,3.000000,0.000000,"226283-street-sinking-away-from-manhole-manhole-protruding-from-street","Open","Street sinking away from manhole.  Manhole protruding from street","05/27/2013 - 07:55pm","2013-05-27T19:55:59-04:00",0.000000,0.000000,0," "," "," "," "," "," "," "," "," "," "," "," "," "," ",0,0.000000," "," "," "," ",0.000000,0.000000,0,0," "," "," "," "
,"4877 Presidential Pkwy Macon, GA 31206, USA","http://bit.ly/NRDuXe","08/27/2012 - 11:44am",225472.000000,225472.000000,32.812985,-83.720294,672719.000000,1.000000,1.000000,0.000000,"225472-repainting-needed","Open","Repainting needed","08/27/2012 - 11:44am","2012-08-27T11:44:38-04:00",57036.000000,0.000000,0," "," "," "," "," "," "," "," "," "," "," "," "," "," ",0,0.000000," "," "," "," ",0.000000,0.000000,0,0," "," "," "," "
,"600 Riverside Pkwy Sw Lithia Springs, GA 30122, USA","http://bit.ly/QXYbeY","08/21/2012 - 08:38pm",223443.000000,223443.000000,33.732799,-84.587745,680826.000000,1.000000,2.000000,0.000000,"223443-turning-lane-going-from-thornton-rd-to-riverside-pkwy","Open","Turning lane going from Thornton rd to riverside pkwy.","10/21/2012 - 04:00pm","2012-10-21T16:00:50-04:00",35180.000000,1.000000,0," "," "," "," "," "," "," "," "," "," "," "," "," "," ",0,0.000000," "," "," "," ",0.000000,0.000000,0,0," "," "," "," "
,"5831-5855 Zebulon Rd Macon, GA 31210, USA","http://bit.ly/SNQnOl","08/21/2012 - 11:32am",223121.000000,223121.000000,32.879849,-83.757342,681372.000000,1.000000,2.000000,0.000000,"223121-brush-needs-cutting","Open","Brush needs cutting","12/20/2012 - 04:10pm","2012-12-20T16:10:57-05:00",54740.000000,1.000000,0," "," "," "," "," "," "," "," "," "," "," "," "," "," ",0,0.000000," "," "," "," ",0.000000,0.000000,0,0," "," "," "," "
,"5180 Mercer University Dr Macon, GA","http://bit.ly/Rx7ucv","08/20/2012 - 04:22pm",222768.000000,222768.000000,32.832587,-83.731407,682522.000000,1.000000,2.000000,0.000000,"222768-water-main-leak","Open","Water Main Leak","11/30/2012 - 06:51am","2012-11-30T06:51:14-05:00",47116.000000,1.000000,0," "," "," "," "," "," "," "," "," "," "," "," "," "," ",0,0.000000," "," "," "," ",0.000000,0.000000,0,0," "," "," "," "
,"1644 Jennifer Dr Macon, GA 31216, USA","http://bit.ly/RogRLn","08/17/2012 - 04:24pm",221835.000000,221835.000000,32.768800,-83.671875,686839.000000,1.000000,3.000000,0.000000,"221835-this-area-needs-to-be-made-more-attractive-by-doing-just-a-little-landscaping-location-is-at-bloomfield-and-eisenhower-parkway","Open","This area needs to be made more attractive by doing just a little landscaping.  Location is at Bloomfield and  Eisenhower Parkway","10/20/2012 - 03:42pm","2012-10-20T15:42:44-04:00",48029.000000,1.000000,0," "," "," "," "," "," "," "," "," "," "," "," "," "," ",0,0.000000," "," "," "," ",0.000000,0.000000,0,0," "," "," "," "
,"Sandy Run Road Houston, GA","http://bit.ly/Rni4Th","08/17/2012 - 10:12am",221616.000000,221616.000000,32.568118,-83.594541,687211.000000,1.000000,1.000000,0.000000,"221616-report-road-issues","Open","Report road issues.","08/17/2012 - 10:12am","2012-08-17T10:12:38-04:00",0.000000,0.000000,0," "," "," "," "," "," "," "," "," "," "," "," "," "," ",0,0.000000," "," "," "," ",0.000000,0.000000,0,0," "," "," "," "
,"2300 Plaster Rd Ne Atlanta, GA","http://bit.ly/PwbMik","08/17/2012 - 01:06am",221493.000000,221493.000000,33.863500,-84.294841,687758.000000,1.000000,1.000000,0.000000,"221493-hole-in-road","Open","hole in road","07/24/2013 - 08:28am","2013-07-24T08:28:34-04:00",135739.000000,0.000000,0," "," "," "," "," "," "," "," "," "," "," "," "," "," ",0,0.000000," "," "," "," ",0.000000,0.000000,0,0," "," "," "," "
,"1325 Silver Hill Rd Stone Mountain, GA","http://bit.ly/NJASIS","08/16/2012 - 09:11pm",221429.000000,221429.000000,33.819867,-84.164195,687993.000000,1.000000,2.000000,0.000000,"221429-streetlight-out","Open","streetlight out","01/14/2013 - 12:15pm","2013-01-14T12:15:24-05:00",0.000000,0.000000,0," "," "," "," "," "," "," "," "," "," "," "," "," "," ",0,0.000000," "," "," "," ",0.000000,0.000000,0,0," "," "," "," "
,"701-745 Sams Crossing Decatur, GA","http://bit.ly/QGZWgz","08/16/2012 - 07:24pm",221399.000000,221399.000000,33.774831,-84.279534,688100.000000,1.000000,2.000000,0.000000,"221399-tire-killing-bump","Open","Tire-killing Bump","07/24/2013 - 01:02am","2013-07-24T01:02:04-04:00",0.000000,1.000000,0," "," "," "," "," "," "," "," "," "," "," "," "," "," ",0,0.000000," "," "," "," ",0.000000,0.000000,0,0," "," "," "," "
,"6080 Bethelview Rd Cumming, GA","http://www.seeclickfix.com/issues/219570-my-truck-takes-a-pounding-everyday-while-driving-this-road","08/13/2012 - 05:52pm",219570.000000,219570.000000,34.162244,-84.174928,692512.000000,1.000000,2.000000,0.000000,"219570-my-truck-takes-a-pounding-everyday-while-driving-this-road","Open","My Truck takes a pounding everyday while driving this road","09/27/2012 - 05:21pm","2012-09-27T17:21:14-04:00",0.000000,1.000000,0," "," "," "," "," "," "," "," "," "," "," "," "," "," ",0,0.000000," "," "," "," ",0.000000,0.000000,0,0," "," "," "," "
,"3126 Flamingo Dr decatur, GA","http://bit.ly/R6wRS0","08/12/2012 - 09:48pm",218995.000000,218995.000000,33.818886,-84.262977,693716.000000,1.000000,1.000000,0.000000,"218995-street-light-out","Open","street light out","08/12/2012 - 09:48pm","2012-08-12T21:48:32-04:00",0.000000,0.000000,0," "," "," "," "," "," "," "," "," "," "," "," "," "," ",0,0.000000," "," "," "," ",0.000000,0.000000,0,0," "," "," "," "
,"4197 Brookdale Ave Macon, GA","http://bit.ly/MxK6ng","08/08/2012 - 09:25pm",216823.000000,216823.000000,32.853368,-83.693624,699739.000000,1.000000,1.000000,0.000000,"216823-billing-issue","Open","BILLING ISSUE","08/08/2012 - 09:25pm","2012-08-08T21:25:34Z",34553.000000,0.000000,0," "," "," "," "," "," "," "," "," "," "," "," "," "," ",0,0.000000," "," "," "," ",0.000000,0.000000,0,0," "," "," "," "
,"4910 Registry View Kennesaw, GA","http://bit.ly/N4J488","08/08/2012 - 02:42pm",216181.000000,216181.000000,33.978589,-84.694625,700142.000000,1.000000,2.000000,0.000000,"216181-street-sewer-manhole","Open","Street sewer manhole","07/05/2013 - 01:28pm","2013-07-05T13:28:07Z",0.000000,1.000000,0," "," "," "," "," "," "," "," "," "," "," "," "," "," ",0,0.000000," "," "," "," ",0.000000,0.000000,0,0," "," "," "," "
,"1700 Union Avenue Chattanooga, TN","http://bit.ly/N4dQhj","08/08/2012 - 12:44pm",216069.000000,216069.000000,35.033347,-85.279235,700259.000000,1.000000,4.000000,0.000000,"216069-fix-it-or-demolish","Open","Fix it or demolish","11/09/2012 - 10:56pm","2012-11-09T22:56:28Z",0.000000,3.000000,0," "," "," "," "," "," "," "," "," "," "," "," "," "," ",0,0.000000," "," "," "," ",0.000000,0.000000,0,0," "," "," "," "
,"Bouldercrest Rd Ellenwood, GA","http://www.seeclickfix.com/issues/215773-pot-hole","08/07/2012 - 05:39pm",215773.000000,215773.000000,33.631231,-84.282946,701404.000000,1.000000,1.000000,0.000000,"215773-pot-hole","Open","Pot Hole","08/07/2012 - 05:39pm","2012-08-07T17:39:51Z",0.000000,0.000000,0," "," "," "," "," "," "," "," "," "," "," "," "," "," ",0,0.000000," "," "," "," ",0.000000,0.000000,0,0," "," "," "," "
,"328-334 Interstate N Pkwy Se Atlanta, GA","http://bit.ly/OV3M8D","08/06/2012 - 06:21pm",215370.000000,215370.000000,33.893634,-84.461451,702563.000000,1.000000,1.000000,0.000000,"215370-potholes","Open","POTHOLES","08/06/2012 - 06:21pm","2012-08-06T18:21:25-04:00",0.000000,0.000000,0," "," "," "," "," "," "," "," "," "," "," "," "," "," ",0,0.000000," "," "," "," ",0.000000,0.000000,0,0," "," "," "," "
,"Wesley Chapel Rd Decatur, GA","http://bit.ly/RqPO0J","08/05/2012 - 10:11pm",214758.000000,214758.000000,33.708023,-84.218452,703772.000000,1.000000,1.000000,0.000000,"214758-pothole-on-wesley-chapel","Open","Pothole on Wesley Chapel","08/05/2012 - 10:11pm","2012-08-05T22:11:41-04:00",0.000000,0.000000,0," "," "," "," "," "," "," "," "," "," "," "," "," "," ",0,0.000000," "," "," "," ",0.000000,0.000000,0,0," "," "," "," "
,"2345 Morris Rd College Park, GA 30349, USA","http://bit.ly/NXAMfr","08/03/2012 - 10:49am",214106.000000,214106.000000,33.576051,-84.463271,707335.000000,1.000000,2.000000,0.000000,"214106-someone-from-the-water-department-are-putting-lottory-in-people-yards-at-2495","Open","someone from the water department are putting lottory in people yards at 2495","09/28/2013 - 09:37am","2013-09-28T09:37:54-04:00",40555.000000,0.000000,0," "," "," "," "," "," "," "," "," "," "," "," "," "," ",0,0.000000," "," "," "," ",0.000000,0.000000,0,0," "," "," "," "
,"Georgia 74 Senoia, GA","http://bit.ly/QqApya","07/29/2012 - 10:30pm",211977.000000,211977.000000,33.340083,-84.522281,713834.000000,1.000000,1.000000,0.000000,"211977-malfunctioning-traffic-signal","Open","Malfunctioning traffic signal","07/29/2012 - 10:30pm","2012-07-29T22:30:12-04:00",0.000000,0.000000,0," "," "," "," "," "," "," "," "," "," "," "," "," "," ",0,0.000000," "," "," "," ",0.000000,0.000000,0,0," "," "," "," "
,"3038 Lavista Rd Decatur, GA","http://bit.ly/M02dC0","07/28/2012 - 06:02pm",211648.000000,211648.000000,33.826362,-84.282989,715542.000000,1.000000,2.000000,0.000000,"211648-lavista-road-road-crumbling","Open","Lavista Road Road Crumbling","08/28/2013 - 09:41pm","2013-08-28T21:41:38-04:00",0.000000,2.000000,0," "," "," "," "," "," "," "," "," "," "," "," "," "," ",0,0.000000," "," "," "," ",0.000000,0.000000,0,0," "," "," "," "
,"1088-1498 Marshall Mill Rd Fort Valley, GA","http://bit.ly/Nb0b1L","07/28/2012 - 01:50pm",211593.000000,211593.000000,32.681132,-83.858200,715793.000000,1.000000,1.000000,0.000000,"211593-pot-holes","Open","Pot Holes","07/28/2012 - 01:50pm","2012-07-28T13:50:57-04:00",0.000000,0.000000,0," "," "," "," "," "," "," "," "," "," "," "," "," "," ",0,0.000000," "," "," "," ",0.000000,0.000000,0,0," "," "," "," "
,"3602 Shepherds Path decatur, GA","http://bit.ly/OsjDJN","07/27/2012 - 04:35pm",211444.000000,211444.000000,33.680442,-84.235406,717068.000000,1.000000,1.000000,0.000000,"211444-entire-street-is-damaged","Open","entire street is damaged","07/27/2012 - 04:35pm","2012-07-27T16:35:41-04:00",0.000000,0.000000,0," "," "," "," "," "," "," "," "," "," "," "," "," "," ",0,0.000000," "," "," "," ",0.000000,0.000000,0,0," "," "," "," "
,"113-115 Tobee Dr Lizella, GA","http://bit.ly/QPiWyu","07/27/2012 - 03:47pm",211416.000000,211416.000000,32.797213,-83.781764,717117.000000,1.000000,2.000000,0.000000,"211416-grass-needs-cutting-at-tobee-creek-sub-division","Open","Grass needs cutting at Tobee Creek Sub-Division","10/28/2013 - 03:13pm","2013-10-28T15:13:51-04:00",0.000000,0.000000,0," "," "," "," "," "," "," "," "," "," "," "," "," "," ",0,0.000000," "," "," "," ",0.000000,0.000000,0,0," "," "," "," "
,"Charmer'S Way (1st House On Right ; Enchanted Woods Subdivision Between Wydella & Arcado Rd.; Off Rockbridge Road))Your Map Shows This Incorrectly.  This Address Is Near Arcado Elem. not Hwy. 29), Lilburn , GA","http://bit.ly/SXbFLm","07/27/2012 - 07:51am",211199.000000,211199.000000,33.885319,-84.165420,717592.000000,1.000000,1.000000,0.000000,"211199-graffiti-on-home-1st-home-on-right-on-charmer-s-way-enchanted-woods-subdidvision","Open","graffiti on home. 1st home on right on Charmer's Way. Enchanted Woods subdidvision.","07/27/2012 - 07:51am","2012-07-27T07:51:52-04:00",0.000000,0.000000,0," "," "," "," "," "," "," "," "," "," "," "," "," "," ",0,0.000000," "," "," "," ",0.000000,0.000000,0,0," "," "," "," "
,"Intersection Of Hwy 41 & 53 East calhoun, GA","http://bit.ly/NvAFKG","07/25/2012 - 07:53pm",210641.000000,210641.000000,34.478786,-84.935193,719751.000000,1.000000,1.000000,0.000000,"210641-new-construction","Open","New construction","07/25/2012 - 07:53pm","2012-07-25T19:53:07-04:00",0.000000,0.000000,0," "," "," "," "," "," "," "," "," "," "," "," "," "," ",0,0.000000," "," "," "," ",0.000000,0.000000,0,0," "," "," "," "
,"8322-8326 Union Grove Rd Lithonia, GA","http://bit.ly/M8Cayq","07/25/2012 - 11:57am",210347.000000,210347.000000,33.727901,-84.060250,720226.000000,1.000000,1.000000,0.000000,"210347-potholes","Open","Potholes","07/25/2012 - 11:57am","2012-07-25T11:57:56-04:00",0.000000,0.000000,0," "," "," "," "," "," "," "," "," "," "," "," "," "," ",0,0.000000," "," "," "," ",0.000000,0.000000,0,0," "," "," "," "
,"314 Willow Cove Lizella , GA","http://bit.ly/OlkGuS","07/24/2012 - 04:26pm",210010.000000,210010.000000,32.795233,-83.774781,721397.000000,1.000000,2.000000,0.000000,"210010-overgrown-bushes-growning-onto-road","Open","Overgrown bushes growning onto road","10/28/2013 - 03:18pm","2013-10-28T15:18:43-04:00",0.000000,1.000000,0," "," "," "," "," "," "," "," "," "," "," "," "," "," ",0,0.000000," "," "," "," ",0.000000,0.000000,0,0," "," "," "," "
,"156 Tobee Drive Lizella, GA","http://bit.ly/Olj7x6","07/24/2012 - 04:03pm",209999.000000,209999.000000,32.797151,-83.775152,721421.000000,1.000000,2.000000,0.000000,"209999-overgrown-trees-and-bushes","Open","Overgrown trees and bushes","10/28/2013 - 03:11pm","2013-10-28T15:11:15-04:00",0.000000,0.000000,0," "," "," "," "," "," "," "," "," "," "," "," "," "," ",0,0.000000," "," "," "," ",0.000000,0.000000,0,0," "," "," "," "
,"421 Big Oak Circle  Lizella, GA","http://bit.ly/OlilAi","07/24/2012 - 03:53pm",209993.000000,209993.000000,32.795855,-83.777800,721431.000000,1.000000,2.000000,0.000000,"209993-over-growth-along-roadway","Open","over growth along roadway","09/24/2013 - 11:58am","2013-09-24T11:58:23-04:00",0.000000,0.000000,0," "," "," "," "," "," "," "," "," "," "," "," "," "," ",0,0.000000," "," "," "," ",0.000000,0.000000,0,0," "," "," "," "
,"161 Tobee Drive Lizella/Bibb, GA","http://bit.ly/Olhgbr","07/24/2012 - 03:33pm",209985.000000,209985.000000,32.796847,-83.775165,721451.000000,1.000000,2.000000,0.000000,"209985-overgrowth-side-of-roads","Open","Overgrowth-side of roads","10/28/2013 - 03:14pm","2013-10-28T15:14:50-04:00",0.000000,0.000000,0," "," "," "," "," "," "," "," "," "," "," "," "," "," ",0,0.000000," "," "," "," ",0.000000,0.000000,0,0," "," "," "," "
,"Tobee Dr Lizella, GA","http://bit.ly/Qhda9D","07/24/2012 - 10:54am",209842.000000,209842.000000,32.797271,-83.779164,721729.000000,1.000000,2.000000,0.000000,"209842-overgrowth-lots","Open","Overgrowth lots","10/28/2013 - 03:16pm","2013-10-28T15:16:34-04:00",0.000000,0.000000,0," "," "," "," "," "," "," "," "," "," "," "," "," "," ",0,0.000000," "," "," "," ",0.000000,0.000000,0,0," "," "," "," "
,"3623-3695 Ashford Dunwoody Rd Atlanta, GA","http://bit.ly/NRRfUz","07/21/2012 - 10:25am",209001.000000,209001.000000,33.894453,-84.328584,726079.000000,1.000000,8.000000,2604.000000,"209001-pedestrian-crosswalk-signage-inadequate","Acknowledged","Pedestrian crosswalk signage inadequate","09/01/2013 - 09:10am","2013-09-01T09:10:13-04:00",0.000000,6.000000,0," "," "," "," "," "," "," "," "," "," "," "," "," "," ",0,0.000000," "," "," "," ",0.000000,0.000000,0,0," "," "," "," "
,"3435 Ashford Dunwoody Rd Atlanta, GA","http://bit.ly/NRQquN","07/21/2012 - 10:19am",208999.000000,208999.000000,33.890147,-84.325336,726084.000000,1.000000,12.000000,2604.000000,"208999-pedestrian-crosswalk-signage-inadequate","Acknowledged","Pedestrian crosswalk signage inadequate","09/01/2013 - 09:08am","2013-09-01T09:08:07-04:00",0.000000,11.000000,0," "," "," "," "," "," "," "," "," "," "," "," "," "," ",0,0.000000," "," "," "," ",0.000000,0.000000,0,0," "," "," "," "
,"2035-2055 S Johnson Ferry Rd Ne Atlanta, GA","http://bit.ly/NRQ2wj","07/21/2012 - 10:16am",208998.000000,208998.000000,33.893458,-84.331126,726088.000000,1.000000,10.000000,2604.000000,"208998-pedestrian-crosswalk-signage-inadequate","Acknowledged","Pedestrian crosswalk signage inadequate","08/18/2013 - 02:50pm","2013-08-18T14:50:45-04:00",0.000000,8.000000,0," "," "," "," "," "," "," "," "," "," "," "," "," "," ",0,0.000000," "," "," "," ",0.000000,0.000000,0,0," "," "," "," "
,"2806 North Decatur Rd decatur , dekalb, GA","http://bit.ly/NE7540","07/20/2012 - 04:48pm",208872.000000,208872.000000,33.786225,-84.244072,727136.000000,1.000000,1.000000,0.000000,"208872-holes-in-road","Open","holes in road","07/20/2012 - 04:48pm","2012-07-20T16:48:08-04:00",0.000000,0.000000,0," "," "," "," "," "," "," "," "," "," "," "," "," "," ",0,0.000000," "," "," "," ",0.000000,0.000000,0,0," "," "," "," "
,"Georgia 96 Dry Branch, GA","http://bit.ly/OJTqEm","07/19/2012 - 01:40pm",208416.000000,208416.000000,32.541819,-83.512398,728763.000000,1.000000,2.000000,0.000000,"208416-report-road-issues","Open","Report road issues.","01/17/2013 - 04:34pm","2013-01-17T16:34:56-05:00",0.000000,2.000000,0," "," "," "," "," "," "," "," "," "," "," "," "," "," ",0,0.000000," "," "," "," ",0.000000,0.000000,0,0," "," "," "," "
,"Webb Gin House At Janmar Road Snellville, GA","http://bit.ly/OsCTrY","07/19/2012 - 08:25am",208230.000000,208230.000000,33.893443,-84.024573,729078.000000,1.000000,2.000000,0.000000,"208230-huge-campaign-sign-in-right-of-way-is-blocking-view-of-oncoming-traffic","Open","Huge campaign sign in right-of-way is blocking view of oncoming traffic","07/21/2012 - 07:22am","2012-07-21T07:22:57-04:00",0.000000,1.000000,0," "," "," "," "," "," "," "," "," "," "," "," "," "," ",0,0.000000," "," "," "," ",0.000000,0.000000,0,0," "," "," "," "
,"Interstate 20 Lithonia, GA","http://bit.ly/OswCg0","07/19/2012 - 08:12am",208221.000000,208221.000000,33.701492,-84.190979,729092.000000,1.000000,2.000000,0.000000,"208221-i-20-potholes","Open","I-20 Potholes","07/15/2013 - 06:14am","2013-07-15T06:14:43-04:00",0.000000,0.000000,0," "," "," "," "," "," "," "," "," "," "," "," "," "," ",0,0.000000," "," "," "," ",0.000000,0.000000,0,0," "," "," "," "
,"5831-5855 Zebulon Rd Macon, GA 31210, USA","http://bit.ly/M9dr8x","07/18/2012 - 01:17pm",207900.000000,207900.000000,32.879902,-83.756976,730226.000000,1.000000,2.000000,0.000000,"207900-trim-brush","Open","Trim brush","09/12/2013 - 11:17am","2013-09-12T11:17:53-04:00",54740.000000,1.000000,0," "," "," "," "," "," "," "," "," "," "," "," "," "," ",0,0.000000," "," "," "," ",0.000000,0.000000,0,0," "," "," "," "
,"Glen Wood Drive macon bibb, GA","http://bit.ly/NylMEt","07/17/2012 - 11:17am",207370.000000,207370.000000,32.829875,-83.748703,731787.000000,1.000000,2.000000,0.000000,"207370-brick-columns-down","Open","Brick columns down","07/17/2012 - 11:18am","2012-07-17T11:18:00-04:00",0.000000,2.000000,0," "," "," "," "," "," "," "," "," "," "," "," "," "," ",0,0.000000," "," "," "," ",0.000000,0.000000,0,0," "," "," "," "
,"6754 Vonreg Dr Macon, GA","http://bit.ly/NyiCkf","07/17/2012 - 10:43am",207344.000000,207344.000000,32.726172,-83.707813,731821.000000,1.000000,2.000000,0.000000,"207344-debris-tree-down","Open","debris tree down","07/20/2012 - 03:33pm","2012-07-20T15:33:18-04:00",0.000000,0.000000,0," "," "," "," "," "," "," "," "," "," "," "," "," "," ",0,0.000000," "," "," "," ",0.000000,0.000000,0,0," "," "," "," "
,"Vonreg Dr And Cyndy Jo Circle Macon, GA","http://bit.ly/NyipNV","07/17/2012 - 10:40am",207341.000000,207341.000000,32.725712,-83.708125,731823.000000,1.000000,1.000000,0.000000,"207341-tree-down-debris","Open","tree down, debris","07/17/2012 - 10:40am","2012-07-17T10:40:51-04:00",0.000000,0.000000,0," "," "," "," "," "," "," "," "," "," "," "," "," "," ",0,0.000000," "," "," "," ",0.000000,0.000000,0,0," "," "," "," "
,"Corner Of Vonreg Dr And Cyndy Jo Circle Macon, GA","http://bit.ly/Nyg3P4","07/17/2012 - 10:16am",207328.000000,207328.000000,32.725712,-83.708125,731847.000000,1.000000,1.000000,0.000000,"207328-tree-down-across-the-road-july1st-inmates-deputy-sheriff-cleared-road-that-night-but-left-all-the-debris-from-tree","Open","tree down across the road July1st. Inmates, deputy sheriff cleared road that night but left all the debris from tree.","07/17/2012 - 10:16am","2012-07-17T10:16:43-04:00",0.000000,0.000000,0," "," "," "," "," "," "," "," "," "," "," "," "," "," ",0,0.000000," "," "," "," ",0.000000,0.000000,0,0," "," "," "," "
,"Zebulon Rd Macon, GA","http://bit.ly/MtElg0","07/16/2012 - 01:40pm",206974.000000,206974.000000,32.886975,-83.795245,733084.000000,1.000000,2.000000,0.000000,"206974-brush-and-trees-need-trimming","Open","Brush and trees need trimming","09/10/2013 - 11:37pm","2013-09-10T23:37:52-04:00",54740.000000,0.000000,0," "," "," "," "," "," "," "," "," "," "," "," "," "," ",0,0.000000," "," "," "," ",0.000000,0.000000,0,0," "," "," "," "
,"Bowman Boulevard Macon, GA","http://bit.ly/LQHmH4","07/14/2012 - 09:03am",206399.000000,206399.000000,32.915718,-83.711032,736240.000000,1.000000,2.000000,0.000000,"206399-cut-the-right-of-way-heavy-litter","Open","Cut the Right of Way/Heavy LItter","12/13/2012 - 10:56pm","2012-12-13T22:56:12-05:00",0.000000,1.000000,0," "," "," "," "," "," "," "," "," "," "," "," "," "," ",0,0.000000," "," "," "," ",0.000000,0.000000,0,0," "," "," "," "
,"227 Champagne Drive Byron, GA","http://bit.ly/P5p57Q","07/13/2012 - 08:38pm",206340.000000,206340.000000,32.616206,-83.757629,736986.000000,1.000000,1.000000,0.000000,"206340-growing-pothole","Open","Growing pothole","07/13/2012 - 08:38pm","2012-07-13T20:38:06-04:00",0.000000,0.000000,0," "," "," "," "," "," "," "," "," "," "," "," "," "," ",0,0.000000," "," "," "," ",0.000000,0.000000,0,0," "," "," "," "
,"North Peachtree Rd Near North Shallowford Rd Dekalb co, GA","http://bit.ly/M7xwyH","07/13/2012 - 03:26pm",206258.000000,206258.000000,33.911980,-84.298465,737298.000000,1.000000,1.000000,0.000000,"206258-hole-in-road","Open","hole in road","07/13/2012 - 03:26pm","2012-07-13T15:26:32-04:00",0.000000,0.000000,0," "," "," "," "," "," "," "," "," "," "," "," "," "," ",0,0.000000," "," "," "," ",0.000000,0.000000,0,0," "," "," "," "
,"1590-1598 Alderbrook Rd Ne Decatur, GA","http://bit.ly/NgCREZ","07/13/2012 - 11:57am",206099.000000,206099.000000,33.826782,-84.295855,737507.000000,1.000000,4.000000,0.000000,"206099-multiple-asphalt-humps","Open","Multiple asphalt humps","01/10/2013 - 08:06pm","2013-01-10T20:06:05-05:00",0.000000,2.000000,0," "," "," "," "," "," "," "," "," "," "," "," "," "," ",0,0.000000," "," "," "," ",0.000000,0.000000,0,0," "," "," "," "
,"3464 Kingsview Circle Macon, GA","http://bit.ly/LMOzYN","07/12/2012 - 07:40pm",205913.000000,205913.000000,32.886410,-83.565549,738484.000000,1.000000,2.000000,0.000000,"205913-replacement-cart","Open","Replacement Cart","10/11/2012 - 08:40am","2012-10-11T08:40:23-04:00",0.000000,0.000000,0," "," "," "," "," "," "," "," "," "," "," "," "," "," ",0,0.000000," "," "," "," ",0.000000,0.000000,0,0," "," "," "," "
,"2045 Valiant Drive N.E. atlanta, GA","http://bit.ly/NqFNd5","07/12/2012 - 09:13am",205608.000000,205608.000000,33.844074,-84.297061,739111.000000,1.000000,1.000000,0.000000,"205608-potholes","Open","Potholes -","07/12/2012 - 09:13am","2012-07-12T09:13:08-04:00",0.000000,0.000000,0," "," "," "," "," "," "," "," "," "," "," "," "," "," ",0,0.000000," "," "," "," ",0.000000,0.000000,0,0," "," "," "," "
,"223-257 Brand Rd Sw Loganville, GA","http://bit.ly/NdGuKR","07/10/2012 - 10:49am",204717.000000,204717.000000,33.855166,-83.905024,741895.000000,1.000000,1.000000,0.000000,"204717-still-not-working-on-road","Open","STILL !!!!!! not working on road","07/10/2012 - 10:49am","2012-07-10T10:49:25-04:00",0.000000,0.000000,0," "," "," "," "," "," "," "," "," "," "," "," "," "," ",0,0.000000," "," "," "," ",0.000000,0.000000,0,0," "," "," "," "
,"990 Deer Chase Ct Stone Mountain, GA","http://bit.ly/MgPPzs","07/09/2012 - 02:33pm",204429.000000,204429.000000,33.765131,-84.183573,743111.000000,1.000000,2.000000,0.000000,"204429-street-lights","Open","Street Lights","07/10/2012 - 10:35am","2012-07-10T10:35:20-04:00",0.000000,0.000000,0," "," "," "," "," "," "," "," "," "," "," "," "," "," ",0,0.000000," "," "," "," ",0.000000,0.000000,0,0," "," "," "," "
,"1088 Meadow Brook Drive Woodstock, GA","http://bit.ly/LXvroP","07/08/2012 - 09:47pm",204054.000000,204054.000000,34.152216,-84.429972,744117.000000,1.000000,1.000000,0.000000,"204054-street-lights-out","Open","Street Lights out","05/05/2013 - 09:10am","2013-05-05T09:10:37-04:00",0.000000,0.000000,0," "," "," "," "," "," "," "," "," "," "," "," "," "," ",0,0.000000," "," "," "," ",0.000000,0.000000,0,0," "," "," "," "
,"2300-2350 Butler Ferry Rd Bainbridge, GA","http://bit.ly/Nef7iQ","07/07/2012 - 10:17am",203766.000000,203766.000000,30.903403,-84.641184,746247.000000,1.000000,1.000000,0.000000,"203766-pot-holes-that-is-gonna-cause-accident-or-really-destroy-someones-tires-and-vehicle","Open","pot holes that is gonna cause accident or really destroy someones tires and vehicle","07/07/2012 - 10:17am","2012-07-07T10:17:34-04:00",0.000000,0.000000,0," "," "," "," "," "," "," "," "," "," "," "," "," "," ",0,0.000000," "," "," "," ",0.000000,0.000000,0,0," "," "," "," "
,"2300-2350 Butler Ferry Rd Bainbridge, GA","http://bit.ly/NeeXYI","07/07/2012 - 10:15am",203765.000000,203765.000000,30.903403,-84.641184,746248.000000,1.000000,1.000000,0.000000,"203765-pot-holes-that-is-gonna-cause-accident-or-really-tear-someones-vehicle-up","Open","pot holes that is gonna cause accident or really tear someones vehicle up","07/07/2012 - 10:15am","2012-07-07T10:15:43-04:00",0.000000,0.000000,0," "," "," "," "," "," "," "," "," "," "," "," "," "," ",0,0.000000," "," "," "," ",0.000000,0.000000,0,0," "," "," "," "
,"Splitpine Ct Atlanta, GA 30349, USA","http://bit.ly/LErUcj","07/07/2012 - 08:14am",203747.000000,203747.000000,33.576150,-84.463453,746370.000000,1.000000,3.000000,0.000000,"203747-the-house-at-this-address-2555-creel-rd-snow-need-2-check-on-it-there-a-banit-car-in-driveway","Open","THE HOUSE AT THIS ADDRESS 2555 CREEL RD. SNOW NEED 2 CHECK ON IT THERE A BANIT CAR IN DRIVEWAY","06/03/2013 - 07:10am","2013-06-03T07:10:31-04:00",40555.000000,0.000000,0," "," "," "," "," "," "," "," "," "," "," "," "," "," ",0,0.000000," "," "," "," ",0.000000,0.000000,0,0," "," "," "," "
,"2495 Creel Rd.","http://bit.ly/Rixqod","07/05/2012 - 07:39am",202882.000000,202882.000000,33.599064,-84.489322,749285.000000,1.000000,3.000000,0.000000,"202882-we-have-more-trash-bags-on-the-corner-of-creel-rd-old-national-hwy-need-2-be-pickup-please","Open","we have more trash bags on the corner of Creel rd . & old national Hwy need 2 be pickup  please","09/02/2013 - 08:56pm","2013-09-02T20:56:15-04:00",40555.000000,0.000000,0," "," "," "," "," "," "," "," "," "," "," "," "," "," ",0,0.000000," "," "," "," ",0.000000,0.000000,0,0," "," "," "," "
,"285 College Park, GA","http://bit.ly/MPP1U8","07/03/2012 - 01:32am",202266.000000,202266.000000,33.607310,-84.485646,752532.000000,1.000000,1.000000,0.000000,"202266-getting-away-from-i-285","Open","Getting away from I-285","07/03/2012 - 01:32am","2012-07-03T01:32:33-04:00",0.000000,0.000000,0," "," "," "," "," "," "," "," "," "," "," "," "," "," ",0,0.000000," "," "," "," ",0.000000,0.000000,0,0," "," "," "," "
,"Flat Shoals Road Union City, GA","http://bit.ly/MPOzVR","07/03/2012 - 01:28am",202264.000000,202264.000000,33.586558,-84.530376,752536.000000,1.000000,1.000000,0.000000,"202264-dip-in-center-lane","Open","Dip in center lane","07/03/2012 - 01:28am","2012-07-03T01:28:29-04:00",0.000000,0.000000,0," "," "," "," "," "," "," "," "," "," "," "," "," "," ",0,0.000000," "," "," "," ",0.000000,0.000000,0,0," "," "," "," "
,"Mall Parkway And Turner Hill Rd Intersection Lithonia/Dekalb, GA","http://bit.ly/M05rpz","07/02/2012 - 11:21am",201949.000000,201949.000000,33.691620,-84.088764,753382.000000,1.000000,2.000000,0.000000,"201949-all-crosswalk-lights-inoperable","Open","all crosswalk lights inoperable","06/28/2013 - 08:30am","2013-06-28T08:30:22-04:00",0.000000,1.000000,0," "," "," "," "," "," "," "," "," "," "," "," "," "," ",0,0.000000," "," "," "," ",0.000000,0.000000,0,0," "," "," "," "
,"I-285 Atlanta, GA","http://bit.ly/N3igk0","06/29/2012 - 04:40pm",200999.000000,200999.000000,33.688622,-84.303501,757384.000000,1.000000,1.000000,0.000000,"200999-almost-every-overpass","Open","Almost every overpass","12/30/2012 - 07:22am","2012-12-30T07:22:56-05:00",0.000000,0.000000,0," "," "," "," "," "," "," "," "," "," "," "," "," "," ",0,0.000000," "," "," "," ",0.000000,0.000000,0,0," "," "," "," "
,"51 89 Zebulon Rd Macon, GA","http://bit.ly/NXmrAk","06/29/2012 - 11:34am",200886.000000,200886.000000,32.886975,-83.795245,757689.000000,1.000000,1.000000,0.000000,"200886-debris-pickup-request","Open","Debris - Pickup Request","06/29/2012 - 11:43am","2012-06-29T11:43:31-04:00",0.000000,0.000000,0," "," "," "," "," "," "," "," "," "," "," "," "," "," ",0,0.000000," "," "," "," ",0.000000,0.000000,0,0," "," "," "," "
,"3464 Kingsview Cir Macon, GA","http://bit.ly/M4KaQc","06/27/2012 - 10:17am",199900.000000,199900.000000,32.886410,-83.565549,760646.000000,1.000000,1.000000,0.000000,"199900-garbage-cart","Open","GARBAGE CART","06/27/2012 - 10:17am","2012-06-27T10:17:41-04:00",34553.000000,0.000000,0," "," "," "," "," "," "," "," "," "," "," "," "," "," ",0,0.000000," "," "," "," ",0.000000,0.000000,0,0," "," "," "," "
,"Kent Dr Macon, GA","http://bit.ly/OjIlAq","06/25/2012 - 09:13am",198830.000000,198830.000000,32.940953,-83.841542,763590.000000,1.000000,1.000000,0.000000,"198830-clean-cut-city-owned-property","Open","Clean / Cut City Owned Property","06/25/2012 - 09:19am","2012-06-25T09:19:36-04:00",0.000000,0.000000,0," "," "," "," "," "," "," "," "," "," "," "," "," "," ",0,0.000000," "," "," "," ",0.000000,0.000000,0,0," "," "," "," "
," Webb Road riverdale, GA","http://bit.ly/MpuTW0","06/22/2012 - 05:51pm",198386.000000,198386.000000,33.527770,-84.410632,767393.000000,1.000000,1.000000,0.000000,"198386-manhole","Open","manhole","06/22/2012 - 05:51pm","2012-06-22T17:51:20-04:00",0.000000,0.000000,0," "," "," "," "," "," "," "," "," "," "," "," "," "," ",0,0.000000," "," "," "," ",0.000000,0.000000,0,0," "," "," "," "
,"500 Bk Of Wesleyan Dr South Bound Macon, GA","http://bit.ly/MrX1Ij","06/20/2012 - 01:41am",197346.000000,197346.000000,32.887154,-83.717455,771482.000000,1.000000,1.000000,0.000000,"197346-bamboo-in-right-of-way-on-road","Open","bamboo in right of way on road","07/04/2013 - 02:26am","2013-07-04T02:26:37Z",0.000000,0.000000,0," "," "," "," "," "," "," "," "," "," "," "," "," "," ",0,0.000000," "," "," "," ",0.000000,0.000000,0,0," "," "," "," "
,"200 Turner Davis Rd Sharpsburg, GA 30277, USA","http://bit.ly/L5XjbQ","06/17/2012 - 09:49am",196216.000000,196216.000000,33.334152,-84.681030,775075.000000,1.000000,1.000000,0.000000,"196216-breaking-road","Open","Breaking Road","06/17/2012 - 09:49am","2012-06-17T09:49:28-04:00",37957.000000,0.000000,0," "," "," "," "," "," "," "," "," "," "," "," "," "," ",0,0.000000," "," "," "," ",0.000000,0.000000,0,0," "," "," "," "
,"883-929 Hickory Flat Hwy Canton, GA","http://bit.ly/LRE19a","06/15/2012 - 11:06am",195773.000000,195773.000000,34.222573,-84.481706,777878.000000,1.000000,2.000000,0.000000,"195773-pot-hole-at-train-track","Acknowledged","Pot Hole at train track","06/22/2012 - 01:31pm","2012-06-22T13:31:24-04:00",0.000000,0.000000,0," "," "," "," "," "," "," "," "," "," "," "," "," "," ",0,0.000000," "," "," "," ",0.000000,0.000000,0,0," "," "," "," "
,"Larry Mcdonald Memorial Hwy Kennesaw, GA","http://bit.ly/KiVXsQ","06/11/2012 - 09:44pm",194298.000000,194298.000000,33.997315,-84.560565,783000.000000,1.000000,1.000000,0.000000,"194298-pothole-excessive-patching","Open","Pothole/excessive patching","06/11/2012 - 09:44pm","2012-06-11T21:44:14-04:00",0.000000,0.000000,0," "," "," "," "," "," "," "," "," "," "," "," "," "," ",0,0.000000," "," "," "," ",0.000000,0.000000,0,0," "," "," "," "
,"5674 Wells Circle Stone Mountain, GA","http://bit.ly/JXpOlL","06/11/2012 - 01:48pm",194119.000000,194119.000000,33.781624,-84.158698,783475.000000,1.000000,2.000000,0.000000,"194119-pothole","Open","Pothole","06/12/2012 - 09:48am","2012-06-12T09:48:12-04:00",0.000000,0.000000,0," "," "," "," "," "," "," "," "," "," "," "," "," "," ",0,0.000000," "," "," "," ",0.000000,0.000000,0,0," "," "," "," "
,"1617 Maes Overlook loganville, GA","http://bit.ly/N0pBFo","06/10/2012 - 06:06pm",193774.000000,193774.000000,33.764127,-83.922250,784658.000000,1.000000,1.000000,0.000000,"193774-street-light","Open","street light","06/10/2012 - 06:06pm","2012-06-10T18:06:16-04:00",0.000000,0.000000,0," "," "," "," "," "," "," "," "," "," "," "," "," "," ",0,0.000000," "," "," "," ",0.000000,0.000000,0,0," "," "," "," "
,"5062 Audley Lane Norcross / Gwinnett, GA","http://bit.ly/LEvFyi","06/07/2012 - 11:21am",192836.000000,192836.000000,33.995612,-84.221000,789383.000000,1.000000,1.000000,0.000000,"192836-sunken-hole","Open","Sunken hole","06/07/2012 - 11:21am","2012-06-07T11:21:28-04:00",0.000000,0.000000,0," "," "," "," "," "," "," "," "," "," "," "," "," "," ",0,0.000000," "," "," "," ",0.000000,0.000000,0,0," "," "," "," "
,"1511 Timber Heights Dr Loganville, GA","http://bit.ly/LvLFSS","06/05/2012 - 04:48pm",191875.000000,191875.000000,33.888433,-83.876703,791935.000000,1.000000,2.000000,0.000000,"191875-bad-clean-up-of-street-repair","Open","Bad clean up of street repair","08/14/2012 - 08:45pm","2012-08-14T20:45:34-04:00",0.000000,1.000000,0," "," "," "," "," "," "," "," "," "," "," "," "," "," ",0,0.000000," "," "," "," ",0.000000,0.000000,0,0," "," "," "," "
,"Ruth E. Willett Dr. Midland, GA","http://bit.ly/LvDxld","06/05/2012 - 03:32pm",191834.000000,191834.000000,32.607543,-84.800721,792012.000000,1.000000,1.000000,0.000000,"191834-street-lights","Open","Street Lights","06/05/2012 - 03:32pm","2012-06-05T15:32:08-04:00",0.000000,0.000000,0," "," "," "," "," "," "," "," "," "," "," "," "," "," ",0,0.000000," "," "," "," ",0.000000,0.000000,0,0," "," "," "," "
,"Asbury Dr dekalb, GA","http://bit.ly/L3I9Th","05/30/2012 - 05:45pm",189771.000000,189771.000000,33.767312,-84.084191,800519.000000,1.000000,1.000000,0.000000,"189771-patch-patch","Open","patch,patch","05/30/2012 - 05:45pm","2012-05-30T17:45:15-04:00",0.000000,0.000000,0," "," "," "," "," "," "," "," "," "," "," "," "," "," ",0,0.000000," "," "," "," ",0.000000,0.000000,0,0," "," "," "," "
,"4665 Ruby Rd Stone Mountain, GA","http://bit.ly/KWUaUW","05/30/2012 - 02:39pm",189670.000000,189670.000000,33.772034,-84.201292,800705.000000,1.000000,1.000000,0.000000,"189670-blight-on-subdivision","Open","Blight on Subdivision","05/30/2012 - 02:39pm","2012-05-30T14:39:12-04:00",0.000000,0.000000,0," "," "," "," "," "," "," "," "," "," "," "," "," "," ",0,0.000000," "," "," "," ",0.000000,0.000000,0,0," "," "," "," "
,"I-85 North Milemarker 153 Commerce, Jackson, GA","http://bit.ly/L2fOsT","05/29/2012 - 05:16pm",189341.000000,189341.000000,34.289349,-83.419597,801988.000000,1.000000,1.000000,0.000000,"189341-dentists-best-friend","Open","Dentists Best Friend","06/10/2012 - 09:52pm","2012-06-10T21:52:16-04:00",0.000000,0.000000,0," "," "," "," "," "," "," "," "," "," "," "," "," "," ",0,0.000000," "," "," "," ",0.000000,0.000000,0,0," "," "," "," "
,"3464 Kingsview Cir Macon, GA","http://bit.ly/L1Tr72","05/29/2012 - 03:15pm",189252.000000,189252.000000,32.886410,-83.565549,802108.000000,1.000000,2.000000,0.000000,"189252-garbage-cart","Open","GARBAGE CART","11/10/2012 - 06:44pm","2012-11-10T18:44:04-05:00",34553.000000,2.000000,0," "," "," "," "," "," "," "," "," "," "," "," "," "," ",0,0.000000," "," "," "," ",0.000000,0.000000,0,0," "," "," "," "
,"4786 Sugarloaf Pkwy Lawrenceville, GA","http://bit.ly/LktzWn","05/25/2012 - 09:41pm",188416.000000,188416.000000,33.952882,-84.050946,807483.000000,1.000000,1.000000,0.000000,"188416-missing-left-turn-arrow","Open","Missing Left-Turn Arrow","05/25/2012 - 09:41pm","2012-05-25T21:41:33-04:00",0.000000,0.000000,0," "," "," "," "," "," "," "," "," "," "," "," "," "," ",0,0.000000," "," "," "," ",0.000000,0.000000,0,0," "," "," "," "
,"556 Tyrone Rd Tyrone, GA","http://bit.ly/LwXeLe","05/24/2012 - 11:42pm",188133.000000,188133.000000,33.463525,-84.556274,808802.000000,1.000000,1.000000,0.000000,"188133-road-problem","Open","road problem","05/24/2012 - 11:42pm","2012-05-24T23:42:11-04:00",0.000000,0.000000,0," "," "," "," "," "," "," "," "," "," "," "," "," "," ",0,0.000000," "," "," "," ",0.000000,0.000000,0,0," "," "," "," "
,"5000 Mcginnis Ferry Rd Alpharetta, GA 30005, USA","http://bit.ly/LqWwMe","05/23/2012 - 03:49pm",187676.000000,187676.000000,34.099086,-84.213635,810715.000000,1.000000,2.000000,0.000000,"187676-traffic-signal-road-sensors-not-working","Open","Traffic Signal Road Sensors not working","06/04/2012 - 11:16pm","2012-06-04T23:16:33-04:00",0.000000,1.000000,0," "," "," "," "," "," "," "," "," "," "," "," "," "," ",0,0.000000," "," "," "," ",0.000000,0.000000,0,0," "," "," "," "
,"Sugarloaf @ Cruse Road Lawrenceville, GA","http://bit.ly/KB17wN","05/23/2012 - 07:36am",187452.000000,187452.000000,33.954865,-84.055474,811208.000000,1.000000,2.000000,0.000000,"187452-faded-street-curb-painting","Open","Faded Street & Curb Painting","05/25/2012 - 09:42pm","2012-05-25T21:42:03-04:00",0.000000,1.000000,0," "," "," "," "," "," "," "," "," "," "," "," "," "," ",0,0.000000," "," "," "," ",0.000000,0.000000,0,0," "," "," "," "
,"Intersection Of Avalon Forest Dr. & Lady Gwenevere Lawrenceville, GA","http://bit.ly/JQVEpZ","05/23/2012 - 07:30am",187448.000000,187448.000000,33.935337,-84.085000,811214.000000,1.000000,1.000000,0.000000,"187448-pothole","Open","Pothole","05/23/2012 - 07:30am","2012-05-23T07:30:11-04:00",0.000000,0.000000,0," "," "," "," "," "," "," "," "," "," "," "," "," "," ",0,0.000000," "," "," "," ",0.000000,0.000000,0,0," "," "," "," "
,"Intersection Of Cruse Rd @ Club Drive Lawrenceville, GA","http://bit.ly/JQUCdw","05/23/2012 - 07:24am",187447.000000,187447.000000,33.934358,-84.086030,811220.000000,1.000000,1.000000,0.000000,"187447-potholes","Open","Potholes","12/20/2012 - 07:57am","2012-12-20T07:57:18-05:00",0.000000,0.000000,0," "," "," "," "," "," "," "," "," "," "," "," "," "," ",0,0.000000," "," "," "," ",0.000000,0.000000,0,0," "," "," "," "
,"1027 Towne Lake Hills East Woodstock, GA","http://bit.ly/JrGuaI","05/21/2012 - 12:00pm",186673.000000,186673.000000,34.120132,-84.549945,813824.000000,1.000000,1.000000,0.000000,"186673-stree-light-out","Open","Stree Light Out","05/21/2012 - 12:00pm","2012-05-21T12:00:06-04:00",0.000000,0.000000,0," "," "," "," "," "," "," "," "," "," "," "," "," "," ",0,0.000000," "," "," "," ",0.000000,0.000000,0,0," "," "," "," "
,"Collins Road Kennesaw, GA","http://bit.ly/L88wII","05/15/2012 - 04:40pm",184771.000000,184771.000000,33.992077,-84.600918,822184.000000,1.000000,1.000000,0.000000,"184771-narrow-road-no-sidewalk","Open","Narrow road, no sidewalk","05/15/2012 - 04:40pm","2012-05-15T16:40:38-04:00",0.000000,0.000000,0," "," "," "," "," "," "," "," "," "," "," "," "," "," ",0,0.000000," "," "," "," ",0.000000,0.000000,0,0," "," "," "," "
,"5909 Rotondo Pl Tucker, GA 30084, USA","http://bit.ly/Jz41Tv","05/14/2012 - 12:44am",184025.000000,184025.000000,33.876588,-84.181462,824580.000000,1.000000,2.000000,0.000000,"184025-utility-line-on-ground","Open","Utility line on ground","05/25/2012 - 11:32am","2012-05-25T11:32:17-04:00",7523.000000,1.000000,0," "," "," "," "," "," "," "," "," "," "," "," "," "," ",0,0.000000," "," "," "," ",0.000000,0.000000,0,0," "," "," "," "
,"5384 Post Road Pass Stone Mountain, GA","http://bit.ly/IIxBob","05/11/2012 - 10:09am",183465.000000,183465.000000,33.773099,-84.168638,828335.000000,1.000000,1.000000,0.000000,"183465-collapsing-sewer-cap","Open","Collapsing Sewer Cap","11/08/2012 - 05:50am","2012-11-08T05:50:06-05:00",0.000000,0.000000,0," "," "," "," "," "," "," "," "," "," "," "," "," "," ",0,0.000000," "," "," "," ",0.000000,0.000000,0,0," "," "," "," "
,"1963 Pleasant Hill Rd. Duluth, GA","http://bit.ly/ITMTsU","05/10/2012 - 05:48pm",183292.000000,183292.000000,33.953526,-84.131092,829316.000000,1.000000,1.000000,0.000000,"183292-pot-hole-drain-is-real-low-leaving-an-uneven-pavement-right-before-the-85-south-exit-ramp","Open","pot hole/drain is real low leaving an uneven pavement right before the 85 south exit ramp.","05/10/2012 - 05:48pm","2012-05-10T17:48:00-04:00",0.000000,0.000000,0," "," "," "," "," "," "," "," "," "," "," "," "," "," ",0,0.000000," "," "," "," ",0.000000,0.000000,0,0," "," "," "," "
,"Intersection Of Old Hawkinsville Rd And Hwy 96 Warner Robins, GA","http://bit.ly/Kcmdon","05/10/2012 - 07:43am",183014.000000,183014.000000,32.543715,-83.573875,829920.000000,1.000000,1.000000,0.000000,"183014-report-road-issues","Open","Report road issues.","05/10/2012 - 07:43am","2012-05-10T07:43:52-04:00",0.000000,0.000000,0," "," "," "," "," "," "," "," "," "," "," "," "," "," ",0,0.000000," "," "," "," ",0.000000,0.000000,0,0," "," "," "," "
,"5801 Rotondo Pl Tucker, GA 30084, USA","http://bit.ly/JVlRwH","05/09/2012 - 03:04pm",182855.000000,182855.000000,33.876668,-84.181612,830919.000000,1.000000,1.000000,0.000000,"182855-utility-line-in-street","Open","Utility line in street","05/09/2012 - 03:04pm","2012-05-09T15:04:58-04:00",7523.000000,0.000000,0," "," "," "," "," "," "," "," "," "," "," "," "," "," ",0,0.000000," "," "," "," ",0.000000,0.000000,0,0," "," "," "," "
,"Allatoona Shores Canton, GA","http://bit.ly/KZ5tPf","05/08/2012 - 09:31am",182294.000000,182294.000000,34.209615,-84.560468,832693.000000,1.000000,1.000000,0.000000,"182294-parking-on-street","Open","Parking on Street","05/08/2012 - 09:31am","2012-05-08T09:31:11-04:00",0.000000,0.000000,0," "," "," "," "," "," "," "," "," "," "," "," "," "," ",0,0.000000," "," "," "," ",0.000000,0.000000,0,0," "," "," "," "
,"2107 Bennett Avenue Chattanooga, TN","http://bit.ly/IOr2yz","05/04/2012 - 08:16am",181049.000000,181049.000000,35.028520,-85.274527,838527.000000,1.000000,5.000000,0.000000,"181049-lack-of-visibility-and-it-is-unsafe-for-me-a-68-years-old","Open","Lack of visibility and it is unsafe for me a 68 years old.","11/01/2012 - 04:57pm","2012-11-01T16:57:04-04:00",0.000000,2.000000,0," "," "," "," "," "," "," "," "," "," "," "," "," "," ",0,0.000000," "," "," "," ",0.000000,0.000000,0,0," "," "," "," "
,"2107 Bennett Avenue Chattanooga, TN","http://bit.ly/IOpp44","05/04/2012 - 08:02am",181038.000000,181038.000000,35.028520,-85.274527,838541.000000,1.000000,4.000000,0.000000,"181038-safety-hazardous","Open","safety hazardous","11/16/2013 - 09:45am","2013-11-16T09:45:54-05:00",0.000000,1.000000,0," "," "," "," "," "," "," "," "," "," "," "," "," "," ",0,0.000000," "," "," "," ",0.000000,0.000000,0,0," "," "," "," "
,"Bolero Way And Bolero Drive Atlanta, GA","http://bit.ly/JDq24t","05/02/2012 - 02:57pm",180465.000000,180465.000000,33.868010,-84.255836,841007.000000,1.000000,1.000000,0.000000,"180465-pothole","Open","Pothole","05/02/2012 - 02:57pm","2012-05-02T14:57:42-04:00",0.000000,0.000000,0," "," "," "," "," "," "," "," "," "," "," "," "," "," ",0,0.000000," "," "," "," ",0.000000,0.000000,0,0," "," "," "," "
,"101 Drew Ct perry/houston, GA","http://bit.ly/JNHFMF","05/02/2012 - 12:03pm",180366.000000,180366.000000,32.490904,-83.705324,841180.000000,1.000000,1.000000,0.000000,"180366-report-road-issues","Open","Report road issues.","05/02/2012 - 12:03pm","2012-05-02T12:03:56-04:00",0.000000,0.000000,0," "," "," "," "," "," "," "," "," "," "," "," "," "," ",0,0.000000," "," "," "," ",0.000000,0.000000,0,0," "," "," "," "
,"5071 Whitewater Dr Norcross, GA","http://bit.ly/ITPpMm","05/02/2012 - 11:34am",180355.000000,180355.000000,33.994843,-84.220958,841210.000000,1.000000,1.000000,0.000000,"180355-street-light-out","Open","street light out","05/02/2012 - 11:34am","2012-05-02T11:34:02-04:00",0.000000,0.000000,0," "," "," "," "," "," "," "," "," "," "," "," "," "," ",0,0.000000," "," "," "," ",0.000000,0.000000,0,0," "," "," "," "
,"309 Sourwood Lane Canton, GA","http://bit.ly/Ip1xcB","05/02/2012 - 02:27am",180215.000000,180215.000000,34.174273,-84.364013,841757.000000,1.000000,1.000000,0.000000,"180215-street-light-not-working","Open","Street light not working","05/02/2012 - 02:27am","2012-05-02T02:27:19-04:00",0.000000,0.000000,0," "," "," "," "," "," "," "," "," "," "," "," "," "," ",0,0.000000," "," "," "," ",0.000000,0.000000,0,0," "," "," "," "
,"5683 Dabbs Bridge Rd Acworth, GA","http://bit.ly/KHOYJD","05/01/2012 - 09:42pm",180197.000000,180197.000000,34.080744,-84.744969,842042.000000,1.000000,1.000000,0.000000,"180197-really-bad-pot-hole","Open","really bad pot hole","05/01/2012 - 09:42pm","2012-05-01T21:42:10-04:00",0.000000,0.000000,0," "," "," "," "," "," "," "," "," "," "," "," "," "," ",0,0.000000," "," "," "," ",0.000000,0.000000,0,0," "," "," "," "
,"390 Lokchapee Dr Macon, GA","http://bit.ly/KszGZ3","04/30/2012 - 08:19am",179369.000000,179369.000000,32.880919,-83.704200,844284.000000,1.000000,1.000000,0.000000,"179369-debris","Open","Debris","04/30/2012 - 08:20am","2012-04-30T08:20:42-04:00",0.000000,0.000000,0," "," "," "," "," "," "," "," "," "," "," "," "," "," ",0,0.000000," "," "," "," ",0.000000,0.000000,0,0," "," "," "," "
,"Teamon Rd. Spalding County, GA","http://bit.ly/JLvV1H","04/27/2012 - 04:39pm",178800.000000,178800.000000,33.328054,-84.237563,848105.000000,1.000000,3.000000,0.000000,"178800-pot-holes","Open","Pot holes","10/29/2013 - 07:19am","2013-10-29T07:19:09-04:00",0.000000,0.000000,0," "," "," "," "," "," "," "," "," "," "," "," "," "," ",0,0.000000," "," "," "," ",0.000000,0.000000,0,0," "," "," "," "
,"1608 E 13th St Chattanooga, TN 37404, USA","http://bit.ly/IHElTX","04/26/2012 - 02:10pm",178414.000000,178414.000000,35.028821,-85.282576,849694.000000,1.000000,3.000000,0.000000,"178414-overgrown-lot","Open","Overgrown Lot","04/26/2012 - 02:27pm","2012-04-26T14:27:26-04:00",24157.000000,3.000000,0," "," "," "," "," "," "," "," "," "," "," "," "," "," ",0,0.000000," "," "," "," ",0.000000,0.000000,0,0," "," "," "," "
,"Rockbridge Rd At Ridge Ave Stone Mountain, GA","http://bit.ly/Isw9aU","04/26/2012 - 11:42am",178341.000000,178341.000000,33.790391,-84.171900,849842.000000,1.000000,4.000000,0.000000,"178341-traffic-light-green-is-too-short-on-rockbridge-rd-in-am-hours","Open","Traffic light green is too short on Rockbridge Rd in am hours","08/29/2013 - 07:13am","2013-08-29T07:13:32-04:00",0.000000,0.000000,0," "," "," "," "," "," "," "," "," "," "," "," "," "," ",0,0.000000," "," "," "," ",0.000000,0.000000,0,0," "," "," "," "
,"Rockbridge Rd And Wynbrooke Pkwy Stone Mountain, GA","http://bit.ly/IsuDWh","04/26/2012 - 11:36am",178339.000000,178339.000000,33.786151,-84.110402,849848.000000,1.000000,2.000000,0.000000,"178339-traffic-light-green-too-short-on-rockbridge-rd-at-wynbrooke-pkwy","Open","Traffic light green too short on Rockbridge Rd at Wynbrooke Pkwy","04/26/2012 - 11:37am","2012-04-26T11:37:47-04:00",0.000000,0.000000,0," "," "," "," "," "," "," "," "," "," "," "," "," "," ",0,0.000000," "," "," "," ",0.000000,0.000000,0,0," "," "," "," "
,"N Deshong Rd Lithonia, GA","http://bit.ly/IqD9BD","04/26/2012 - 11:25am",178332.000000,178332.000000,33.747062,-84.128697,849858.000000,1.000000,2.000000,0.000000,"178332-traffic-light-changed-green-too-short-on-rockbridge-rd","Open","Traffic light changed. Green too short on Rockbridge Rd","04/26/2012 - 11:28am","2012-04-26T11:28:10-04:00",0.000000,0.000000,0," "," "," "," "," "," "," "," "," "," "," "," "," "," ",0,0.000000," "," "," "," ",0.000000,0.000000,0,0," "," "," "," "
,"P'Tree Ind.Blvd. And Sugarloaf Pkwy duluth, gwinnett county, GA","http://bit.ly/IbAD6L","04/24/2012 - 11:55pm",177711.000000,177711.000000,34.000461,-84.094752,851989.000000,1.000000,1.000000,0.000000,"177711-pot-holes-hazzard","Open","pot holes hazzard","04/24/2012 - 11:55pm","2012-04-24T23:55:23-04:00",0.000000,0.000000,0," "," "," "," "," "," "," "," "," "," "," "," "," "," ",0,0.000000," "," "," "," ",0.000000,0.000000,0,0," "," "," "," "
,"Georgia 155 S & Interstate 75 & N Mcdonough Rd Mc Donough, GA","http://bit.ly/IdO2HY","04/24/2012 - 06:38am",177369.000000,177369.000000,33.412493,-84.160444,853026.000000,1.000000,2.000000,0.000000,"177369-hwy155-ramp-to-i75","Open","hwy155 ramp to i75","07/24/2013 - 09:03am","2013-07-24T09:03:07-04:00",0.000000,1.000000,0," "," "," "," "," "," "," "," "," "," "," "," "," "," ",0,0.000000," "," "," "," ",0.000000,0.000000,0,0," "," "," "," "
,"Interstate 75 Jonesboro, GA","http://bit.ly/IdNC4u","04/24/2012 - 06:35am",177368.000000,177368.000000,33.547761,-84.281187,853028.000000,1.000000,1.000000,0.000000,"177368-i75-north-bound","Open","I75 north bound","04/24/2012 - 06:35am","2012-04-24T06:35:48-04:00",0.000000,0.000000,0," "," "," "," "," "," "," "," "," "," "," "," "," "," ",0,0.000000," "," "," "," ",0.000000,0.000000,0,0," "," "," "," "
,"1660 Brooks Pointe Court Lawrenceville, Ga","http://bit.ly/I6ikBz","04/23/2012 - 04:53pm",177279.000000,177279.000000,33.943725,-83.913021,853851.000000,1.000000,1.000000,0.000000,"177279-huge-pothole","Open","Huge pothole","04/23/2012 - 04:53pm","2012-04-23T16:53:46-04:00",0.000000,0.000000,0," "," "," "," "," "," "," "," "," "," "," "," "," "," ",0,0.000000," "," "," "," ",0.000000,0.000000,0,0," "," "," "," "
,"Yellowwood Sharpsburg, GA","http://bit.ly/JK84Kn","04/23/2012 - 08:25am",176989.000000,176989.000000,33.473998,-84.629891,854358.000000,1.000000,1.000000,0.000000,"176989-street-light-out","Open","Street light out","04/23/2012 - 08:25am","2012-04-23T08:25:58-04:00",0.000000,0.000000,0," "," "," "," "," "," "," "," "," "," "," "," "," "," ",0,0.000000," "," "," "," ",0.000000,0.000000,0,0," "," "," "," "
,"Winder Hwy Jefferson, GA","http://bit.ly/JGfTk5","04/22/2012 - 08:53pm",176919.000000,176919.000000,34.088634,-83.621901,855051.000000,1.000000,1.000000,0.000000,"176919-bridge-work","Open","bridge work","04/22/2012 - 08:53pm","2012-04-22T20:53:06-04:00",0.000000,0.000000,0," "," "," "," "," "," "," "," "," "," "," "," "," "," ",0,0.000000," "," "," "," ",0.000000,0.000000,0,0," "," "," "," "
,"Gravel Springs Rd Buford, GA","http://bit.ly/JkXWMl","04/22/2012 - 02:17pm",176833.000000,176833.000000,34.062917,-83.946747,855447.000000,1.000000,2.000000,0.000000,"176833-bridge-work","Open","bridge work","05/10/2012 - 04:54pm","2012-05-10T16:54:57-04:00",0.000000,0.000000,0," "," "," "," "," "," "," "," "," "," "," "," "," "," ",0,0.000000," "," "," "," ",0.000000,0.000000,0,0," "," "," "," "
,"1485 Bailey Ave Chattanooga, TN","http://bit.ly/I16XKq","04/20/2012 - 05:59pm",176506.000000,176506.000000,35.035514,-85.281616,858105.000000,1.000000,1.000000,0.000000,"176506-light-at-intersection","Open","Light at intersection","04/16/2013 - 05:18pm","2013-04-16T17:18:44-04:00",0.000000,0.000000,0," "," "," "," "," "," "," "," "," "," "," "," "," "," ",0,0.000000," "," "," "," ",0.000000,0.000000,0,0," "," "," "," "
,"4602 Pine Valley Dr Macon, GA","http://bit.ly/IxW11c","04/16/2012 - 10:25am",174711.000000,174711.000000,32.832760,-83.713904,864318.000000,1.000000,1.000000,0.000000,"174711-cave-in-4602-pine-valley-dr-adv-485","Open","Cave in/ 4602 Pine Valley Dr / Adv 485","04/16/2012 - 10:26am","2012-04-16T10:26:31-04:00",0.000000,0.000000,0," "," "," "," "," "," "," "," "," "," "," "," "," "," ",0,0.000000," "," "," "," ",0.000000,0.000000,0,0," "," "," "," "
,"3673 Northcrest Rd Doraville, GA 30340, USA","http://bit.ly/HLbKNk","04/15/2012 - 09:11am",174451.000000,174451.000000,33.897856,-84.250800,865832.000000,1.000000,2.000000,0.000000,"174451-traffic-signal-malfunctionmalfunction","Open","Traffic Signal MalfunctionMalfunction","06/12/2013 - 09:24am","2013-06-12T09:24:54-04:00",17991.000000,0.000000,0," "," "," "," "," "," "," "," "," "," "," "," "," "," ",0,0.000000," "," "," "," ",0.000000,0.000000,0,0," "," "," "," "
,"2360 Statler Dr Decatur, GA","http://bit.ly/HxXvtb","04/11/2012 - 06:03pm",173447.000000,173447.000000,33.719419,-84.207803,871061.000000,1.000000,3.000000,0.000000,"173447-we-need-a-traffic-light","Open","We need a traffic light.","12/12/2012 - 05:04pm","2012-12-12T17:04:59-05:00",0.000000,0.000000,0," "," "," "," "," "," "," "," "," "," "," "," "," "," ",0,0.000000," "," "," "," ",0.000000,0.000000,0,0," "," "," "," "
,"Henderson Road Jones County, GA","http://bit.ly/HAOMw5","04/11/2012 - 03:19pm",173388.000000,173388.000000,32.888631,-83.500960,871225.000000,1.000000,1.000000,0.000000,"173388-report-road-issues","Open","Report road issues.","04/11/2012 - 03:19pm","2012-04-11T15:19:22-04:00",0.000000,0.000000,0," "," "," "," "," "," "," "," "," "," "," "," "," "," ",0,0.000000," "," "," "," ",0.000000,0.000000,0,0," "," "," "," "
,"4029 West Oak Dr Macon, GA","http://bit.ly/Ih7pAo","04/11/2012 - 01:18pm",173310.000000,173310.000000,32.832952,-83.721493,871346.000000,1.000000,1.000000,0.000000,"173310-garbage-cart","Open","Garbage Cart","04/11/2012 - 01:18pm","2012-04-11T13:18:41-04:00",0.000000,0.000000,0," "," "," "," "," "," "," "," "," "," "," "," "," "," ",0,0.000000," "," "," "," ",0.000000,0.000000,0,0," "," "," "," "
,"3049 Alfred Drive","http://bit.ly/HrZ90o","04/11/2012 - 12:20pm",173279.000000,173279.000000,32.789113,-83.717461,871403.000000,1.000000,1.000000,0.000000,"173279-garbage-cart","Open","Garbage Cart","04/11/2012 - 12:22pm","2012-04-11T12:22:19-04:00",0.000000,0.000000,0," "," "," "," "," "," "," "," "," "," "," "," "," "," ",0,0.000000," "," "," "," ",0.000000,0.000000,0,0," "," "," "," "
,"Palmetto Cascade Hwy Fairburn, GA","http://bit.ly/IyFAY8","04/11/2012 - 09:41am",173205.000000,173205.000000,33.628341,-84.674377,871563.000000,1.000000,1.000000,0.000000,"173205-large-pothole-on-palmetto-cascadehighway","Open","Large Pothole on Palmetto CascadeHighway","07/03/2013 - 10:25pm","2013-07-03T22:25:29-04:00",0.000000,0.000000,0," "," "," "," "," "," "," "," "," "," "," "," "," "," ",0,0.000000," "," "," "," ",0.000000,0.000000,0,0," "," "," "," "
,"Amwiler Rd Nw Atlanta, GA","http://bit.ly/IiccpO","04/10/2012 - 07:05pm",173083.000000,173083.000000,33.923799,-84.251460,872439.000000,1.000000,1.000000,0.000000,"173083-pothole","Open","PotHole","04/10/2012 - 07:05pm","2012-04-10T19:05:23-04:00",0.000000,0.000000,0," "," "," "," "," "," "," "," "," "," "," "," "," "," ",0,0.000000," "," "," "," ",0.000000,0.000000,0,0," "," "," "," "
,"Woodshire Dr Decatur, GA","http://bit.ly/Htp3V1","04/09/2012 - 05:53pm",172748.000000,172748.000000,33.823788,-84.298173,873950.000000,1.000000,4.000000,0.000000,"172748-pothole","Open","pothole","04/27/2013 - 09:53pm","2013-04-27T21:53:23-04:00",0.000000,1.000000,0," "," "," "," "," "," "," "," "," "," "," "," "," "," ",0,0.000000," "," "," "," ",0.000000,0.000000,0,0," "," "," "," "
,"Millerfield Road Macon, GA","http://bit.ly/HBkPJH","04/09/2012 - 12:11pm",172599.000000,172599.000000,32.881729,-83.545715,874293.000000,1.000000,1.000000,0.000000,"172599-pot-hole","Open","Pot hole","04/09/2012 - 12:14pm","2012-04-09T12:14:33-04:00",0.000000,0.000000,0," "," "," "," "," "," "," "," "," "," "," "," "," "," ",0,0.000000," "," "," "," ",0.000000,0.000000,0,0," "," "," "," "
,"Sandy Creek Rd Tyrone/Fayette County, GA","http://bit.ly/ImZyDa","04/07/2012 - 08:55pm",172288.000000,172288.000000,33.486333,-84.533712,876649.000000,1.000000,2.000000,0.000000,"172288-3-potholes","Open","3 potholes","12/04/2012 - 12:10pm","2012-12-04T12:10:42-05:00",0.000000,0.000000,0," "," "," "," "," "," "," "," "," "," "," "," "," "," ",0,0.000000," "," "," "," ",0.000000,0.000000,0,0," "," "," "," "
,"305 Carmichael Cir Canton, GA","http://bit.ly/Ho1cTy","04/06/2012 - 04:08pm",172069.000000,172069.000000,34.208160,-84.398544,878376.000000,1.000000,1.000000,0.000000,"172069-pot-sink-hole","Open","Pot / Sink Hole","04/06/2012 - 04:08pm","2012-04-06T16:08:16-04:00",0.000000,0.000000,0," "," "," "," "," "," "," "," "," "," "," "," "," "," ",0,0.000000," "," "," "," ",0.000000,0.000000,0,0," "," "," "," "
,"5017 Nisbet Dr Macon, GA","http://bit.ly/Hiwdg8","04/05/2012 - 08:49am",171665.000000,171665.000000,32.800934,-83.714664,880255.000000,1.000000,1.000000,0.000000,"171665-garbage-cart","Open","Garbage Cart","05/15/2013 - 11:16am","2013-05-15T11:16:37-04:00",38670.000000,0.000000,0," "," "," "," "," "," "," "," "," "," "," "," "," "," ",0,0.000000," "," "," "," ",0.000000,0.000000,0,0," "," "," "," "
,"Hwy 74 & Sandy Creek Rd. Tyrone/Fayette County, GA","http://bit.ly/Hi7ZxZ","04/04/2012 - 10:25pm",171644.000000,171644.000000,33.507847,-84.576523,880879.000000,1.000000,2.000000,0.000000,"171644-pothole","Open","Pothole","09/27/2013 - 02:12pm","2013-09-27T14:12:44-04:00",0.000000,0.000000,0," "," "," "," "," "," "," "," "," "," "," "," "," "," ",0,0.000000," "," "," "," ",0.000000,0.000000,0,0," "," "," "," "
,"3851 RICE MILL RD, GA","http://bit.ly/I1vLwX","04/04/2012 - 02:24pm",171494.000000,171494.000000,34.337644,-82.844139,881360.000000,1.000000,1.000000,0.000000,"171494-debris","Open","DEBRIS","04/04/2012 - 02:26pm","2012-04-04T14:26:40-04:00",37214.000000,0.000000,0," "," "," "," "," "," "," "," "," "," "," "," "," "," ",0,0.000000," "," "," "," ",0.000000,0.000000,0,0," "," "," "," "
,"2523 Lawrenceville Hwy Deactur, GA","http://bit.ly/HQ0YYs","04/03/2012 - 03:08pm",171185.000000,171185.000000,33.820421,-84.264194,882756.000000,1.000000,2.000000,0.000000,"171185-missing-manhole-cover","Open","missing manhole cover","04/06/2012 - 03:31pm","2012-04-06T15:31:02-04:00",0.000000,0.000000,0," "," "," "," "," "," "," "," "," "," "," "," "," "," ",0,0.000000," "," "," "," ",0.000000,0.000000,0,0," "," "," "," "
,"Old Hwy 41 North Of Bells Ferry Rd. Marietta, GA","http://bit.ly/H7JszE","04/01/2012 - 09:20am",170465.000000,170465.000000,34.064835,-84.560896,885984.000000,1.000000,2.000000,0.000000,"170465-potholes","Open","Potholes","01/27/2013 - 11:06am","2013-01-27T11:06:41-05:00",0.000000,0.000000,0," "," "," "," "," "," "," "," "," "," "," "," "," "," ",0,0.000000," "," "," "," ",0.000000,0.000000,0,0," "," "," "," "
,"3464 Kingsview Cir Macon, GA","http://bit.ly/H4jb5M","03/30/2012 - 02:27pm",170153.000000,170153.000000,32.886410,-83.565549,888557.000000,1.000000,2.000000,0.000000,"170153-garbag-cart-broken-handle","Open","Garbag Cart - Broken handle","06/07/2012 - 09:46am","2012-06-07T09:46:25-04:00",0.000000,0.000000,0," "," "," "," "," "," "," "," "," "," "," "," "," "," ",0,0.000000," "," "," "," ",0.000000,0.000000,0,0," "," "," "," "
,"769 Ishman Ballard Rd Newnan, GA 30263, USA","http://bit.ly/HoYn7c","03/30/2012 - 08:19am",170049.000000,170049.000000,33.360920,-84.847484,888925.000000,1.000000,2.000000,0.000000,"170049-school-sign-discrepancy","Open","School sign discrepancy","05/23/2012 - 09:08am","2012-05-23T09:08:09-04:00",0.000000,1.000000,0," "," "," "," "," "," "," "," "," "," "," "," "," "," ",0,0.000000," "," "," "," ",0.000000,0.000000,0,0," "," "," "," "
,"Tinker Dr Macon, GA","http://bit.ly/HoGnYw","03/29/2012 - 03:19pm",169886.000000,169886.000000,32.756033,-83.668903,889945.000000,1.000000,1.000000,0.000000,"169886-garbage-pick-up-request-tinker-dr","Open","garbage -pick up request / Tinker Dr.","03/29/2012 - 03:19pm","2012-03-29T15:19:59-04:00",0.000000,0.000000,0," "," "," "," "," "," "," "," "," "," "," "," "," "," ",0,0.000000," "," "," "," ",0.000000,0.000000,0,0," "," "," "," "
,"Hwy 138 Riverdale, GA","http://bit.ly/HotMlZ","03/28/2012 - 06:00pm",169621.000000,169621.000000,33.550421,-84.426227,891224.000000,1.000000,1.000000,0.000000,"169621-pothole-problem","Open","Pothole Problem","03/28/2012 - 06:00pm","2012-03-28T18:00:49-04:00",0.000000,0.000000,0," "," "," "," "," "," "," "," "," "," "," "," "," "," ",0,0.000000," "," "," "," ",0.000000,0.000000,0,0," "," "," "," "
,"5020 Houston Rd Macon, GA","http://bit.ly/HeAc6Y","03/27/2012 - 11:01am",169091.000000,169091.000000,32.759832,-83.660056,893083.000000,1.000000,2.000000,0.000000,"169091-share-the-road-sign-missing","Open","Share the Road sign missing","09/24/2012 - 07:09am","2012-09-24T07:09:47-04:00",37849.000000,1.000000,0," "," "," "," "," "," "," "," "," "," "," "," "," "," ",0,0.000000," "," "," "," ",0.000000,0.000000,0,0," "," "," "," "
,"State Route 361 Macon, GA","http://bit.ly/HbafpS","03/27/2012 - 10:44am",169077.000000,169077.000000,32.932028,-83.727691,893100.000000,1.000000,2.000000,0.000000,"169077-please-remove","Acknowledged","Please remove","03/27/2012 - 10:48am","2012-03-27T10:48:02-04:00",37849.000000,0.000000,0," "," "," "," "," "," "," "," "," "," "," "," "," "," ",0,0.000000," "," "," "," ",0.000000,0.000000,0,0," "," "," "," "
,"5017 Nisbet Dr Macon, GA","http://bit.ly/GV9PWF","03/26/2012 - 03:22pm",168835.000000,168835.000000,32.800934,-83.714664,894262.000000,1.000000,1.000000,0.000000,"168835-garbage-cart-5017-nisbet-dr","Open","Garbage Cart / 5017 Nisbet Dr.","03/26/2012 - 03:22pm","2012-03-26T15:22:30-04:00",0.000000,0.000000,0," "," "," "," "," "," "," "," "," "," "," "," "," "," ",0,0.000000," "," "," "," ",0.000000,0.000000,0,0," "," "," "," "
,"4325 Lincolndale Dr Ellenwoood, Ga","http://bit.ly/GH1CY5","03/22/2012 - 07:58pm",167949.000000,167949.000000,33.652192,-84.251554,899746.000000,1.000000,2.000000,0.000000,"167949-no-street-lights","Open","No street lights","12/18/2012 - 01:21pm","2012-12-18T13:21:28-05:00",0.000000,1.000000,0," "," "," "," "," "," "," "," "," "," "," "," "," "," ",0,0.000000," "," "," "," ",0.000000,0.000000,0,0," "," "," "," "
,"Hwy 138 Sw Union City, GA","http://bit.ly/GGWYIH","03/22/2012 - 12:41pm",167788.000000,167788.000000,33.551448,-84.486978,900183.000000,1.000000,2.000000,0.000000,"167788-severe-bump-on-bridge","Open","Severe bump on bridge","04/22/2012 - 08:54pm","2012-04-22T20:54:57-04:00",0.000000,0.000000,0," "," "," "," "," "," "," "," "," "," "," "," "," "," ",0,0.000000," "," "," "," ",0.000000,0.000000,0,0," "," "," "," "
,"Airport Macon, GA","http://bit.ly/GALjwN","03/20/2012 - 09:17am",166970.000000,166970.000000,32.825655,-83.566103,903267.000000,1.000000,1.000000,0.000000,"166970-pothole","Open","Pothole","03/20/2012 - 09:17am","2012-03-20T09:17:13-04:00",0.000000,0.000000,0," "," "," "," "," "," "," "," "," "," "," "," "," "," ",0,0.000000," "," "," "," ",0.000000,0.000000,0,0," "," "," "," "
,"Scenic Brook Dr Sw Conyers, GA","http://bit.ly/yzbo2F","03/18/2012 - 06:04pm",166435.000000,166435.000000,33.661853,-84.090256,905620.000000,1.000000,1.000000,0.000000,"166435-pot-holes","Open","Pot Holes","03/18/2012 - 06:04pm","2012-03-18T18:04:50-04:00",0.000000,0.000000,0," "," "," "," "," "," "," "," "," "," "," "," "," "," ",0,0.000000," "," "," "," ",0.000000,0.000000,0,0," "," "," "," "
,"Oak Rd Sw Lawrenceville, GA","http://bit.ly/FP5dzL","03/18/2012 - 10:26am",166351.000000,166351.000000,33.888757,-84.061190,906077.000000,1.000000,1.000000,0.000000,"166351-drivers-left-turn-dangerous","Open","Drivers Left turn Dangerous","03/18/2012 - 10:26am","2012-03-18T10:26:56-04:00",0.000000,0.000000,0," "," "," "," "," "," "," "," "," "," "," "," "," "," ",0,0.000000," "," "," "," ",0.000000,0.000000,0,0," "," "," "," "
,"Okland Rd/Cruse Rd Lawrenceville, GA","http://bit.ly/wf9yZ7","03/16/2012 - 11:15am",165980.000000,165980.000000,33.941546,-84.079815,908909.000000,1.000000,1.000000,0.000000,"165980-graffiti-marks","Open","Graffiti marks","03/16/2012 - 11:15am","2012-03-16T11:15:41-04:00",0.000000,0.000000,0," "," "," "," "," "," "," "," "," "," "," "," "," "," ",0,0.000000," "," "," "," ",0.000000,0.000000,0,0," "," "," "," "
,"Best Friend Rd Atlanta, GA","http://bit.ly/zxv841","03/14/2012 - 11:34pm",165489.000000,165489.000000,33.908399,-84.243258,911049.000000,1.000000,1.000000,0.000000,"165489-accident-causing-rough-railroad","Open","Accident-causing rough railroad","03/14/2012 - 11:34pm","2012-03-14T23:34:56-04:00",0.000000,0.000000,0," "," "," "," "," "," "," "," "," "," "," "," "," "," ",0,0.000000," "," "," "," ",0.000000,0.000000,0,0," "," "," "," "
,"Pleasantdale Rd Atlanta, GA","http://bit.ly/y339n5","03/14/2012 - 11:31pm",165487.000000,165487.000000,33.906190,-84.246584,911053.000000,1.000000,3.000000,0.000000,"165487-green-light-too-long","Open","Green light too long","10/07/2013 - 05:21pm","2013-10-07T17:21:55-04:00",0.000000,0.000000,0," "," "," "," "," "," "," "," "," "," "," "," "," "," ",0,0.000000," "," "," "," ",0.000000,0.000000,0,0," "," "," "," "
,"Interstate 85 Atlanta, GA","http://bit.ly/A43nL4","03/13/2012 - 02:42pm",165072.000000,165072.000000,33.598749,-84.491901,913022.000000,1.000000,1.000000,0.000000,"165072-hwy-sinking","Open","hwy sinking","07/08/2013 - 08:08pm","2013-07-08T20:08:27-04:00",0.000000,0.000000,0," "," "," "," "," "," "," "," "," "," "," "," "," "," ",0,0.000000," "," "," "," ",0.000000,0.000000,0,0," "," "," "," "
,"7170 East Riverdale, GA","http://bit.ly/yl8zLa","03/09/2012 - 04:13pm",164169.000000,164169.000000,33.520907,-84.416119,918631.000000,1.000000,1.000000,0.000000,"164169-accident-prone-bridge-gap-patch","Open","Accident Prone - Bridge Gap/Patch","03/09/2012 - 04:13pm","2012-03-09T16:13:20-05:00",0.000000,0.000000,0," "," "," "," "," "," "," "," "," "," "," "," "," "," ",0,0.000000," "," "," "," ",0.000000,0.000000,0,0," "," "," "," "
,"1203 Pleasant Oak Lane Douglasville, GA","http://bit.ly/yeErMR","03/09/2012 - 08:33am",163959.000000,163959.000000,33.773122,-84.748056,919091.000000,1.000000,1.000000,0.000000,"163959-street-light-outage","Open","street light outage","03/09/2012 - 08:33am","2012-03-09T08:33:34-05:00",0.000000,0.000000,0," "," "," "," "," "," "," "," "," "," "," "," "," "," ",0,0.000000," "," "," "," ",0.000000,0.000000,0,0," "," "," "," "
,"Waldrop Rd Decatur, GA","http://bit.ly/zkeMiR","03/07/2012 - 05:19pm",163553.000000,163553.000000,33.680154,-84.254029,921445.000000,1.000000,1.000000,0.000000,"163553-lots-of-pot-holes","Open","Lots of pot holes","03/07/2012 - 05:19pm","2012-03-07T17:19:16-05:00",0.000000,0.000000,0," "," "," "," "," "," "," "," "," "," "," "," "," "," ",0,0.000000," "," "," "," ",0.000000,0.000000,0,0," "," "," "," "
,"Waldrop Road Decatur, GA","http://bit.ly/AhCgkD","03/07/2012 - 05:06pm",163551.000000,163551.000000,33.680154,-84.254029,921457.000000,1.000000,2.000000,0.000000,"163551-lots-of-pot-holds","Open","lots of pot holds","03/12/2012 - 12:50pm","2012-03-12T12:50:30-04:00",0.000000,0.000000,0," "," "," "," "," "," "," "," "," "," "," "," "," "," ",0,0.000000," "," "," "," ",0.000000,0.000000,0,0," "," "," "," "
,"Hwy 27 @ Ga 120 Buchanan, GA","http://bit.ly/xNm1Uz","03/07/2012 - 06:45am",163282.000000,163282.000000,33.803564,-85.177064,922079.000000,1.000000,1.000000,0.000000,"163282-red-light-improper-functioning","Open","red light improper functioning","03/08/2012 - 12:30pm","2012-03-08T12:30:34-05:00",0.000000,0.000000,0," "," "," "," "," "," "," "," "," "," "," "," "," "," ",0,0.000000," "," "," "," ",0.000000,0.000000,0,0," "," "," "," "
,"4900 Salem Road Atlanta Decatur, GA","http://bit.ly/wm7Hb0","03/05/2012 - 07:08pm",162896.000000,162896.000000,33.676675,-84.185594,924216.000000,1.000000,2.000000,0.000000,"162896-severly-uneven-pavement","Open","Severly uneven Pavement","03/09/2012 - 11:26am","2012-03-09T11:26:47-05:00",0.000000,0.000000,0," "," "," "," "," "," "," "," "," "," "," "," "," "," ",0,0.000000," "," "," "," ",0.000000,0.000000,0,0," "," "," "," "
,"Meadows Powder Springs/Cobb, GA","http://bit.ly/zdOmeD","03/05/2012 - 04:41pm",162855.000000,162855.000000,33.837228,-84.683442,924363.000000,1.000000,2.000000,0.000000,"162855-potholes-everywhere","Open","Potholes EVERYWHERE","03/05/2012 - 04:42pm","2012-03-05T16:42:04-05:00",0.000000,2.000000,0," "," "," "," "," "," "," "," "," "," "," "," "," "," ",0,0.000000," "," "," "," ",0.000000,0.000000,0,0," "," "," "," "
,"Hiram Lithia Springs Rd Powder Springs/Cobb, GA","http://bit.ly/ygvUbr","03/05/2012 - 04:40pm",162854.000000,162854.000000,33.850795,-84.708154,924364.000000,1.000000,2.000000,0.000000,"162854-potholes-everywhere","Open","Potholes EVERYWHERE","03/05/2012 - 04:40pm","2012-03-05T16:40:52-05:00",0.000000,1.000000,0," "," "," "," "," "," "," "," "," "," "," "," "," "," ",0,0.000000," "," "," "," ",0.000000,0.000000,0,0," "," "," "," "
,"2835 Battle Forrest Dr Decatur, GA","http://bit.ly/wmcLIQ","03/02/2012 - 05:48pm",162308.000000,162308.000000,33.701492,-84.223937,928616.000000,1.000000,1.000000,0.000000,"162308-large-hole-in-strreet","Open","large hole in strreet","03/02/2012 - 05:48pm","2012-03-02T17:48:10-05:00",0.000000,0.000000,0," "," "," "," "," "," "," "," "," "," "," "," "," "," ",0,0.000000," "," "," "," ",0.000000,0.000000,0,0," "," "," "," "
,"7015 Palmetto Cascade Hwy Fairburn, GA","http://bit.ly/wzygKo","03/02/2012 - 04:52pm",162294.000000,162294.000000,33.565873,-84.667292,928672.000000,1.000000,1.000000,0.000000,"162294-lots-of-pot-holes","Open","lots of pot holes","07/03/2013 - 10:25pm","2013-07-03T22:25:15-04:00",0.000000,0.000000,0," "," "," "," "," "," "," "," "," "," "," "," "," "," ",0,0.000000," "," "," "," ",0.000000,0.000000,0,0," "," "," "," "
,"2868 Laurelgate Dr. Decatur, Ga","http://bit.ly/ymusDS","03/01/2012 - 06:47pm",161893.000000,161893.000000,33.832289,-84.274588,930297.000000,1.000000,3.000000,0.000000,"161893-street-light-out","Open","Street light out","03/06/2012 - 10:34pm","2012-03-06T22:34:24Z",0.000000,0.000000,0," "," "," "," "," "," "," "," "," "," "," "," "," "," ",0,0.000000," "," "," "," ",0.000000,0.000000,0,0," "," "," "," "
,"Hambrick Rd Stone Mountain, GA","http://bit.ly/yi8Q2e","02/28/2012 - 09:44pm",161389.000000,161389.000000,33.787333,-84.212758,933000.000000,1.000000,2.000000,0.000000,"161389-the-road-is-meesed-up","Open","The road is meesed up!!","03/01/2012 - 10:20pm","2012-03-01T22:20:30Z",0.000000,0.000000,0," "," "," "," "," "," "," "," "," "," "," "," "," "," ",0,0.000000," "," "," "," ",0.000000,0.000000,0,0," "," "," "," "
,"Georgia 120 Buchanan, GA","http://bit.ly/zkA4Vr","02/28/2012 - 02:58pm",161149.000000,161149.000000,33.803278,-85.177408,933406.000000,1.000000,2.000000,0.000000,"161149-red-light-hwy-27-ga-120","Open","Red Light @ HWY 27 / GA 120","03/30/2012 - 04:30pm","2012-03-30T16:30:18Z",0.000000,0.000000,0," "," "," "," "," "," "," "," "," "," "," "," "," "," ",0,0.000000," "," "," "," ",0.000000,0.000000,0,0," "," "," "," "
,"307 Barrister Cir Guyton, GA","http://bit.ly/wPH82i","02/26/2012 - 12:24pm",160652.000000,160652.000000,32.288722,-81.350891,936140.000000,1.000000,1.000000,0.000000,"160652-pot-holes-in-barrister-criossing","Open","Pot holes in Barrister Criossing","02/26/2012 - 12:24pm","2012-02-26T12:24:43-05:00",0.000000,0.000000,0," "," "," "," "," "," "," "," "," "," "," "," "," "," ",0,0.000000," "," "," "," ",0.000000,0.000000,0,0," "," "," "," "
,"6399 Oakhurst Dr Morrow, GA","http://bit.ly/AaHtQA","02/23/2012 - 06:41pm",160035.000000,160035.000000,33.580302,-84.317321,940083.000000,1.000000,1.000000,0.000000,"160035-potholes-4-issues","Open","Potholes-(4) issues","12/04/2012 - 01:09pm","2012-12-04T13:09:38-05:00",0.000000,0.000000,0," "," "," "," "," "," "," "," "," "," "," "," "," "," ",0,0.000000," "," "," "," ",0.000000,0.000000,0,0," "," "," "," "
,"4299 Pleasantdale Rd. doraville/dekalb co., GA","http://bit.ly/x84cL2","02/23/2012 - 11:20am",159710.000000,159710.000000,33.908238,-84.246637,940524.000000,1.000000,4.000000,0.000000,"159710-potholes-encroaching-bushes","Open","potholes,encroaching bushes","01/29/2013 - 07:40pm","2013-01-29T19:40:33-05:00",0.000000,2.000000,0," "," "," "," "," "," "," "," "," "," "," "," "," "," ",0,0.000000," "," "," "," ",0.000000,0.000000,0,0," "," "," "," "
,"4848 Huntlea Ct Decatur, GA","http://bit.ly/wgcgH4","02/23/2012 - 09:50am",159668.000000,159668.000000,33.704277,-84.207930,940614.000000,1.000000,1.000000,0.000000,"159668-road-sinking-sunken-please-help","Open","Road sinking/sunken PLEASE HELP!!!","02/23/2012 - 09:50am","2012-02-23T09:50:10-05:00",0.000000,0.000000,0," "," "," "," "," "," "," "," "," "," "," "," "," "," ",0,0.000000," "," "," "," ",0.000000,0.000000,0,0," "," "," "," "
,"Killian Hill Rd Sw Lilburn, GA","http://bit.ly/xRnWoM","02/21/2012 - 07:53am",158935.000000,158935.000000,33.868298,-84.093619,943611.000000,1.000000,1.000000,0.000000,"158935-left-turn-at-any-rush-hour-is-too-short","Open","Left turn at any rush hour is too short.","02/21/2012 - 07:53am","2012-02-21T07:53:41-05:00",0.000000,0.000000,0," "," "," "," "," "," "," "," "," "," "," "," "," "," ",0,0.000000," "," "," "," ",0.000000,0.000000,0,0," "," "," "," "
,"4325 Lincolndale Drive ellenwood, GA","http://bit.ly/ywbxOq","02/20/2012 - 04:53pm",158819.000000,158819.000000,33.652192,-84.251554,944510.000000,1.000000,3.000000,0.000000,"158819-no-street-lights-in-my-neighborhood","Open","no street lights in my neighborhood","04/02/2012 - 09:40am","2012-04-02T09:40:13-04:00",0.000000,0.000000,0," "," "," "," "," "," "," "," "," "," "," "," "," "," ",0,0.000000," "," "," "," ",0.000000,0.000000,0,0," "," "," "," "
,"Richland Creek Rd Anderson, SC","http://bit.ly/w6EE8O","02/20/2012 - 08:42am",158660.000000,158660.000000,34.464674,-82.834813,945001.000000,1.000000,1.000000,0.000000,"158660-speed","Open","SPEED","11/17/2012 - 04:08pm","2012-11-17T16:08:51-05:00",0.000000,0.000000,0," "," "," "," "," "," "," "," "," "," "," "," "," "," ",0,0.000000," "," "," "," ",0.000000,0.000000,0,0," "," "," "," "
,"3698 Brandeis Ct Atlanta Decatur, GA","http://bit.ly/w5hZyi","02/19/2012 - 10:15am",158534.000000,158534.000000,33.673464,-84.233454,946349.000000,1.000000,2.000000,0.000000,"158534-street-light","Open","street light","02/24/2012 - 11:17am","2012-02-24T11:17:47-05:00",0.000000,0.000000,0," "," "," "," "," "," "," "," "," "," "," "," "," "," ",0,0.000000," "," "," "," ",0.000000,0.000000,0,0," "," "," "," "
,"3170 Panola Road North  Lithonia, GA","http://bit.ly/wGCLJ8","02/18/2012 - 11:37am",158381.000000,158381.000000,33.693937,-84.173613,947707.000000,1.000000,1.000000,0.000000,"158381-pothole","Open","pothole","02/18/2012 - 11:37am","2012-02-18T11:37:06-05:00",0.000000,0.000000,0," "," "," "," "," "," "," "," "," "," "," "," "," "," ",0,0.000000," "," "," "," ",0.000000,0.000000,0,0," "," "," "," "
,"1500 Harry Hagan Rd Pembroke, GA 31321, USA","http://bit.ly/z6FyUz","02/17/2012 - 02:19pm",158262.000000,158262.000000,32.165404,-81.612710,948985.000000,1.000000,1.000000,0.000000,"158262-terrible-road-surface-from-lake-drive-to-sims-rd","Open","terrible road surface from Lake Drive to Sims Rd.","02/17/2012 - 02:19pm","2012-02-17T14:19:09-05:00",0.000000,0.000000,0," "," "," "," "," "," "," "," "," "," "," "," "," "," ",0,0.000000," "," "," "," ",0.000000,0.000000,0,0," "," "," "," "
,"275 Old Donaldson Rd. Canton, GA","http://bit.ly/xFCxEV","02/14/2012 - 08:58am",157182.000000,157182.000000,34.252605,-84.494783,953626.000000,1.000000,1.000000,0.000000,"157182-pot-hole","Open","Pot hole","02/14/2012 - 08:58am","2012-02-14T08:58:48-05:00",0.000000,0.000000,0," "," "," "," "," "," "," "," "," "," "," "," "," "," ",0,0.000000," "," "," "," ",0.000000,0.000000,0,0," "," "," "," "
,"Clifton Springs Rd Decatur, GA","http://bit.ly/zzXXft","02/13/2012 - 05:47pm",157074.000000,157074.000000,33.691488,-84.282589,954537.000000,1.000000,1.000000,0.000000,"157074-large-pothole-intersection","Open","Large Pothole @ intersection","02/13/2012 - 05:47pm","2012-02-13T17:47:10-05:00",0.000000,0.000000,0," "," "," "," "," "," "," "," "," "," "," "," "," "," ",0,0.000000," "," "," "," ",0.000000,0.000000,0,0," "," "," "," "
,"Interstate 85 Norcross, GA","http://bit.ly/wB3hta","02/13/2012 - 05:42pm",157072.000000,157072.000000,33.911525,-84.212586,954542.000000,1.000000,2.000000,0.000000,"157072-dangerous-debris-in-hot-lanes","Open","Dangerous Debris in HOT Lanes","02/13/2012 - 06:12pm","2012-02-13T18:12:53-05:00",0.000000,1.000000,0," "," "," "," "," "," "," "," "," "," "," "," "," "," ",0,0.000000," "," "," "," ",0.000000,0.000000,0,0," "," "," "," "
,"3228 Tucker Norcross Road Tucker, GA","http://bit.ly/zLVPhw","02/10/2012 - 05:52pm",156549.000000,156549.000000,33.885054,-84.219452,958852.000000,1.000000,2.000000,0.000000,"156549-major-dip","Open","Major Dip","02/22/2012 - 10:46am","2012-02-22T10:46:39-05:00",0.000000,0.000000,0," "," "," "," "," "," "," "," "," "," "," "," "," "," ",0,0.000000," "," "," "," ",0.000000,0.000000,0,0," "," "," "," "
,"Pleasantdale Rd Atlanta, GA","http://bit.ly/w8h8uq","02/10/2012 - 07:38am",156312.000000,156312.000000,33.905114,-84.246425,959466.000000,1.000000,7.000000,0.000000,"156312-pleasantdale-road","Open","Pleasantdale Road","01/29/2013 - 07:40pm","2013-01-29T19:40:15-05:00",0.000000,5.000000,0," "," "," "," "," "," "," "," "," "," "," "," "," "," ",0,0.000000," "," "," "," ",0.000000,0.000000,0,0," "," "," "," "
,"East Jones Bridge / Peachtree Parkway Norcross / Peachtree Corners, GA","http://bit.ly/wxDHsz","02/07/2012 - 04:05pm",155604.000000,155604.000000,33.984369,-84.214598,963579.000000,1.000000,1.000000,0.000000,"155604-hole-in-the-road","Open","Hole in the road","10/05/2012 - 01:56pm","2012-10-05T13:56:20Z",0.000000,0.000000,0," "," "," "," "," "," "," "," "," "," "," "," "," "," ",0,0.000000," "," "," "," ",0.000000,0.000000,0,0," "," "," "," "
,"706 Dublin Cir. Rome, GA","http://bit.ly/xZeKuH","02/05/2012 - 11:46am",155241.000000,155241.000000,34.339340,-85.028187,966418.000000,1.000000,6.000000,0.000000,"155241-pothole-heaven","Open","pothole heaven","04/09/2012 - 05:34pm","2012-04-09T17:34:32-04:00",0.000000,5.000000,0," "," "," "," "," "," "," "," "," "," "," "," "," "," ",0,0.000000," "," "," "," ",0.000000,0.000000,0,0," "," "," "," "
,"Panola Rd Dekalb , GA","http://bit.ly/xZL2wl","02/03/2012 - 05:44pm",155067.000000,155067.000000,33.706945,-84.169052,968940.000000,1.000000,3.000000,0.000000,"155067-pothole","Open","pothole","03/26/2013 - 01:52pm","2013-03-26T13:52:27-04:00",0.000000,1.000000,0," "," "," "," "," "," "," "," "," "," "," "," "," "," ",0,0.000000," "," "," "," ",0.000000,0.000000,0,0," "," "," "," "
,"3725 Holy Cross Way Decatur, GA","http://bit.ly/y2YWhP","02/02/2012 - 07:05pm",154878.000000,154878.000000,33.672816,-84.236457,970299.000000,1.000000,4.000000,0.000000,"154878-several-potholes-damaged-streets-and-poor-surfacing-located-within-the-brook-glen-community","Open","Several potholes, damaged streets, and poor surfacing located within the Brook Glen Community","02/08/2012 - 10:47am","2012-02-08T10:47:22-05:00",0.000000,2.000000,0," "," "," "," "," "," "," "," "," "," "," "," "," "," ",0,0.000000," "," "," "," ",0.000000,0.000000,0,0," "," "," "," "
,"West Liddell Road Duluth, GA","http://bit.ly/yYhMpG","02/02/2012 - 04:51pm",154856.000000,154856.000000,33.952832,-84.151875,970433.000000,1.000000,3.000000,0.000000,"154856-filled-with-holes-needs-repair","Open","filled with holes, needs repair","02/02/2012 - 04:52pm","2012-02-02T16:52:54-05:00",0.000000,2.000000,0," "," "," "," "," "," "," "," "," "," "," "," "," "," ",0,0.000000," "," "," "," ",0.000000,0.000000,0,0," "," "," "," "
,"2905 Stonecrest Cir Lithonia, GA","http://bit.ly/zXptaO","02/02/2012 - 04:28pm",154849.000000,154849.000000,33.695632,-84.091496,970456.000000,1.000000,2.000000,0.000000,"154849-light-poles","Open","Light Poles","09/20/2013 - 03:42pm","2013-09-20T15:42:35-04:00",70183.000000,6.000000,0," "," "," "," "," "," "," "," "," "," "," "," "," "," ",0,0.000000," "," "," "," ",0.000000,0.000000,0,0," "," "," "," "
,"Austin &Wesleyan Drive In Bradley Point South Savannah, GA","http://bit.ly/AiXxFo","02/02/2012 - 01:21pm",154787.000000,154787.000000,31.937307,-81.273126,970643.000000,1.000000,1.000000,0.000000,"154787-pot-hole","Open","pot hole","02/02/2012 - 01:21pm","2012-02-02T13:21:44-05:00",0.000000,0.000000,0," "," "," "," "," "," "," "," "," "," "," "," "," "," ",0,0.000000," "," "," "," ",0.000000,0.000000,0,0," "," "," "," "
,"Hoods Mill Road commerce, GA","http://bit.ly/ywlmTF","02/01/2012 - 05:03pm",154621.000000,154621.000000,34.146813,-83.464450,971861.000000,1.000000,2.000000,0.000000,"154621-bad-road","Open","bad road","03/28/2013 - 10:07am","2013-03-28T10:07:17-04:00",0.000000,0.000000,0," "," "," "," "," "," "," "," "," "," "," "," "," "," ",0,0.000000," "," "," "," ",0.000000,0.000000,0,0," "," "," "," "
,"Bouldercrest Rd Se Decatur, GA","http://bit.ly/yNyPvE","02/01/2012 - 04:41pm",154619.000000,154619.000000,33.655209,-84.285907,971883.000000,1.000000,2.000000,0.000000,"154619-potholes-keep-returning","Open","potholes keep returning","02/06/2012 - 05:47pm","2012-02-06T17:47:17-05:00",0.000000,0.000000,0," "," "," "," "," "," "," "," "," "," "," "," "," "," ",0,0.000000," "," "," "," ",0.000000,0.000000,0,0," "," "," "," "
,"Flatshoals And Flakesmill Road Decatur, GA","http://bit.ly/xrUGFI","02/01/2012 - 04:40pm",154618.000000,154618.000000,33.656139,-84.230787,971884.000000,1.000000,2.000000,0.000000,"154618-there-are-several-potholes-coming-from-flatshoals-turning-onto-flakesmill-road-headed-towards-river-road","Open","There are several potholes coming from flatshoals turning onto flakesmill Road, headed towards River Road","02/02/2012 - 03:45pm","2012-02-02T15:45:34-05:00",0.000000,0.000000,0," "," "," "," "," "," "," "," "," "," "," "," "," "," ",0,0.000000," "," "," "," ",0.000000,0.000000,0,0," "," "," "," "
,"Flakes Mill Rd Decatur, GA","http://bit.ly/wpZpoV","01/31/2012 - 09:47pm",154388.000000,154388.000000,33.675771,-84.231404,973317.000000,1.000000,2.000000,0.000000,"154388-potholes","Open","potholes","02/02/2012 - 09:20pm","2012-02-02T21:20:58Z",0.000000,2.000000,0," "," "," "," "," "," "," "," "," "," "," "," "," "," ",0,0.000000," "," "," "," ",0.000000,0.000000,0,0," "," "," "," "
,"Flakes Mill Rd Decatur, GA","http://bit.ly/zqBapH","01/31/2012 - 09:41pm",154385.000000,154385.000000,33.670538,-84.228057,973323.000000,1.000000,2.000000,0.000000,"154385-potholes","Open","potholes","01/31/2012 - 10:21pm","2012-01-31T22:21:59Z",0.000000,1.000000,0," "," "," "," "," "," "," "," "," "," "," "," "," "," ",0,0.000000," "," "," "," ",0.000000,0.000000,0,0," "," "," "," "
,"3020 5 Forks Trickum ilburn, GA","http://bit.ly/ymE0fx","01/31/2012 - 03:49pm",154242.000000,154242.000000,33.885930,-84.060143,973675.000000,1.000000,1.000000,0.000000,"154242-no-cross-walks-or-crossmlites","Open","no cross walks or crossmlites","01/31/2012 - 03:49pm","2012-01-31T15:49:52Z",0.000000,0.000000,0," "," "," "," "," "," "," "," "," "," "," "," "," "," ",0,0.000000," "," "," "," ",0.000000,0.000000,0,0," "," "," "," "
,"810 Hwy 138 Sw Jonesboro, GA","http://bit.ly/yMxydB","01/31/2012 - 12:55am",154151.000000,154151.000000,33.537774,-84.364881,974569.000000,1.000000,1.000000,0.000000,"154151-sunken-drain","Open","Sunken Drain","01/31/2012 - 12:55am","2012-01-31T00:55:10Z",0.000000,0.000000,0," "," "," "," "," "," "," "," "," "," "," "," "," "," ",0,0.000000," "," "," "," ",0.000000,0.000000,0,0," "," "," "," "
,"Homestead Stockbridge, GA","http://bit.ly/zzg8gK","01/30/2012 - 09:39pm",154107.000000,154107.000000,33.575726,-84.262390,974765.000000,1.000000,5.000000,0.000000,"154107-repatch-after-repatch-after-repatch-for-years-try-driving-homestead-rd-just-north-of-stockbridge","Open","Repatch after repatch after repatch...for years! Try driving Homestead Rd. just north of Stockbridge","06/24/2013 - 11:17pm","2013-06-24T23:17:12Z",0.000000,4.000000,0," "," "," "," "," "," "," "," "," "," "," "," "," "," ",0,0.000000," "," "," "," ",0.000000,0.000000,0,0," "," "," "," "
,"Business Hwy27 @ East Ave CEDARTOWN, GA","http://bit.ly/zRaDbI","01/29/2012 - 05:43pm",153792.000000,153792.000000,33.994209,-85.237227,976441.000000,1.000000,1.000000,0.000000,"153792-traffic-light","Open","TRAFFIC LIGHT","01/29/2012 - 05:43pm","2012-01-29T17:43:01Z",0.000000,0.000000,0," "," "," "," "," "," "," "," "," "," "," "," "," "," ",0,0.000000," "," "," "," ",0.000000,0.000000,0,0," "," "," "," "
,"Hwy 27 At Hwy 120 BUCHANNAN, GA","http://bit.ly/wH1XVj","01/29/2012 - 05:38pm",153791.000000,153791.000000,33.803665,-85.176663,976446.000000,1.000000,1.000000,0.000000,"153791-traffic-light","Open","TRAFFIC LIGHT","01/29/2012 - 05:38pm","2012-01-29T17:38:28Z",0.000000,0.000000,0," "," "," "," "," "," "," "," "," "," "," "," "," "," ",0,0.000000," "," "," "," ",0.000000,0.000000,0,0," "," "," "," "
,"At The Interstation Of Bouldercrest And Pantersville decatur, GA","http://bit.ly/w4JYjI","01/27/2012 - 07:57pm",153628.000000,153628.000000,33.657852,-84.286749,978887.000000,1.000000,4.000000,0.000000,"153628-please-help-harry","Open","please help harry!!!!!!!!!!!!!!!!!","02/01/2012 - 04:42pm","2012-02-01T16:42:28-05:00",0.000000,2.000000,0," "," "," "," "," "," "," "," "," "," "," "," "," "," ",0,0.000000," "," "," "," ",0.000000,0.000000,0,0," "," "," "," "
,"Rockbridge Road Between Stephenson Rd To Memorial Drive stone mountain , GA","http://bit.ly/ArIub0","01/27/2012 - 07:06pm",153614.000000,153614.000000,33.800910,-84.208247,978938.000000,1.000000,2.000000,0.000000,"153614-potholes","Open","potholes","12/03/2012 - 03:08pm","2012-12-03T15:08:09-05:00",0.000000,0.000000,0," "," "," "," "," "," "," "," "," "," "," "," "," "," ",0,0.000000," "," "," "," ",0.000000,0.000000,0,0," "," "," "," "
,"Medical Pkwy Lithonia, GA","http://bit.ly/wmH6Ub","01/26/2012 - 04:54pm",153329.000000,153329.000000,33.712679,-84.146631,980510.000000,1.000000,2.000000,0.000000,"153329-large-potholes-all-up-and-down-the-pkwy-reall-bad-between-miller-grove-high-and-dekalb-medical-center","Open","Large potholes all up and down the pkwy, reall bad between miller grove high and Dekalb medical center","01/30/2012 - 02:09pm","2012-01-30T14:09:00-05:00",0.000000,0.000000,0," "," "," "," "," "," "," "," "," "," "," "," "," "," ",0,0.000000," "," "," "," ",0.000000,0.000000,0,0," "," "," "," "
,"Silver Comet Trail Cumberland Connector Smyrna, GA","http://bit.ly/w21yJ2","01/25/2012 - 05:47pm",153060.000000,153060.000000,33.852374,-84.493553,981897.000000,1.000000,1.000000,0.000000,"153060-intersection-needs-light-and-crosswalk","Open","Intersection needs light and crosswalk","01/25/2012 - 05:47pm","2012-01-25T17:47:54-05:00",0.000000,0.000000,0," "," "," "," "," "," "," "," "," "," "," "," "," "," ",0,0.000000," "," "," "," ",0.000000,0.000000,0,0," "," "," "," "
,"2415 Marsh Rabbit Bend Atlanta Decatur, GA","http://bit.ly/wpOSIj","01/25/2012 - 12:31pm",152948.000000,152948.000000,33.723973,-84.202365,982213.000000,1.000000,1.000000,0.000000,"152948-street-light-pole-needs-replaced","Open","Street light pole needs replaced","01/25/2012 - 12:31pm","2012-01-25T12:31:38-05:00",0.000000,0.000000,0," "," "," "," "," "," "," "," "," "," "," "," "," "," ",0,0.000000," "," "," "," ",0.000000,0.000000,0,0," "," "," "," "
,"Highway 36 @ Flat Shoals Rd COVINGTON, GA","http://bit.ly/yoO4cQ","01/24/2012 - 04:33pm",152721.000000,152721.000000,33.527877,-83.852063,983411.000000,1.000000,1.000000,0.000000,"152721-super-dangerous-intersection","Open","Super Dangerous Intersection","01/24/2012 - 04:33pm","2012-01-24T16:33:05-05:00",0.000000,0.000000,0," "," "," "," "," "," "," "," "," "," "," "," "," "," ",0,0.000000," "," "," "," ",0.000000,0.000000,0,0," "," "," "," "
,"3122-3172 Kittery Dr Sw Snellville, GA 30039, USA","http://bit.ly/wjLiHf","01/23/2012 - 09:24pm",152532.000000,152532.000000,33.818561,-84.041786,984560.000000,1.000000,1.000000,0.000000,"152532-street-light-is-out","Open","Street light is out.","01/23/2012 - 09:24pm","2012-01-23T21:24:59-05:00",0.000000,0.000000,0," "," "," "," "," "," "," "," "," "," "," "," "," "," ",0,0.000000," "," "," "," ",0.000000,0.000000,0,0," "," "," "," "
,"Lower Roswell Road marietta, GA","http://bit.ly/xO34wk","01/23/2012 - 04:50pm",152487.000000,152487.000000,33.949007,-84.491259,984834.000000,1.000000,1.000000,0.000000,"152487-metal-sheets-that-are-over-potholes-are-invading-our-road","Open","Metal Sheets that are over potholes, are invading our road.","09/21/2012 - 05:07pm","2012-09-21T17:07:23-04:00",0.000000,0.000000,0," "," "," "," "," "," "," "," "," "," "," "," "," "," ",0,0.000000," "," "," "," ",0.000000,0.000000,0,0," "," "," "," "
,"3578.  Indian Shoals Road Bethlehem, Ga","http://bit.ly/wzoV0V","01/23/2012 - 01:39pm",152431.000000,152431.000000,33.942558,-83.817939,985025.000000,1.000000,1.000000,0.000000,"152431-pot-hole-right-before-the-small-bridge-hard-to-get-around-with-the-small-bridge-ahead","Open","Pot hole right before the small bridge, hard to get around with the small bridge ahead","01/23/2012 - 01:39pm","2012-01-23T13:39:28-05:00",0.000000,0.000000,0," "," "," "," "," "," "," "," "," "," "," "," "," "," ",0,0.000000," "," "," "," ",0.000000,0.000000,0,0," "," "," "," "
,"3578 Indian Shoals Rd  Bethlehem, Ga","http://bit.ly/y8bYPm","01/23/2012 - 12:16pm",152397.000000,152397.000000,33.942558,-83.817939,985108.000000,1.000000,2.000000,0.000000,"152397-pot-hole-right-before-the-small-bridge-hard-to-get-around-with-the-small-bridge-ahead","Open","Pot hole right before the small bridge, hard to get around with the small bridge ahead","01/23/2012 - 12:21pm","2012-01-23T12:21:25-05:00",0.000000,0.000000,0," "," "," "," "," "," "," "," "," "," "," "," "," "," ",0,0.000000," "," "," "," ",0.000000,0.000000,0,0," "," "," "," "
,"Bells Ferry Rd Canton, GA","http://bit.ly/wGDdHF","01/22/2012 - 01:38pm",152233.000000,152233.000000,34.189307,-84.542188,986466.000000,1.000000,1.000000,0.000000,"152233-man-made-pothole-picture-3","Open","Man Made Pothole Picture 3","01/22/2012 - 01:38pm","2012-01-22T13:38:22-05:00",0.000000,0.000000,0," "," "," "," "," "," "," "," "," "," "," "," "," "," ",0,0.000000," "," "," "," ",0.000000,0.000000,0,0," "," "," "," "
,"Bells Ferry Road Canton, GA","http://bit.ly/xJMWrx","01/22/2012 - 01:35pm",152231.000000,152231.000000,34.189307,-84.542188,986469.000000,1.000000,2.000000,0.000000,"152231-man-made-pothole","Open","man made pothole","09/14/2013 - 06:28pm","2013-09-14T18:28:15-04:00",0.000000,1.000000,0," "," "," "," "," "," "," "," "," "," "," "," "," "," ",0,0.000000," "," "," "," ",0.000000,0.000000,0,0," "," "," "," "
,"Wertz Industrial  NEWNAN, GA","http://bit.ly/x4u3Si","01/21/2012 - 08:15pm",152181.000000,152181.000000,33.325938,-84.866638,987509.000000,1.000000,5.000000,0.000000,"152181-they-tore-up-the-street-for-repaving-farmer-industrial-34-bypass-and-they-have-left-it-and-there-are-several-potholes-that-are-tearing-up-our-cars","Open","They tore up the street for repaving Farmer Industrial/34 bypass and they have left it and there are several potholes that are tearing up our cars.","01/22/2012 - 11:06am","2012-01-22T11:06:15-05:00",0.000000,4.000000,0," "," "," "," "," "," "," "," "," "," "," "," "," "," ",0,0.000000," "," "," "," ",0.000000,0.000000,0,0," "," "," "," "
,"Mitchell Rd Hampton, GA","http://bit.ly/yqVBr7","01/19/2012 - 11:41pm",151838.000000,151838.000000,33.470235,-84.255331,990183.000000,1.000000,1.000000,0.000000,"151838-unsafe-road","Open","unsafe road","01/19/2012 - 11:41pm","2012-01-19T23:41:42-05:00",0.000000,0.000000,0," "," "," "," "," "," "," "," "," "," "," "," "," "," ",0,0.000000," "," "," "," ",0.000000,0.000000,0,0," "," "," "," "
,"Holt Rd Lithonia, GA","http://bit.ly/xtVYn6","01/19/2012 - 04:31pm",151778.000000,151778.000000,33.746999,-84.136855,990613.000000,1.000000,3.000000,0.000000,"151778-super-sized-holes","Open","Super sized holes","01/24/2012 - 09:28am","2012-01-24T09:28:07-05:00",0.000000,0.000000,0," "," "," "," "," "," "," "," "," "," "," "," "," "," ",0,0.000000," "," "," "," ",0.000000,0.000000,0,0," "," "," "," "
,"95079 Starling Ct Fernandina Beach, FL","http://bit.ly/zCj6OR","01/17/2012 - 02:11pm",151096.000000,151096.000000,30.596964,-81.535116,993633.000000,1.000000,2.000000,0.000000,"151096-bfs-credit-is-ruining-our-neighborhoods-with-litter","Open","BFS Credit is ruining our neighborhoods with litter","04/10/2012 - 04:22pm","2012-04-10T16:22:48-04:00",0.000000,0.000000,0," "," "," "," "," "," "," "," "," "," "," "," "," "," ",0,0.000000," "," "," "," ",0.000000,0.000000,0,0," "," "," "," "
,"Ledbetter Road Villa Rica, GA","http://bit.ly/y9lgsD","01/16/2012 - 02:02pm",150854.000000,150854.000000,33.768744,-84.906370,995082.000000,1.000000,1.000000,0.000000,"150854-pothole","Open","Pothole","01/16/2012 - 02:02pm","2012-01-16T14:02:51-05:00",0.000000,0.000000,0," "," "," "," "," "," "," "," "," "," "," "," "," "," ",0,0.000000," "," "," "," ",0.000000,0.000000,0,0," "," "," "," "
,"Elder Road Winder, GA","http://bit.ly/yF2k4v","01/16/2012 - 01:31pm",150850.000000,150850.000000,33.967481,-83.633036,995113.000000,1.000000,2.000000,0.000000,"150850-multiple-potholes","Open","Multiple Potholes","09/08/2013 - 08:05am","2013-09-08T08:05:25-04:00",0.000000,0.000000,0," "," "," "," "," "," "," "," "," "," "," "," "," "," ",0,0.000000," "," "," "," ",0.000000,0.000000,0,0," "," "," "," "
,"Park Meadows Dr Sw Lawrenceville, GA","http://bit.ly/wqzULe","01/15/2012 - 08:52pm",150725.000000,150725.000000,33.907258,-84.074572,996412.000000,1.000000,2.000000,0.000000,"150725-park-meadows-at-heathgate-dr","Open","Park Meadows at Heathgate Dr","02/19/2012 - 08:41pm","2012-02-19T20:41:30Z",0.000000,0.000000,0," "," "," "," "," "," "," "," "," "," "," "," "," "," ",0,0.000000," "," "," "," ",0.000000,0.000000,0,0," "," "," "," "
,"Stonehurst Way Sw Lawrenceville, GA","http://bit.ly/xCwHEQ","01/15/2012 - 08:48pm",150723.000000,150723.000000,33.911817,-84.074100,996416.000000,1.000000,2.000000,0.000000,"150723-stonehurst-way-close-to-winn-dr","Open","Stonehurst Way close to Winn Dr","02/19/2012 - 08:40pm","2012-02-19T20:40:25Z",0.000000,0.000000,0," "," "," "," "," "," "," "," "," "," "," "," "," "," ",0,0.000000," "," "," "," ",0.000000,0.000000,0,0," "," "," "," "
,"Rockbridge Road stone Mountain, GA","http://bit.ly/z1nM7e","01/13/2012 - 10:45pm",150521.000000,150521.000000,33.788849,-84.150949,999179.000000,1.000000,2.000000,0.000000,"150521-this-hole-will-knock-your-hub-cap-off","Open","this hole will knock your hub cap off","01/19/2012 - 04:39pm","2012-01-19T16:39:42Z",0.000000,0.000000,0," "," "," "," "," "," "," "," "," "," "," "," "," "," ",0,0.000000," "," "," "," ",0.000000,0.000000,0,0," "," "," "," "
,"Peachtree Pkwy Nw Norcross, GA","http://bit.ly/zsyTJO","01/13/2012 - 10:22pm",150518.000000,150518.000000,33.984699,-84.212427,999202.000000,1.000000,1.000000,0.000000,"150518-pothole-in-merging-lane","Open","Pothole in merging lane","01/13/2012 - 10:22pm","2012-01-13T22:22:42Z",0.000000,0.000000,0," "," "," "," "," "," "," "," "," "," "," "," "," "," ",0,0.000000," "," "," "," ",0.000000,0.000000,0,0," "," "," "," "
,"Milam Rd Fairburn  ga","http://bit.ly/x80KGG","01/13/2012 - 09:41pm",150508.000000,150508.000000,33.527255,-84.561067,999243.000000,1.000000,1.000000,0.000000,"150508-too-many-potholes","Open","too many potholes","07/04/2013 - 02:25am","2013-07-04T02:25:01Z",0.000000,0.000000,0," "," "," "," "," "," "," "," "," "," "," "," "," "," ",0,0.000000," "," "," "," ",0.000000,0.000000,0,0," "," "," "," "
,"Univeter Road Canton, GA","http://bit.ly/zHvOtP","01/13/2012 - 08:51pm",150492.000000,150492.000000,34.196036,-84.522706,999293.000000,1.000000,3.000000,0.000000,"150492-rr-crossing-at-chicken-plant","Open","rr crossing at chicken plant","01/30/2013 - 08:33pm","2013-01-30T20:33:38Z",0.000000,1.000000,0," "," "," "," "," "," "," "," "," "," "," "," "," "," ",0,0.000000," "," "," "," ",0.000000,0.000000,0,0," "," "," "," "
,"Six Flags Drive AUSTELL, GA","http://bit.ly/AhAEHc","01/13/2012 - 03:51pm",150394.000000,150394.000000,33.780896,-84.592778,999593.000000,1.000000,1.000000,0.000000,"150394-pot-holes-causing-accidents","Open","POT HOLES CAUSING ACCIDENTS","01/13/2012 - 03:51pm","2012-01-13T15:51:59Z",0.000000,0.000000,0," "," "," "," "," "," "," "," "," "," "," "," "," "," ",0,0.000000," "," "," "," ",0.000000,0.000000,0,0," "," "," "," "
,"Regal Heights Dr Lithonia, GA","http://bit.ly/w60g8d","01/13/2012 - 02:13pm",150374.000000,150374.000000,33.755433,-84.115203,999691.000000,1.000000,2.000000,0.000000,"150374-street-full-of-potholes","Open","Street full of potholes","12/04/2013 - 02:08pm","2013-12-04T14:08:45Z",0.000000,0.000000,0," "," "," "," "," "," "," "," "," "," "," "," "," "," ",0,0.000000," "," "," "," ",0.000000,0.000000,0,0," "," "," "," "
,"Interstate 20 Rutledge, GA","http://bit.ly/zlcf56","01/13/2012 - 03:46am",150338.000000,150338.000000,33.576112,-83.568921,1000318.000000,1.000000,1.000000,0.000000,"150338-road-work","Open","road work","01/13/2012 - 03:46am","2012-01-13T03:46:57Z",0.000000,0.000000,0," "," "," "," "," "," "," "," "," "," "," "," "," "," ",0,0.000000," "," "," "," ",0.000000,0.000000,0,0," "," "," "," "
,"260 Fields Chapel Rd Canton,","http://bit.ly/xo15wP","01/12/2012 - 11:00pm",150295.000000,150295.000000,34.207276,-84.594515,1000604.000000,1.000000,2.000000,0.000000,"150295-dead-tree-huge-threatening-fields-chapel-rd-traffic","Open","Dead tree (huge) threatening fields chapel rd traffic","10/04/2013 - 10:03pm","2013-10-04T22:03:58Z",0.000000,0.000000,0," "," "," "," "," "," "," "," "," "," "," "," "," "," ",0,0.000000," "," "," "," ",0.000000,0.000000,0,0," "," "," "," "
,"Interstate 85 Union City, GA","http://bit.ly/zoRhMz","01/12/2012 - 10:43pm",150292.000000,150292.000000,33.564284,-84.537048,1000621.000000,1.000000,1.000000,0.000000,"150292-road-collapse","Open","road collapse","07/04/2013 - 02:25am","2013-07-04T02:25:01Z",0.000000,0.000000,0," "," "," "," "," "," "," "," "," "," "," "," "," "," ",0,0.000000," "," "," "," ",0.000000,0.000000,0,0," "," "," "," "
,"3892 Lavista Rd Tucker, GA","http://bit.ly/ya3s4n","01/12/2012 - 10:42pm",150291.000000,150291.000000,33.843660,-84.258323,1000622.000000,1.000000,2.000000,0.000000,"150291-pot-hole","Open","POT HOLE","01/19/2012 - 03:35pm","2012-01-19T15:35:01Z",0.000000,0.000000,0," "," "," "," "," "," "," "," "," "," "," "," "," "," ",0,0.000000," "," "," "," ",0.000000,0.000000,0,0," "," "," "," "
,"Jennings Mill Parkway/Oconee Connector Athens, Ga","http://bit.ly/xwHlzd","01/12/2012 - 09:43pm",150284.000000,150284.000000,33.908883,-83.465153,1000681.000000,1.000000,2.000000,0.000000,"150284-construction-still-going-on-was-to-open-last-spring-what-s-taking-so-long","Open","Construction still going on.  Was to open last Spring.  What's taking so long?","03/13/2012 - 12:24pm","2012-03-13T12:24:58Z",0.000000,0.000000,0," "," "," "," "," "," "," "," "," "," "," "," "," "," ",0,0.000000," "," "," "," ",0.000000,0.000000,0,0," "," "," "," "
,"Dekalb Medical lithonia, GA","http://bit.ly/zlBrU2","01/12/2012 - 05:04am",150123.000000,150123.000000,33.712537,-84.146631,1001680.000000,1.000000,1.000000,0.000000,"150123-several-pot-holes","Open","several pot holes","01/12/2012 - 05:04am","2012-01-12T05:04:32Z",0.000000,0.000000,0," "," "," "," "," "," "," "," "," "," "," "," "," "," ",0,0.000000," "," "," "," ",0.000000,0.000000,0,0," "," "," "," "
,"Waterfront Dr Mc Donough, GA","http://bit.ly/yJ4JHL","01/12/2012 - 04:57am",150120.000000,150120.000000,33.459802,-84.166131,1001688.000000,1.000000,1.000000,0.000000,"150120-bumps-waves-and-man-hole-covers","Open","bumps,waves, and man hole covers","11/07/2012 - 11:06am","2012-11-07T11:06:03Z",0.000000,0.000000,0," "," "," "," "," "," "," "," "," "," "," "," "," "," ",0,0.000000," "," "," "," ",0.000000,0.000000,0,0," "," "," "," "
,"5 Forks Trickum Rd Sw Lawrenceville, GA","http://bit.ly/xHsSsE","01/12/2012 - 04:44am",150119.000000,150119.000000,33.888102,-84.058623,1001700.000000,1.000000,1.000000,0.000000,"150119-pothole-while-turning-right-onto-dogwood-rd","Open","Pothole while turning right onto Dogwood Rd","01/12/2012 - 04:44am","2012-01-12T04:44:35Z",0.000000,0.000000,0," "," "," "," "," "," "," "," "," "," "," "," "," "," ",0,0.000000," "," "," "," ",0.000000,0.000000,0,0," "," "," "," "
,"Jamerson Road Woodstock, GA","http://bit.ly/AEAxAA","01/11/2012 - 05:56pm",150070.000000,150070.000000,34.075135,-84.483756,1002048.000000,1.000000,2.000000,0.000000,"150070-at-the-railroad-tracks-there-is-a-uneven-pavement-under-the-tracks-that-twists-and-turn-your-vichcle-have-to-go-over-the-railroad-tracks-very-slow","Open","At the railroad tracks, there is a uneven pavement under the tracks that twists and turn your vichcle.Have to go over the railroad tracks very slow.","07/02/2012 - 11:31pm","2012-07-02T23:31:29-04:00",0.000000,1.000000,0," "," "," "," "," "," "," "," "," "," "," "," "," "," ",0,0.000000," "," "," "," ",0.000000,0.000000,0,0," "," "," "," "
,"1305 Chastain Rd. Kennesaw, GA","http://bit.ly/x1Q1oa","01/11/2012 - 05:55pm",150068.000000,150068.000000,34.013372,-84.609002,1002049.000000,1.000000,2.000000,0.000000,"150068-big-pothole-in-right-land","Open","big pothole in right land","03/07/2012 - 09:49am","2012-03-07T09:49:34-05:00",0.000000,0.000000,0," "," "," "," "," "," "," "," "," "," "," "," "," "," ",0,0.000000," "," "," "," ",0.000000,0.000000,0,0," "," "," "," "
,"1270 Chastain Rd. Kennesaw, GA","http://bit.ly/yyiQio","01/11/2012 - 05:50pm",150066.000000,150066.000000,34.023848,-84.588520,1002054.000000,1.000000,2.000000,0.000000,"150066-right-lane-is-disappearing","Open","Right lane is disappearing","03/07/2012 - 02:13pm","2012-03-07T14:13:55-05:00",0.000000,0.000000,0," "," "," "," "," "," "," "," "," "," "," "," "," "," ",0,0.000000," "," "," "," ",0.000000,0.000000,0,0," "," "," "," "
,"1500 Cedar Grove Rd Conley, GA","http://bit.ly/z4B49j","01/09/2012 - 11:41pm",149663.000000,149663.000000,33.657674,-84.330282,1004583.000000,1.000000,2.000000,0.000000,"149663-multiple-potholes-and-dips-in-the-road","Open","multiple potholes and dips in the road","01/17/2012 - 11:48am","2012-01-17T11:48:29-05:00",0.000000,0.000000,0," "," "," "," "," "," "," "," "," "," "," "," "," "," ",0,0.000000," "," "," "," ",0.000000,0.000000,0,0," "," "," "," "
,"Eagles Landing Pkwy Stockbridge, GA","http://bit.ly/AhwziU","01/09/2012 - 06:37pm",149631.000000,149631.000000,33.513149,-84.214284,1004887.000000,1.000000,2.000000,0.000000,"149631-terrible-road-work","Open","Terrible road work","01/10/2012 - 11:07am","2012-01-10T11:07:22-05:00",0.000000,0.000000,0," "," "," "," "," "," "," "," "," "," "," "," "," "," ",0,0.000000," "," "," "," ",0.000000,0.000000,0,0," "," "," "," "
,"Steve Reynolds At Satellite Blvd Duluth, GA","http://bit.ly/z7hXBo","01/09/2012 - 05:53pm",149621.000000,149621.000000,33.954386,-84.141496,1004931.000000,1.000000,3.000000,0.000000,"149621-big-pothole-in-the-road","Open","Big Pothole in the road","05/15/2012 - 09:03am","2012-05-15T09:03:12-04:00",0.000000,2.000000,0," "," "," "," "," "," "," "," "," "," "," "," "," "," ",0,0.000000," "," "," "," ",0.000000,0.000000,0,0," "," "," "," "
,"1204 Dale Dr. Monroe ga.","http://bit.ly/weRXrW","01/09/2012 - 05:52pm",149620.000000,149620.000000,33.936524,-83.686450,1004933.000000,1.000000,1.000000,0.000000,"149620-poor-road-work-potholes-uneven-pavement-poor-patch-jobs","Open","Poor road work/ potholes/ uneven pavement/poor patch jobs","04/09/2012 - 04:53pm","2012-04-09T16:53:46-04:00",0.000000,0.000000,0," "," "," "," "," "," "," "," "," "," "," "," "," "," ",0,0.000000," "," "," "," ",0.000000,0.000000,0,0," "," "," "," "
,"311 Wyatt Rd Monticello, GA","http://bit.ly/zzIdoK","01/09/2012 - 04:48pm",149602.000000,149602.000000,33.389941,-83.592971,1004996.000000,1.000000,2.000000,0.000000,"149602-big-pot-hole-in-my-park","Open","Big Pot Hole In My Park","02/09/2012 - 08:33am","2012-02-09T08:33:14-05:00",0.000000,1.000000,0," "," "," "," "," "," "," "," "," "," "," "," "," "," ",0,0.000000," "," "," "," ",0.000000,0.000000,0,0," "," "," "," "
,"578 Dorsey Cir Sw Lilburn, GA","http://bit.ly/xy7xC8","01/09/2012 - 12:48pm",149491.000000,149491.000000,33.877178,-84.104602,1005236.000000,1.000000,2.000000,0.000000,"149491-road-trench-patch-is-sinking","Open","Road trench patch is sinking","04/23/2012 - 12:34pm","2012-04-23T12:34:54-04:00",0.000000,0.000000,0," "," "," "," "," "," "," "," "," "," "," "," "," "," ",0,0.000000," "," "," "," ",0.000000,0.000000,0,0," "," "," "," "
,"3725 Holy Cross Way Decatur, GA","http://bit.ly/zOHfjw","01/08/2012 - 10:32pm",149352.000000,149352.000000,33.676354,-84.223937,1006092.000000,1.000000,3.000000,0.000000,"149352-pot-holes-on-brown-dr","Open","pot holes on Brown Dr.","09/18/2013 - 01:49pm","2013-09-18T13:49:01-04:00",0.000000,0.000000,0," "," "," "," "," "," "," "," "," "," "," "," "," "," ",0,0.000000," "," "," "," ",0.000000,0.000000,0,0," "," "," "," "
,"2164 Fort Mcallister Rd Richmond Hill, GA 31324, USA","http://bit.ly/AzAKzF","01/08/2012 - 10:18pm",149351.000000,149351.000000,31.880672,-81.244299,1006106.000000,1.000000,1.000000,0.000000,"149351-remove-old-rusted-culvert-from-entrance-to-green-creek-trail","Open","Remove old rusted culvert from entrance to green creek trail","01/08/2012 - 10:18pm","2012-01-08T22:18:59-05:00",0.000000,0.000000,0," "," "," "," "," "," "," "," "," "," "," "," "," "," ",0,0.000000," "," "," "," ",0.000000,0.000000,0,0," "," "," "," "
,"Joe Cox Rd Newnan, GA","http://bit.ly/ABrjRh","01/07/2012 - 06:22pm",149226.000000,149226.000000,33.341481,-84.702350,1007782.000000,1.000000,1.000000,0.000000,"149226-unpaved-road-huge-pothole","Open","Unpaved road / Huge Pothole","01/07/2012 - 06:22pm","2012-01-07T18:22:59-05:00",0.000000,0.000000,0," "," "," "," "," "," "," "," "," "," "," "," "," "," ",0,0.000000," "," "," "," ",0.000000,0.000000,0,0," "," "," "," "
,"Cameron Way Stockbridge, GA","http://bit.ly/xLXV5m","01/07/2012 - 05:18pm",149205.000000,149205.000000,33.523078,-84.149780,1007846.000000,1.000000,4.000000,0.000000,"149205-pothole-needs-repairing","Open","Pothole needs repairing","11/30/2013 - 11:08am","2013-11-30T11:08:32-05:00",155800.000000,1.000000,0," "," "," "," "," "," "," "," "," "," "," "," "," "," ",0,0.000000," "," "," "," ",0.000000,0.000000,0,0," "," "," "," "
,"Dalena Way Dallas, GA","http://bit.ly/xoc33w","01/06/2012 - 05:36pm",149067.000000,149067.000000,33.913370,-84.752445,1009268.000000,1.000000,2.000000,0.000000,"149067-light-is-out","Open","light is out","10/03/2012 - 10:27pm","2012-10-03T22:27:23-04:00",0.000000,0.000000,0," "," "," "," "," "," "," "," "," "," "," "," "," "," ",0,0.000000," "," "," "," ",0.000000,0.000000,0,0," "," "," "," "
,"Six Flags Dr Austell, GA","http://bit.ly/yOfxJx","01/05/2012 - 05:36pm",148783.000000,148783.000000,33.777003,-84.588690,1010708.000000,1.000000,2.000000,0.000000,"148783-pot-holes-caused-by-rain","Open","Pot holes caused by rain","10/21/2012 - 04:05pm","2012-10-21T16:05:47-04:00",0.000000,1.000000,0," "," "," "," "," "," "," "," "," "," "," "," "," "," ",0,0.000000," "," "," "," ",0.000000,0.000000,0,0," "," "," "," "
,"3049 Heatherbrook Trace Canton Georgia , GA","http://bit.ly/t9Owk2","01/03/2012 - 08:57am",148067.000000,148067.000000,34.176347,-84.574934,1014107.000000,1.000000,2.000000,0.000000,"148067-potholes","Acknowledged","Potholes","01/05/2012 - 01:40pm","2012-01-05T13:40:18-05:00",0.000000,0.000000,0," "," "," "," "," "," "," "," "," "," "," "," "," "," ",0,0.000000," "," "," "," ",0.000000,0.000000,0,0," "," "," "," "
,"Klondike Road Lithonia, GA","http://bit.ly/rYqisX","01/03/2012 - 02:11am",148040.000000,148040.000000,33.641360,-84.128400,1014513.000000,1.000000,2.000000,0.000000,"148040-potholes","Open","Potholes","01/10/2012 - 10:08am","2012-01-10T10:08:02-05:00",0.000000,0.000000,0," "," "," "," "," "," "," "," "," "," "," "," "," "," ",0,0.000000," "," "," "," ",0.000000,0.000000,0,0," "," "," "," "
,"West Broad St Sugar hill, GA","http://bit.ly/scrS3d","01/02/2012 - 09:44pm",148024.000000,148024.000000,34.102707,-84.083862,1014780.000000,1.000000,1.000000,0.000000,"148024-poor-image-of-city-respect","Open","Poor image of city respect..","01/02/2012 - 09:44pm","2012-01-02T21:44:56-05:00",0.000000,0.000000,0," "," "," "," "," "," "," "," "," "," "," "," "," "," ",0,0.000000," "," "," "," ",0.000000,0.000000,0,0," "," "," "," "
,"2398 Arrow Circle Atlanta  , GA","http://bit.ly/vrK3nB","01/01/2012 - 07:08pm",147858.000000,147858.000000,33.873043,-84.291447,1016376.000000,1.000000,1.000000,0.000000,"147858-street-light-out","Open","Street light out.","01/01/2012 - 07:08pm","2012-01-01T19:08:16-05:00",0.000000,0.000000,0," "," "," "," "," "," "," "," "," "," "," "," "," "," ",0,0.000000," "," "," "," ",0.000000,0.000000,0,0," "," "," "," "
,"Winterglen Lane Sw & Six Flags Drive Sw Austell, GA","http://bit.ly/u7O9H9","12/30/2011 - 05:47pm",147660.000000,147660.000000,33.777839,-84.587819,1019337.000000,1.000000,3.000000,0.000000,"147660-biggest-longest-pothole-ever","Open","Biggest & Longest pothole ever..","10/26/2012 - 09:18pm","2012-10-26T21:18:22-04:00",0.000000,2.000000,0," "," "," "," "," "," "," "," "," "," "," "," "," "," ",0,0.000000," "," "," "," ",0.000000,0.000000,0,0," "," "," "," "
,"Six Flags Drive AUSTELL, GA","http://bit.ly/snwJek","12/29/2011 - 12:01am",147296.000000,147296.000000,33.780896,-84.592778,1021843.000000,1.000000,2.000000,0.000000,"147296-pot-holes-everywhere","Open","POT HOLES EVERYWHERE","10/21/2012 - 04:05pm","2012-10-21T16:05:36-04:00",0.000000,1.000000,0," "," "," "," "," "," "," "," "," "," "," "," "," "," ",0,0.000000," "," "," "," ",0.000000,0.000000,0,0," "," "," "," "
,"6218 Klondike River Rd Lithonia, GA","http://bit.ly/szOJkG","12/28/2011 - 05:17pm",147246.000000,147246.000000,33.692352,-84.114074,1022247.000000,1.000000,2.000000,0.000000,"147246-pot-holes","Open","pot holes","05/22/2013 - 06:56am","2013-05-22T06:56:33-04:00",0.000000,0.000000,0," "," "," "," "," "," "," "," "," "," "," "," "," "," ",0,0.000000," "," "," "," ",0.000000,0.000000,0,0," "," "," "," "
,"Hwy.142 covington, GA","http://bit.ly/twCh0y","12/27/2011 - 04:43pm",147011.000000,147011.000000,33.574970,-83.771878,1023721.000000,1.000000,1.000000,0.000000,"147011-when-well-it-end","Open","when well it end","12/27/2011 - 04:43pm","2011-12-27T16:43:50-05:00",0.000000,0.000000,0," "," "," "," "," "," "," "," "," "," "," "," "," "," ",0,0.000000," "," "," "," ",0.000000,0.000000,0,0," "," "," "," "
,"Hosea Road At Lawrenceville Highway Lawrenceville, GA","http://bit.ly/skXgmI","12/27/2011 - 05:44am",146814.000000,146814.000000,33.924634,-84.069377,1024380.000000,1.000000,2.000000,0.000000,"146814-fall-into-the-dip","Open","Fall into the dip","09/22/2012 - 07:18am","2012-09-22T07:18:16-04:00",0.000000,0.000000,0," "," "," "," "," "," "," "," "," "," "," "," "," "," ",0,0.000000," "," "," "," ",0.000000,0.000000,0,0," "," "," "," "
,"3652-3834 Sharpsburg Mccullum Rd Newnan, GA 30265, USA","http://bit.ly/tyvRMu","12/26/2011 - 07:40pm",146781.000000,146781.000000,33.433314,-84.691494,1024985.000000,1.000000,2.000000,0.000000,"146781-widen-154","Open","Widen 154","05/07/2012 - 07:22pm","2012-05-07T19:22:57-04:00",27831.000000,0.000000,0," "," "," "," "," "," "," "," "," "," "," "," "," "," ",0,0.000000," "," "," "," ",0.000000,0.000000,0,0," "," "," "," "
,"2889 Chamblee Tucker Rd Chamblee, GA","http://bit.ly/uOUXYu","12/23/2011 - 09:01am",146295.000000,146295.000000,33.878084,-84.272190,1029943.000000,1.000000,2.000000,0.000000,"146295-uncovered-bolts-sticking-up-out-of-cement","Open","Uncovered bolts sticking up out of cement","12/27/2011 - 01:19pm","2011-12-27T13:19:50-05:00",6354.000000,0.000000,0," "," "," "," "," "," "," "," "," "," "," "," "," "," ",0,0.000000," "," "," "," ",0.000000,0.000000,0,0," "," "," "," "
,"I-20east@285-North FULTON/COBB, GA","http://bit.ly/vAisPn","12/22/2011 - 07:58pm",146264.000000,146264.000000,31.958610,-83.988610,1030726.000000,1.000000,2.000000,0.000000,"146264-the-roadway-is-horrible-ironically-its-mostly-only-on-the-fulton-county-side-because-cobb-usually-makes-sure-their-roads-are-kept-up-to-par","Open","THE ROADWAY IS HORRIBLE&IRONICALLY ITS MOSTLY ONLY ON THE FULTON COUNTY SIDE BECAUSE COBB USUALLY MAKES SURE THEIR ROADS ARE KEPT UP TO PAR...","04/21/2012 - 06:29pm","2012-04-21T18:29:56-04:00",0.000000,0.000000,0," "," "," "," "," "," "," "," "," "," "," "," "," "," ",0,0.000000," "," "," "," ",0.000000,0.000000,0,0," "," "," "," "
,"465 Wakefield Bluff Court Alpharetta, GA","http://bit.ly/vSYHSN","12/21/2011 - 01:48pm",146040.000000,146040.000000,34.128172,-84.243839,1032536.000000,1.000000,1.000000,0.000000,"146040-chickens-on-property","Open","Chickens on property","12/21/2011 - 01:48pm","2011-12-21T13:48:40-05:00",0.000000,0.000000,0," "," "," "," "," "," "," "," "," "," "," "," "," "," ",0,0.000000," "," "," "," ",0.000000,0.000000,0,0," "," "," "," "
,"2932 Hawkinsville Hwy Eastman/Dodge, Ga","http://bit.ly/vxars4","12/17/2011 - 11:48am",145376.000000,145376.000000,32.202765,-83.275223,1038416.000000,1.000000,1.000000,0.000000,"145376-mass-transportation-incentive-program","Open","Mass Transportation Incentive Program","12/17/2011 - 11:48am","2011-12-17T11:48:32-05:00",0.000000,0.000000,0," "," "," "," "," "," "," "," "," "," "," "," "," "," ",0,0.000000," "," "," "," ",0.000000,0.000000,0,0," "," "," "," "
,"1345 Sycamore St. Stockbridge, GA","http://bit.ly/uZjBZp","12/17/2011 - 11:19am",145366.000000,145366.000000,33.533406,-84.189583,1038445.000000,1.000000,1.000000,0.000000,"145366-something-needed-to-be-done-10-years-ago-we-payed-taxes-for-this-road","Open","Something needed to be done 10 years ago. We payed taxes for this road.","12/17/2011 - 11:19am","2011-12-17T11:19:42-05:00",0.000000,0.000000,0," "," "," "," "," "," "," "," "," "," "," "," "," "," ",0,0.000000," "," "," "," ",0.000000,0.000000,0,0," "," "," "," "
,"2704 Crosshaven Drive hephzibah, GA","http://bit.ly/tgPCda","12/15/2011 - 08:34pm",145181.000000,145181.000000,32.157435,-82.907123,1040770.000000,1.000000,1.000000,0.000000,"145181-street-light-out","Open","street light out","12/15/2011 - 08:34pm","2011-12-15T20:34:28-05:00",0.000000,0.000000,0," "," "," "," "," "," "," "," "," "," "," "," "," "," ",0,0.000000," "," "," "," ",0.000000,0.000000,0,0," "," "," "," "
,"2495 Fairway Lane Cumming, GA","http://bit.ly/uy8HyI","12/14/2011 - 07:47pm",144956.000000,144956.000000,34.179107,-84.099003,1042257.000000,1.000000,1.000000,0.000000,"144956-the-road-to-my-home-is-owned-by-the-lanier-golf-course-they-refuse-to-repair-the-road-it-is-full-of-potholes-and-part-of-the-road-is-not-passable","Open","the road to my home is owned by the Lanier Golf Course.  They refuse to repair the road. It is full of potholes and part of the road is not passable","12/14/2011 - 07:47pm","2011-12-14T19:47:15-05:00",0.000000,0.000000,0," "," "," "," "," "," "," "," "," "," "," "," "," "," ",0,0.000000," "," "," "," ",0.000000,0.000000,0,0," "," "," "," "
,"Pleasant Hill Rd lithonia, GA","http://bit.ly/u6kqPl","12/13/2011 - 02:29pm",144623.000000,144623.000000,33.733354,-84.061825,1044015.000000,1.000000,2.000000,0.000000,"144623-street-clean-up","Open","street clean up","12/15/2011 - 10:55am","2011-12-15T10:55:02-05:00",0.000000,0.000000,0," "," "," "," "," "," "," "," "," "," "," "," "," "," ",0,0.000000," "," "," "," ",0.000000,0.000000,0,0," "," "," "," "
,"2495 Fairway Lane Cumming, GA","http://bit.ly/uEaNeT","12/02/2011 - 06:31pm",142792.000000,142792.000000,34.143634,-84.163513,1059613.000000,1.000000,1.000000,0.000000,"142792-huge-potholes-on-my-deeded-easement-road","Open","huge potholes on my deeded easement road","12/02/2011 - 06:31pm","2011-12-02T18:31:29-05:00",0.000000,0.000000,0," "," "," "," "," "," "," "," "," "," "," "," "," "," ",0,0.000000," "," "," "," ",0.000000,0.000000,0,0," "," "," "," "
,"Brookstone Parkway And Brookstone Drive  Ellenwood, Dekalb, GA","http://bit.ly/w03bG6","12/01/2011 - 08:27pm",142586.000000,142586.000000,33.795644,-84.227879,1060937.000000,1.000000,4.000000,0.000000,"142586-hole-in-the-middle-of-the-road","Open","Hole in the middle of the road.","10/04/2013 - 10:15am","2013-10-04T10:15:39-04:00",0.000000,1.000000,0," "," "," "," "," "," "," "," "," "," "," "," "," "," ",0,0.000000," "," "," "," ",0.000000,0.000000,0,0," "," "," "," "
,"Button Gwinette Dr And Pleasantdale Rd Doraville, GA","http://bit.ly/vauYK0","11/28/2011 - 06:09pm",141780.000000,141780.000000,33.901729,-84.244456,1065395.000000,1.000000,5.000000,0.000000,"141780-big-pothole","Open","Big Pothole!","01/29/2013 - 07:41pm","2013-01-29T19:41:02-05:00",0.000000,1.000000,0," "," "," "," "," "," "," "," "," "," "," "," "," "," ",0,0.000000," "," "," "," ",0.000000,0.000000,0,0," "," "," "," "
,"Montego Rd. And Rock Spring Rd. Buford GA","http://bit.ly/uZCLdO","11/28/2011 - 09:34am",141583.000000,141583.000000,34.050099,-83.978505,1065910.000000,1.000000,1.000000,0.000000,"141583-bush-cut-down-at-corner","Open","Bush cut down at corner","11/28/2011 - 09:57am","2011-11-28T09:57:15-05:00",0.000000,0.000000,0," "," "," "," "," "," "," "," "," "," "," "," "," "," ",0,0.000000," "," "," "," ",0.000000,0.000000,0,0," "," "," "," "
,"1392 Sagewood Circle Stone Mountain, GA","http://bit.ly/vaalci","11/26/2011 - 09:01am",141306.000000,141306.000000,33.821066,-84.217484,1068823.000000,1.000000,4.000000,0.000000,"141306-light-out","Open","Light out","09/17/2012 - 05:06pm","2012-09-17T17:06:24-04:00",0.000000,1.000000,0," "," "," "," "," "," "," "," "," "," "," "," "," "," ",0,0.000000," "," "," "," ",0.000000,0.000000,0,0," "," "," "," "
,"Newton Rd union city/ fayette, GA","http://bit.ly/t1KQB0","11/26/2011 - 03:42am",141300.000000,141300.000000,33.535834,-84.523595,1069142.000000,1.000000,2.000000,0.000000,"141300-ryou-will-miss-turn-due-to-sign-to-far-from-hwy","Open","ryou will miss turn due to sign to far from hwy.","07/18/2013 - 09:43am","2013-07-18T09:43:25-04:00",0.000000,0.000000,0," "," "," "," "," "," "," "," "," "," "," "," "," "," ",0,0.000000," "," "," "," ",0.000000,0.000000,0,0," "," "," "," "
,"Panola Industrial Blvd Decatur, GA","http://bit.ly/rXFhvk","11/25/2011 - 12:42pm",141212.000000,141212.000000,33.705369,-84.177188,1070042.000000,1.000000,4.000000,0.000000,"141212-street-need-repaving-pothole-repaired-to-death","Open","Street need repaving, pothole repaired to death","03/26/2013 - 01:52pm","2013-03-26T13:52:49-04:00",0.000000,1.000000,0," "," "," "," "," "," "," "," "," "," "," "," "," "," ",0,0.000000," "," "," "," ",0.000000,0.000000,0,0," "," "," "," "
,"1881 Aspen Dr Ne Atlanta, GA","http://bit.ly/uaubNs","11/22/2011 - 05:38pm",140806.000000,140806.000000,33.838393,-84.271981,1074066.000000,1.000000,3.000000,0.000000,"140806-broken-pavement-at-intersection","Open","broken pavement at intersection","11/29/2011 - 11:12am","2011-11-29T11:12:32-05:00",0.000000,0.000000,0," "," "," "," "," "," "," "," "," "," "," "," "," "," ",0,0.000000," "," "," "," ",0.000000,0.000000,0,0," "," "," "," "
,"1866 Castleway Ln Ne Unincorporated Dekalb, GA","http://bit.ly/w4RhXh","11/22/2011 - 09:34am",140671.000000,140671.000000,33.837324,-84.278215,1074550.000000,1.000000,3.000000,0.000000,"140671-potholes-disintegrating-pavement-and-depression-in-the-street","Open","potholes, disintegrating pavement and depression in the street","12/17/2012 - 04:35pm","2012-12-17T16:35:47-05:00",0.000000,0.000000,0," "," "," "," "," "," "," "," "," "," "," "," "," "," ",0,0.000000," "," "," "," ",0.000000,0.000000,0,0," "," "," "," "
,"4275 Chatuge Dr Buford, GA 30519, USA","http://bit.ly/rYSfcj","11/20/2011 - 07:09pm",140340.000000,140340.000000,34.126842,-83.945030,1076855.000000,1.000000,1.000000,0.000000,"140340-street-light-out","Open","Street Light out","11/20/2011 - 07:09pm","2011-11-20T19:09:32-05:00",26059.000000,0.000000,0," "," "," "," "," "," "," "," "," "," "," "," "," "," ",0,0.000000," "," "," "," ",0.000000,0.000000,0,0," "," "," "," "
,"3118 Trickum Rd Woodstock, GA","http://bit.ly/uQrSVW","11/18/2011 - 05:54pm",140114.000000,140114.000000,34.113065,-84.471259,1079810.000000,1.000000,1.000000,0.000000,"140114-pothole","Open","Pothole","11/18/2011 - 05:54pm","2011-11-18T17:54:47-05:00",0.000000,0.000000,0," "," "," "," "," "," "," "," "," "," "," "," "," "," ",0,0.000000," "," "," "," ",0.000000,0.000000,0,0," "," "," "," "
,"Shallowford Rd Ne Marietta, GA","http://bit.ly/vJdDAg","11/17/2011 - 06:29pm",139953.000000,139953.000000,34.057974,-84.521620,1081215.000000,1.000000,1.000000,0.000000,"139953-pavement-need-resurfacing","Open","Pavement need resurfacing","11/17/2011 - 06:29pm","2011-11-17T18:29:57-05:00",0.000000,0.000000,0," "," "," "," "," "," "," "," "," "," "," "," "," "," ",0,0.000000," "," "," "," ",0.000000,0.000000,0,0," "," "," "," "
,"4418 Winters Chapel Rd Doraville, GA","http://bit.ly/su2GYF","11/14/2011 - 05:36pm",139241.000000,139241.000000,33.926287,-84.268977,1085588.000000,1.000000,2.000000,0.000000,"139241-harry-follow-up","Open","Harry follow up","09/21/2012 - 01:10pm","2012-09-21T13:10:09-04:00",0.000000,0.000000,0," "," "," "," "," "," "," "," "," "," "," "," "," "," ",0,0.000000," "," "," "," ",0.000000,0.000000,0,0," "," "," "," "
,"2441 Valhalla Dr Atlanta Dekalb, GA","http://bit.ly/rWpp7a","11/11/2011 - 09:18pm",138817.000000,138817.000000,33.843675,-84.288391,1089686.000000,1.000000,2.000000,0.000000,"138817-street-light-out-on-valhalla","Open","street light out on Valhalla","11/21/2011 - 10:19am","2011-11-21T10:19:05-05:00",0.000000,0.000000,0," "," "," "," "," "," "," "," "," "," "," "," "," "," ",0,0.000000," "," "," "," ",0.000000,0.000000,0,0," "," "," "," "
,"Lakeshore Rd. Buford, GA","http://bit.ly/u8NX6L","11/07/2011 - 07:23pm",137833.000000,137833.000000,34.149292,-83.999253,1095562.000000,1.000000,1.000000,0.000000,"137833-pot-holes","Open","pot holes","11/07/2011 - 07:23pm","2011-11-07T19:23:11-05:00",0.000000,0.000000,0," "," "," "," "," "," "," "," "," "," "," "," "," "," ",0,0.000000," "," "," "," ",0.000000,0.000000,0,0," "," "," "," "
,"1133 East West Connector Austell, GA","http://bit.ly/tTfCe1","11/06/2011 - 06:21pm",137564.000000,137564.000000,33.856303,-84.590198,1097063.000000,1.000000,1.000000,0.000000,"137564-traffic-signal","Open","Traffic Signal","11/06/2011 - 06:21pm","2011-11-06T18:21:58-05:00",23618.000000,0.000000,0," "," "," "," "," "," "," "," "," "," "," "," "," "," ",0,0.000000," "," "," "," ",0.000000,0.000000,0,0," "," "," "," "
,"4188 Floyd Rd Austell, GA","http://bit.ly/rOisUq","11/06/2011 - 06:05pm",137561.000000,137561.000000,33.852579,-84.588353,1097079.000000,1.000000,2.000000,0.000000,"137561-street-name-sign","Open","Street Name Sign","11/06/2011 - 06:06pm","2011-11-06T18:06:26-05:00",23618.000000,0.000000,0," "," "," "," "," "," "," "," "," "," "," "," "," "," ",0,0.000000," "," "," "," ",0.000000,0.000000,0,0," "," "," "," "
,"Winters Chapel Road Doraville, GA","http://bit.ly/u3DKGq","11/04/2011 - 10:05am",137195.000000,137195.000000,33.926605,-84.268979,1100500.000000,1.000000,3.000000,0.000000,"137195-trucking-noise-late-night","Open","Trucking noise late night","03/05/2012 - 10:45am","2012-03-05T10:45:21-05:00",0.000000,0.000000,0," "," "," "," "," "," "," "," "," "," "," "," "," "," ",0,0.000000," "," "," "," ",0.000000,0.000000,0,0," "," "," "," "
,"Gateway Blvd Stone Mountain, Dekalb, GA.    The Southlands","http://bit.ly/ugqCup","11/03/2011 - 11:58am",136991.000000,136991.000000,33.775954,-84.150316,1101826.000000,1.000000,3.000000,0.000000,"136991-numerous-bumps-and-holes","Open","numerous bumps and holes","11/08/2011 - 09:55am","2011-11-08T09:55:32-05:00",0.000000,1.000000,0," "," "," "," "," "," "," "," "," "," "," "," "," "," ",0,0.000000," "," "," "," ",0.000000,0.000000,0,0," "," "," "," "
,"Interstate 285 & Interstate 85 & Access Rd & Northcrest Rd Atlanta, GA","http://bit.ly/tqJvT1","11/02/2011 - 07:00pm",136847.000000,136847.000000,33.893359,-84.263076,1102844.000000,1.000000,3.000000,0.000000,"136847-tree-blocking-sign","Open","Tree Blocking Sign","01/26/2013 - 08:52am","2013-01-26T08:52:59-05:00",0.000000,0.000000,0," "," "," "," "," "," "," "," "," "," "," "," "," "," ",0,0.000000," "," "," "," ",0.000000,0.000000,0,0," "," "," "," "
,"Fountain Dr woodstock, GA","http://bit.ly/ts26d8","11/02/2011 - 08:04am",136627.000000,136627.000000,34.120748,-84.481234,1103500.000000,1.000000,1.000000,0.000000,"136627-the-roads-are-cracked-there-are-huge-pot-holes-everywhere","Open","The roads are cracked, there are huge pot holes everywhere.","11/02/2011 - 08:04am","2011-11-02T08:04:32-04:00",0.000000,0.000000,0," "," "," "," "," "," "," "," "," "," "," "," "," "," ",0,0.000000," "," "," "," ",0.000000,0.000000,0,0," "," "," "," "
,"Intersection Of Ohls Avenue And The 500 Block Of West 42nd Steet Chattanooga, TN","http://bit.ly/tJ8eiv","10/28/2011 - 12:19pm",135782.000000,135782.000000,35.004758,-85.317860,1110445.000000,1.000000,2.000000,0.000000,"135782-pot-holes","Open","Pot Holes","01/05/2012 - 01:53pm","2012-01-05T13:53:10-05:00",0.000000,0.000000,0," "," "," "," "," "," "," "," "," "," "," "," "," "," ",0,0.000000," "," "," "," ",0.000000,0.000000,0,0," "," "," "," "
,"4629 Wieuca Rd Atlanta, GA","http://bit.ly/ugaTXv","10/27/2011 - 08:43pm",135670.000000,135670.000000,32.157435,-82.907123,1111382.000000,1.000000,2.000000,0.000000,"135670-dangerous-sidewalk","Open","Dangerous sidewalk","11/30/2011 - 12:23pm","2011-11-30T12:23:40-05:00",0.000000,0.000000,0," "," "," "," "," "," "," "," "," "," "," "," "," "," ",0,0.000000," "," "," "," ",0.000000,0.000000,0,0," "," "," "," "
,"6405 The Trail Stone Mountain, GA","http://bit.ly/tqEhOZ","10/27/2011 - 05:52pm",135637.000000,135637.000000,33.770487,-84.126614,1111552.000000,1.000000,3.000000,0.000000,"135637-driveway-entrance-pothole-southland","Open","Driveway entrance pothole;Southland","12/27/2011 - 12:42pm","2011-12-27T12:42:43-05:00",0.000000,0.000000,0," "," "," "," "," "," "," "," "," "," "," "," "," "," ",0,0.000000," "," "," "," ",0.000000,0.000000,0,0," "," "," "," "
,"310 Windemere Way Jonesboro, GA","http://bit.ly/v0BUAB","10/27/2011 - 04:28pm",135615.000000,135615.000000,33.535575,-84.380911,1111636.000000,1.000000,1.000000,0.000000,"135615-potholes","Open","Potholes","10/27/2011 - 04:28pm","2011-10-27T16:28:47-04:00",0.000000,0.000000,0," "," "," "," "," "," "," "," "," "," "," "," "," "," ",0,0.000000," "," "," "," ",0.000000,0.000000,0,0," "," "," "," "
,"W Hightower Trail Conyers, GA","http://bit.ly/tmuNxJ","10/27/2011 - 09:35am",135511.000000,135511.000000,33.755458,-84.016914,1112049.000000,1.000000,1.000000,0.000000,"135511-bad-intersection-needs-paving","Open","Bad Intersection - Needs Paving","10/27/2011 - 09:35am","2011-10-27T09:35:24-04:00",0.000000,0.000000,0," "," "," "," "," "," "," "," "," "," "," "," "," "," ",0,0.000000," "," "," "," ",0.000000,0.000000,0,0," "," "," "," "
,"Seven Oaks Circle CONLEY, GA","http://bit.ly/srrMZk","10/26/2011 - 10:32pm",135449.000000,135449.000000,33.665845,-84.297825,1112712.000000,1.000000,3.000000,0.000000,"135449-potholes","Open","POTHOLES","12/27/2011 - 03:49pm","2011-12-27T15:49:51-05:00",0.000000,1.000000,0," "," "," "," "," "," "," "," "," "," "," "," "," "," ",0,0.000000," "," "," "," ",0.000000,0.000000,0,0," "," "," "," "
,"Five Forks Trickum  Lilburn/Gwinnett, GA","http://bit.ly/v6Q7UB","10/26/2011 - 05:44pm",135403.000000,135403.000000,33.848971,-84.117707,1113000.000000,1.000000,1.000000,0.000000,"135403-location-at-the-intersection-of-five-forks-trickum-road-and-oak-rd-too-the-insection-of-tom-smith-road-ff-trickum-road","Open","Location- At the intersection of Five forks trickum road and Oak Rd. Too The Insection of Tom Smith Road & FF Trickum road","10/26/2011 - 05:44pm","2011-10-26T17:44:53-04:00",0.000000,0.000000,0," "," "," "," "," "," "," "," "," "," "," "," "," "," ",0,0.000000," "," "," "," ",0.000000,0.000000,0,0," "," "," "," "
,"1615 1617 E 14th Street, Chattanooga, TN","http://bit.ly/uorxZo","10/26/2011 - 08:59am",135240.000000,135240.000000,35.028066,-85.282508,1113525.000000,1.000000,4.000000,0.000000,"135240-burned-houses","Open","Burned Houses","04/24/2012 - 09:02am","2012-04-24T09:02:00-04:00",0.000000,2.000000,0," "," "," "," "," "," "," "," "," "," "," "," "," "," ",0,0.000000," "," "," "," ",0.000000,0.000000,0,0," "," "," "," "
,"Gateway Blvd Stone Mountain, GA","http://bit.ly/ujA1j9","10/25/2011 - 02:02pm",135080.000000,135080.000000,33.776325,-84.151572,1114663.000000,1.000000,2.000000,0.000000,"135080-rough-patchy-road","Open","rough, patchy road","11/02/2011 - 09:48pm","2011-11-02T21:48:25-04:00",0.000000,1.000000,0," "," "," "," "," "," "," "," "," "," "," "," "," "," ",0,0.000000," "," "," "," ",0.000000,0.000000,0,0," "," "," "," "
,"Gateway Blvd Dekalb, GA","http://bit.ly/s4ksvJ","10/25/2011 - 11:15am",135017.000000,135017.000000,33.776325,-84.151572,1114830.000000,1.000000,2.000000,0.000000,"135017-dangerous-road","Open","Dangerous Road","11/02/2011 - 09:48pm","2011-11-02T21:48:01-04:00",0.000000,1.000000,0," "," "," "," "," "," "," "," "," "," "," "," "," "," ",0,0.000000," "," "," "," ",0.000000,0.000000,0,0," "," "," "," "
,"Gateway Blvd stone mountain, GA","http://bit.ly/voOV6A","10/24/2011 - 04:38pm",134882.000000,134882.000000,33.776325,-84.151572,1115946.000000,1.000000,3.000000,0.000000,"134882-uneven-paving","Open","uneven paving","11/02/2011 - 09:45pm","2011-11-02T21:45:18-04:00",0.000000,1.000000,0," "," "," "," "," "," "," "," "," "," "," "," "," "," ",0,0.000000," "," "," "," ",0.000000,0.000000,0,0," "," "," "," "
,"Klondike Rd  rockdale, GA","http://bit.ly/nkC0g3","10/21/2011 - 02:08pm",134380.000000,134380.000000,33.630162,-84.128517,1120417.000000,1.000000,2.000000,0.000000,"134380-pot-holes","Open","pot holes","10/28/2011 - 10:48am","2011-10-28T10:48:25-04:00",0.000000,0.000000,0," "," "," "," "," "," "," "," "," "," "," "," "," "," ",0,0.000000," "," "," "," ",0.000000,0.000000,0,0," "," "," "," "
,"884 Lagoon Court Stone Mountain, GA","http://bit.ly/o22KvO","10/19/2011 - 11:41pm",133985.000000,133985.000000,33.802605,-84.233395,1122723.000000,1.000000,4.000000,0.000000,"133985-horrible-road","Open","horrible road","05/04/2013 - 10:41am","2013-05-04T10:41:16-04:00",0.000000,1.000000,0," "," "," "," "," "," "," "," "," "," "," "," "," "," ",0,0.000000," "," "," "," ",0.000000,0.000000,0,0," "," "," "," "
,"20-60 Hardwood Ct Newnan, GA 30265, USA","http://bit.ly/nTHITE","10/19/2011 - 12:55pm",133878.000000,133878.000000,33.400796,-84.688754,1123369.000000,1.000000,2.000000,0.000000,"133878-street-light-out","Open","Street light out","10/19/2011 - 12:59pm","2011-10-19T12:59:06-04:00",0.000000,0.000000,0," "," "," "," "," "," "," "," "," "," "," "," "," "," ",0,0.000000," "," "," "," ",0.000000,0.000000,0,0," "," "," "," "
,"1803-1805 Duncan Ave Chattanooga, TN 37404, USA","http://bit.ly/n1SRK7","10/18/2011 - 10:25pm",133749.000000,133749.000000,35.035478,-85.276050,1124239.000000,1.000000,2.000000,0.000000,"133749-there-is-no-posted-permit","Open","There is no posted permit.","11/28/2011 - 10:39am","2011-11-28T10:39:32-05:00",0.000000,1.000000,0," "," "," "," "," "," "," "," "," "," "," "," "," "," ",0,0.000000," "," "," "," ",0.000000,0.000000,0,0," "," "," "," "
,"Mount Carmel Church Road Good Hope/Monroe/ Walton county, GA","http://bit.ly/qFAX32","10/18/2011 - 06:11pm",133696.000000,133696.000000,33.830917,-83.570355,1124493.000000,1.000000,4.000000,0.000000,"133696-road-crumbling-creating-potholes-no-fog-line-standing-water","Open","road crumbling creating potholes, no fog line, standing water","07/10/2013 - 07:10am","2013-07-10T07:10:12-04:00",0.000000,3.000000,0," "," "," "," "," "," "," "," "," "," "," "," "," "," ",0,0.000000," "," "," "," ",0.000000,0.000000,0,0," "," "," "," "
,"4985 Doby Ln austell, GA","http://bit.ly/pxKHsb","10/17/2011 - 11:42pm",133496.000000,133496.000000,33.832368,-84.614487,1125602.000000,1.000000,4.000000,0.000000,"133496-no-lights-and-speeding-cars","Open","no lights and speeding cars","11/20/2011 - 10:18am","2011-11-20T10:18:39-05:00",0.000000,4.000000,0," "," "," "," "," "," "," "," "," "," "," "," "," "," ",0,0.000000," "," "," "," ",0.000000,0.000000,0,0," "," "," "," "
,"1590 Southern Oaks Cove Lawrenceville, GA","http://bit.ly/nsZXVW","10/17/2011 - 11:58am",133373.000000,133373.000000,34.004102,-83.997001,1126306.000000,1.000000,3.000000,0.000000,"133373-dip-in-road","Open","Dip in road","12/03/2012 - 03:08pm","2012-12-03T15:08:10-05:00",0.000000,0.000000,0," "," "," "," "," "," "," "," "," "," "," "," "," "," ",0,0.000000," "," "," "," ",0.000000,0.000000,0,0," "," "," "," "
,"Victoria Rd. Cherokee, GA","http://bit.ly/nIi0xi","10/14/2011 - 08:56am",132874.000000,132874.000000,34.145819,-84.603668,1130808.000000,1.000000,1.000000,0.000000,"132874-no-help-from-county","Open","No help from county","10/14/2011 - 08:56am","2011-10-14T08:56:47-04:00",0.000000,0.000000,0," "," "," "," "," "," "," "," "," "," "," "," "," "," ",0,0.000000," "," "," "," ",0.000000,0.000000,0,0," "," "," "," "
,"Georgia 212 Conyers, GA","http://bit.ly/ny3qUB","10/13/2011 - 06:49pm",132798.000000,132798.000000,33.550139,-84.029982,1131655.000000,1.000000,2.000000,0.000000,"132798-i-spoke-with-ira-with-gdot-404-299-4386-but-to-no-avail-help-harry","Open","I spoke with Ira with GDOT @ (404) 299-4386 but to no avail HELP HARRY!!!!!!","10/13/2011 - 07:04pm","2011-10-13T19:04:00-04:00",0.000000,1.000000,0," "," "," "," "," "," "," "," "," "," "," "," "," "," ",0,0.000000," "," "," "," ",0.000000,0.000000,0,0," "," "," "," "
,"1030 Old Peachtree Rd Nw Lawrenceville, GA","http://bit.ly/pQGjDQ","10/13/2011 - 05:45pm",132789.000000,132789.000000,34.000597,-84.066921,1131719.000000,1.000000,1.000000,0.000000,"132789-nasty-pot-hole","Open","Nasty Pot hole","10/13/2011 - 05:45pm","2011-10-13T17:45:16-04:00",0.000000,0.000000,0," "," "," "," "," "," "," "," "," "," "," "," "," "," ",0,0.000000," "," "," "," ",0.000000,0.000000,0,0," "," "," "," "
,"1747 Hewatt Rd Sw gwinnett, GA","http://bit.ly/pJJiFf","10/13/2011 - 01:39pm",132688.000000,132688.000000,33.857954,-84.059608,1131965.000000,1.000000,2.000000,0.000000,"132688-no-drosswalks-or-lights","Open","no drosswalks or lights","11/14/2011 - 10:24am","2011-11-14T10:24:32-05:00",0.000000,0.000000,0," "," "," "," "," "," "," "," "," "," "," "," "," "," ",0,0.000000," "," "," "," ",0.000000,0.000000,0,0," "," "," "," "
,"1830 Sharpsburg Mc Cullum Rd Newnan, GA","http://bit.ly/oBgQyG","10/13/2011 - 12:37am",132525.000000,132525.000000,33.381429,-84.671802,1132747.000000,1.000000,1.000000,0.000000,"132525-finish-this-intersection","Open","Finish this intersection","10/13/2011 - 12:37am","2011-10-13T00:37:18-04:00",0.000000,0.000000,0," "," "," "," "," "," "," "," "," "," "," "," "," "," ",0,0.000000," "," "," "," ",0.000000,0.000000,0,0," "," "," "," "
,"2581 Chippewa Ct Duluth, GA","http://bit.ly/pnoUfH","10/12/2011 - 04:32pm",132462.000000,132462.000000,33.959237,-84.165251,1133233.000000,1.000000,1.000000,0.000000,"132462-road-needs-fixing","Open","Road needs fixing","10/12/2011 - 04:32pm","2011-10-12T16:32:04-04:00",0.000000,0.000000,0," "," "," "," "," "," "," "," "," "," "," "," "," "," ",0,0.000000," "," "," "," ",0.000000,0.000000,0,0," "," "," "," "
,"Bakers Bridge Rd Douglasville, GA","http://bit.ly/prrdU4","10/11/2011 - 11:37pm",132234.000000,132234.000000,33.799602,-84.806449,1134248.000000,1.000000,2.000000,0.000000,"132234-they-have-been-working-on-this-bridge-for-almost-if-not-2-years-they-built-a-temporary-bridge-and-we-had-to-drive-over-it-they-started-a-new-bridge","Open","They have been working on this bridge for almost if not 2 years, they built a temporary bridge and we had to drive over it & they started a new bridge","10/11/2011 - 11:47pm","2011-10-11T23:47:42-04:00",0.000000,0.000000,0," "," "," "," "," "," "," "," "," "," "," "," "," "," ",0,0.000000," "," "," "," ",0.000000,0.000000,0,0," "," "," "," "
,"502 Mimosa Grove Crossing Tucker, GA","http://bit.ly/naBc1W","10/10/2011 - 07:44am",131632.000000,131632.000000,33.877449,-84.177634,1136640.000000,1.000000,2.000000,0.000000,"131632-pot-hole-at-corner-of-mimosa-grove-crossing-and-poppy-tree","Open","Pot hole at corner of Mimosa Grove Crossing and Poppy Tree","03/12/2012 - 01:24pm","2012-03-12T13:24:22-04:00",0.000000,1.000000,0," "," "," "," "," "," "," "," "," "," "," "," "," "," ",0,0.000000," "," "," "," ",0.000000,0.000000,0,0," "," "," "," "
,"2000 Austell Rd. Sw Marietta, GA","http://bit.ly/nnKKzQ","10/07/2011 - 05:50pm",131314.000000,131314.000000,33.901606,-84.569599,1140354.000000,1.000000,1.000000,0.000000,"131314-pot-hole-in-side-walk","Open","Pot hole in side walk","10/07/2011 - 05:50pm","2011-10-07T17:50:30-04:00",0.000000,0.000000,0," "," "," "," "," "," "," "," "," "," "," "," "," "," ",0,0.000000," "," "," "," ",0.000000,0.000000,0,0," "," "," "," "
,"Interstate 285 & Bouldercrest Rd Se Atlanta Decatur, GA","http://bit.ly/pq13oD","10/07/2011 - 04:49pm",131292.000000,131292.000000,33.683246,-84.309833,1140416.000000,1.000000,2.000000,0.000000,"131292-the-exit-ramp","Open","The exit ramp","10/13/2011 - 04:02pm","2011-10-13T16:02:41-04:00",0.000000,0.000000,0," "," "," "," "," "," "," "," "," "," "," "," "," "," ",0,0.000000," "," "," "," ",0.000000,0.000000,0,0," "," "," "," "
,"2905 Stonecrest Cir Lithonia, GA","http://bit.ly/nwvU2R","10/07/2011 - 02:56pm",131259.000000,131259.000000,33.695548,-84.091329,1140528.000000,1.000000,5.000000,0.000000,"131259-street-light-poles","Open","street light poles","09/20/2013 - 03:44pm","2013-09-20T15:44:57-04:00",70183.000000,9.000000,0," "," "," "," "," "," "," "," "," "," "," "," "," "," ",0,0.000000," "," "," "," ",0.000000,0.000000,0,0," "," "," "," "
,"Interstate 285 Decatur, GA","http://bit.ly/mXGkox","10/05/2011 - 09:07pm",130760.000000,130760.000000,33.749713,-84.231297,1143038.000000,1.000000,2.000000,0.000000,"130760-interstate-sign","Open","Interstate Sign","10/05/2011 - 09:13pm","2011-10-05T21:13:42-04:00",0.000000,0.000000,0," "," "," "," "," "," "," "," "," "," "," "," "," "," ",0,0.000000," "," "," "," ",0.000000,0.000000,0,0," "," "," "," "
,"W Stewarts Mill Rd Douglasville, GA 30135, USA","http://bit.ly/oYAk5y","10/03/2011 - 11:38pm",130271.000000,130271.000000,33.708521,-84.747467,1145767.000000,1.000000,2.000000,0.000000,"130271-the-entire-stretch-of-w-stewart-mill-rd-in-douglasville-needs-repairs-badly-medium-sized-pot-holes-a-large-hill-with-a-large-bump-on-the-corner-of-stewart-mill-w-stewart-mill-rd","Open","The entire stretch of W. Stewart Mill Rd. In Douglasville needs repairs badly. Medium sized pot holes & a large hill with a large bump on the corner of Stewart Mill & W. Stewart Mill Rd.","10/03/2011 - 11:38pm","2011-10-03T23:38:48-04:00",0.000000,1.000000,0," "," "," "," "," "," "," "," "," "," "," "," "," "," ",0,0.000000," "," "," "," ",0.000000,0.000000,0,0," "," "," "," "
,"1038 Autumn Crest Dr stone mountain, GA 30083","http://bit.ly/rclJzY","10/03/2011 - 04:44pm",130219.000000,130219.000000,33.764252,-84.199352,1146180.000000,1.000000,3.000000,0.000000,"130219-pothole-in-front-of-house-at-1038-autumn-crest-dr-stone-mountain-30083","Open","pothole in front of house at 1038 autumn crest dr, stone mountain 30083","11/03/2011 - 03:17pm","2011-11-03T15:17:44-04:00",0.000000,0.000000,0," "," "," "," "," "," "," "," "," "," "," "," "," "," ",0,0.000000," "," "," "," ",0.000000,0.000000,0,0," "," "," "," "
,"Interstate 24 Chattanooga, TN","http://bit.ly/qPecKp","10/03/2011 - 07:21am",130061.000000,130061.000000,35.004128,-85.219917,1146743.000000,1.000000,3.000000,0.000000,"130061-several-pot-holes-on-i-24","Open","Several pot holes on I-24","02/06/2012 - 01:07pm","2012-02-06T13:07:45-05:00",0.000000,0.000000,0," "," "," "," "," "," "," "," "," "," "," "," "," "," ",0,0.000000," "," "," "," ",0.000000,0.000000,0,0," "," "," "," "
,"4975 Canton Highway Marietta/Cobb, GA","http://bit.ly/oCX07l","10/01/2011 - 07:38pm",129929.000000,129929.000000,34.046048,-84.528914,1148886.000000,1.000000,1.000000,0.000000,"129929-bug-infestation","Open","Bug infestation","10/01/2011 - 07:38pm","2011-10-01T19:38:41-04:00",0.000000,0.000000,0," "," "," "," "," "," "," "," "," "," "," "," "," "," ",0,0.000000," "," "," "," ",0.000000,0.000000,0,0," "," "," "," "
,"500 Block Of West 45th Street Chattanooga, TN","http://bit.ly/oSFBfl","09/29/2011 - 09:13am",129181.000000,129181.000000,35.001727,-85.319416,1152391.000000,1.000000,2.000000,0.000000,"129181-pot-holes","Open","pot holes","10/13/2011 - 04:06pm","2011-10-13T16:06:01-04:00",0.000000,0.000000,0," "," "," "," "," "," "," "," "," "," "," "," "," "," ",0,0.000000," "," "," "," ",0.000000,0.000000,0,0," "," "," "," "
,"2701 Log Cabin Dr Smyrna, GA","http://bit.ly/oXXLZx","09/28/2011 - 05:59pm",129073.000000,129073.000000,33.839694,-84.480249,1153305.000000,1.000000,1.000000,0.000000,"129073-pothole","Open","Pothole","09/28/2011 - 05:59pm","2011-09-28T17:59:50-04:00",0.000000,0.000000,0," "," "," "," "," "," "," "," "," "," "," "," "," "," ",0,0.000000," "," "," "," ",0.000000,0.000000,0,0," "," "," "," "
,"2150 Paxton Dr Lilburn, GA 30047, GA","http://bit.ly/q3fBK4","09/28/2011 - 01:06pm",128962.000000,128962.000000,33.836788,-84.075442,1153599.000000,1.000000,1.000000,0.000000,"128962-pets-smart","Open","Pets Smart","09/30/2011 - 06:19am","2011-09-30T06:19:56-04:00",0.000000,0.000000,0," "," "," "," "," "," "," "," "," "," "," "," "," "," ",0,0.000000," "," "," "," ",0.000000,0.000000,0,0," "," "," "," "
,"Wisteria Drive Snellville, GA","http://bit.ly/nRHzKC","09/26/2011 - 07:12am",128195.000000,128195.000000,33.792843,-84.048156,1156832.000000,1.000000,2.000000,0.000000,"128195-snellville-streets","Open","Snellville streets","10/22/2012 - 11:42am","2012-10-22T11:42:50-04:00",0.000000,0.000000,0," "," "," "," "," "," "," "," "," "," "," "," "," "," ",0,0.000000," "," "," "," ",0.000000,0.000000,0,0," "," "," "," "
,"Airport Loop Rd & Interstate 75 & Interstate 285 & Lake Mirror Dr Atlanta, GA","http://bit.ly/qQn3S8","09/23/2011 - 04:46pm",127870.000000,127870.000000,33.631933,-84.402744,1160578.000000,1.000000,2.000000,0.000000,"127870-pothole-groove-on-exit-ramp","Open","Pothole ""Groove"" on exit ramp.","07/03/2013 - 10:24pm","2013-07-03T22:24:37-04:00",0.000000,1.000000,0," "," "," "," "," "," "," "," "," "," "," "," "," "," ",0,0.000000," "," "," "," ",0.000000,0.000000,0,0," "," "," "," "
,"Savannah Ga","http://bit.ly/o1t1wP","09/23/2011 - 08:24am",127701.000000,127701.000000,32.039433,-81.143769,1161080.000000,1.000000,2.000000,0.000000,"127701-huge-hole","Open","huge hole","04/27/2012 - 05:46pm","2012-04-27T17:46:24-04:00",0.000000,1.000000,0," "," "," "," "," "," "," "," "," "," "," "," "," "," ",0,0.000000," "," "," "," ",0.000000,0.000000,0,0," "," "," "," "
,"2951-2963 Henderson Mill Rd Atlanta, GA 30341, USA","http://bit.ly/qioR9S","09/22/2011 - 10:37am",127468.000000,127468.000000,33.871983,-84.250845,1162387.000000,1.000000,2.000000,0.000000,"127468-pedestrians-middle-schoolers-at-risk-from-right-turning-cars","Open","Pedestrians (middle-schoolers) at risk from right turning cars","06/20/2013 - 12:03am","2013-06-20T00:03:44-04:00",6354.000000,0.000000,0," "," "," "," "," "," "," "," "," "," "," "," "," "," ",0,0.000000," "," "," "," ",0.000000,0.000000,0,0," "," "," "," "
,"5753 Village Loop Fairburn, GA","http://bit.ly/nusfAI","09/21/2011 - 11:43pm",127373.000000,127373.000000,33.604748,-84.637854,1163042.000000,1.000000,1.000000,0.000000,"127373-dodging-responsibilty","Open","Dodging responsibilty","06/17/2013 - 11:24am","2013-06-17T11:24:46-04:00",0.000000,0.000000,0," "," "," "," "," "," "," "," "," "," "," "," "," "," ",0,0.000000," "," "," "," ",0.000000,0.000000,0,0," "," "," "," "
,"Interstate 285 Decatur, GA","http://bit.ly/phvEjC","09/20/2011 - 05:15pm",126986.000000,126986.000000,33.763004,-84.232392,1164869.000000,1.000000,4.000000,0.000000,"126986-there-s-a-gap-jyst-before-you-cross-over-the-bridge-of-285-redan-road-holcombe-rd","Open","There's a gap jyst before you cross over the bridge of 285 Redan Road/Holcombe RD","09/22/2011 - 10:37am","2011-09-22T10:37:00-04:00",0.000000,3.000000,0," "," "," "," "," "," "," "," "," "," "," "," "," "," ",0,0.000000," "," "," "," ",0.000000,0.000000,0,0," "," "," "," "
,"Interstate 85 & Pleasant Hill Rd Suwanee Duluth, GA","http://bit.ly/mZFYVz","09/20/2011 - 04:42pm",126980.000000,126980.000000,33.953109,-84.130806,1164902.000000,1.000000,1.000000,0.000000,"126980-manhole-cover-falling-in","Open","Manhole Cover Falling In","09/20/2011 - 04:42pm","2011-09-20T16:42:35-04:00",0.000000,0.000000,0," "," "," "," "," "," "," "," "," "," "," "," "," "," ",0,0.000000," "," "," "," ",0.000000,0.000000,0,0," "," "," "," "
,"765 Kirkly Way Fairburn, GA","http://bit.ly/qjWbnn","09/16/2011 - 04:22pm",126191.000000,126191.000000,33.592295,-84.630216,1170683.000000,1.000000,3.000000,0.000000,"126191-lid-don-t-fit","Acknowledged","lid don't fit","07/03/2013 - 10:24pm","2013-07-03T22:24:36-04:00",0.000000,0.000000,0," "," "," "," "," "," "," "," "," "," "," "," "," "," ",0,0.000000," "," "," "," ",0.000000,0.000000,0,0," "," "," "," "
,"400 Block Of W 45th St Chattanooga, TN 37410, USA","http://bit.ly/nczvsI","09/16/2011 - 12:58pm",126151.000000,126151.000000,35.002431,-85.321303,1170886.000000,1.000000,2.000000,0.000000,"126151-this-street-and-side-walks-are-blocked-with-pallets-on-a-regular-basis","Open","This street and side walks are blocked with pallets on a regular basis","01/05/2012 - 02:46pm","2012-01-05T14:46:14-05:00",0.000000,0.000000,0," "," "," "," "," "," "," "," "," "," "," "," "," "," ",0,0.000000," "," "," "," ",0.000000,0.000000,0,0," "," "," "," "
,"Interstate 285 Atlanta, GA","http://bit.ly/nLuAcd","09/13/2011 - 05:22pm",125395.000000,125395.000000,33.880213,-84.473147,1174942.000000,1.000000,3.000000,0.000000,"125395-interstate-sign","Open","Interstate Sign","09/15/2011 - 05:29pm","2011-09-15T17:29:16-04:00",0.000000,3.000000,0," "," "," "," "," "," "," "," "," "," "," "," "," "," ",0,0.000000," "," "," "," ",0.000000,0.000000,0,0," "," "," "," "
,"244 W 18th St Chattanooga, TN 37408, USA","http://bit.ly/qg1TO8","09/12/2011 - 08:45pm",125173.000000,125173.000000,35.034494,-85.311627,1176179.000000,1.000000,2.000000,0.000000,"125173-light-flickers","Open","Light flickers","09/12/2011 - 08:47pm","2011-09-12T20:47:14-04:00",0.000000,0.000000,0," "," "," "," "," "," "," "," "," "," "," "," "," "," ",0,0.000000," "," "," "," ",0.000000,0.000000,0,0," "," "," "," "
,"Austell Road COBB , GA","http://bit.ly/nrk94e","09/08/2011 - 06:00pm",124381.000000,124381.000000,33.837405,-84.611304,1182104.000000,1.000000,4.000000,0.000000,"124381-pot-holes","Open","POT HOLES","03/13/2013 - 11:35pm","2013-03-13T23:35:38-04:00",0.000000,2.000000,0," "," "," "," "," "," "," "," "," "," "," "," "," "," ",0,0.000000," "," "," "," ",0.000000,0.000000,0,0," "," "," "," "
,"6380 Peachtree Industrial Blvd Atlanta, GA 30338, USA","http://bit.ly/nNHC8E","09/08/2011 - 05:00pm",124372.000000,124372.000000,33.923313,-84.282066,1182164.000000,1.000000,2.000000,0.000000,"124372-need-yield-signs-for-traffic","Open","Need Yield signs for traffic","03/13/2012 - 06:27am","2012-03-13T06:27:13-04:00",0.000000,0.000000,0," "," "," "," "," "," "," "," "," "," "," "," "," "," ",0,0.000000," "," "," "," ",0.000000,0.000000,0,0," "," "," "," "
,"Kings Dr Se Acworth, GA","http://bit.ly/nFzp1k","09/07/2011 - 05:43pm",124078.000000,124078.000000,34.085045,-84.717979,1183561.000000,1.000000,1.000000,0.000000,"124078-water-is-running-out-of-rd","Open","water is running out of rd","09/07/2011 - 05:43pm","2011-09-07T17:43:48-04:00",0.000000,0.000000,0," "," "," "," "," "," "," "," "," "," "," "," "," "," ",0,0.000000," "," "," "," ",0.000000,0.000000,0,0," "," "," "," "
,"Cobb Parkway Acworth, GA","http://bit.ly/oxRL5a","09/07/2011 - 05:20pm",124065.000000,124065.000000,34.060362,-84.722540,1183584.000000,1.000000,2.000000,0.000000,"124065-need-turning-light","Open","Need turning light","12/08/2012 - 02:57pm","2012-12-08T14:57:13-05:00",0.000000,0.000000,0," "," "," "," "," "," "," "," "," "," "," "," "," "," ",0,0.000000," "," "," "," ",0.000000,0.000000,0,0," "," "," "," "
,"4676 Klondike Rd Lithonia, GA","http://bit.ly/oXJp68","09/06/2011 - 04:51pm",123777.000000,123777.000000,33.642062,-84.125061,1185054.000000,1.000000,2.000000,0.000000,"123777-potholes","Open","POTHOLES","09/12/2011 - 02:34pm","2011-09-12T14:34:05-04:00",0.000000,0.000000,0," "," "," "," "," "," "," "," "," "," "," "," "," "," ",0,0.000000," "," "," "," ",0.000000,0.000000,0,0," "," "," "," "
,"5111fairforest Dr. deaklb, st.mtn., GA","http://bit.ly/o312i0","09/06/2011 - 03:52pm",123761.000000,123761.000000,32.157435,-82.907123,1185112.000000,1.000000,2.000000,0.000000,"123761-dont-have-a-image","Open","dont have a image","09/06/2011 - 04:01pm","2011-09-06T16:01:12-04:00",0.000000,0.000000,0," "," "," "," "," "," "," "," "," "," "," "," "," "," ",0,0.000000," "," "," "," ",0.000000,0.000000,0,0," "," "," "," "
,"2600-2698 Livingston Ave Savannah, GA 31406, USA","http://bit.ly/qHFcho","09/04/2011 - 02:45pm",123444.000000,123444.000000,32.015137,-81.064875,1188059.000000,1.000000,2.000000,0.000000,"123444-pot-hole","Open","Pot hole","01/03/2012 - 04:02pm","2012-01-03T16:02:59-05:00",0.000000,1.000000,0," "," "," "," "," "," "," "," "," "," "," "," "," "," ",0,0.000000," "," "," "," ",0.000000,0.000000,0,0," "," "," "," "
,"1600-1602 E 13th St Chattanooga, TN 37404, USA","http://bit.ly/pbUTHJ","09/04/2011 - 08:02am",123407.000000,123407.000000,35.029109,-85.283191,1188463.000000,1.000000,4.000000,0.000000,"123407-overgrown-yard","Open","overgrown yard","08/29/2013 - 11:29pm","2013-08-29T23:29:58-04:00",0.000000,3.000000,0," "," "," "," "," "," "," "," "," "," "," "," "," "," ",0,0.000000," "," "," "," ",0.000000,0.000000,0,0," "," "," "," "
,"1010 S Highland Park Ave Chattanooga, TN 37404, USA","http://bit.ly/q5Ptx5","09/04/2011 - 07:43am",123403.000000,123403.000000,35.031378,-85.283657,1188482.000000,1.000000,6.000000,0.000000,"123403-no-roof-this-building-should-be-condemned-and-cited","Open","no roof!  this building should be condemned and cited!","11/09/2012 - 06:06pm","2012-11-09T18:06:26-05:00",0.000000,4.000000,0," "," "," "," "," "," "," "," "," "," "," "," "," "," ",0,0.000000," "," "," "," ",0.000000,0.000000,0,0," "," "," "," "
,"Bouldercrest Rd Decatur, GA","http://bit.ly/pPIBb2","09/02/2011 - 09:17am",123116.000000,123116.000000,33.683942,-84.310004,1191267.000000,1.000000,3.000000,0.000000,"123116-2-feet-hole-on-with-iron","Open","2 feet Hole on with iron","09/06/2011 - 10:03am","2011-09-06T10:03:59-04:00",0.000000,1.000000,0," "," "," "," "," "," "," "," "," "," "," "," "," "," ",0,0.000000," "," "," "," ",0.000000,0.000000,0,0," "," "," "," "
,"Hwy. 20 And Ruth Rd. Cumming, GA","http://bit.ly/ruvoX4","09/01/2011 - 11:39pm",123075.000000,123075.000000,34.127939,-84.095473,1191846.000000,1.000000,1.000000,0.000000,"123075-pot-hole","Open","Pot hole","09/01/2011 - 11:39pm","2011-09-01T23:39:05-04:00",0.000000,0.000000,0," "," "," "," "," "," "," "," "," "," "," "," "," "," ",0,0.000000," "," "," "," ",0.000000,0.000000,0,0," "," "," "," "
,"Flakes Mill dekalb, GA","http://bit.ly/qdICqp","09/01/2011 - 04:28pm",123011.000000,123011.000000,33.679300,-84.230954,1192277.000000,1.000000,4.000000,0.000000,"123011-road-is-in-bad-condition","Open","road is in bad condition","05/29/2013 - 11:44pm","2013-05-29T23:44:35-04:00",0.000000,1.000000,0," "," "," "," "," "," "," "," "," "," "," "," "," "," ",0,0.000000," "," "," "," ",0.000000,0.000000,0,0," "," "," "," "
,"12 W 17th St Chattanooga, TN 37408, USA","http://bit.ly/ruajMk","08/31/2011 - 11:12pm",122864.000000,122864.000000,35.034431,-85.308596,1193312.000000,1.000000,2.000000,0.000000,"122864-attempt-to-access-damage-mail-box","Open","Attempt to access / damage mail box","07/09/2012 - 06:53pm","2012-07-09T18:53:56-04:00",0.000000,1.000000,0," "," "," "," "," "," "," "," "," "," "," "," "," "," ",0,0.000000," "," "," "," ",0.000000,0.000000,0,0," "," "," "," "
,"244 W 18th St Chattanooga, TN 37408, USA","http://bit.ly/ptYeLD","08/31/2011 - 11:07pm",122862.000000,122862.000000,35.034488,-85.311646,1193317.000000,1.000000,1.000000,0.000000,"122862-street-light-m6-129","Open","Street light  M6 129","08/31/2011 - 11:07pm","2011-08-31T23:07:33-04:00",0.000000,0.000000,0," "," "," "," "," "," "," "," "," "," "," "," "," "," ",0,0.000000," "," "," "," ",0.000000,0.000000,0,0," "," "," "," "
,"Hwy 154 / Lower Fayetteville Road Coweta, GA","http://bit.ly/nB95p5","08/31/2011 - 02:11pm",122733.000000,122733.000000,33.381357,-84.671802,1193853.000000,1.000000,1.000000,0.000000,"122733-intersection-is-a-dangerous-mess","Open","Intersection is a dangerous mess","08/31/2011 - 02:11pm","2011-08-31T14:11:21-04:00",0.000000,0.000000,0," "," "," "," "," "," "," "," "," "," "," "," "," "," ",0,0.000000," "," "," "," ",0.000000,0.000000,0,0," "," "," "," "
,"2148 State Highway 92 Douglasville, GA 30135, USA","http://bit.ly/pV0pHU","08/30/2011 - 04:49pm",122470.000000,122470.000000,33.747246,-84.698319,1195135.000000,1.000000,1.000000,0.000000,"122470-parking-lot-pot-hole","Open","Parking lot pot hole","08/30/2011 - 04:49pm","2011-08-30T16:49:34-04:00",18208.000000,0.000000,0," "," "," "," "," "," "," "," "," "," "," "," "," "," ",0,0.000000," "," "," "," ",0.000000,0.000000,0,0," "," "," "," "
,"Burnt Hickory Rd douglasville, ga","http://bit.ly/qXvAfC","08/30/2011 - 04:39pm",122464.000000,122464.000000,33.763156,-84.702487,1195145.000000,1.000000,1.000000,0.000000,"122464-pot-holes","Open","pot holes","08/30/2011 - 04:39pm","2011-08-30T16:39:53-04:00",0.000000,0.000000,0," "," "," "," "," "," "," "," "," "," "," "," "," "," ",0,0.000000," "," "," "," ",0.000000,0.000000,0,0," "," "," "," "
,"197 N Clarkesville, GA","http://bit.ly/nJV1sz","08/29/2011 - 01:05pm",121973.000000,121973.000000,34.728777,-83.590153,1196799.000000,1.000000,2.000000,0.000000,"121973-no-sidewalk-accessable-areas","Open","no sidewalk accessable areas","08/30/2011 - 05:21pm","2011-08-30T17:21:53-04:00",18142.000000,2.000000,0," "," "," "," "," "," "," "," "," "," "," "," "," "," ",0,0.000000," "," "," "," ",0.000000,0.000000,0,0," "," "," "," "
,"1445 Market St Chattanooga, TN 37402, USA","http://bit.ly/oP0TX0","08/25/2011 - 10:40pm",121171.000000,121171.000000,35.036945,-85.308038,1201984.000000,1.000000,1.000000,0.000000,"121171-street-light-shutting-off","Open","Street light shutting off","07/09/2012 - 06:54pm","2012-07-09T18:54:34-04:00",17976.000000,0.000000,0," "," "," "," "," "," "," "," "," "," "," "," "," "," ",0,0.000000," "," "," "," ",0.000000,0.000000,0,0," "," "," "," "
,"41 Ruth Ln Cumming, GA","http://bit.ly/oISuvD","08/25/2011 - 05:04pm",121134.000000,121134.000000,34.127908,-84.095578,1202320.000000,1.000000,1.000000,0.000000,"121134-very-deep-pot-hole","Open","VERY DEEP POT HOLE","08/25/2011 - 05:04pm","2011-08-25T17:04:40-04:00",0.000000,0.000000,0," "," "," "," "," "," "," "," "," "," "," "," "," "," ",0,0.000000," "," "," "," ",0.000000,0.000000,0,0," "," "," "," "
,"Atlanta Highway Gainesville, GA","http://bit.ly/o2BQwr","08/23/2011 - 08:03am",120653.000000,120653.000000,34.254819,-83.845815,1205742.000000,1.000000,1.000000,0.000000,"120653-pothole","Open","pothole","08/23/2011 - 08:03am","2011-08-23T08:03:17-04:00",0.000000,0.000000,0," "," "," "," "," "," "," "," "," "," "," "," "," "," ",0,0.000000," "," "," "," ",0.000000,0.000000,0,0," "," "," "," "
,"Apple Valley Road jefferson, GA","http://bit.ly/mOTA0S","08/17/2011 - 05:45pm",119797.000000,119797.000000,34.139088,-83.479614,1213799.000000,1.000000,4.000000,0.000000,"119797-full-road-repair","Open","full road repair","09/20/2011 - 06:38pm","2011-09-20T18:38:30-04:00",0.000000,3.000000,0," "," "," "," "," "," "," "," "," "," "," "," "," "," ",0,0.000000," "," "," "," ",0.000000,0.000000,0,0," "," "," "," "
,"1311 Pebble Ridge Lane hampton, GA","http://bit.ly/nzpEIQ","08/16/2011 - 05:56pm",119527.000000,119527.000000,33.452074,-84.349665,1215229.000000,1.000000,1.000000,0.000000,"119527-rip-off-from-comany","Open","Rip Off from Comany","08/16/2011 - 05:56pm","2011-08-16T17:56:02-04:00",0.000000,0.000000,0," "," "," "," "," "," "," "," "," "," "," "," "," "," ",0,0.000000," "," "," "," ",0.000000,0.000000,0,0," "," "," "," "
,"1478 Anderson Valley Dr Snellville, GA","http://bit.ly/pQStNC","08/15/2011 - 09:28pm",119304.000000,119304.000000,33.748876,-84.041349,1216456.000000,1.000000,2.000000,0.000000,"119304-street-lights-on-saine-rd-are-not-working","Open","Street lights on Saine Rd are not working","08/22/2011 - 02:11pm","2011-08-22T14:11:41-04:00",0.000000,0.000000,0," "," "," "," "," "," "," "," "," "," "," "," "," "," ",0,0.000000," "," "," "," ",0.000000,0.000000,0,0," "," "," "," "
,"624 E Main St Chattanooga, TN 37408, USA","http://bit.ly/nYTjrp","08/14/2011 - 05:16pm",119058.000000,119058.000000,35.032673,-85.299029,1218148.000000,1.000000,2.000000,0.000000,"119058-storm-drains-facing-wrong-direction","Open","Storm drains facing wrong direction","05/29/2013 - 01:24pm","2013-05-29T13:24:00-04:00",0.000000,1.000000,0," "," "," "," "," "," "," "," "," "," "," "," "," "," ",0,0.000000," "," "," "," ",0.000000,0.000000,0,0," "," "," "," "
,"354 Russell Rd. Lawrenceville, GA","http://bit.ly/rai5yQ","08/14/2011 - 12:01pm",119035.000000,119035.000000,33.993711,-84.021643,1218463.000000,1.000000,1.000000,0.000000,"119035-there-is-an-indention-in-the-pavement-that-will-shake-the-front-end-of-your-vehicle","Open","There is an indention in the pavement that will shake the front end of your vehicle","08/14/2011 - 12:01pm","2011-08-14T12:01:57-04:00",0.000000,0.000000,0," "," "," "," "," "," "," "," "," "," "," "," "," "," ",0,0.000000," "," "," "," ",0.000000,0.000000,0,0," "," "," "," "
,"4964 5066 Bakers Bridge Rd Douglasville, GA","http://bit.ly/pactng","08/12/2011 - 04:38pm",118885.000000,118885.000000,33.799602,-84.806449,1221066.000000,1.000000,1.000000,0.000000,"118885-makeshift-bridge-doesn-t-meet-road-evenly","Open","Makeshift Bridge doesn't meet road evenly","08/12/2011 - 04:38pm","2011-08-12T16:38:54-04:00",0.000000,0.000000,0," "," "," "," "," "," "," "," "," "," "," "," "," "," ",0,0.000000," "," "," "," ",0.000000,0.000000,0,0," "," "," "," "
,"3278 Brookmont Pkwy Douglasville, GA","http://bit.ly/pijDHx","08/11/2011 - 05:58pm",118726.000000,118726.000000,33.714479,-84.705632,1222426.000000,1.000000,2.000000,0.000000,"118726-1-2-mile-pothole","Open","1/2 mile pothole","12/05/2011 - 09:09am","2011-12-05T09:09:52-05:00",0.000000,0.000000,0," "," "," "," "," "," "," "," "," "," "," "," "," "," ",0,0.000000," "," "," "," ",0.000000,0.000000,0,0," "," "," "," "
,"Transition Ramp From I-85 South To I-285 West Dekalb, GA","http://bit.ly/mYS0hO","08/11/2011 - 01:42pm",118657.000000,118657.000000,33.795644,-84.227879,1222682.000000,1.000000,4.000000,0.000000,"118657-the-ramp-is-a-joke","Open","The ramp is a joke!","04/30/2013 - 08:58am","2013-04-30T08:58:53-04:00",0.000000,1.000000,0," "," "," "," "," "," "," "," "," "," "," "," "," "," ",0,0.000000," "," "," "," ",0.000000,0.000000,0,0," "," "," "," "
,"80 2392 Water Works Rd Palmetto, GA","http://bit.ly/qKA66R","08/09/2011 - 05:46pm",118265.000000,118265.000000,33.515887,-84.691758,1225319.000000,1.000000,1.000000,0.000000,"118265-quarter-mile-of-pot-holes","Open","Quarter Mile of Pot Holes","08/09/2011 - 05:46pm","2011-08-09T17:46:22-04:00",0.000000,0.000000,0," "," "," "," "," "," "," "," "," "," "," "," "," "," ",0,0.000000," "," "," "," ",0.000000,0.000000,0,0," "," "," "," "
,"1555 Owens Store Rd canton, GA","http://bit.ly/rhtBye","08/09/2011 - 11:39am",118158.000000,118158.000000,34.232172,-84.332990,1225685.000000,1.000000,2.000000,0.000000,"118158-traffic-light-not-working","Open","traffic light not working","08/26/2011 - 08:38pm","2011-08-26T20:38:07-04:00",0.000000,1.000000,0," "," "," "," "," "," "," "," "," "," "," "," "," "," ",0,0.000000," "," "," "," ",0.000000,0.000000,0,0," "," "," "," "
,"555 North Indian Creek Drive  Clarkston, GA","http://bit.ly/oblRCU","08/08/2011 - 11:47am",117938.000000,117938.000000,33.789799,-84.236146,1227118.000000,1.000000,3.000000,0.000000,"117938-multilple-potholes-and-uneven-pavement","Open","Multilple potholes and uneven pavement","08/17/2011 - 11:03am","2011-08-17T11:03:59-04:00",0.000000,1.000000,0," "," "," "," "," "," "," "," "," "," "," "," "," "," ",0,0.000000," "," "," "," ",0.000000,0.000000,0,0," "," "," "," "
,"Barton Creek Road Westminster/Oconee, SC","http://bit.ly/mWfS5C","08/04/2011 - 03:58pm",117421.000000,117421.000000,34.656504,-83.271277,1232626.000000,1.000000,10.000000,0.000000,"117421-road-needs-paving","Open","Road Needs PAVING","10/28/2013 - 11:45am","2013-10-28T11:45:25-04:00",121658.000000,12.000000,0," "," "," "," "," "," "," "," "," "," "," "," "," "," ",0,0.000000," "," "," "," ",0.000000,0.000000,0,0," "," "," "," "
,"2100 2192 Doc Hughes Rd Buford, GA","http://bit.ly/qrY8vo","08/03/2011 - 05:45pm",117254.000000,117254.000000,34.079126,-83.886151,1233960.000000,1.000000,4.000000,0.000000,"117254-blind-intersection","Open","Blind intersection","11/08/2012 - 07:01pm","2012-11-08T19:01:13-05:00",0.000000,4.000000,0," "," "," "," "," "," "," "," "," "," "," "," "," "," ",0,0.000000," "," "," "," ",0.000000,0.000000,0,0," "," "," "," "
,"Branch St gainesville, GA","http://bit.ly/n4E8TH","07/24/2011 - 11:22pm",115158.000000,115158.000000,34.303633,-83.803811,1248023.000000,1.000000,1.000000,0.000000,"115158-need-fixing","Open","need fixing","07/24/2011 - 11:22pm","2011-07-24T23:22:01-04:00",0.000000,0.000000,0," "," "," "," "," "," "," "," "," "," "," "," "," "," ",0,0.000000," "," "," "," ",0.000000,0.000000,0,0," "," "," "," "
,"Branch Street gainesville, GA","http://bit.ly/mPP5b0","07/24/2011 - 11:17pm",115157.000000,115157.000000,34.303633,-83.803811,1248027.000000,1.000000,2.000000,0.000000,"115157-please-help","Open","PLEASE HELP","07/24/2011 - 11:23pm","2011-07-24T23:23:20-04:00",0.000000,1.000000,0," "," "," "," "," "," "," "," "," "," "," "," "," "," ",0,0.000000," "," "," "," ",0.000000,0.000000,0,0," "," "," "," "
,"1588 1604 Elliott Rd Mc Donough, GA","http://bit.ly/q2Adej","07/22/2011 - 05:08pm",114898.000000,114898.000000,33.510627,-84.114847,1251276.000000,1.000000,6.000000,0.000000,"114898-unsafe-dirt-road","Open","unsafe dirt road","10/23/2013 - 08:50pm","2013-10-23T20:50:51-04:00",0.000000,4.000000,0," "," "," "," "," "," "," "," "," "," "," "," "," "," ",0,0.000000," "," "," "," ",0.000000,0.000000,0,0," "," "," "," "
,"611-627 Victoria Rd Woodstock, GA 30189, USA","http://bit.ly/pQ4Mui","07/17/2011 - 09:57pm",113546.000000,113546.000000,34.138729,-84.607002,1258187.000000,1.000000,1.000000,0.000000,"113546-pothole","Open","Pothole","07/17/2011 - 09:57pm","2011-07-17T21:57:30-04:00",16465.000000,0.000000,0," "," "," "," "," "," "," "," "," "," "," "," "," "," ",0,0.000000," "," "," "," ",0.000000,0.000000,0,0," "," "," "," "
,"5393-5399 Jasmine Ave Savannah, GA 31406, USA","http://bit.ly/r6jJs7","07/16/2011 - 04:54pm",113421.000000,113421.000000,32.015338,-81.065989,1259931.000000,1.000000,2.000000,0.000000,"113421-people-turning-left-not-yielding","Open","People turning left not yielding","07/21/2011 - 09:00pm","2011-07-21T21:00:00-04:00",16430.000000,1.000000,0," "," "," "," "," "," "," "," "," "," "," "," "," "," ",0,0.000000," "," "," "," ",0.000000,0.000000,0,0," "," "," "," "
,"Canton Rd & Piedmont Rd Marietta, GA","http://bit.ly/oA1oOc","07/15/2011 - 07:06am",113152.000000,113152.000000,34.020014,-84.528393,1261958.000000,1.000000,6.000000,0.000000,"113152-canton-rd-construction-finally-done-but","Open","Canton Rd Construction finally done BUT","07/23/2013 - 08:46pm","2013-07-23T20:46:13-04:00",0.000000,5.000000,0," "," "," "," "," "," "," "," "," "," "," "," "," "," ",0,0.000000," "," "," "," ",0.000000,0.000000,0,0," "," "," "," "
,"Braswell Mt. Rd. Rockmart, GA","http://bit.ly/nrMUSm","07/13/2011 - 05:13pm",112875.000000,112875.000000,33.948932,-84.943175,1264231.000000,1.000000,2.000000,0.000000,"112875-my-car-is-need-of-repair-because-of-this-road","Open","My car is need of repair because of this road","07/26/2011 - 02:40pm","2011-07-26T14:40:49-04:00",0.000000,0.000000,0," "," "," "," "," "," "," "," "," "," "," "," "," "," ",0,0.000000," "," "," "," ",0.000000,0.000000,0,0," "," "," "," "
,"2905 Stonecrest Cir Lithonia, GA","http://bit.ly/o8zoLJ","07/12/2011 - 04:41pm",112624.000000,112624.000000,33.695994,-84.091179,1265704.000000,1.000000,5.000000,0.000000,"112624-street-lights-on-poles","Open","Street Lights On Poles","09/20/2013 - 03:44pm","2013-09-20T15:44:32-04:00",70183.000000,20.000000,0," "," "," "," "," "," "," "," "," "," "," "," "," "," ",0,0.000000," "," "," "," ",0.000000,0.000000,0,0," "," "," "," "
,"6819 Mancha St Atlanta, GA","http://bit.ly/ovg4SY","07/12/2011 - 10:48am",112510.000000,112510.000000,33.571961,-84.467127,1266056.000000,1.000000,3.000000,0.000000,"112510-broken-meter-lid","Acknowledged","Broken Meter Lid","07/03/2013 - 10:24pm","2013-07-03T22:24:28-04:00",0.000000,1.000000,0," "," "," "," "," "," "," "," "," "," "," "," "," "," ",0,0.000000," "," "," "," ",0.000000,0.000000,0,0," "," "," "," "
,"7375 Jumpers Trail Atlanta, GA","http://bit.ly/nbm3G9","07/12/2011 - 03:23am",112419.000000,112419.000000,33.623124,-84.624247,1266502.000000,1.000000,2.000000,0.000000,"112419-sidewalk-is-falling-apart","Open","sidewalk is falling apart","10/04/2011 - 08:33am","2011-10-04T08:33:17-04:00",0.000000,0.000000,0," "," "," "," "," "," "," "," "," "," "," "," "," "," ",0,0.000000," "," "," "," ",0.000000,0.000000,0,0," "," "," "," "
,"1044-1098 N Sanctuary Rd Chattanooga, TN 37421, USA","http://bit.ly/otZnT3","07/12/2011 - 02:41am",112418.000000,112418.000000,35.002124,-85.173611,1266544.000000,1.000000,1.000000,0.000000,"112418-manhole-covers-well-above-pavement","Open","Manhole covers well above pavement","07/12/2011 - 02:41am","2011-07-12T02:41:08-04:00",0.000000,0.000000,0," "," "," "," "," "," "," "," "," "," "," "," "," "," ",0,0.000000," "," "," "," ",0.000000,0.000000,0,0," "," "," "," "
,"7375 Jumpers Trail Fairburn, Ga.","http://bit.ly/qj5XDP","07/12/2011 - 02:06am",112416.000000,112416.000000,33.623124,-84.624247,1266579.000000,1.000000,2.000000,0.000000,"112416-meter-lid-has-a-poor-fit","Open","Meter Lid has a poor fit","07/12/2011 - 02:10am","2011-07-12T02:10:27-04:00",0.000000,2.000000,0," "," "," "," "," "," "," "," "," "," "," "," "," "," ",0,0.000000," "," "," "," ",0.000000,0.000000,0,0," "," "," "," "
,"6522 6536 Cohran Store Rd Douglasville, GA","http://bit.ly/irnLUO","07/03/2011 - 10:44pm",110805.000000,110805.000000,33.804398,-84.840803,1278300.000000,1.000000,1.000000,0.000000,"110805-4-way-stop-sign","Open","4-Way Stop Sign","07/03/2011 - 10:44pm","2011-07-03T22:44:27-04:00",0.000000,0.000000,0," "," "," "," "," "," "," "," "," "," "," "," "," "," ",0,0.000000," "," "," "," ",0.000000,0.000000,0,0," "," "," "," "
,"4442 4448 Jimmy Lee Smith Pkwy Hiram, GA","http://bit.ly/kmDuwd","07/03/2011 - 10:42pm",110804.000000,110804.000000,33.891222,-84.754371,1278302.000000,1.000000,1.000000,0.000000,"110804-ghetto-red-lights","Open","Ghetto Red Lights","07/03/2011 - 10:42pm","2011-07-03T22:42:46-04:00",0.000000,0.000000,0," "," "," "," "," "," "," "," "," "," "," "," "," "," ",0,0.000000," "," "," "," ",0.000000,0.000000,0,0," "," "," "," "
,"427 Cohran Store Rd Douglasville, GA","http://bit.ly/lbgh2Z","07/03/2011 - 10:37pm",110803.000000,110803.000000,33.800475,-84.837799,1278308.000000,1.000000,2.000000,0.000000,"110803-cracked-potholes-terrible-patchs","Open","Cracked, Potholes, Terrible Patchs.","07/03/2011 - 10:40pm","2011-07-03T22:40:39-04:00",0.000000,5.000000,0," "," "," "," "," "," "," "," "," "," "," "," "," "," ",0,0.000000," "," "," "," ",0.000000,0.000000,0,0," "," "," "," "
,"2674 Sandy Plains Rd Marietta, GA","http://bit.ly/ivESjy","07/01/2011 - 04:52pm",110564.000000,110564.000000,34.015001,-84.492840,1281532.000000,1.000000,2.000000,0.000000,"110564-ruts-potholes-dents-lumps-everywhere","Open","ruts, potholes, dents, lumps everywhere","07/01/2011 - 04:52pm","2011-07-01T16:52:52-04:00",0.000000,1.000000,0," "," "," "," "," "," "," "," "," "," "," "," "," "," ",0,0.000000," "," "," "," ",0.000000,0.000000,0,0," "," "," "," "
,"Rosser Road  Smoke Rise , GA","http://bit.ly/lRezXc","07/01/2011 - 04:38pm",110557.000000,110557.000000,33.848643,-84.168008,1281547.000000,1.000000,3.000000,0.000000,"110557-needs-repaving","Open","Needs repaving","04/17/2012 - 07:46am","2012-04-17T07:46:18-04:00",0.000000,1.000000,0," "," "," "," "," "," "," "," "," "," "," "," "," "," ",0,0.000000," "," "," "," ",0.000000,0.000000,0,0," "," "," "," "
,"2330 2340 Prince Howard Way Marietta, GA","http://bit.ly/myWYH7","07/01/2011 - 04:38pm",110556.000000,110556.000000,34.006565,-84.467525,1281547.000000,1.000000,1.000000,0.000000,"110556-deep-dent-in-road","Open","deep dent in road","07/01/2011 - 04:38pm","2011-07-01T16:38:14-04:00",0.000000,0.000000,0," "," "," "," "," "," "," "," "," "," "," "," "," "," ",0,0.000000," "," "," "," ",0.000000,0.000000,0,0," "," "," "," "
,"1739-1799 Cowart St Chattanooga, TN 37408, USA","http://bit.ly/kNMhzO","06/30/2011 - 06:06pm",110338.000000,110338.000000,35.035197,-85.311369,1282899.000000,1.000000,3.000000,0.000000,"110338-speed-hump-request","Open","Speed Hump Request -","10/10/2011 - 07:00am","2011-10-10T07:00:12-04:00",0.000000,0.000000,0," "," "," "," "," "," "," "," "," "," "," "," "," "," ",0,0.000000," "," "," "," ",0.000000,0.000000,0,0," "," "," "," "
,"1376 Briers Dr stone mountain, GA","http://bit.ly/kuHwkN","06/30/2011 - 05:43pm",110335.000000,110335.000000,33.819663,-84.208699,1282921.000000,1.000000,2.000000,0.000000,"110335-potholes-in-the-neighborhood","Open","potholes in the neighborhood","07/01/2011 - 09:11am","2011-07-01T09:11:23-04:00",0.000000,0.000000,0," "," "," "," "," "," "," "," "," "," "," "," "," "," ",0,0.000000," "," "," "," ",0.000000,0.000000,0,0," "," "," "," "
,"3124 Arlington Dr Rex/Clayton, GA","http://bit.ly/kj79UV","06/30/2011 - 04:44pm",110320.000000,110320.000000,33.571227,-84.288147,1282981.000000,1.000000,1.000000,0.000000,"110320-burned-up-house","Open","burned up house","06/30/2011 - 04:44pm","2011-06-30T16:44:18-04:00",0.000000,0.000000,0," "," "," "," "," "," "," "," "," "," "," "," "," "," ",0,0.000000," "," "," "," ",0.000000,0.000000,0,0," "," "," "," "
,"2153 Jodeco Rd Mc Donough, GA","http://bit.ly/lqQ9b7","06/29/2011 - 11:37pm",110134.000000,110134.000000,33.477272,-84.221191,1284007.000000,1.000000,1.000000,0.000000,"110134-bad-potholes","Open","bad potholes","06/29/2011 - 11:37pm","2011-06-29T23:37:36-04:00",0.000000,0.000000,0," "," "," "," "," "," "," "," "," "," "," "," "," "," ",0,0.000000," "," "," "," ",0.000000,0.000000,0,0," "," "," "," "
,"I-75 North And South Bound Kennesaw, GA","http://bit.ly/k7Mr39","06/28/2011 - 04:52pm",109839.000000,109839.000000,34.069724,-84.613609,1285852.000000,1.000000,3.000000,0.000000,"109839-lanes-buttons-missing","Open","Lanes buttons missing","11/08/2011 - 03:15pm","2011-11-08T15:15:21-05:00",0.000000,1.000000,0," "," "," "," "," "," "," "," "," "," "," "," "," "," ",0,0.000000," "," "," "," ",0.000000,0.000000,0,0," "," "," "," "
,"Milam Road Fairburn, GA","http://bit.ly/jnvsay","06/28/2011 - 04:29pm",109833.000000,109833.000000,33.527201,-84.559272,1285876.000000,1.000000,1.000000,0.000000,"109833-potholes","Open","Potholes","06/28/2011 - 04:29pm","2011-06-28T16:29:14-04:00",0.000000,0.000000,0," "," "," "," "," "," "," "," "," "," "," "," "," "," ",0,0.000000," "," "," "," ",0.000000,0.000000,0,0," "," "," "," "
,"1751 1799 E Piedmont Rd Marietta, GA","http://bit.ly/it8wdN","06/28/2011 - 02:07pm",109796.000000,109796.000000,33.994789,-84.487953,1286018.000000,1.000000,1.000000,0.000000,"109796-grass-in-divider-unkept","Open","Grass in divider unkept","06/28/2011 - 02:07pm","2011-06-28T14:07:16-04:00",11699.000000,0.000000,0," "," "," "," "," "," "," "," "," "," "," "," "," "," ",0,0.000000," "," "," "," ",0.000000,0.000000,0,0," "," "," "," "
,"2635 Sandy Plains Rd Marietta, GA","http://bit.ly/lxsYqc","06/28/2011 - 02:05pm",109795.000000,109795.000000,34.013311,-84.495758,1286019.000000,1.000000,2.000000,0.000000,"109795-aged-construction-debris-land-disturbance","Open","Aged construction debris/land disturbance","07/01/2011 - 04:48pm","2011-07-01T16:48:41-04:00",11699.000000,1.000000,0," "," "," "," "," "," "," "," "," "," "," "," "," "," ",0,0.000000," "," "," "," ",0.000000,0.000000,0,0," "," "," "," "
,"1500 1540 E Piedmont Rd Marietta, GA","http://bit.ly/jjjhq9","06/28/2011 - 02:03pm",109792.000000,109792.000000,33.987406,-84.488039,1286022.000000,1.000000,1.000000,0.000000,"109792-green-bulb-out-on-signal","Open","Green bulb out on signal","06/28/2011 - 02:03pm","2011-06-28T14:03:09-04:00",11699.000000,0.000000,0," "," "," "," "," "," "," "," "," "," "," "," "," "," ",0,0.000000," "," "," "," ",0.000000,0.000000,0,0," "," "," "," "
,"Polar Fox Court Riverdale, GA","http://bit.ly/jJtsmj","06/27/2011 - 06:49pm",109586.000000,109586.000000,33.582841,-84.462589,1287175.000000,1.000000,2.000000,0.000000,"109586-foxfire-phase-ii-asphalt-final-topping-pot-holes-and-lower-one-manhole","Open","Foxfire Phase II Asphalt Final Topping/Pot Holes and Lower one manhole.","08/26/2013 - 09:56am","2013-08-26T09:56:19-04:00",0.000000,4.000000,0," "," "," "," "," "," "," "," "," "," "," "," "," "," ",0,0.000000," "," "," "," ",0.000000,0.000000,0,0," "," "," "," "
,"Coner/Fairforest&Hearon Dr. st.mtn., GA","http://bit.ly/l9ItOJ","06/27/2011 - 05:54pm",109578.000000,109578.000000,33.822084,-83.988418,1287230.000000,1.000000,1.000000,0.000000,"109578-pot-holds","Open","pot holds","06/27/2011 - 05:54pm","2011-06-27T17:54:40-04:00",0.000000,0.000000,0," "," "," "," "," "," "," "," "," "," "," "," "," "," ",0,0.000000," "," "," "," ",0.000000,0.000000,0,0," "," "," "," "
,"I 675 North Bound decalb, GA","http://bit.ly/mpZGpm","06/27/2011 - 06:27am",109357.000000,109357.000000,32.157435,-82.907123,1287917.000000,1.000000,1.000000,0.000000,"109357-bad-on-ramp","Open","bad on ramp","06/27/2011 - 06:27am","2011-06-27T06:27:42-04:00",0.000000,0.000000,0," "," "," "," "," "," "," "," "," "," "," "," "," "," ",0,0.000000," "," "," "," ",0.000000,0.000000,0,0," "," "," "," "
,"4766 E Ponce De Leon Ave Stone Mountain, GA","http://bit.ly/lxX5fH","06/23/2011 - 11:30pm",108923.000000,108923.000000,33.818340,-84.221835,1292654.000000,1.000000,3.000000,0.000000,"108923-no-sidewalk","Open","No sidewalk","09/17/2012 - 05:11pm","2012-09-17T17:11:21-04:00",13109.000000,0.000000,0," "," "," "," "," "," "," "," "," "," "," "," "," "," ",0,0.000000," "," "," "," ",0.000000,0.000000,0,0," "," "," "," "
,"1400 Crest Lake Court Lithonia, GA","http://bit.ly/lVoZ7S","06/23/2011 - 10:00am",108770.000000,108770.000000,33.752453,-84.113521,1293464.000000,1.000000,3.000000,0.000000,"108770-numerous-pot-holes","Open","Numerous Pot Holes","12/13/2011 - 10:32am","2011-12-13T10:32:31-05:00",0.000000,0.000000,0," "," "," "," "," "," "," "," "," "," "," "," "," "," ",0,0.000000," "," "," "," ",0.000000,0.000000,0,0," "," "," "," "
,"7004 7012 Best Friend Rd Atlanta, GA","http://bit.ly/lVKExh","06/22/2011 - 04:51pm",108689.000000,108689.000000,33.907928,-84.243593,1294493.000000,1.000000,3.000000,0.000000,"108689-railroad-crossings","Open","railroad crossings","01/29/2013 - 07:41pm","2013-01-29T19:41:17-05:00",0.000000,1.000000,0," "," "," "," "," "," "," "," "," "," "," "," "," "," ",0,0.000000," "," "," "," ",0.000000,0.000000,0,0," "," "," "," "
,"Little Road canton, GA","http://bit.ly/lhGnmJ","06/20/2011 - 02:18am",108086.000000,108086.000000,34.155479,-84.429714,1298246.000000,1.000000,2.000000,0.000000,"108086-little-road-next-to-sequoyah-high","Open","Little Road next to Sequoyah high","06/20/2011 - 02:19am","2011-06-20T02:19:34-04:00",0.000000,1.000000,0," "," "," "," "," "," "," "," "," "," "," "," "," "," ",0,0.000000," "," "," "," ",0.000000,0.000000,0,0," "," "," "," "
,"Sams Crossing Decatur, GA","http://bit.ly/kyfWQU","06/19/2011 - 10:04pm",108076.000000,108076.000000,33.774984,-84.279577,1298501.000000,1.000000,4.000000,0.000000,"108076-washboards-dangerous-for-motor-vehicles-and-bicycles","Open","Washboards dangerous for motor vehicles and bicycles","07/24/2013 - 01:03am","2013-07-24T01:03:38-04:00",13109.000000,1.000000,0," "," "," "," "," "," "," "," "," "," "," "," "," "," ",0,0.000000," "," "," "," ",0.000000,0.000000,0,0," "," "," "," "
,"Pleasentdale Rd/ N.E Expressway doraville, GA","http://bit.ly/kIS5JH","06/16/2011 - 03:47pm",107647.000000,107647.000000,33.892705,-84.231277,1303198.000000,1.000000,2.000000,0.000000,"107647-reacurring-pothole","Open","reacurring pothole","03/10/2012 - 10:57am","2012-03-10T10:57:59-05:00",0.000000,1.000000,0," "," "," "," "," "," "," "," "," "," "," "," "," "," ",0,0.000000," "," "," "," ",0.000000,0.000000,0,0," "," "," "," "
,"5864 W. Yeager Rd Douglasville, GA","http://bit.ly/iwdNuK","06/15/2011 - 05:53pm",107457.000000,107457.000000,33.648299,-84.763070,1304512.000000,1.000000,1.000000,0.000000,"107457-pave-our-road","Open","pave our road","06/15/2011 - 05:53pm","2011-06-15T17:53:26-04:00",0.000000,0.000000,0," "," "," "," "," "," "," "," "," "," "," "," "," "," ",0,0.000000," "," "," "," ",0.000000,0.000000,0,0," "," "," "," "
,"2415 Dekalb Medical Pkwy Lithonia, GA 30058, USA","http://bit.ly/kxqY7Z","06/10/2011 - 11:00am",106526.000000,106526.000000,33.717521,-84.145789,1312124.000000,1.000000,3.000000,0.000000,"106526-trees-blocking-sidewalks","Open","TREES BLOCKING SIDEWALKS","08/24/2011 - 09:05am","2011-08-24T09:05:49-04:00",0.000000,0.000000,0," "," "," "," "," "," "," "," "," "," "," "," "," "," ",0,0.000000," "," "," "," ",0.000000,0.000000,0,0," "," "," "," "
,"Braselton Hwy Lawrenceville, GA","http://bit.ly/l0ywi8","06/09/2011 - 06:29pm",106406.000000,106406.000000,34.004412,-83.979664,1313116.000000,1.000000,1.000000,0.000000,"106406-the-city-needs-light","Open","The City Needs Light","06/09/2011 - 06:29pm","2011-06-09T18:29:28-04:00",0.000000,0.000000,0," "," "," "," "," "," "," "," "," "," "," "," "," "," ",0,0.000000," "," "," "," ",0.000000,0.000000,0,0," "," "," "," "
," ","http://bit.ly/iXlA6Q","06/08/2011 - 06:05pm",106183.000000,106183.000000,33.698970,-84.153910,1314579.000000,1.000000,2.000000,0.000000,"106183-crime","Open","CRIME","01/26/2012 - 07:15am","2012-01-26T07:15:35-05:00",0.000000,1.000000,0," "," "," "," "," "," "," "," "," "," "," "," "," "," ",0,0.000000," "," "," "," ",0.000000,0.000000,0,0," "," "," "," "
,"7401-7409 La Roche Ave Savannah, GA 31406, USA","http://bit.ly/lNyn3p","06/07/2011 - 02:02am",105746.000000,105746.000000,31.997121,-81.059038,1316982.000000,1.000000,3.000000,0.000000,"105746-extreme-tailgating-to-drivers-obeying-speed-limit","Open","Extreme Tailgating to drivers obeying speed limit","04/04/2013 - 05:07am","2013-04-04T05:07:52-04:00",0.000000,2.000000,0," "," "," "," "," "," "," "," "," "," "," "," "," "," ",0,0.000000," "," "," "," ",0.000000,0.000000,0,0," "," "," "," "
,"141-175 Sibley Rd Ne Milledgeville, GA 31061, USA","http://bit.ly/kE5wNP","05/22/2011 - 05:42pm",102695.000000,102695.000000,33.099774,-83.130798,1339083.000000,1.000000,2.000000,0.000000,"102695-report-road-issues","Open","Report road issues.","08/01/2011 - 03:42pm","2011-08-01T15:42:12-04:00",0.000000,0.000000,0," "," "," "," "," "," "," "," "," "," "," "," "," "," ",0,0.000000," "," "," "," ",0.000000,0.000000,0,0," "," "," "," "
,"140 Aquinnah Dr Pooler, GA 31322, USA","http://bit.ly/mTq9xS","05/17/2011 - 08:09pm",101824.000000,101824.000000,32.062082,-81.266673,1346136.000000,1.000000,4.000000,0.000000,"101824-excessive-speeding","Closed","Excessive speeding","11/30/2013 - 09:00am","2013-11-30T09:00:26-05:00",0.000000,2.000000,0," "," "," "," "," "," "," "," "," "," "," "," "," "," ",0,0.000000," "," "," "," ",0.000000,0.000000,0,0," "," "," "," "
,"1190 Horne Road Eastman, GA","http://bit.ly/j9VfpV","04/28/2011 - 01:19pm",97933.000000,97933.000000,32.252689,-83.076862,1373906.000000,1.000000,1.000000,0.000000,"97933-report-road-issues","Open","Report road issues.","04/28/2011 - 01:19pm","2011-04-28T13:19:04-04:00",0.000000,0.000000,0," "," "," "," "," "," "," "," "," "," "," "," "," "," ",0,0.000000," "," "," "," ",0.000000,0.000000,0,0," "," "," "," "
,"Frey Rd Kennesaw, GA 30144, USA","http://bit.ly/jM2vYl","04/27/2011 - 07:30pm",97742.000000,97742.000000,34.043734,-84.581058,1374974.000000,1.000000,1.000000,0.000000,"97742-graffiti","Open","graffiti","04/27/2011 - 07:30pm","2011-04-27T19:30:40-04:00",0.000000,0.000000,0," "," "," "," "," "," "," "," "," "," "," "," "," "," ",0,0.000000," "," "," "," ",0.000000,0.000000,0,0," "," "," "," "
,"Atlantic Coastal Hwy Pooler-Burroughs, GA 31405, USA","http://bit.ly/hojwwG","04/26/2011 - 07:13pm",97492.000000,97492.000000,32.039221,-81.208019,1376431.000000,1.000000,13.000000,0.000000,"97492-traffic-light-please","Open","Traffic light PLEASE","12/21/2012 - 09:17am","2012-12-21T09:17:50-05:00",0.000000,12.000000,0," "," "," "," "," "," "," "," "," "," "," "," "," "," ",0,0.000000," "," "," "," ",0.000000,0.000000,0,0," "," "," "," "
,"529 Sullivan Rd. WARNER ROBINS, GA","http://bit.ly/hF1QFw","04/25/2011 - 10:27am",97054.000000,97054.000000,32.665386,-83.650550,1378397.000000,1.000000,1.000000,0.000000,"97054-report-road-issues","Open","Report road issues.","04/25/2011 - 10:27am","2011-04-25T10:27:46-04:00",0.000000,0.000000,0," "," "," "," "," "," "," "," "," "," "," "," "," "," ",0,0.000000," "," "," "," ",0.000000,0.000000,0,0," "," "," "," "
,"42-84 Old Georgia 16 Sharpsburg, GA 30277, USA","http://bit.ly/hxmSCq","04/24/2011 - 12:35pm",96957.000000,96957.000000,33.341490,-84.668487,1379709.000000,1.000000,1.000000,0.000000,"96957-graffiti-on-bridge","Open","Graffiti On Bridge","04/24/2011 - 12:35pm","2011-04-24T12:35:45-04:00",12647.000000,0.000000,0," "," "," "," "," "," "," "," "," "," "," "," "," "," ",0,0.000000," "," "," "," ",0.000000,0.000000,0,0," "," "," "," "
,"3501-3577 State Highway 16 Sharpsburg, GA 30277, USA","http://bit.ly/ibzV63","04/24/2011 - 12:32pm",96955.000000,96955.000000,33.341392,-84.669710,1379713.000000,1.000000,2.000000,0.000000,"96955-pot-hole","Open","Pot Hole","04/24/2011 - 12:33pm","2011-04-24T12:33:14-04:00",12647.000000,0.000000,0," "," "," "," "," "," "," "," "," "," "," "," "," "," ",0,0.000000," "," "," "," ",0.000000,0.000000,0,0," "," "," "," "
,"Westbrooks Rd Forsyth, GA","http://bit.ly/gqOgEr","04/23/2011 - 10:06am",96815.000000,96815.000000,33.165623,-83.971925,1381299.000000,1.000000,1.000000,0.000000,"96815-pave-road","Open","pave road","04/23/2011 - 10:06am","2011-04-23T10:06:00-04:00",0.000000,0.000000,0," "," "," "," "," "," "," "," "," "," "," "," "," "," ",0,0.000000," "," "," "," ",0.000000,0.000000,0,0," "," "," "," "
,"Turnerwoods Drive Gray, GA","http://bit.ly/gzVo5S","04/21/2011 - 12:58pm",96482.000000,96482.000000,32.997077,-83.513711,1384007.000000,1.000000,2.000000,0.000000,"96482-report-road-issues","Open","Report road issues.","04/21/2011 - 12:58pm","2011-04-21T12:58:33-04:00",0.000000,1.000000,0," "," "," "," "," "," "," "," "," "," "," "," "," "," ",0,0.000000," "," "," "," ",0.000000,0.000000,0,0," "," "," "," "
,"1100 Thornblade Dr Warner Robins, GA 31088, USA","http://bit.ly/dTFJdn","04/21/2011 - 12:29pm",96472.000000,96472.000000,32.557954,-83.677668,1384035.000000,1.000000,2.000000,0.000000,"96472-report-road-issues","Open","Report road issues.","08/09/2013 - 10:25am","2013-08-09T10:25:58-04:00",0.000000,0.000000,0," "," "," "," "," "," "," "," "," "," "," "," "," "," ",0,0.000000," "," "," "," ",0.000000,0.000000,0,0," "," "," "," "
,"287 Remington Ct byron, GA","http://bit.ly/erwHka","04/21/2011 - 11:55am",96458.000000,96458.000000,32.708617,-83.824501,1384070.000000,1.000000,1.000000,0.000000,"96458-report-road-issues","Open","Report road issues.","06/03/2011 - 12:42pm","2011-06-03T12:42:39-04:00",0.000000,0.000000,0," "," "," "," "," "," "," "," "," "," "," "," "," "," ",0,0.000000," "," "," "," ",0.000000,0.000000,0,0," "," "," "," "
,"171 Michelle Rd. Milledgeville, GA","http://bit.ly/hMa3is","04/21/2011 - 09:55am",96421.000000,96421.000000,33.167215,-83.305473,1384190.000000,1.000000,1.000000,0.000000,"96421-report-road-issues","Open","Report road issues.","04/21/2011 - 09:55am","2011-04-21T09:55:29-04:00",0.000000,0.000000,0," "," "," "," "," "," "," "," "," "," "," "," "," "," ",0,0.000000," "," "," "," ",0.000000,0.000000,0,0," "," "," "," "
,"Hwy 247 & Bargain Rd Warner Robins, GA","http://bit.ly/htKgkq","04/21/2011 - 08:51am",96388.000000,96388.000000,32.647194,-83.608520,1384253.000000,1.000000,1.000000,0.000000,"96388-need-longer-left-turn-lane-247-bargain-rd","Open","Need longer left turn lane 247 & Bargain Rd","04/21/2011 - 08:51am","2011-04-21T08:51:50-04:00",0.000000,0.000000,0," "," "," "," "," "," "," "," "," "," "," "," "," "," ",0,0.000000," "," "," "," ",0.000000,0.000000,0,0," "," "," "," "
,"10127 Hawkinsville Rd Warner Robins, GA 31093, USA","http://bit.ly/eCbF1h","04/21/2011 - 08:45am",96386.000000,96386.000000,32.658598,-83.618488,1384259.000000,1.000000,1.000000,0.000000,"96386-need-left-turn-signal-247-elberta","Open","Need left turn signal 247/Elberta","04/21/2011 - 08:45am","2011-04-21T08:45:56-04:00",0.000000,0.000000,0," "," "," "," "," "," "," "," "," "," "," "," "," "," ",0,0.000000," "," "," "," ",0.000000,0.000000,0,0," "," "," "," "
,"247 & Elberta Rd Warner Robins, GA","http://bit.ly/gQBe27","04/20/2011 - 11:53pm",96352.000000,96352.000000,32.659270,-83.618694,1384792.000000,1.000000,2.000000,0.000000,"96352-report-road-issues","Open","Report road issues.","05/31/2013 - 10:32pm","2013-05-31T22:32:27-04:00",0.000000,0.000000,0," "," "," "," "," "," "," "," "," "," "," "," "," "," ",0,0.000000," "," "," "," ",0.000000,0.000000,0,0," "," "," "," "
,"Hwy 49 Fort Valley, GA","http://bit.ly/fDjV8s","04/20/2011 - 06:31pm",96320.000000,96320.000000,32.530372,-83.916882,1385114.000000,1.000000,1.000000,0.000000,"96320-report-road-issues","Open","Report road issues.","04/20/2011 - 06:31pm","2011-04-20T18:31:09-04:00",0.000000,0.000000,0," "," "," "," "," "," "," "," "," "," "," "," "," "," ",0,0.000000," "," "," "," ",0.000000,0.000000,0,0," "," "," "," "
,"527 Mary Freeman Rd Newnan, GA 30265, USA","http://bit.ly/hdk92T","04/13/2011 - 09:45pm",94977.000000,94977.000000,33.370406,-84.711380,1395000.000000,1.000000,1.000000,0.000000,"94977-burning-of-plastic-rubber-in-backyard","Open","Burning of plastic/ rubber in backyard","04/13/2011 - 09:45pm","2011-04-13T21:45:20-04:00",9569.000000,0.000000,0," "," "," "," "," "," "," "," "," "," "," "," "," "," ",0,0.000000," "," "," "," ",0.000000,0.000000,0,0," "," "," "," "
,"16 Heights Drive Rome, GA","http://bit.ly/gmVWWH","04/13/2011 - 10:28am",94820.000000,94820.000000,34.251100,-85.121700,1395676.000000,1.000000,1.000000,0.000000,"94820-asphalt-broken","Open","asphalt broken","04/13/2011 - 10:28am","2011-04-13T10:28:47-04:00",0.000000,0.000000,0," "," "," "," "," "," "," "," "," "," "," "," "," "," ",0,0.000000," "," "," "," ",0.000000,0.000000,0,0," "," "," "," "
,"122 Hearthstone Dr. S. Newnan ga.USA","http://bit.ly/g4AZsI","04/10/2011 - 05:48pm",94175.000000,94175.000000,33.364557,-84.844971,1399556.000000,1.000000,2.000000,0.000000,"94175-raw-sewage-runoff-in-a-subdivison","Open","raw sewage runoff in a subdivison","04/23/2011 - 09:11pm","2011-04-23T21:11:07-04:00",0.000000,6.000000,0," "," "," "," "," "," "," "," "," "," "," "," "," "," ",0,0.000000," "," "," "," ",0.000000,0.000000,0,0," "," "," "," "
,"2204-2208 Barnes Rd Macon, GA 31216, USA","http://bit.ly/gQ4UNE","03/29/2011 - 04:57pm",91703.000000,91703.000000,32.752235,-83.655481,1416887.000000,1.000000,4.000000,0.000000,"91703-both-roads-are-dirt-with-washouts-long-times-with-no-rain-causes-too-much-dust-and-rocks-tearing-up-vehicles-help","Open","Both roads are dirt with washouts. Long times with no rain causes too much dust and rocks tearing up vehicles. HELP!!!!!!!!!!!","09/01/2012 - 09:21pm","2012-09-01T21:21:53-04:00",0.000000,4.000000,0," "," "," "," "," "," "," "," "," "," "," "," "," "," ",0,0.000000," "," "," "," ",0.000000,0.000000,0,0," "," "," "," "
,"1540 Camp John Hope Road Fort Valley, GA","http://bit.ly/eXprLL","03/28/2011 - 08:57am",91288.000000,91288.000000,32.497237,-83.864787,1418808.000000,1.000000,3.000000,0.000000,"91288-road-is-in-terrible-shape","Open","road is in terrible shape","04/21/2011 - 10:02am","2011-04-21T10:02:21-04:00",0.000000,2.000000,0," "," "," "," "," "," "," "," "," "," "," "," "," "," ",0,0.000000," "," "," "," ",0.000000,0.000000,0,0," "," "," "," "
,"5422 St Elmo Ave Chattanooga, TN 37409, USA","http://bit.ly/dPGWFq","03/27/2011 - 03:49pm",91208.000000,91208.000000,34.988425,-85.330853,1419836.000000,1.000000,1.000000,0.000000,"91208-active-permit-but-no-active-work-this-house-is-dangerous","Open","active permit, but no active work. this house is dangerous","03/27/2011 - 03:49pm","2011-03-27T15:49:16-04:00",0.000000,0.000000,0," "," "," "," "," "," "," "," "," "," "," "," "," "," ",0,0.000000," "," "," "," ",0.000000,0.000000,0,0," "," "," "," "
,"Marion Rd MACON GA 31020, USA","http://bit.ly/gE0Ay1","03/26/2011 - 05:50pm",91075.000000,91075.000000,32.753498,-83.540039,1421155.000000,1.000000,1.000000,0.000000,"91075-twiggs-co-side-of-marion-rd","Open","twiggs co side of marion rd","03/26/2011 - 05:50pm","2011-03-26T17:50:31-04:00",0.000000,0.000000,0," "," "," "," "," "," "," "," "," "," "," "," "," "," ",0,0.000000," "," "," "," ",0.000000,0.000000,0,0," "," "," "," "
,"000marion Rd/Twiggs Co Macon, GA","http://bit.ly/eUpGbI","03/26/2011 - 05:47pm",91073.000000,91073.000000,32.763529,-83.551985,1421158.000000,1.000000,1.000000,0.000000,"91073-twiggs-co-side-of-marion-rd","Open","twiggs co side of marion rd","03/26/2011 - 05:47pm","2011-03-26T17:47:20-04:00",0.000000,0.000000,0," "," "," "," "," "," "," "," "," "," "," "," "," "," ",0,0.000000," "," "," "," ",0.000000,0.000000,0,0," "," "," "," "
,"Arkwright Road Macon, GA","http://bit.ly/gl44x4","03/26/2011 - 04:25pm",91062.000000,91062.000000,32.919488,-83.699945,1421240.000000,1.000000,1.000000,0.000000,"91062-road-needs-repaving","Open","Road Needs Repaving","03/26/2011 - 04:25pm","2011-03-26T16:25:31-04:00",0.000000,0.000000,0," "," "," "," "," "," "," "," "," "," "," "," "," "," ",0,0.000000," "," "," "," ",0.000000,0.000000,0,0," "," "," "," "
,"Emory Hgwy Macon, GA","http://bit.ly/dLNM6C","03/26/2011 - 04:22pm",91061.000000,91061.000000,32.847189,-83.597796,1421242.000000,1.000000,4.000000,0.000000,"91061-bump-in-road-been-there-four-months-are-more","Open","bump in road been there four months are more","03/29/2011 - 11:13am","2011-03-29T11:13:06-04:00",0.000000,3.000000,0," "," "," "," "," "," "," "," "," "," "," "," "," "," ",0,0.000000," "," "," "," ",0.000000,0.000000,0,0," "," "," "," "
,"Interstate 285 & Interstate 75 & U.S. 41 Northeast Cobb, GA 30339, USA","http://bit.ly/hg9mMD","03/23/2011 - 04:37pm",90222.000000,90222.000000,33.885509,-84.469497,1425548.000000,1.000000,1.000000,0.000000,"90222-mis-timed-lights-at-75-cobb-pkwy-spring-rd","Open","Mis-timed lights at 75/Cobb Pkwy/Spring Rd","03/23/2011 - 04:37pm","2011-03-23T16:37:32-04:00",0.000000,0.000000,0," "," "," "," "," "," "," "," "," "," "," "," "," "," ",0,0.000000," "," "," "," ",0.000000,0.000000,0,0," "," "," "," "
,"129 Midland Pines Road Guyton, GA","http://bit.ly/gbd56Y","03/18/2011 - 09:01am",89036.000000,89036.000000,32.261306,-81.366345,1433204.000000,1.000000,6.000000,0.000000,"89036-courthouse-rd-between-midland-17","Open","Courthouse Rd. between Midland & 17","05/12/2012 - 05:56pm","2012-05-12T17:56:05-04:00",0.000000,2.000000,0," "," "," "," "," "," "," "," "," "," "," "," "," "," ",0,0.000000," "," "," "," ",0.000000,0.000000,0,0," "," "," "," "
,"107 Charlotte Drive Savannah, GA","http://bit.ly/eWS22q","03/16/2011 - 10:35am",88658.000000,88658.000000,32.173462,-81.323144,1435990.000000,1.000000,1.000000,0.000000,"88658-not-enought-room-to-drive-through","Open","Not enought room to drive through","12/06/2012 - 11:17am","2012-12-06T11:17:23-05:00",0.000000,0.000000,0," "," "," "," "," "," "," "," "," "," "," "," "," "," ",0,0.000000," "," "," "," ",0.000000,0.000000,0,0," "," "," "," "
,"4135 Courthouse Rd Guyton, GA 31312, USA","http://bit.ly/hCUqJN","03/14/2011 - 02:27pm",88166.000000,88166.000000,32.254620,-81.367492,1438638.000000,1.000000,4.000000,0.000000,"88166-courthouse-between-midland-and-hwy-17","Open","courthouse between midland and hwy 17","01/08/2012 - 11:50am","2012-01-08T11:50:43-05:00",0.000000,3.000000,0," "," "," "," "," "," "," "," "," "," "," "," "," "," ",0,0.000000," "," "," "," ",0.000000,0.000000,0,0," "," "," "," "
,"30 Parish Way Savannah, GA 31419, USA","http://bit.ly/h9l8se","03/01/2011 - 03:15pm",84947.000000,84947.000000,32.056717,-81.256599,1457250.000000,1.000000,1.000000,0.000000,"84947-road-about-to-collapse","Open","Road about to collapse","03/01/2011 - 03:15pm","2011-03-01T15:15:52-05:00",0.000000,0.000000,0," "," "," "," "," "," "," "," "," "," "," "," "," "," ",0,0.000000," "," "," "," ",0.000000,0.000000,0,0," "," "," "," "
,"160 George Coggin Rd Newnan, GA 30265, USA","http://bit.ly/ieCNK3","02/26/2011 - 12:19pm",84227.000000,84227.000000,33.434834,-84.686223,1461746.000000,1.000000,1.000000,0.000000,"84227-no-lines-for-several-years","Open","no lines for several years","02/26/2011 - 12:19pm","2011-02-26T12:19:52-05:00",0.000000,0.000000,0," "," "," "," "," "," "," "," "," "," "," "," "," "," ",0,0.000000," "," "," "," ",0.000000,0.000000,0,0," "," "," "," "
,"1907 Chamberlain Ave Chattanooga, TN 37404, USA","http://bit.ly/i1negL","02/14/2011 - 09:54am",81668.000000,81668.000000,35.034274,-85.274885,1479171.000000,1.000000,3.000000,0.000000,"81668-derelict-house-needs-attention","Open","Derelict house needs attention!!","11/28/2011 - 10:40am","2011-11-28T10:40:57-05:00",0.000000,1.000000,0," "," "," "," "," "," "," "," "," "," "," "," "," "," ",0,0.000000," "," "," "," ",0.000000,0.000000,0,0," "," "," "," "
,"2801-2899 8th Ave Chattanooga, TN 37407, USA","http://bit.ly/hDfcjr","02/05/2011 - 10:33am",79997.000000,79997.000000,35.009822,-85.279226,1492092.000000,1.000000,2.000000,0.000000,"79997-potholes-road-hazards","Open","Potholes/road hazards","02/10/2011 - 11:49am","2011-02-10T11:49:05-05:00",0.000000,0.000000,0," "," "," "," "," "," "," "," "," "," "," "," "," "," ",0,0.000000," "," "," "," ",0.000000,0.000000,0,0," "," "," "," "
,"1207-1231 Vance Rd Chattanooga, TN 37421, USA","http://bit.ly/fVuETi","01/26/2011 - 01:10am",76609.000000,76609.000000,35.019993,-85.188782,1507055.000000,1.000000,3.000000,0.000000,"76609-potholes-road-hazards","Open","Potholes/road hazards","01/26/2011 - 02:45pm","2011-01-26T14:45:57-05:00",0.000000,1.000000,0," "," "," "," "," "," "," "," "," "," "," "," "," "," ",0,0.000000," "," "," "," ",0.000000,0.000000,0,0," "," "," "," "
,"236 Mclaughlin Ln Richmond Hill, GA 31324, USA","http://bit.ly/garOEf","01/25/2011 - 11:00am",76449.000000,76449.000000,31.854860,-81.272681,1507905.000000,1.000000,2.000000,0.000000,"76449-broken-curbing","Open","Broken curbing","02/09/2011 - 06:54pm","2011-02-09T18:54:17-05:00",0.000000,1.000000,0," "," "," "," "," "," "," "," "," "," "," "," "," "," ",0,0.000000," "," "," "," ",0.000000,0.000000,0,0," "," "," "," "
,"4451 Atlanta Rd Smyrna, GA 30080, USA","http://bit.ly/gSZ2NL","01/20/2011 - 06:12pm",75715.000000,75715.000000,33.845401,-84.490430,1514673.000000,1.000000,2.000000,0.000000,"75715-signal-takes-too-long","Open","signal takes too long","03/18/2011 - 08:08am","2011-03-18T08:08:09-04:00",0.000000,1.000000,0," "," "," "," "," "," "," "," "," "," "," "," "," "," ",0,0.000000," "," "," "," ",0.000000,0.000000,0,0," "," "," "," "
,"175 Windsong Dr Richmond Hill, GA 31324, USA","http://bit.ly/f8GQB3","01/19/2011 - 06:05pm",75237.000000,75237.000000,31.854923,-81.275911,1516120.000000,1.000000,1.000000,0.000000,"75237-windsong-dr-street-sign-missing","Open","Windsong Dr. street sign missing","01/19/2011 - 06:05pm","2011-01-19T18:05:27-05:00",0.000000,0.000000,0," "," "," "," "," "," "," "," "," "," "," "," "," "," ",0,0.000000," "," "," "," ",0.000000,0.000000,0,0," "," "," "," "
,"506 Mingarry Dr Richmond Hill, GA 31324, USA","http://bit.ly/e3NPtO","01/19/2011 - 06:02pm",75235.000000,75235.000000,31.849711,-81.263980,1516123.000000,1.000000,1.000000,0.000000,"75235-mingarry-dr-street-sign-missing","Open","Mingarry Dr street sign missing","01/19/2011 - 06:02pm","2011-01-19T18:02:48-05:00",0.000000,0.000000,0," "," "," "," "," "," "," "," "," "," "," "," "," "," ",0,0.000000," "," "," "," ",0.000000,0.000000,0,0," "," "," "," "
,"500-504 Browns Ferry Rd Chattanooga, TN 37419, USA","http://bit.ly/eL2bBo","01/19/2011 - 12:44pm",75017.000000,75017.000000,35.037586,-85.359113,1516441.000000,1.000000,2.000000,0.000000,"75017-potholes-road-hazards","Open","Potholes/road hazards","01/19/2011 - 12:50pm","2011-01-19T12:50:31-05:00",0.000000,0.000000,0," "," "," "," "," "," "," "," "," "," "," "," "," "," ",0,0.000000," "," "," "," ",0.000000,0.000000,0,0," "," "," "," "
,"8326 E Mountain Ln Chattanooga, TN 37421, USA","http://bit.ly/gKdtci","01/11/2011 - 01:28pm",72861.000000,72861.000000,34.987604,-85.145716,1527917.000000,1.000000,3.000000,0.000000,"72861-potholes-road-hazards","Open","Potholes/road hazards","01/11/2011 - 01:29pm","2011-01-11T13:29:10-05:00",0.000000,2.000000,0," "," "," "," "," "," "," "," "," "," "," "," "," "," ",0,0.000000," "," "," "," ",0.000000,0.000000,0,0," "," "," "," "
,"Interstate 24 Chattanooga, TN 37404, USA","http://bit.ly/gf568B","01/06/2011 - 07:21am",72047.000000,72047.000000,35.015622,-85.270342,1535484.000000,1.000000,4.000000,0.000000,"72047-potholes-road-hazards","Open","Potholes/road hazards","01/19/2011 - 12:45pm","2011-01-19T12:45:05-05:00",0.000000,3.000000,0," "," "," "," "," "," "," "," "," "," "," "," "," "," ",0,0.000000," "," "," "," ",0.000000,0.000000,0,0," "," "," "," "
,"Old River Rd chatham country, ga.","http://bit.ly/eoNgnk","01/05/2011 - 10:06am",71781.000000,71781.000000,32.093239,-81.376343,1536759.000000,1.000000,2.000000,0.000000,"71781-pot-hole-in-inbound-lane-big-as-trash-can-lid","Open","pot hole in inbound lane big as trash can lid","03/10/2011 - 10:06pm","2011-03-10T22:06:46-05:00",0.000000,1.000000,0," "," "," "," "," "," "," "," "," "," "," "," "," "," ",0,0.000000," "," "," "," ",0.000000,0.000000,0,0," "," "," "," "
,"2241-2299 Jenkins Rd Chattanooga, TN 37421, USA","http://bit.ly/efcngY","12/22/2010 - 05:26pm",69785.000000,69785.000000,35.034072,-85.133721,1556479.000000,1.000000,2.000000,0.000000,"69785-potholes-road-hazards","Open","Potholes/road hazards","12/29/2010 - 10:49am","2010-12-29T10:49:26-05:00",0.000000,0.000000,0," "," "," "," "," "," "," "," "," "," "," "," "," "," ",0,0.000000," "," "," "," ",0.000000,0.000000,0,0," "," "," "," "
,"Larry Mcdonald Memorial Hwy Fort Oglethorpe-Lakeview, GA 30736, USA","http://bit.ly/hvnOCw","12/01/2010 - 06:51am",67187.000000,67187.000000,34.985003,-85.201281,1587354.000000,1.000000,1.000000,0.000000,"67187-potholes-road-hazards","Open","Potholes/road hazards","02/10/2011 - 05:49am","2011-02-10T05:49:29-05:00",0.000000,0.000000,0," "," "," "," "," "," "," "," "," "," "," "," "," "," ",0,0.000000," "," "," "," ",0.000000,0.000000,0,0," "," "," "," "
,"3638 Weldon Drive","http://bit.ly/9m91B3","11/19/2010 - 04:21pm",66117.000000,66117.000000,34.999916,-85.255322,1604064.000000,1.000000,1.000000,0.000000,"66117-potholes-road-hazards","Open","Potholes/road hazards","11/19/2010 - 04:21pm","2010-11-19T16:21:58-05:00",0.000000,0.000000,0," "," "," "," "," "," "," "," "," "," "," "," "," "," ",0,0.000000," "," "," "," ",0.000000,0.000000,0,0," "," "," "," "
,"Northpoint Blvd.","http://bit.ly/bT8M6Y","11/17/2010 - 09:35am",65752.000000,65752.000000,35.033088,-85.297679,1607350.000000,1.000000,6.000000,0.000000,"65752-potholes-road-hazards","Open","Potholes/road hazards","12/31/2012 - 10:11am","2012-12-31T10:11:33-05:00",0.000000,2.000000,0," "," "," "," "," "," "," "," "," "," "," "," "," "," ",0,0.000000," "," "," "," ",0.000000,0.000000,0,0," "," "," "," "
,"8400-8622cresthill Ave Savannah, GA 31406, USA","http://bit.ly/aoB9GR","11/15/2010 - 08:51am",65437.000000,65437.000000,31.988477,-81.097190,1610274.000000,1.000000,3.000000,0.000000,"65437-speeding","Open","SPEEDING","04/16/2013 - 01:13pm","2013-04-16T13:13:15-04:00",0.000000,0.000000,0," "," "," "," "," "," "," "," "," "," "," "," "," "," ",0,0.000000," "," "," "," ",0.000000,0.000000,0,0," "," "," "," "
,"Gravel Springs Road Morgan Road Buford, Ga","http://bit.ly/ceO0R3","11/12/2010 - 06:33pm",65269.000000,65269.000000,34.059849,-83.955224,1614012.000000,1.000000,2.000000,0.000000,"65269-need-a-traffic-light-asap","Open","Need a traffic light asap","08/03/2011 - 05:46pm","2011-08-03T17:46:42-04:00",0.000000,1.000000,0," "," "," "," "," "," "," "," "," "," "," "," "," "," ",0,0.000000," "," "," "," ",0.000000,0.000000,0,0," "," "," "," "
,"6901 Peachtree Industrial Blvd Atlanta, GA 30360, USA","http://bit.ly/cr4H2I","11/06/2010 - 08:25pm",64358.000000,64358.000000,33.930708,-84.264960,1622600.000000,1.000000,3.000000,0.000000,"64358-inground-directional-lights","Open","inground directional lights","11/07/2010 - 11:34am","2010-11-07T11:34:06-05:00",0.000000,2.000000,0," "," "," "," "," "," "," "," "," "," "," "," "," "," ",0,0.000000," "," "," "," ",0.000000,0.000000,0,0," "," "," "," "
,"John Carter Rd","http://bit.ly/cnuBrL","11/01/2010 - 08:42pm",63622.000000,63622.000000,32.089882,-81.349382,1629783.000000,1.000000,2.000000,0.000000,"63622-pot-hole","Open","Pot hole","03/10/2011 - 10:07pm","2011-03-10T22:07:42-05:00",0.000000,1.000000,0," "," "," "," "," "," "," "," "," "," "," "," "," "," ",0,0.000000," "," "," "," ",0.000000,0.000000,0,0," "," "," "," "
,"2010 Bacon Park Drive","http://bit.ly/9Gal5E","11/01/2010 - 09:32am",63503.000000,63503.000000,31.995847,-81.061935,1630453.000000,1.000000,2.000000,0.000000,"63503-skidaway-road-from-52nd-street-to-bonna-bella-drive","Open","Skidaway Road from 52nd Street to Bonna Bella Drive","03/01/2011 - 02:41pm","2011-03-01T14:41:29-05:00",0.000000,2.000000,0," "," "," "," "," "," "," "," "," "," "," "," "," "," ",0,0.000000," "," "," "," ",0.000000,0.000000,0,0," "," "," "," "
,"La Roche Ave Skidway To City Limits","http://bit.ly/9xvtA7","11/01/2010 - 08:36am",63483.000000,63483.000000,32.136082,-81.061935,1630509.000000,1.000000,1.000000,0.000000,"63483-resurface-la-roche-ave","Open","Resurface La Roche Ave","11/03/2012 - 08:02am","2012-11-03T08:02:53-04:00",0.000000,0.000000,0," "," "," "," "," "," "," "," "," "," "," "," "," "," ",0,0.000000," "," "," "," ",0.000000,0.000000,0,0," "," "," "," "
,"1649 Crestline Drive Atlanta, GA","http://bit.ly/9pqt3J","10/23/2010 - 07:57pm",62414.000000,62414.000000,33.836716,-84.293709,1642788.000000,1.000000,1.000000,0.000000,"62414-mislocated-speed-detection-device-removed","Open","Mislocated Speed Detection Device REMOVED","12/26/2010 - 10:22pm","2010-12-26T22:22:56-05:00",2168.000000,0.000000,0," "," "," "," "," "," "," "," "," "," "," "," "," "," ",0,0.000000," "," "," "," ",0.000000,0.000000,0,0," "," "," "," "
,"8718 Oak View Drive Chattanooga, TN 37421, USA","http://bit.ly/bPPFzt","10/15/2010 - 12:21am",61282.000000,61282.000000,34.996754,-85.140416,1655484.000000,1.000000,4.000000,0.000000,"61282-potholes-road-hazards","Open","Potholes/road hazards","01/20/2011 - 02:13pm","2011-01-20T14:13:36-05:00",0.000000,2.000000,0," "," "," "," "," "," "," "," "," "," "," "," "," "," ",0,0.000000," "," "," "," ",0.000000,0.000000,0,0," "," "," "," "
,"St Elmo Avenue","http://bit.ly/d6uHPi","10/13/2010 - 01:16pm",61061.000000,61061.000000,34.995410,-85.329952,1657590.000000,1.000000,2.000000,0.000000,"61061-potholes-road-hazards","Open","Potholes/road hazards","10/13/2010 - 02:41pm","2010-10-13T14:41:09-04:00",0.000000,0.000000,0," "," "," "," "," "," "," "," "," "," "," "," "," "," ",0,0.000000," "," "," "," ",0.000000,0.000000,0,0," "," "," "," "
,"4100 Greenbriar Road","http://bit.ly/cVYdJb","10/12/2010 - 01:18pm",60913.000000,60913.000000,34.989995,-85.242276,1659027.000000,1.000000,1.000000,0.000000,"60913-potholes-road-hazards","Open","Potholes/road hazards","10/12/2010 - 01:18pm","2010-10-12T13:18:09-04:00",0.000000,0.000000,0," "," "," "," "," "," "," "," "," "," "," "," "," "," ",0,0.000000," "," "," "," ",0.000000,0.000000,0,0," "," "," "," "
,"Rossville Blvd","http://bit.ly/cfn7Ga","10/07/2010 - 01:50pm",60401.000000,60401.000000,35.001307,-85.292087,1666195.000000,1.000000,2.000000,0.000000,"60401-potholes-road-hazards","Open","Potholes/road hazards","10/07/2010 - 03:23pm","2010-10-07T15:23:59-04:00",0.000000,0.000000,0," "," "," "," "," "," "," "," "," "," "," "," "," "," ",0,0.000000," "," "," "," ",0.000000,0.000000,0,0," "," "," "," "
,"On Chamblee-Tucker just east of exit ramp.","http://bit.ly/94gpOo","10/05/2010 - 12:05pm",60043.000000,60043.000000,33.877862,-84.271574,1669180.000000,1.000000,2.000000,0.000000,"60043-pedestrian-bike-car-hazard","Open","Pedestrian/bike/car Hazard","06/20/2013 - 12:04am","2013-06-20T00:04:46-04:00",6354.000000,1.000000,0," "," "," "," "," "," "," "," "," "," "," "," "," "," ",0,0.000000," "," "," "," ",0.000000,0.000000,0,0," "," "," "," "
,"Corner Of Dresden And Chamblee-Tucker","http://bit.ly/9OojCG","10/05/2010 - 11:57am",60037.000000,60037.000000,33.879537,-84.274191,1669188.000000,1.000000,4.000000,0.000000,"60037-ped-bike-auto-hazardous-intersection","Open","Ped/bike/auto hazardous intersection","06/20/2013 - 12:04am","2013-06-20T00:04:52-04:00",6354.000000,2.000000,0," "," "," "," "," "," "," "," "," "," "," "," "," "," ",0,0.000000," "," "," "," ",0.000000,0.000000,0,0," "," "," "," "
,"Whitehall Ct Marietta, GA 30066, USA","http://bit.ly/aYfIRw","10/01/2010 - 12:46pm",59504.000000,59504.000000,34.003604,-84.501653,1674899.000000,1.000000,1.000000,0.000000,"59504-street-light-illumination-blocked-by-tree-branches","Open","Street light illumination blocked by tree branches","10/01/2010 - 12:46pm","2010-10-01T12:46:23-04:00",5753.000000,0.000000,0," "," "," "," "," "," "," "," "," "," "," "," "," "," ",0,0.000000," "," "," "," ",0.000000,0.000000,0,0," "," "," "," "
,"5385 Coldstream Way powder springs, GA","http://bit.ly/cMuYwn","09/24/2010 - 04:04pm",58552.000000,58552.000000,33.919603,-84.709691,1684781.000000,1.000000,1.000000,0.000000,"58552-checking-for-issues","Open","checking for issues","09/24/2010 - 04:04pm","2010-09-24T16:04:41-04:00",0.000000,0.000000,0," "," "," "," "," "," "," "," "," "," "," "," "," "," ",0,0.000000," "," "," "," ",0.000000,0.000000,0,0," "," "," "," "
,"75 North An  24   West","http://bit.ly/cRTm3D","09/14/2010 - 12:56am",56662.000000,56662.000000,35.000753,-85.211162,1700089.000000,1.000000,1.000000,0.000000,"56662-potholes-road-hazards","Open","Potholes/road hazards","09/14/2010 - 12:56am","2010-09-14T00:56:08-04:00",0.000000,0.000000,0," "," "," "," "," "," "," "," "," "," "," "," "," "," ",0,0.000000," "," "," "," ",0.000000,0.000000,0,0," "," "," "," "
,"6020 Ogeechee Road","http://bit.ly/chCyiQ","09/13/2010 - 07:39pm",56642.000000,56642.000000,32.012151,-81.227416,1700406.000000,1.000000,2.000000,0.000000,"56642-school-flashing-school-speed-limit-sign","Open","School flashing school speed limit sign","10/26/2010 - 07:40am","2010-10-26T07:40:07-04:00",0.000000,1.000000,0," "," "," "," "," "," "," "," "," "," "," "," "," "," ",0,0.000000," "," "," "," ",0.000000,0.000000,0,0," "," "," "," "
,"East Ridge Elementary John Ross Rd, East Ridge, Tennessee","http://bit.ly/dgVtGw","08/29/2010 - 06:51pm",54123.000000,54123.000000,34.996463,-85.250511,1722055.000000,1.000000,2.000000,0.000000,"54123-sprinklers-on-all-day","Open","Sprinklers on all day","08/29/2010 - 06:51pm","2010-08-29T18:51:50-04:00",0.000000,0.000000,0," "," "," "," "," "," "," "," "," "," "," "," "," "," ",0,0.000000," "," "," "," ",0.000000,0.000000,0,0," "," "," "," "
,"908 Givens Rd Chattanooga, TN 37421, USA","http://bit.ly/dzcwF0","08/20/2010 - 10:14am",52602.000000,52602.000000,34.995405,-85.145212,1735531.000000,1.000000,3.000000,0.000000,"52602-potholes-road-hazards","Open","Potholes/road hazards","01/20/2011 - 02:13pm","2011-01-20T14:13:18-05:00",0.000000,1.000000,0," "," "," "," "," "," "," "," "," "," "," "," "," "," ",0,0.000000," "," "," "," ",0.000000,0.000000,0,0," "," "," "," "
,"5610 St Elmo Ave Chattanooga, TN 37409, USA","http://bit.ly/bFxU4M","08/18/2010 - 04:35pm",52321.000000,52321.000000,34.985846,-85.331840,1738030.000000,1.000000,1.000000,0.000000,"52321-potholes-road-hazards","Open","Potholes/road hazards","08/18/2010 - 04:35pm","2010-08-18T16:35:21-04:00",0.000000,0.000000,0," "," "," "," "," "," "," "," "," "," "," "," "," "," ",0,0.000000," "," "," "," ",0.000000,0.000000,0,0," "," "," "," "
,"1-27 S Germantown Rd Chattanooga, TN 37411, USA","http://bit.ly/dlupz7","08/15/2010 - 08:36pm",51572.000000,51572.000000,35.023846,-85.246760,1742109.000000,1.000000,1.000000,0.000000,"51572-potholes-road-hazards","Open","Potholes/road hazards","12/20/2010 - 11:07pm","2010-12-20T23:07:42-05:00",0.000000,0.000000,0," "," "," "," "," "," "," "," "," "," "," "," "," "," ",0,0.000000," "," "," "," ",0.000000,0.000000,0,0," "," "," "," "
,"519  Sylvester Drive","http://bit.ly/cOPLm8","08/09/2010 - 12:40pm",50602.000000,50602.000000,31.198533,-83.790827,1751226.000000,1.000000,1.000000,0.000000,"50602-park-ave","Open","Park Ave","08/09/2010 - 12:40pm","2010-08-09T12:40:05-04:00",0.000000,0.000000,0," "," "," "," "," "," "," "," "," "," "," "," "," "," ",0,0.000000," "," "," "," ",0.000000,0.000000,0,0," "," "," "," "
,"101 129 W F Smith St Flovilla, GA 30216, USA","http://bit.ly/cHuwqG","08/09/2010 - 11:39am",50578.000000,50578.000000,33.263401,-83.906611,1751286.000000,1.000000,1.000000,0.000000,"50578-pothole","Open","Pothole","08/09/2010 - 11:39am","2010-08-09T11:39:30-04:00",0.000000,0.000000,0," "," "," "," "," "," "," "," "," "," "," "," "," "," ",0,0.000000," "," "," "," ",0.000000,0.000000,0,0," "," "," "," "
,"Riley Rd Flovilla, GA 30216, USA","http://bit.ly/bAIru0","08/09/2010 - 11:32am",50574.000000,50574.000000,33.276737,-83.896729,1751293.000000,1.000000,1.000000,0.000000,"50574-potholes","Open","Potholes","08/09/2010 - 11:32am","2010-08-09T11:32:21-04:00",0.000000,0.000000,0," "," "," "," "," "," "," "," "," "," "," "," "," "," ",0,0.000000," "," "," "," ",0.000000,0.000000,0,0," "," "," "," "
,"Clanton Rd Evans, GA 30809, USA","http://bit.ly/94ahK0","08/07/2010 - 09:34am",50344.000000,50344.000000,33.549403,-82.214527,1754291.000000,1.000000,1.000000,0.000000,"50344-box-spring","Open","Box Spring","08/07/2010 - 09:34am","2010-08-07T09:34:32-04:00",0.000000,0.000000,0," "," "," "," "," "," "," "," "," "," "," "," "," "," ",0,0.000000," "," "," "," ",0.000000,0.000000,0,0," "," "," "," "
,"1434-1528 Powder Springs Rd Sw Marietta, GA 30008, USA","http://bit.ly/djQy6S","08/04/2010 - 08:13am",49746.000000,49746.000000,33.910977,-84.596969,1758693.000000,1.000000,1.000000,0.000000,"49746-no-left-turn-signal-at-powder-springs-and-callaway-intersection-coming-from-austell-road-no-one-can-turn-until-after-the-light-is-red-very-dangerous-and-traffic-is-backed-up-majorly-school-starts-tomorrow-and-it-s-only-going-to-get-worse","Open","no left turn signal at powder springs and callaway intersection coming from austell road. No one can turn until AFTER the light is red. VERY dangerous and traffic is backed up majorly. school starts tomorrow and it's only going to get worse!","08/04/2011 - 04:59pm","2011-08-04T16:59:18-04:00",0.000000,1.000000,0," "," "," "," "," "," "," "," "," "," "," "," "," "," ",0,0.000000," "," "," "," ",0.000000,0.000000,0,0," "," "," "," "
,"2506 Nugget Dr Conyers, GA 30094, USA","http://bit.ly/aewzV3","08/01/2010 - 12:14pm",49237.000000,49237.000000,33.624312,-84.043227,1762771.000000,1.000000,5.000000,0.000000,"49237-nugget-drive-needs-repaving","Open","nugget drive needs repaving","08/02/2010 - 10:37am","2010-08-02T10:37:43-04:00",0.000000,2.000000,0," "," "," "," "," "," "," "," "," "," "," "," "," "," ",0,0.000000," "," "," "," ",0.000000,0.000000,0,0," "," "," "," "
,"Nugget Drive conyers, ga 30094","http://bit.ly/bo5PFi","08/01/2010 - 11:44am",49227.000000,49227.000000,33.623913,-84.045284,1762802.000000,1.000000,9.000000,0.000000,"49227-this-whole-road-needs-tending-to","Open","this whole road needs tending to...","04/12/2011 - 10:23am","2011-04-12T10:23:49-04:00",0.000000,7.000000,0," "," "," "," "," "," "," "," "," "," "," "," "," "," ",0,0.000000," "," "," "," ",0.000000,0.000000,0,0," "," "," "," "
,"Gallatin Tn","http://bit.ly/9wTDkG","07/22/2010 - 05:55am",47505.000000,47505.000000,32.157435,-82.907123,1777550.000000,1.000000,1.000000,0.000000,"47505-right-turn-lane-on-109-n-onto-old-109-north","Open","Right Turn Lane on 109 N onto old 109 North","07/22/2010 - 05:55am","2010-07-22T05:55:46-04:00",0.000000,0.000000,0," "," "," "," "," "," "," "," "," "," "," "," "," "," ",0,0.000000," "," "," "," ",0.000000,0.000000,0,0," "," "," "," "
,"20 Brent Dr Ringgold, GA 30736, USA","http://bit.ly/cW2JUb","07/08/2010 - 09:59am",45431.000000,45431.000000,34.954504,-85.194618,1797466.000000,1.000000,1.000000,0.000000,"45431-potholes-road-hazards","Open","Potholes/road hazards","07/08/2010 - 09:59am","2010-07-08T09:59:57-04:00",0.000000,0.000000,0," "," "," "," "," "," "," "," "," "," "," "," "," "," ",0,0.000000," "," "," "," ",0.000000,0.000000,0,0," "," "," "," "
,"401 415 W Main St Chattanooga, TN 37402, USA","http://bit.ly/bnuRpd","06/25/2010 - 01:58pm",43558.000000,43558.000000,35.037700,-85.311434,1815950.000000,1.000000,3.000000,0.000000,"43558-confusing-turn-lane","Open","Confusing turn lane","01/28/2011 - 03:31pm","2011-01-28T15:31:43-05:00",0.000000,1.000000,0," "," "," "," "," "," "," "," "," "," "," "," "," "," ",0,0.000000," "," "," "," ",0.000000,0.000000,0,0," "," "," "," "
,"3541 Thunderwood Ln Snellville, GA 30039, USA","http://bit.ly/aJs68z","06/22/2010 - 06:08pm",43155.000000,43155.000000,33.786762,-84.018013,1820020.000000,1.000000,1.000000,0.000000,"43155-abandoned-house-in-neighborhood-debris-in-backyard-and-fallen-tree-in-front-yard","Open","Abandoned house in neighborhood; debris in backyard and fallen tree in front yard","06/22/2010 - 06:08pm","2010-06-22T18:08:43-04:00",0.000000,0.000000,0," "," "," "," "," "," "," "," "," "," "," "," "," "," ",0,0.000000," "," "," "," ",0.000000,0.000000,0,0," "," "," "," "
,"Prigle","http://bit.ly/bXUX5V","06/17/2010 - 07:44am",42382.000000,42382.000000,30.945593,-82.722989,1827845.000000,1.000000,1.000000,0.000000,"42382-water-street","Open","water street","06/17/2010 - 07:44am","2010-06-17T07:44:17-04:00",0.000000,0.000000,0," "," "," "," "," "," "," "," "," "," "," "," "," "," ",0,0.000000," "," "," "," ",0.000000,0.000000,0,0," "," "," "," "
,"Tom Miller Road bethlehem, GA","http://bit.ly/InJe85","04/11/2012 - 06:55pm",173465.000000,173465.000000,33.989938,-83.738277,871008.000000,1.000000,1.000000,0.000000,"173465-holes-and-a-very-bumpy-road-needs-repavement","Open","holes and a very bumpy road needs repavement.","04/11/2012 - 06:55pm","2012-04-11T18:55:54-04:00",0.000000,0.000000,4,"13","83420"," ","1383420","Winder","Winder city","25","C1","Y","N","N","G4110","M","A",0,0.000000," "," "," "," ",0.000000,0.000000,0,0," "," "," "," "
,"1528 Atlanta Hwy. Nw Auburn, GA","http://bit.ly/w8AZvf","01/10/2012 - 03:28pm",149828.000000,149828.000000,34.009666,-83.852710,1003636.000000,1.000000,1.000000,0.000000,"149828-a-red-light-needs-added","Open","A red light needs added","01/10/2012 - 03:28pm","2012-01-10T15:28:47-05:00",0.000000,0.000000,8,"13","04140"," ","1304140","Auburn","Auburn city","25","C1","N","N","N","G4110","M","A",0,0.000000," "," "," "," ",0.000000,0.000000,0,0," "," "," "," "
,"Middle St","http://bit.ly/9EYMck","07/01/2010 - 06:30pm",44597.000000,44597.000000,31.884712,-85.100783,1807039.000000,1.000000,1.000000,0.000000,"44597-grass-at-atena","Open","Grass at atena","07/01/2010 - 06:30pm","2010-07-01T18:30:22-04:00",0.000000,0.000000,9,"13","32524"," ","1332524","Georgetown","Georgetown city","25","C1","N","N","N","G4110","M","A",0,0.000000," "," "," "," ",0.000000,0.000000,0,0," "," "," "," "
,"Middle Street","http://bit.ly/95pAtI","06/17/2010 - 11:22am",42443.000000,42443.000000,31.884712,-85.100783,1827627.000000,1.000000,1.000000,0.000000,"42443-lack-of-vehicle-noise-regulation-enforcement","Open","Lack of vehicle noise regulation enforcement","06/17/2010 - 11:22am","2010-06-17T11:22:00-04:00",0.000000,0.000000,9,"13","32524"," ","1332524","Georgetown","Georgetown city","25","C1","N","N","N","G4110","M","A",0,0.000000," "," "," "," ",0.000000,0.000000,0,0," "," "," "," "
,"186-298 Ridley Ave La Grange, GA 30240, USA","http://bit.ly/fryREL","02/23/2011 - 11:38am",83548.000000,83548.000000,33.041107,-85.030869,1466107.000000,1.000000,2.000000,711.000000,"83548-street-sign","Acknowledged","Street Sign","02/23/2011 - 11:41am","2011-02-23T11:41:14-05:00",0.000000,0.000000,35,"13","44340"," ","1344340","LaGrange","LaGrange city","25","C1","Y","Y","N","G4110","M","A",0,0.000000," "," "," "," ",0.000000,0.000000,0,0," "," "," "," "
,"200 Ridley Ave LaGrange, GA","http://bit.ly/eevwF6","02/22/2011 - 02:33pm",83347.000000,83347.000000,33.040987,-85.031087,1467372.000000,1.000000,1.000000,0.000000,"83347-lots-of-people-working","Open","Lots of People Working","02/22/2011 - 02:33pm","2011-02-22T14:33:23-05:00",9228.000000,0.000000,35,"13","44340"," ","1344340","LaGrange","LaGrange city","25","C1","Y","Y","N","G4110","M","A",0,0.000000," "," "," "," ",0.000000,0.000000,0,0," "," "," "," "
,"70 S Cedar Ln Fort Oglethorpe, GA 30742, USA","http://bit.ly/jxo4Ex","06/20/2011 - 04:26pm",108219.000000,108219.000000,34.957003,-85.237787,1297398.000000,1.000000,1.000000,0.000000,"108219-bummy-as-you-trun-left-hate-it","Open","bummy as you trun left hate it..","06/20/2011 - 04:26pm","2011-06-20T16:26:50-04:00",0.000000,0.000000,37,"13","30956"," ","1330956","Fort Oglethorpe","Fort Oglethorpe city","25","C1","N","N","N","G4110","M","A",0,0.000000," "," "," "," ",0.000000,0.000000,0,0," "," "," "," "
,"Cedar Tree Lane/Bluegrass Circle","http://bit.ly/brbF75","10/10/2010 - 05:35pm",60664.000000,60664.000000,34.976001,-85.225582,1661650.000000,1.000000,1.000000,0.000000,"60664-potholes-road-hazards","Open","Potholes/road hazards","10/10/2010 - 05:35pm","2010-10-10T17:35:22-04:00",0.000000,0.000000,37,"13","30956"," ","1330956","Fort Oglethorpe","Fort Oglethorpe city","25","C1","N","N","N","G4110","M","A",0,0.000000," "," "," "," ",0.000000,0.000000,0,0," "," "," "," "
,"Waycross Georgia 31501","http://bit.ly/hPM4zP","03/27/2011 - 02:54pm",91201.000000,91201.000000,31.204958,-82.332046,1419891.000000,1.000000,1.000000,0.000000,"91201-pothole-need-fixing","Open","pothole need fixing","03/27/2011 - 02:54pm","2011-03-27T14:54:09-04:00",0.000000,0.000000,43,"13","80956"," ","1380956","Waycross","Waycross city","25","C1","Y","Y","N","G4110","M","A",0,0.000000," "," "," "," ",0.000000,0.000000,0,0," "," "," "," "
,"200 Burnett Ferry Rd  rome, GA","http://bit.ly/Q3gYFr","09/04/2012 - 05:49pm",228592.000000,228592.000000,34.264777,-85.222008,660834.000000,1.000000,2.000000,0.000000,"228592-potholes","Open","potholes","03/06/2013 - 05:19am","2013-03-06T05:19:38-05:00",0.000000,0.000000,45,"13","66668"," ","1366668","Rome","Rome city","25","C1","Y","Y","N","G4110","M","A",0,0.000000," "," "," "," ",0.000000,0.000000,0,0," "," "," "," "
,"562 Gil Harbin Industrial Blvd Valdosta, GA 31601, USA","http://bit.ly/VQTA1c","11/06/2012 - 12:28pm",272686.000000,272686.000000,30.806423,-83.269828,570371.000000,1.000000,1.000000,0.000000,"272686-public-works-parking-lot","Open","Public Works parking lot","11/06/2012 - 12:28pm","2012-11-06T12:28:05-05:00",81646.000000,0.000000,46,"13","78800"," ","1378800","Valdosta","Valdosta city","25","C1","Y","Y","N","G4110","M","A",0,0.000000," "," "," "," ",0.000000,0.000000,0,0," "," "," "," "
,"400 Baytree St. Valdosta, GA","http://bit.ly/5ZUpgu","01/04/2010 - 11:35pm",11689.000000,11689.000000,30.847200,-83.294100,2062994.000000,1.000000,2.000000,0.000000,"11689-cant-keep-the-lion-white","Open","cant keep the lion white...","03/30/2010 - 10:28am","2010-03-30T10:28:27-04:00",0.000000,0.000000,46,"13","78800"," ","1378800","Valdosta","Valdosta city","25","C1","Y","Y","N","G4110","M","A",0,0.000000," "," "," "," ",0.000000,0.000000,0,0," "," "," "," "
,"East Washington Street Madison, GA","http://bit.ly/RmjPKV","10/30/2012 - 09:25am",262523.000000,262523.000000,33.589101,-83.462111,580693.000000,1.000000,1.000000,0.000000,"262523-potholes","Open","Potholes","10/30/2012 - 09:25am","2012-10-30T09:25:25-04:00",0.000000,0.000000,48,"13","49196"," ","1349196","Madison","Madison city","25","C1","Y","N","N","G4110","M","A",0,0.000000," "," "," "," ",0.000000,0.000000,0,0," "," "," "," "
,"East Washington Street Madison, GA","http://bit.ly/RmjOqo","10/30/2012 - 09:25am",262522.000000,262522.000000,33.589101,-83.462111,580693.000000,1.000000,1.000000,0.000000,"262522-potholes","Open","Potholes","10/30/2012 - 09:25am","2012-10-30T09:25:17-04:00",0.000000,0.000000,48,"13","49196"," ","1349196","Madison","Madison city","25","C1","Y","N","N","G4110","M","A",0,0.000000," "," "," "," ",0.000000,0.000000,0,0," "," "," "," "
,"Eatonton Rd.   441 Hwy. madison, GA  30650","http://bit.ly/nmt02D","10/19/2011 - 05:51pm",133948.000000,133948.000000,33.558562,-83.476181,1123074.000000,1.000000,1.000000,0.000000,"133948-bad-road-turn-lane","Open","bad road turn lane","10/19/2011 - 05:51pm","2011-10-19T17:51:07-04:00",0.000000,0.000000,48,"13","49196"," ","1349196","Madison","Madison city","25","C1","Y","N","N","G4110","M","A",0,0.000000," "," "," "," ",0.000000,0.000000,0,0," "," "," "," "
,"Wagon Trail Loganville, GA","http://bit.ly/GYbQjP","03/28/2012 - 11:54pm",169674.000000,169674.000000,33.742612,-83.861293,890870.000000,1.000000,2.000000,0.000000,"169674-speed-bumps","Open","speed bumps","03/28/2012 - 11:54pm","2012-03-28T23:54:50-04:00",0.000000,1.000000,58,"13","80228"," ","1380228","Walnut Grove","Walnut Grove city","25","C1","Y","N","N","G4110","M","A",0,0.000000," "," "," "," ",0.000000,0.000000,0,0," "," "," "," "
,"Cedar Street  Carrollton, GA","http://bit.ly/GTXnIN","03/27/2012 - 04:32pm",169264.000000,169264.000000,33.583283,-85.056901,892752.000000,1.000000,2.000000,0.000000,"169264-bad-rd","Open","Bad Rd","08/20/2013 - 08:26am","2013-08-20T08:26:28-04:00",0.000000,0.000000,68,"13","13492"," ","1313492","Carrollton","Carrollton city","25","C1","Y","N","N","G4110","M","A",0,0.000000," "," "," "," ",0.000000,0.000000,0,0," "," "," "," "
,"305-397 Racetrack Road McDonough, GA 30252, USA","http://bit.ly/1d0Vgik","12/06/2013 - 10:08am",846042.000000,846042.000000,33.430866,-84.134361,1708.000000,1.000000,1.000000,4017.000000,"846042-dumping-and-littering","Open","DUMPING AND LITTERING","12/06/2013 - 10:08am","2013-12-06T10:08:58-05:00",342827.000000,0.000000,76,"13","48624"," ","1348624","McDonough","McDonough city","25","C1","N","N","N","G4110","M","A",0,0.000000," "," "," "," ",0.000000,0.000000,0,0," "," "," "," "
,"150 Lakemont Drive McDonough, GA 30252, USA","http://bit.ly/1cd79ju","12/05/2013 - 12:14pm",844490.000000,844490.000000,33.444911,-84.129676,3022.000000,1.000000,2.000000,4071.000000,"844490-pothole-sidewalk-or-curbing-problem","Acknowledged","Pothole, sidewalk or curbing problem","12/05/2013 - 02:16pm","2013-12-05T14:16:57-05:00",340432.000000,0.000000,76,"13","48624"," ","1348624","McDonough","McDonough city","25","C1","N","N","N","G4110","M","A",0,0.000000," "," "," "," ",0.000000,0.000000,0,0," "," "," "," "
,"Chase Court Mcdonough","http://bit.ly/18AMGd4","12/03/2013 - 01:44pm",841290.000000,841290.000000,33.464122,-84.155931,5813.000000,1.000000,2.000000,4031.000000,"841290-sign-code-violation","Closed","Sign Code Violation","12/05/2013 - 01:48pm","2013-12-05T13:48:01-05:00",0.000000,0.000000,76,"13","48624"," ","1348624","McDonough","McDonough city","25","C1","N","N","N","G4110","M","A",0,0.000000," "," "," "," ",0.000000,0.000000,0,0," "," "," "," "
,"Chase Court McDonough, GA 30253, USA","http://bit.ly/18AMdrv","12/03/2013 - 01:39pm",841281.000000,841281.000000,33.464994,-84.154184,5818.000000,1.000000,2.000000,4031.000000,"841281-sign-code-violation","Closed","Sign Code Violation","12/05/2013 - 01:47pm","2013-12-05T13:47:07-05:00",0.000000,0.000000,76,"13","48624"," ","1348624","McDonough","McDonough city","25","C1","N","N","N","G4110","M","A",0,0.000000," "," "," "," ",0.000000,0.000000,0,0," "," "," "," "
,"10-58 Georgia 155 North McDonough, GA 30253, USA","http://bit.ly/1dLw8RD","12/02/2013 - 11:58am",839968.000000,839968.000000,33.447776,-84.141670,7359.000000,1.000000,3.000000,4041.000000,"839968-street-signs","Closed","Street Signs","12/05/2013 - 02:44pm","2013-12-05T14:44:35-05:00",340436.000000,0.000000,76,"13","48624"," ","1348624","McDonough","McDonough city","25","C1","N","N","N","G4110","M","A",0,0.000000," "," "," "," ",0.000000,0.000000,0,0," "," "," "," "
,"Sloan Street Mcdonough","http://bit.ly/1eA0ymN","11/27/2013 - 09:17am",835630.000000,835630.000000,33.446205,-84.146386,14719.000000,1.000000,2.000000,4028.000000,"835630-property-maintenance","Closed","Property Maintenance","12/05/2013 - 01:49pm","2013-12-05T13:49:17-05:00",355142.000000,0.000000,76,"13","48624"," ","1348624","McDonough","McDonough city","25","C1","N","N","N","G4110","M","A",0,0.000000," "," "," "," ",0.000000,0.000000,0,0," "," "," "," "
,"60 Jonesboro  McDonough, GA","http://bit.ly/1dpwjls","11/22/2013 - 06:13pm",831771.000000,831771.000000,33.447376,-84.149309,21384.000000,1.000000,2.000000,4017.000000,"831771-barco-lounger","Closed","Barco Lounger","12/05/2013 - 01:50pm","2013-12-05T13:50:15-05:00",341131.000000,0.000000,76,"13","48624"," ","1348624","McDonough","McDonough city","25","C1","N","N","N","G4110","M","A",0,0.000000," "," "," "," ",0.000000,0.000000,0,0," "," "," "," "
,"44 Carmichael St McDonough, Ga","http://bit.ly/18T61R1","11/21/2013 - 11:35am",830575.000000,830575.000000,33.450746,-84.148715,23221.000000,1.000000,6.000000,4029.000000,"830575-need-speed-bumps","Closed","Need speed bumps","12/02/2013 - 05:03pm","2013-12-02T17:03:06-05:00",0.000000,4.000000,76,"13","48624"," ","1348624","McDonough","McDonough city","25","C1","N","N","N","G4110","M","A",0,0.000000," "," "," "," ",0.000000,0.000000,0,0," "," "," "," "
,"61 Woodruff St.  McDonough/ Henry, Georgia","http://bit.ly/1bau6Xk","11/07/2013 - 02:33pm",814390.000000,814390.000000,33.452621,-84.149923,43203.000000,1.000000,2.000000,4071.000000,"814390-curbing","Open","Curbing","11/08/2013 - 09:43am","2013-11-08T09:43:51-05:00",0.000000,1.000000,76,"13","48624"," ","1348624","McDonough","McDonough city","25","C1","N","N","N","G4110","M","A",0,0.000000," "," "," "," ",0.000000,0.000000,0,0," "," "," "," "
,"Mcdonough GA, USA","http://bit.ly/XR3Y9H","10/28/2013 - 01:27pm",802248.000000,802248.000000,33.451558,-84.142877,57729.000000,1.000000,4.000000,4071.000000,"802248-pothole-sidewalk-or-curbing-problem","Acknowledged","Pothole, sidewalk or curbing problem","11/21/2013 - 01:10pm","2013-11-21T13:10:30-05:00",339997.000000,2.000000,76,"13","48624"," ","1348624","McDonough","McDonough city","25","C1","N","N","N","G4110","M","A",0,0.000000," "," "," "," ",0.000000,0.000000,0,0," "," "," "," "
,"116 June Court Hampton, GA","http://bit.ly/wFPZxb","01/20/2012 - 09:27am",151890.000000,151890.000000,33.394431,-84.294377,989597.000000,1.000000,1.000000,0.000000,"151890-dangerous-street","Open","Dangerous street","01/20/2012 - 09:27am","2012-01-20T09:27:26-05:00",0.000000,0.000000,77,"13","36276"," ","1336276","Hampton","Hampton city","25","C1","N","N","N","G4110","M","A",0,0.000000," "," "," "," ",0.000000,0.000000,0,0," "," "," "," "
,"608 Lockwood Court Stockbridge, Georgia","http://bit.ly/J00KkU","12/07/2013 - 01:34pm",846863.000000,846863.000000,33.536916,-84.265459,63.000000,1.000000,1.000000,3963.000000,"846863-no-street-light","Open","No street light","12/07/2013 - 01:34pm","2013-12-07T13:34:22-05:00",0.000000,0.000000,78,"13","73704"," ","1373704","Stockbridge","Stockbridge city","25","C1","N","N","N","G4110","M","A",0,0.000000," "," "," "," ",0.000000,0.000000,0,0," "," "," "," "
,"1052-1118 Hudson Bridge Road Stockbridge, GA 30281, USA","http://bit.ly/1f6qOpg","12/07/2013 - 10:11am",846743.000000,846743.000000,33.504405,-84.236282,265.000000,1.000000,1.000000,3958.000000,"846743-sign-violation","Open","Sign Violation","12/07/2013 - 10:11am","2013-12-07T10:11:26-05:00",135598.000000,0.000000,78,"13","73704"," ","1373704","Stockbridge","Stockbridge city","25","C1","N","N","N","G4110","M","A",0,0.000000," "," "," "," ",0.000000,0.000000,0,0," "," "," "," "
,"1090 Eagles Landing Parkway Stockbridge, GA 30281, USA","http://bit.ly/1f6oVJ4","12/07/2013 - 10:02am",846741.000000,846741.000000,33.510189,-84.224624,275.000000,1.000000,1.000000,3958.000000,"846741-sign-violation","Open","Sign Violation","12/07/2013 - 10:02am","2013-12-07T10:02:25-05:00",135598.000000,0.000000,78,"13","73704"," ","1373704","Stockbridge","Stockbridge city","25","C1","N","N","N","G4110","M","A",0,0.000000," "," "," "," ",0.000000,0.000000,0,0," "," "," "," "
,"520 Country Club Drive Stockbridge, GA 30281, USA","http://bit.ly/1f6n9b0","12/07/2013 - 09:49am",846733.000000,846733.000000,33.517456,-84.218910,288.000000,1.000000,2.000000,3963.000000,"846733-traffic-signals-street-lights-signs","Open","Traffic Signals, Street Lights & Signs","12/07/2013 - 11:21am","2013-12-07T11:21:46-05:00",135598.000000,1.000000,78,"13","73704"," ","1373704","Stockbridge","Stockbridge city","25","C1","N","N","N","G4110","M","A",0,0.000000," "," "," "," ",0.000000,0.000000,0,0," "," "," "," "
,"1275 Eagles Landing Parkway Stockbridge, GA 30281, USA","http://bit.ly/13CU4QM","12/07/2013 - 09:05am",846717.000000,846717.000000,33.506439,-84.228507,331.000000,1.000000,1.000000,3958.000000,"846717-sign-violation","Open","Sign Violation","12/07/2013 - 09:05am","2013-12-07T09:05:48-05:00",135598.000000,0.000000,78,"13","73704"," ","1373704","Stockbridge","Stockbridge city","25","C1","N","N","N","G4110","M","A",0,0.000000," "," "," "," ",0.000000,0.000000,0,0," "," "," "," "
,"1275 Eagles Landing Parkway Stockbridge, GA 30281, USA","http://bit.ly/13CU2II","12/07/2013 - 09:05am",846716.000000,846716.000000,33.506729,-84.228294,332.000000,1.000000,1.000000,3958.000000,"846716-sign-violation","Open","Sign Violation","12/07/2013 - 09:05am","2013-12-07T09:05:12-05:00",135598.000000,0.000000,78,"13","73704"," ","1373704","Stockbridge","Stockbridge city","25","C1","N","N","N","G4110","M","A",0,0.000000," "," "," "," ",0.000000,0.000000,0,0," "," "," "," "
,"460-470 Old Atlanta Road Stockbridge, GA 30281, USA","http://bit.ly/13CU2s6","12/07/2013 - 09:04am",846715.000000,846715.000000,33.550491,-84.257774,333.000000,1.000000,1.000000,3958.000000,"846715-sign-violation","Open","Sign Violation","12/07/2013 - 09:04am","2013-12-07T09:04:08-05:00",135598.000000,0.000000,78,"13","73704"," ","1373704","Stockbridge","Stockbridge city","25","C1","N","N","N","G4110","M","A",0,0.000000," "," "," "," ",0.000000,0.000000,0,0," "," "," "," "
,"113 Ashwood Court South Stockbridge, GA","http://bit.ly/1d12xia","12/06/2013 - 11:51am",846093.000000,846093.000000,33.518212,-84.224537,1605.000000,1.000000,2.000000,3963.000000,"846093-lights-only-sometime-mostly-dark","Closed","Lights only sometime; mostly dark","12/06/2013 - 12:15pm","2013-12-06T12:15:35-05:00",0.000000,0.000000,78,"13","73704"," ","1373704","Stockbridge","Stockbridge city","25","C1","N","N","N","G4110","M","A",0,0.000000," "," "," "," ",0.000000,0.000000,0,0," "," "," "," "
,"101-107 Eagles Landing Parkway Stockbridge, GA 30281, USA","http://bit.ly/1dUvVeS","12/06/2013 - 08:48am",845944.000000,845944.000000,33.517814,-84.191825,1789.000000,1.000000,2.000000,3958.000000,"845944-sign-violation","Acknowledged","Sign Violation","12/06/2013 - 09:50am","2013-12-06T09:50:46-05:00",0.000000,0.000000,78,"13","73704"," ","1373704","Stockbridge","Stockbridge city","25","C1","N","N","N","G4110","M","A",0,0.000000," "," "," "," ",0.000000,0.000000,0,0," "," "," "," "
,"Reeves Parkway Stockbridge, GA 30281, USA","http://bit.ly/1dUvMYT","12/06/2013 - 08:47am",845937.000000,845937.000000,33.530048,-84.222544,1789.000000,1.000000,2.000000,3958.000000,"845937-sign-violation","Acknowledged","Sign Violation","12/06/2013 - 09:50am","2013-12-06T09:50:22-05:00",0.000000,0.000000,78,"13","73704"," ","1373704","Stockbridge","Stockbridge city","25","C1","N","N","N","G4110","M","A",0,0.000000," "," "," "," ",0.000000,0.000000,0,0," "," "," "," "
,"4000 Mount Zion Parkway Stockbridge, GA 30281, USA","http://bit.ly/18ix9fi","12/04/2013 - 02:58pm",843188.000000,843188.000000,33.547088,-84.284774,4299.000000,1.000000,3.000000,3958.000000,"843188-sign-violation","Closed","Sign Violation","12/05/2013 - 03:18pm","2013-12-05T15:18:45-05:00",135598.000000,0.000000,78,"13","73704"," ","1373704","Stockbridge","Stockbridge city","25","C1","N","N","N","G4110","M","A",0,0.000000," "," "," "," ",0.000000,0.000000,0,0," "," "," "," "
,"5006 Mount Zion Parkway Stockbridge, GA 30281, USA","http://bit.ly/18ivuXb","12/04/2013 - 02:46pm",843142.000000,843142.000000,33.545501,-84.285362,4310.000000,1.000000,2.000000,3958.000000,"843142-sign-violation","Closed","Sign Violation","12/05/2013 - 03:12pm","2013-12-05T15:12:50-05:00",135598.000000,0.000000,78,"13","73704"," ","1373704","Stockbridge","Stockbridge city","25","C1","N","N","N","G4110","M","A",0,0.000000," "," "," "," ",0.000000,0.000000,0,0," "," "," "," "
,"5006 Mount Zion Parkway Stockbridge, GA 30281, USA","http://bit.ly/18ivh6l","12/04/2013 - 02:45pm",843140.000000,843140.000000,33.545303,-84.285026,4312.000000,1.000000,2.000000,3958.000000,"843140-sign-violation","Closed","Sign Violation","12/05/2013 - 03:12pm","2013-12-05T15:12:32-05:00",135598.000000,0.000000,78,"13","73704"," ","1373704","Stockbridge","Stockbridge city","25","C1","N","N","N","G4110","M","A",0,0.000000," "," "," "," ",0.000000,0.000000,0,0," "," "," "," "
,"1481 Hudson Bridge Road Stockbridge, GA 30281, USA","http://bit.ly/18APQgX","12/03/2013 - 02:13pm",841394.000000,841394.000000,33.503593,-84.238075,5783.000000,1.000000,2.000000,3958.000000,"841394-sign-violation","Closed","Sign Violation","12/04/2013 - 12:28pm","2013-12-04T12:28:02-05:00",0.000000,0.000000,78,"13","73704"," ","1373704","Stockbridge","Stockbridge city","25","C1","N","N","N","G4110","M","A",0,0.000000," "," "," "," ",0.000000,0.000000,0,0," "," "," "," "
,"Hudson Bridge Road & Interstate 75 Stockbridge, GA 30281, USA","http://bit.ly/18AOGC1","12/03/2013 - 02:02pm",841382.000000,841382.000000,33.505702,-84.232414,5795.000000,1.000000,1.000000,0.000000,"841382-sign","Open","Sign","12/03/2013 - 02:02pm","2013-12-03T14:02:05-05:00",0.000000,0.000000,78,"13","73704"," ","1373704","Stockbridge","Stockbridge city","25","C1","N","N","N","G4110","M","A",0,0.000000," "," "," "," ",0.000000,0.000000,0,0," "," "," "," "
,"Hudson Bridge Road & Interstate 75 Stockbridge, GA 30281, USA","http://bit.ly/18AOy5L","12/03/2013 - 02:00pm",841381.000000,841381.000000,33.505687,-84.232650,5796.000000,1.000000,2.000000,3958.000000,"841381-sign-violation","Closed","Sign Violation","12/04/2013 - 12:27pm","2013-12-04T12:27:50-05:00",0.000000,0.000000,78,"13","73704"," ","1373704","Stockbridge","Stockbridge city","25","C1","N","N","N","G4110","M","A",0,0.000000," "," "," "," ",0.000000,0.000000,0,0," "," "," "," "
,"Hudson Bridge Road & Interstate 75 Stockbridge, GA 30281, USA","http://bit.ly/18AOkvj","12/03/2013 - 01:59pm",841380.000000,841380.000000,33.505710,-84.232627,5797.000000,1.000000,2.000000,3958.000000,"841380-sign-violation","Closed","Sign Violation","12/04/2013 - 12:27pm","2013-12-04T12:27:38-05:00",0.000000,0.000000,78,"13","73704"," ","1373704","Stockbridge","Stockbridge city","25","C1","N","N","N","G4110","M","A",0,0.000000," "," "," "," ",0.000000,0.000000,0,0," "," "," "," "
,"4020 East Lake Parkway McDonough, GA 30253, USA","http://bit.ly/18AMpa9","12/03/2013 - 01:41pm",841285.000000,841285.000000,33.519084,-84.190002,5816.000000,1.000000,2.000000,3958.000000,"841285-sign-violation","Closed","Sign Violation","12/04/2013 - 12:27pm","2013-12-04T12:27:25-05:00",0.000000,0.000000,78,"13","73704"," ","1373704","Stockbridge","Stockbridge city","25","C1","N","N","N","G4110","M","A",0,0.000000," "," "," "," ",0.000000,0.000000,0,0," "," "," "," "
,"1-23 Eagles Landing Parkway Stockbridge, GA 30281, USA","http://bit.ly/18AM9YF","12/03/2013 - 01:38pm",841279.000000,841279.000000,33.518295,-84.191474,5818.000000,1.000000,2.000000,3958.000000,"841279-sign-violation","Closed","Sign Violation","12/04/2013 - 12:27pm","2013-12-04T12:27:12-05:00",0.000000,0.000000,78,"13","73704"," ","1373704","Stockbridge","Stockbridge city","25","C1","N","N","N","G4110","M","A",0,0.000000," "," "," "," ",0.000000,0.000000,0,0," "," "," "," "
,"12 Old Atlanta Road Stockbridge, GA 30281, USA","http://bit.ly/18ADGES","12/03/2013 - 12:47pm",841227.000000,841227.000000,33.552242,-84.258926,5869.000000,1.000000,2.000000,3958.000000,"841227-sign-violation","Closed","Sign Violation","12/04/2013 - 12:26pm","2013-12-04T12:26:59-05:00",0.000000,0.000000,78,"13","73704"," ","1373704","Stockbridge","Stockbridge city","25","C1","N","N","N","G4110","M","A",0,0.000000," "," "," "," ",0.000000,0.000000,0,0," "," "," "," "
,"5621 North Henry Boulevard Stockbridge, GA 30281, USA","http://bit.ly/18ACGjW","12/03/2013 - 12:44pm",841225.000000,841225.000000,33.553024,-84.259117,5872.000000,1.000000,2.000000,3958.000000,"841225-sign-violation","Closed","Sign Violation","12/04/2013 - 12:26pm","2013-12-04T12:26:47-05:00",0.000000,0.000000,78,"13","73704"," ","1373704","Stockbridge","Stockbridge city","25","C1","N","N","N","G4110","M","A",0,0.000000," "," "," "," ",0.000000,0.000000,0,0," "," "," "," "
,"4678-4690 North Henry Boulevard Stockbridge, GA 30281, USA","http://bit.ly/1hbjtrx","11/24/2013 - 01:14pm",833509.000000,833509.000000,33.544384,-84.233106,18802.000000,1.000000,3.000000,3971.000000,"833509-asphalt-trash","Acknowledged","Asphalt trash","11/24/2013 - 05:06pm","2013-11-24T17:06:38-05:00",347132.000000,1.000000,78,"13","73704"," ","1373704","Stockbridge","Stockbridge city","25","C1","N","N","N","G4110","M","A",0,0.000000," "," "," "," ",0.000000,0.000000,0,0," "," "," "," "
,"Tributary Park Jonesboro, GA 30236, USA","http://bit.ly/I9YqqC","11/23/2013 - 10:14am",832724.000000,832724.000000,33.540061,-84.290374,20423.000000,1.000000,2.000000,3970.000000,"832724-illegal-dumping","Acknowledged","Illegal Dumping","11/26/2013 - 11:44am","2013-11-26T11:44:50-05:00",135598.000000,0.000000,78,"13","73704"," ","1373704","Stockbridge","Stockbridge city","25","C1","N","N","N","G4110","M","A",0,0.000000," "," "," "," ",0.000000,0.000000,0,0," "," "," "," "
,"1300 Berkeley Drive Jonesboro, GA 30236, USA","http://bit.ly/I9Yd6Y","11/23/2013 - 10:12am",832723.000000,832723.000000,33.539333,-84.289794,20425.000000,1.000000,2.000000,3970.000000,"832723-illegal-dumping","Acknowledged","Illegal Dumping","11/26/2013 - 11:46am","2013-11-26T11:46:15-05:00",135598.000000,0.000000,78,"13","73704"," ","1373704","Stockbridge","Stockbridge city","25","C1","N","N","N","G4110","M","A",0,0.000000," "," "," "," ",0.000000,0.000000,0,0," "," "," "," "
,"100 Willow Springs Lane Stockbridge, GA","http://bit.ly/1bqwiqt","11/14/2013 - 08:14am",821007.000000,821007.000000,33.546995,-84.254898,33502.000000,1.000000,5.000000,3971.000000,"821007-water-pressure","Acknowledged","Water Pressure","11/15/2013 - 12:09am","2013-11-15T00:09:04-05:00",0.000000,1.000000,78,"13","73704"," ","1373704","Stockbridge","Stockbridge city","25","C1","N","N","N","G4110","M","A",0,0.000000," "," "," "," ",0.000000,0.000000,0,0," "," "," "," "
,"626 Fairhaven Blvd. Stockbridge, GA","http://bit.ly/1aD83UU","11/12/2013 - 04:18pm",819009.000000,819009.000000,33.536110,-84.242307,35898.000000,1.000000,4.000000,3966.000000,"819009-another-vacant-eyesore","Acknowledged","Another vacant eyesore","11/28/2013 - 09:41pm","2013-11-28T21:41:39-05:00",0.000000,2.000000,78,"13","73704"," ","1373704","Stockbridge","Stockbridge city","25","C1","N","N","N","G4110","M","A",0,0.000000," "," "," "," ",0.000000,0.000000,0,0," "," "," "," "
,"120 Willow Hill Lane Stockbridge, GA 30281, USA","http://bit.ly/1aX5Dm8","10/18/2013 - 05:40pm",790872.000000,790872.000000,33.520543,-84.216569,71877.000000,1.000000,4.000000,3957.000000,"790872-sidewalk-concern","Acknowledged","Sidewalk Concern","11/11/2013 - 04:15pm","2013-11-11T16:15:23-05:00",348400.000000,0.000000,78,"13","73704"," ","1373704","Stockbridge","Stockbridge city","25","C1","N","N","N","G4110","M","A",0,0.000000," "," "," "," ",0.000000,0.000000,0,0," "," "," "," "
,"3989 North Henry Boulevard Stockbridge, GA 30281, USA","http://bit.ly/UMjzLT","10/10/2013 - 10:36am",781352.000000,781352.000000,33.541023,-84.212028,83821.000000,1.000000,1.000000,0.000000,"781352-sign","Open","Sign","10/10/2013 - 10:36am","2013-10-10T10:36:39-04:00",135598.000000,0.000000,78,"13","73704"," ","1373704","Stockbridge","Stockbridge city","25","C1","N","N","N","G4110","M","A",0,0.000000," "," "," "," ",0.000000,0.000000,0,0," "," "," "," "
,"411 Tanner Trce Stockbridge, Georgia","http://bit.ly/18LoYYI","10/01/2013 - 03:17pm",770809.000000,770809.000000,33.517107,-84.241362,96500.000000,1.000000,3.000000,3949.000000,"770809-drainage-blockage","Acknowledged","Drainage blockage","11/12/2013 - 12:47pm","2013-11-12T12:47:47-05:00",0.000000,1.000000,78,"13","73704"," ","1373704","Stockbridge","Stockbridge city","25","C1","N","N","N","G4110","M","A",0,0.000000," "," "," "," ",0.000000,0.000000,0,0," "," "," "," "
,"442-450 Davis Road Stockbridge, GA 30281, USA","http://bit.ly/16A4JPA","09/28/2013 - 07:51pm",767590.000000,767590.000000,33.557347,-84.247482,100546.000000,1.000000,1.000000,0.000000,"767590-sign-violation","Open","sign violation","09/28/2013 - 07:51pm","2013-09-28T19:51:31-04:00",345035.000000,0.000000,78,"13","73704"," ","1373704","Stockbridge","Stockbridge city","25","C1","N","N","N","G4110","M","A",0,0.000000," "," "," "," ",0.000000,0.000000,0,0," "," "," "," "
,"121 Rock Quarry Rd Stockbridge, GA","http://bit.ly/1bGe75i","09/25/2013 - 02:11pm",762241.000000,762241.000000,33.540391,-84.226075,105206.000000,1.000000,2.000000,3949.000000,"762241-clogged-stormdrain","Acknowledged","Clogged Stormdrain","09/25/2013 - 02:12pm","2013-09-25T14:12:17-04:00",135256.000000,0.000000,78,"13","73704"," ","1373704","Stockbridge","Stockbridge city","25","C1","N","N","N","G4110","M","A",0,0.000000," "," "," "," ",0.000000,0.000000,0,0," "," "," "," "
,"Hudson Bridge Road Stockbridge, Georgia","http://bit.ly/14ZwpfG","09/17/2013 - 04:29pm",748526.000000,748526.000000,33.505807,-84.232565,116828.000000,1.000000,1.000000,0.000000,"748526-sign-picked-up","Open","Sign picked up","09/17/2013 - 04:29pm","2013-09-17T16:29:30Z",135598.000000,0.000000,78,"13","73704"," ","1373704","Stockbridge","Stockbridge city","25","C1","N","N","N","G4110","M","A",0,0.000000," "," "," "," ",0.000000,0.000000,0,0," "," "," "," "
,"Hudson Bridge Road Stockbridge, Georgia","http://bit.ly/14Zwi3V","09/17/2013 - 04:28pm",748523.000000,748523.000000,33.505807,-84.232565,116829.000000,1.000000,1.000000,0.000000,"748523-sign-picked-up","Open","Sign picked up","09/17/2013 - 04:28pm","2013-09-17T16:28:43Z",135598.000000,0.000000,78,"13","73704"," ","1373704","Stockbridge","Stockbridge city","25","C1","N","N","N","G4110","M","A",0,0.000000," "," "," "," ",0.000000,0.000000,0,0," "," "," "," "
,"Hudson Bridge Road & Interstate 75 Stockbridge, GA 30281, USA","http://bit.ly/14ZvE6d","09/17/2013 - 04:24pm",748511.000000,748511.000000,33.505973,-84.232688,116832.000000,1.000000,1.000000,0.000000,"748511-sign","Open","Sign","09/17/2013 - 04:24pm","2013-09-17T16:24:57Z",135598.000000,0.000000,78,"13","73704"," ","1373704","Stockbridge","Stockbridge city","25","C1","N","N","N","G4110","M","A",0,0.000000," "," "," "," ",0.000000,0.000000,0,0," "," "," "," "
,"Hudson Bridge Road & Interstate 75 Stockbridge, GA 30281, USA","http://bit.ly/14Zv4We","09/17/2013 - 04:21pm",748501.000000,748501.000000,33.505973,-84.232688,116836.000000,1.000000,1.000000,0.000000,"748501-sign","Open","Sign","09/17/2013 - 04:21pm","2013-09-17T16:21:47Z",135598.000000,0.000000,78,"13","73704"," ","1373704","Stockbridge","Stockbridge city","25","C1","N","N","N","G4110","M","A",0,0.000000," "," "," "," ",0.000000,0.000000,0,0," "," "," "," "
,"3600-3604 Walt Stephens Road Stockbridge, GA 30281, USA","http://bit.ly/1fIYJT2","09/07/2013 - 03:25pm",732387.000000,732387.000000,33.527743,-84.273838,131292.000000,1.000000,1.000000,0.000000,"732387-illegal-sign","Open","illegal sign","09/07/2013 - 03:25pm","2013-09-07T15:25:06Z",135598.000000,0.000000,78,"13","73704"," ","1373704","Stockbridge","Stockbridge city","25","C1","N","N","N","G4110","M","A",0,0.000000," "," "," "," ",0.000000,0.000000,0,0," "," "," "," "
,"100 Windsong Drive Stockbridge, Georgia","http://bit.ly/1emuL9D","09/06/2013 - 06:15pm",731014.000000,731014.000000,33.514849,-84.229693,132562.000000,1.000000,2.000000,3949.000000,"731014-stormwater-drainage-issue-entrance-of-windsong-plantation","Acknowledged","Stormwater Drainage Issue - Entrance of Windsong Plantation","09/06/2013 - 06:16pm","2013-09-06T18:16:13Z",135256.000000,0.000000,78,"13","73704"," ","1373704","Stockbridge","Stockbridge city","25","C1","N","N","N","G4110","M","A",0,0.000000," "," "," "," ",0.000000,0.000000,0,0," "," "," "," "
,"Neal Ave. stockbridge , ga","http://bit.ly/1fwNOMb","09/03/2013 - 01:38pm",722048.000000,722048.000000,33.545656,-84.220444,136919.000000,1.000000,2.000000,0.000000,"722048-litter-trash-on-the-right-of-way","Open","litter - trash on the right of way","09/30/2013 - 07:34pm","2013-09-30T19:34:16-04:00",0.000000,1.000000,78,"13","73704"," ","1373704","Stockbridge","Stockbridge city","25","C1","N","N","N","G4110","M","A",0,0.000000," "," "," "," ",0.000000,0.000000,0,0," "," "," "," "
,"Hudson Bridge Road & Interstate 75 Stockbridge, GA 30281, USA","http://bit.ly/17xgoMk","09/03/2013 - 01:25pm",722016.000000,722016.000000,33.505847,-84.232577,136932.000000,1.000000,2.000000,0.000000,"722016-illegal-signs","Closed","illegal signs","12/03/2013 - 08:25am","2013-12-03T08:25:37-05:00",135598.000000,0.000000,78,"13","73704"," ","1373704","Stockbridge","Stockbridge city","25","C1","N","N","N","G4110","M","A",0,0.000000," "," "," "," ",0.000000,0.000000,0,0," "," "," "," "
